address,agencyId,agencyName,apartmentSaleType,cityId,createdAt,description,details,developmentId,developmentName,developmentParentId,developmentParentName,districtId,floor,floorArea,floorAreaCalculated,floorInt,galleryImagesCount,id,itemType,itemUrl,metroId,price,pricePerArea,pricePerAreaValue,priceValue,propertyType,publishDate,regionId,resultType,rooms,roomsOrdinal,sourceFinishTime,sourceId,sourceStartTime,sourceUpdateTime,station_distance,station_id,station_lineColors,station_name,title,updatedAt
"Новосибирск, улица Толстого, 56",152810530,Центральное агентство недвижимости,Resale,3285,2020-12-01T12:36:52.794942Z,"3ех комнатная квартира студия с просторной кухней-гостиной и двумя спальнями. В прихожей располагается вместительная гардеробная, гостевой санузел (с/у, раковина, стиральная машина). Зонирование гостиной: обеденная, место отдыха, кухонная зоны. Кухонный гарнитур оснащен встроенной бытовой техникой SIEMENS, BOSCH - варочная панель, духовой шкаф, посудомойка, кофе машина. Спальня и детская комнаты оборудованы встроенными шкафами. Во втором санузле располагается душевая кабина, ванная, раковина с тумбой, туалет, биде (инсталляции Grohe,  сан.фаянс Jacob Delafon, смесители Emmevi Италия) , бесшовный крупноформатный кафель Италия, теплые полы. Балкон утеплен, отделка декоративной штукатуркой, керамогранит, теплый пол, освещение.<br>При отделки квартиры был выполнен ремонт по Индивидуальному дизайн проекту с использование материалов из Америки (обои), Италии и Испании (керамогранит) - заказные позиции. Освещение- люстры, включая холл и сан узлы, дополнительная светодиодная подсветка подсветка , бра в комнатах, коридоре, балконе.<br>Дом кирпичный с огороженной территорией, видео наблюдение, круглосуточная охрана. Имеется детская площадка, футбольное поле. Просторная придомовая парковка, а так же подземный паркинг.<br>300 м. до Метро  Октябрьская , супермаркеты Бахетле, Горожанка, спорт клуб XFit Плаза, школа №202, лицей №185, детский сад №504 в 7 мин ходьбы. <br>Чистая продажа. Документы готовы. Ипотека возможна.<br>При звонке, пожалуйста, назовите номер объявления - 85 603<br>Консультируем подробно по телефону.",75 м²,,,,,650.0,20/25,75 м²,75.0,20,6,3045206546,Sale,/3-komnatnaya-kvartira-na-prodazhu-novosibirsk-3045206546,264.0,9 700 000 ₽,129 333 ₽ за м²,129333,9700000,Apartment,2020-12-01T12:36:52.794942Z,78,Listing,3,3.0,2020-12-31T15:27:50.159192+03:00,2048876359,2020-12-01T15:27:21.742416+03:00,2020-12-07T05:23:41.852781+03:00,0.247,264.0,#FF0000,Октябрьская,"3-комн. квартира, 75 м², 20/25 эт.",2020-12-07T02:33:40.58358Z
"Новосибирская область, Новосибирский район, посёлок Кудряшовский, Октябрьская улица, 13",14569939,******,Resale,3282,2020-12-05T13:54:50.503915Z,"Продадим очень светлую и теплую 3-комнатную картиру в Кудряшах. Окна пластиковые, балкон застеклён. Ванна и санузел- кафель.  <br>Шикарный вид из окон. Большая парковка, всегда есть места!",58 м²,,,,,,4/5,58 м²,58.0,4,7,3054624626,Sale,/3-komnatnaya-kvartira-na-prodazhu-kudryashovskiy-3054624626,,2 800 000 ₽,48 276 ₽ за м²,48276,2800000,Apartment,2020-12-05T13:54:50.503915Z,78,Listing,3,3.0,2021-01-04T16:49:22.54633+03:00,823212435,2016-08-17T07:42:16+03:00,2020-12-05T16:49:22.54633+03:00,,,,,"3-комн. квартира, 58 м², 4/5 эт.",2020-12-05T13:58:27.957303Z
"Новосибирск, Первомайский район, микрорайон Весенний, Заречная улица, 3/5",152810530,Центральное агентство недвижимости,Resale,3285,2020-12-01T12:43:28.871647Z,"В продаже 2 комнатная квартира студия,сдача 4-2021. В доме два лифта: пассажирский и грузовой, домофон, детская площадка.<br>Рядом школа и детский садик.<br>Микрорайон «Весенний» построен на берегу реки Иня, в одном из самых красивых мест Новосибирска. Потрясающие виды из окна, удаленность от шумных магистралей и река Иня, на берегу которой можно отдохнуть. Один собственник,без обременений,реальному покупателю торг.<br>С проектной декларацией можно ознакомиться на сайте застройщика.<br>При звонке, пожалуйста, назовите номер объявления - 115 614<br>Консультируем подробно по телефону.",38 м²,,,,,657.0,2/16,38 м²,38.0,2,5,3045226649,Sale,/2-komnatnaya-kvartira-na-prodazhu-novosibirsk-3045226649,,2 620 000 ₽,68 947 ₽ за м²,68947,2620000,Apartment,2020-12-01T12:43:28.871647Z,78,Listing,2,2.0,2020-12-31T15:34:22.420298+03:00,2048870897,2020-12-01T15:33:57.197802+03:00,2020-12-07T05:32:43.403304+03:00,,,,,"2-комн. квартира, 38 м², 2/16 эт.",2020-12-07T02:42:13.713335Z
"Новосибирск, улица Блюхера, 16",152810530,Центральное агентство недвижимости,Resale,3285,2020-12-01T12:43:25.973601Z,"Предлагается к продаже отличный вариант 2-комнатной квартиры в кирпичном доме до метро Площадь Маркса (400 метров) метро Студенческая (750 метров).<br>-Подходит как для сдачи в аренду так и для комфортного проживания,<br>-Квартира в обычном состоянии, что дает возможность новым собственникам сделать ремонт под свой интерьер,<br>- Преимущества этой квартиры, 1 Взрослый собственник, документы к продаже готовы. Быстрый выход на сделку.<br>В пешей доступности есть все: магазины, ТЦ, школы, дошкольные учреждения и т.д. <br>Приглашаем на просмотр, показываем по договоренности в любое удобное время для Вас.<br>При звонке, пожалуйста, назовите номер объявления - 116 210<br>Консультируем подробно по телефону.",43.3 м²,,,,,654.0,1/5,43.3 м²,43.3,1,8,3045226436,Sale,/2-komnatnaya-kvartira-na-prodazhu-novosibirsk-3045226436,267.0,2 800 000 ₽,64 665 ₽ за м²,64665,2800000,Apartment,2020-12-01T12:43:25.973601Z,78,Listing,2,2.0,2020-12-31T15:34:23.182131+03:00,2048096978,2020-12-01T15:33:56.914982+03:00,2020-12-01T15:34:23.182131+03:00,0.479,267.0,#FF0000,Площадь Маркса,"2-комн. квартира, 43.3 м², 1/5 эт.",2020-12-01T12:43:38.380737Z
"Новосибирск, Охотская улица, 88/1",152810530,Центральное агентство недвижимости,Resale,3285,2020-12-01T12:43:37.293756Z,"Срочная продажа, выгодное предложение.<br>Продается  2-х комнатная студия квартира под самоотделку в ЖК  Эволюция . Квартира  сс чистовой отделкой, высота потолков  -3 метра, ровная стяжка пола, отштукатуренные межквартирные стены и швы, горизонтальная разводка коммуникаций, установлены приборы учета воды, электроэнергии и качественные металлические утепленные входные двери с двумя замками, лоджия с остеклением «под ключ», на полу - стяжка. Окна и двери балконов выполнены из трехкамерного ПВХ-профиля белого цвета с заполнением стеклопакетом. Межквартирные стены выполнены из кирпича толщиной 250 мм.  Перегородки вокруг санузлов и ванных комнат — кирпичные, толщиной 120 мм. - Придомомая территория оборудована детскими развивающими площадки с прорезиненным покрытием, спортивные площадки, ландшафтное озеленение, двор без машин. Территория  жилого комплекса «Эволюция» огорожена и находится под круглосуточным видеонаблюдением. Подходит под ипотеку, материнский капитал.<br>При звонке, пожалуйста, назовите номер объявления - 115 996<br>Консультируем подробно по телефону.",55.1 м²,,,,,653.0,12/12,55.1 м²,55.1,12,6,3045227281,Sale,/2-komnatnaya-kvartira-na-prodazhu-novosibirsk-3045227281,,5 000 000 ₽,90 744 ₽ за м²,90744,5000000,Apartment,2020-12-01T12:43:37.293756Z,78,Listing,2,2.0,2020-12-31T15:34:23.293341+03:00,2048370913,2020-12-01T15:33:57.050139+03:00,2020-12-07T15:39:11.034781+03:00,,,,,"2-комн. квартира, 55.1 м², 12/12 эт.",2020-12-07T12:55:20.506991Z
"Новосибирск, Кировский район, Северо-Чемской жилмассив, улица Саввы Кожевникова, 13",152810530,Центральное агентство недвижимости,Resale,3285,2020-12-01T12:43:26.076984Z,"Продается квартира с исключительной планировкой. Комфортный 8 этаж, открываются завораживающие видовые характеристики на парковую зону и реку Обь, а так же во двор на детсую плорщадку. Дом образцового содержания. ТСЖ, коммунальные платежи низкие. Подьезды чистые, мусоропровод заварен, дворы чистые и обустроенные, всегда хватает парковки. Очень удобная транспортная доступность, 20 мин до Маркса, автобусная остановка 96 маршрута прямо за домом, немного дальше 29, 43 и тд..<br>Во дворе детский сад, в соседнем дворе школа, множество детских кружков, бассейн, лыжная база, крытая хоккуйная коробка и множество плюсов которые можно бесконечно перечислять, начиная от поликлинники взрослой и детской, заканчивая множеством магазинов ярче, мария ра, магнит, пятерочка и рынками.<br>В квартире выполнен дорогостоящий ремонт, мебель и техника остается в подарок. Квартира без обременений, обменнй вариант подобран.<br>При звонке, пожалуйста, назовите номер объявления - 116 315<br>Консультируем подробно по телефону.",60.6 м²,,,,,655.0,8/10,60.6 м²,60.6,8,4,3045226449,Sale,/3-komnatnaya-kvartira-na-prodazhu-novosibirsk-3045226449,,4 500 000 ₽,74 257 ₽ за м²,74257,4500000,Apartment,2020-12-01T12:43:26.076984Z,78,Listing,3,3.0,2020-12-31T15:34:24.613709+03:00,2048366528,2020-12-01T15:33:57.530296+03:00,2020-12-07T05:32:43.749512+03:00,,,,,"3-комн. квартира, 60.6 м², 8/10 эт.",2020-12-07T02:42:16.347236Z
"ул. Петухова, д. 95/4",178825960,"2ПН, покупка-продажа недвижимости",New,3285,2020-12-03T11:03:00.984725Z,"Продается 1я квартира с отделкой «под ключ»: обои под покраску, межкомнатные и входные двери, покрытие полов - линолеум, выровненный, окрашенный потолок, в сан. узле - керамическая плитка, сантехническое оборудование, счётчики энерго-, водопотребления, установлены розетки, выключатели, остекление лоджий - алюминиевый профиль.<br>Перспективный жилом комплексе с собственным детским садиком и школой.<br>Для жителей комплекса предусмотрены благоустройство территории, площадки для отдыха и занятий спортом, игровые площадки, парковочные места.<br>До площади Карла Маркса - 20 минут езды.<br>Помощь в получение ипотеку. Ставка 6,1%<br>Срок сдачи: I квартал 2022г.",42.1 м²,39193.0,ЖК «Матрешкин двор»,39193.0,ЖК «Матрешкин двор»,655.0,11/16,42.1 м²,42.1,11,6,3049847585,Sale,/1-komnatnaya-kvartira-na-prodazhu-novosibirsk-3049847585,,2 781 240 ₽,66 063 ₽ за м²,66063,2781240,Apartment,2020-12-03T11:03:00.984725Z,78,Listing,1,1.0,2021-01-02T13:53:59.364481+03:00,2022645916,2020-12-03T13:53:35.06159+03:00,2020-12-03T14:21:56.023832+03:00,,,,,"1-комн. квартира, 42.1 м², 11/16 эт.",2020-12-03T11:31:51.003199Z
"Новосибирская область, Мошковский район, рабочий посёлок Мошково, улица Пушкина, 2А",164481900,Олеся,Resale,3280,2020-11-04T11:56:09.01937Z,"СРОЧНО!!!  ТОРГ ПРИ ПРОСМОТРЕ!!! Продам уютную и теплую квартиру, на третьем этаже из пяти. Обременений нет, не в ипотеке, в собственности более 25 лет. Причина продажи-нам мало места(большая семья) Так же в квартире сохранена прежняя планировка, а значит есть возможность пофантазировать с планировкой. Сделан косметический ремонт, поменяны трубы на ПВХ, окна пластиковые, балкон остеклен( изнутри обшит деревом) Есть две ниши из которых можно сделать гардеробную. Установлен фильтр двойной очистки для питьевой воды и отдельно на водонагреватель. Удобное расположение, всё в шаговой доступности( дет.сад. ""Улыбка"", школа, бассейн, администрация, МФЦ, магазины, ДК, ЖД вокзал) Замечательные и отзывчивые соседи.  Остальные вопросы по телефону. Рассмотрим любые виды расчёта. Возможна ипотека от Сбербанка без оценки и со скидкой 0,3.Реальному покупателю возможен торг. Так же возможен обмен на дом большей площадью.",58 м²,,,,,,3/5,58 м²,58.0,3,6,2981459936,Sale,/3-komnatnaya-kvartira-na-prodazhu-moshkovo-2981459936,,1 950 000 ₽,33 621 ₽ за м²,33621,1950000,Apartment,2020-11-04T11:56:09.01937Z,78,Listing,3,3.0,2021-01-03T14:48:58.807764+03:00,2026113389,2020-11-04T14:46:45.277506+03:00,2020-12-05T02:27:22.394248+03:00,,,,,"3-комн. квартира, 58 м², 3/5 эт.",2020-12-04T23:36:45.955781Z
"Новосибирск, Кубовая улица, 92/1",81717285,дмитрий,Resale,3285,2019-02-05T20:00:50.913227Z,"Собственник !<br>Продам светлую, уютную 2-х комнатную квартиру-студию общей площадью S=43м2 с новым ремонтом(обои, ламинат, двери - новые) , натяжные потолки, мебель, лоджия застеклена, рядом со всей инфраструктурой,с большой парковкой перед окном в котором открывается шикарный вид во двор, во дворе фонтан, есть подземная парковка,чистый воздух закрытая территория,чистый,красивый подъезд! шикарное,спокойное место, для отдыха после тяжелого рабочего дня, Охраняемая территория, ПАРКОВКА есть и ночью! до площади калинина 15-20мин на газели! Дом находится рядом с остановкой,транспорт ходит часто,вся инфраструктура в шаговой доступности(дет.сад,магазины,кафе)! ВИП проживание за копейки. Достойный контингент людей. Фото реальные! НЕДОРОГО! Срочно! Звоните сейчас!<br>Можно использовать как готовый арендный бизнес с заселенными арендаторами и денежным потоком в 22тр/мес.",43 м²,,,,,653.0,4/10,43 м²,43.0,4,7,261046607,Sale,/2-komnatnaya-kvartira-na-prodazhu-novosibirsk-261046607,260.0,3 180 000 ₽,73 953 ₽ за м²,73953,3180000,Apartment,2019-02-05T20:00:50.913227Z,78,Listing,2,2.0,2020-12-31T15:59:07.485455+03:00,1614321200,2018-12-20T10:04:48.190319+03:00,2020-12-01T15:59:07.485455+03:00,,,,,"2-комн. квартира, 43 м², 4/10 эт.",2020-12-01T13:08:10.754225Z
,61734665,Агентство недвижимости «НИАН»,New,3285,2020-11-03T02:19:47.541402Z,"В продаже представлена шикарной планировки двухкомнатная квартира-студия с большим балконом (остекление в пол) в 5 секции, расположенного в элитном жилищном комплексе «История», между станциями метро «Золотая Нива» и «Березовая роща». Данная квартира распологается на 1 этаже, и за счет трехуровневнего подземного паркинга, вид будет как с 4 этажа.  Два дома переменной этажности имеют единый двор. Изящный фасад, удобные планировки квартир и актуальная организация дворового пространства. Качество строительства соответствует всем нормам и удовлетворяет самым высоким требованиям. Инфраструктура района очень хорошо развита, поблизости несколько школ, детских садов, магазинов различного типа, отличная транспортная развязка. Получить более подробную информацию о квартире, а также наличии других вариантов вы сможете, связавшись по контактному телефону, указанному в объявлении. Льготная ипотека. Комиссия 0%. Звоните, проконсультирую.",42.9 м²,92664.0,ЖК «История»,92664.0,ЖК «История»,651.0,2/18,42.9 м²,42.9,2,8,2978025444,Sale,/2-komnatnaya-kvartira-na-prodazhu-novosibirsk-2978025444,272.0,4 950 000 ₽,115 385 ₽ за м²,115385,4950000,Apartment,2020-11-03T02:19:47.541402Z,78,Listing,2,2.0,2021-01-02T06:14:20.122939+03:00,2023231714,2020-11-03T05:10:22.907821+03:00,2020-12-03T06:14:20.122939+03:00,0.69,272.0,#008000,Золотая Нива,"2-комн. квартира, 42.9 м², 2/18 эт.",2020-12-03T03:23:24.395125Z
"ул. Петухова, д. 95/4",178825960,"2ПН, покупка-продажа недвижимости",New,3285,2020-12-03T11:24:41.843439Z,"Продается квартира-студия с отделкой «под ключ»: обои под покраску, межкомнатные и входные двери, покрытие полов - линолеум, выровненный, окрашенный потолок, в сан. узле - керамическая плитка, сантехническое оборудование, счётчики энерго-, водопотребления, установлены розетки, выключатели, остекление лоджий - алюминиевый профиль.<br>Перспективный жилом комплексе с собственным детским садиком и школой.<br>Для жителей комплекса предусмотрены благоустройство территории, площадки для отдыха и занятий спортом, игровые площадки, парковочные места.<br>До площади Карла Маркса - 20 минут езды.<br>Помощь в получение ипотеку. Ставка 6,1%<br>Срок сдачи: I квартал 2022г.",28 м²,39193.0,ЖК «Матрешкин двор»,39193.0,ЖК «Матрешкин двор»,655.0,6/16,28 м²,28.0,6,6,3049890588,Sale,/kvartira-na-prodazhu-novosibirsk-3049890588,,1 930 620 ₽,68 951 ₽ за м²,68951,1930620,Apartment,2020-12-03T11:24:41.843439Z,78,Listing,Студия,,2021-01-02T14:15:40.076845+03:00,2022381658,2020-12-03T14:15:17.830029+03:00,2020-12-03T14:21:15.629034+03:00,,,,,"Квартира-студия, 28 м², 6/16 эт.",2020-12-03T11:31:51.093381Z
"Новосибирск, Бронная улица, 18/1, подъезд 1",7689615,наталья,New,3285,2020-01-27T00:49:47.766329Z,"Продам квартиру с чистовой отделкой. Делали для себя. Материалы качественные. Пол - кафель, ламинат. Стены - обои. С/у кафель от пола до потолка. Потолки натяжные, двухуровневые. Установлен видеодомофон, видеонаблюдение. В квартире тепло. В ванной установлен водонагреватель. В коридоре установлен встроенный шкаф, длина 5 метров, зеркала во всю высоту шкафа от пола до потолка. В кухонной зоне установлена встроенная кухня: двухсекционная мойка, посудомоечная машина, индукционная плита, духовой шках, вытяжка. Фартук - стекло миркл со светодиодной подсветкой. Установлены качественные входные и межкомнатные двери.<br>Мебель остается по согласованию. Кухня оплачивается отдельно.",40 м²,,,,,655.0,5/10,40 м²,40.0,5,16,2250658980,Sale,/kvartira-na-prodazhu-novosibirsk-2250658980,,1 950 000 ₽,48 750 ₽ за м²,48750,1950000,Apartment,2020-01-27T00:49:47.766329Z,78,Listing,Студия,,2020-12-31T16:04:11.537322+03:00,1869406963,2020-01-26T16:41:28.361912+03:00,2020-12-01T16:04:11.537322+03:00,,,,,"Квартира-студия, 40 м², 5/10 эт.",2020-12-01T13:13:15.844163Z
