address,agencyId,agencyName,apartmentSaleType,cityId,createdAt,description,details,developmentId,developmentName,developmentParentId,developmentParentName,districtId,floor,floorArea,floorAreaCalculated,floorInt,galleryImagesCount,id,itemType,itemUrl,metroId,price,pricePerArea,pricePerAreaValue,priceValue,propertyType,publishDate,regionId,resultType,rooms,roomsOrdinal,sourceFinishTime,sourceId,sourceStartTime,sourceUpdateTime,station_distance,station_id,station_lineColors,station_name,title,updatedAt
"ул. Владимира Заровного, стр. 31",162753784,"Микрорайон «Европейский берег», застройщик Брусника",New,3285,2020-07-03T01:35:18.990221Z,"Квартира с объединенной кухней-гостиной и тремя спальнями в микрорайоне «Европейский Берег». <br>                  ОБЪЯВЛЕНИЕ ОТ ЗАСТРОЙЩИКА<br>Квартиру можно купить онлайн.<br>Трёхкомнатная квартира в ЖК «Европейский Берег» в 15 минутах от метро «Речной вокзал» — это квартира с объединённой кухней-гостиной и тремя спальнями. В «Европейском Береге» можно купить 3-комнатную квартиру с собственной террасой, тёплой лоджией или открытым балконом. В квартирах также спроектированы дополнительные помещения — гардеробные или ниши под хранение, второй санузел, постирочная. Есть особенные квартиры увеличенной площади с несколькими балконами и летними террасами. Купить 3-комнатную квартиру в Октябрьском районе Новосибирска выгодно напрямую от застройщика «Брусника. Сибакадемстрой».<br>На сдаче в 3-комнатных от застройщика «Брусника. Сибакадемстрой» выполнена отделка под чистовую. Установлена надёжная сейф-дверь. В каждой квартире — приборы учёта, радиаторы, розетки и выключатели, разводка отопления и электрики. Стены в студиях оштукатурены. Пол готов к финишному покрытию — ламинату, линолеуму, плитке.<br>ЖК «Европейский Берег» расположен на берегу Оби, между двумя мостами — Коммунальным и Бугринским, 15 минут на автомобиле по улице Большевистской до метро «Речной вокзал». В «Европейском Береге» построено 22 дома и проживает 5 000 семей. Внутри микрорайона расположен детский сад на 320 мест, открыты магазины, аптеки, кафе. Предусмотрено место под строительство школы и второго детского сада.<br>Сейчас в «Европейском Береге» ведётся строительство домов от 6 до 25 этажей на береговой линии ЖК вдоль улицы Владимира Заровного: три закрытых квартала с камерным двором-садом, две башни-доминанты и один сблокированный дом. Под строящимися домами «Европейского Берега» спроектированы подземные паркинги, в цокольных этажах — кладовые помещения. В продаже в ЖК «Европейский Берег» есть квартиры со сдачей в 4 квартале 2020 и 2021.<br>Купить трёхкомнатную квартиру в ЖК «Европейский Берег» в Октябрьском районе Новосибирска выгодно напрямую от застройщика «Брусника. Сибакадемстрой»:<br>— ипотека с отсрочкой платежей на год от ПАО Сбербанк;<br>— беспроцентная рассрочка на 3-комнатные в «Европейском Береге»;<br>— обмен своей квартиры на трёхкомнатную в новостройках на набережной Оби;<br>— возможность заказать отделку и оформить её вместе с 3-комнатной квартирой в ипотеку;<br>— бесплатный юридический сервис по оформлению квартиры.<br>Получить одобрение ипотеки или рассрочку, а также осуществить обмен квартиры можно онлайн. Запишитесь на онлайн презентацию по телефону или на сайте.<br>            № квартиры в нашей базе: НСК15732.",91.6 м²,23887.0,Микрорайон «Европейский Берег»,23887.0,Микрорайон «Европейский Берег»,650.0,13/23,91.6 м²,91.6,13,11,2687145695,Sale,/3-komnatnaya-kvartira-na-prodazhu-novosibirsk-2687145695,265.0,6 700 000 ₽,73 144 ₽ за м²,73144,6700000,Apartment,2020-07-03T01:35:18.990221Z,78,Listing,3,3.0,2020-12-30T07:27:17.74906+03:00,1973930364,2020-07-02T10:18:22.258848+03:00,2020-11-30T07:27:17.74906+03:00,2.338,265.0,#FF0000,Речной вокзал,"3-комн. квартира, 91.6 м², 13/23 эт.",2020-11-30T04:36:30.992468Z
"Новосибирск, Кировский район, Северо-Чемской жилмассив, улица Герцена, 1/2",99883322,Наталья,Resale,3285,2020-12-02T15:28:55.341679Z,"Предлагаю к продаже студию в новом доме с великолепным видом из окна на Бугринский мост , скоро сдача , цены вырастут , в квартире большая лоджия . Дом расположен за т ц Мега , рядом Бугринская роща , пляж. Переуступка дду",30 м²,,,,,655.0,6/20,30 м²,30.0,6,3,3047962323,Sale,/kvartira-na-prodazhu-novosibirsk-3047962323,,1 900 000 ₽,63 333 ₽ за м²,63333,1900000,Apartment,2020-12-02T15:28:55.341679Z,78,Listing,Студия,,2021-01-01T18:20:10.935505+03:00,2072473708,2020-12-02T18:17:28.239986+03:00,2020-12-02T18:20:10.935505+03:00,,,,,"Квартира-студия, 30 м², 6/20 эт.",2020-12-02T15:29:26.607129Z
"Новосибирск, Бронная улица, 6",147244801,Отдел Продаж Недвижимости,Resale,3285,2020-12-08T05:46:41.06802Z,Полноценная однокомнатная квартира под самоотделку. Высокий видовой этаж. Французкие (панорамные окна). Выход на балкон с обеих комнат. Продажа по переуступке.,41.4 м²,,,,,655.0,17/18,41.4 м²,41.4,17,1,3060345702,Sale,/1-komnatnaya-kvartira-na-prodazhu-novosibirsk-3060345702,,1 950 000 ₽,47 101 ₽ за м²,47101,1950000,Apartment,2020-12-08T05:46:41.06802Z,78,Listing,1,1.0,2021-01-07T08:37:39.079359+03:00,2047064931,2020-12-08T08:33:29.512297+03:00,2020-12-08T08:37:39.079359+03:00,,,,,"1-комн. квартира, 41.4 м², 17/18 эт.",2020-12-08T05:46:47.877481Z
"Новосибирск, улица Челюскинцев, 38",23367994,Компания «ЭТАЖИ»,Resale,3285,2020-12-02T07:46:11.681898Z,"В срочной продаже уютная 4-к квартира в самом центре города, в которой найдется место каждому члену, даже большой, семьи. Квартира расположена удачно, на 3 этаже, окна выходят на дворовую площадку. В целом, в квартире выполнен косметический ремонт, она у хоженая и очень уютная, можно проживать без каких-либо дополнительных вложений и затрат. Во дворе д/с, гимназия № 4.<br>В подарок новому собственнику достанется кухонный гарнитур и шкаф-купе в коридоре, а так же посудомоечная машина, при подписании пдкп до 15.12.<br>К квартире отдадим теплую сухую ячейку в подвале, это шикарная альтернатива мини-гаража и пр., для хранения сезонных вещей.<br>Приветствуется ипотека Сбербанк, Мат. кап. не использовался, несовершеннолетних собственников нет.<br>Детали просмотра и все нюансы можно уточнить по тел.. Номер в базе: 5044250. Район: Железнодорожный.",61 м²,,,,,652.0,3/5,61 м²,61.0,3,13,3046826762,Sale,/4-komnatnaya-kvartira-na-prodazhu-novosibirsk-3046826762,262.0,4 350 000 ₽,71 311 ₽ за м²,71311,4350000,Apartment,2020-12-02T07:46:11.681898Z,78,Listing,4,4.0,2021-01-01T10:37:09.216917+03:00,2072767306,2020-12-02T10:36:41.595036+03:00,2020-12-07T19:06:52.433057+03:00,0.606,262.0,#FF0000,Красный проспект,"4-комн. квартира, 61 м², 3/5 эт.",2020-12-07T16:16:28.153684Z
"Новосибирская область, Бердск, Черемушная улица, 53к1",23367994,Компания «ЭТАЖИ»,Resale,3279,2020-09-18T06:20:55.340279Z,"Продаётся квартира — студия, в кирпичном тёплом доме, в молодом развивающемся микрорайоне Раздольный. В квартире сделан косметический ремонт, в ванной комнате выложена кафельная плитка, окна пластиковые. Подходит как для молодых семей, так и для проживания пожилых людей, хороший вариант для сдачи в аренду. Тихий район для проживания, во дворе есть скамейки, всегда свободные парковочные места. В пешей доступности расположена остановка, транспорт ходит каждые 30 минут, вблизи расположен продуктовый магазин, где можно приобрести товары первой необходимости. Подходит под все виды расчёта, помощь в получение ипотеки. Приглашаем на просмотр.. Номер в базе: 4687315. Район: Раздольный.",28.5 м²,,,,,,2/3,28.5 м²,28.5,2,8,2871545564,Sale,/kvartira-na-prodazhu-berdsk-2871545564,,1 395 000 ₽,48 947 ₽ за м²,48947,1395000,Apartment,2020-09-18T06:20:55.340279Z,78,Listing,Студия,,2021-01-02T10:18:28.1078+03:00,2008300511,2020-09-18T09:11:13.432371+03:00,2020-12-03T16:17:53.815531+03:00,,,,,"Квартира-студия, 28.5 м², 2/3 эт.",2020-12-03T13:27:43.229266Z
"Новосибирская область, Бердск, Вокзальная улица, 4",124649193,Сергей,Resale,3279,2020-11-01T06:21:29.726582Z,"Продам лично 3-к квартиру. Интересное расположение дома, рядом садики, школы, магазины, рынок. В шаговой доступности вокзал, автобусные остановки. Окна выходят на обе стороны дома, квартира светлая, солнечная. Отличные виды из окна, вокруг просторные дворы для прогулок. Планировка стандартная для панельного дома, состояние квартиры ухоженное, натяжные потолки, пластиковые окна, установлены водосчетчики. Готовы оставить качественную кухонную мебель в хорошем состоянии. <br>Собственник 1 взрослый. Расчет любой.",58 м²,,,,,,5/5,58 м²,58.0,5,10,2973763238,Sale,/3-komnatnaya-kvartira-na-prodazhu-berdsk-2973763238,,2 850 000 ₽,49 138 ₽ за м²,49138,2850000,Apartment,2020-11-01T06:21:29.726582Z,78,Listing,3,3.0,2020-12-31T19:33:07.929253+03:00,2023649467,2020-11-01T09:10:30.339547+03:00,2020-12-01T19:33:07.929253+03:00,,,,,"3-комн. квартира, 58 м², 5/5 эт.",2020-12-01T16:42:11.886861Z
"Новосибирск, улица Ясный Берег, 10",158305158,Ипотечное Агентство ЛЕГКО,Resale,3285,2020-12-04T08:24:50.127477Z,Продается 2-х. квартира от собственника! С ключами! <br>Таких вариантов нет от застройщика. <br>В продаже квартира с чистовой отделкой в новом доме повышенной комфортности. <br>ЖК Ясный Берег признан одним из комфортных комплексов Новосибирска. <br>Город-Парк как многие его называют.<br>Безупречная чистовая отделка<br>Квартира в кирпичном доме.<br>Территория огорожена. <br>В шаговой доступности школа и детский сад! Запланировано строительство новой школы.<br>Полное сопровождение БЕЗОПАСНОЙ сделки! <br>Ипотека для Вас по сниженным % ставкам!<br>Горячее предложение!!<br>Дом СДАН!,51 м²,,,,,654.0,9/10,51 м²,51.0,9,7,3051903008,Sale,/2-komnatnaya-kvartira-na-prodazhu-novosibirsk-3051903008,268.0,4 350 000 ₽,85 294 ₽ за м²,85294,4350000,Apartment,2020-12-04T08:24:50.127477Z,78,Listing,2,2.0,2021-01-03T11:15:44.507391+03:00,2052773906,2020-12-04T11:15:19.090141+03:00,2020-12-04T11:15:44.507391+03:00,2.399,268.0,#008000,Площадь Гарина-Михайловского,"2-комн. квартира, 51 м², 9/10 эт.",2020-12-04T08:24:58.801671Z
"Новосибирск, улица Галущака, 4",23367994,Компания «ЭТАЖИ»,Resale,3285,2020-12-01T16:45:59.293351Z,"В продаже 3 комнатная квартира 68 м2 на 12 этаже. Все необходимое рядом: магазины, супермаркеты, аптеки, школы и дошкольные учреждения, остановки общественного транспорта. В квартире выполнен качественный ремонт. Вся мебель и техника остается новым собственникам. Квартира без залогов и обременений. Возможно приобрести эту квартиру в ипотеку от 7.7% годовых • Бесплатная помощь в получение ипотеки (Снижение % ставки до – 0.8%) • полное юридическое сопровождение сделки. • Возможно использовать материнский капитал как первоначальный взнос. • Военная ипотека. • Гарантированная безопасность сделки! -Помогу выгодно продать вашу недвижимость. Звоните.. Номер в базе: 5036744. Район: Заельцовский.",68 м²,,,,,653.0,12/19,68 м²,68.0,12,20,3045722190,Sale,/3-komnatnaya-kvartira-na-prodazhu-novosibirsk-3045722190,261.0,6 000 000 ₽,88 235 ₽ за м²,88235,6000000,Apartment,2020-12-01T16:45:59.293351Z,78,Listing,3,3.0,2020-12-31T19:36:57.756079+03:00,2072239851,2020-12-01T19:36:31.534834+03:00,2020-12-07T13:16:53.669855+03:00,0.69,261.0,#FF0000,Гагаринская,"3-комн. квартира, 68 м², 12/19 эт.",2020-12-07T10:26:46.114128Z
"с/п Станционный сельсовет, стр. 4",111821583,Купидом Агентство хороших квартир,New,3285,2020-12-01T09:22:17.43382Z,"Ипотека от 1,9%<br>Жилой комплекс представляет собой лаконичное продолжение застройки микрорайона «Родники» — одного из самых быстро растущих и, благодаря развитой социальной инфраструктуре, привлекательных для молодых семей.<br>Инфраструктура микрорайона на «Родниках» может составить конкуренцию многим историческим районам Новосибирска, и в первую очередь это касается социальных учреждений. В шаговой доступности расположено 3 средних общеобразовательных школы и 8 детских садов комбинированного типа. Поскольку микрорайон является по большей части семейным, здесь можно найти центры досуга, творчества и дополнительного образования для детей на любой вкус, включая спортивные секции, танцевальные студии и школы искусств.",41.4 м²,91384.0,Мкр. «Приозерный»,91384.0,Мкр. «Приозерный»,,1/10,41.4 м²,41.4,1,4,3044646228,Sale,/1-komnatnaya-kvartira-na-prodazhu-novosibirsk-3044646228,,2 950 000 ₽,71 256 ₽ за м²,71256,2950000,Apartment,2020-12-01T09:22:17.43382Z,78,Listing,1,1.0,2020-12-31T12:13:15.041571+03:00,2029259821,2020-12-01T12:12:48.734146+03:00,2020-12-01T12:44:15.989264+03:00,,,,,"1-комн. квартира, 41.4 м², 1/10 эт.",2020-12-01T09:55:04.822729Z
"Новосибирская область, Новосибирский район, Барышевский сельсовет, коттеджный посёлок Горки Академпарка, улица Тесла, 11",164640940,"""Жилфонд"" агентство недвижимости",Resale,3285,2020-08-25T10:20:33.332371Z,"Новосибирский район, нп.Ложок, ул. Тесла.  ЭКСКЛЮЗИВНОЕ ПРЕДЛОЖЕНИЕ в коттеджном поселке вблизи Академгородка. Коттеджный поселок Горки Академпарка располагается в 8 км от проспекта Лаврентьева в сторону горнолыжного комплекса Ключи. Эта местность знаменита горнолыжным спуском, близостью к ботаническому саду СО РАН и Историко-архитектурному музею под открытым небом.<br> <br>Создатели поселка продумали все элементы жизни современного человека.<br> Горки Академпарка обеспечены центральными подземными инженерными коммуникациями- водоснабжение, канализация, газоснабжение, электроснабжение, построена вышка мобильной связи и проложено оптоволокно. <br> Для детей разных возрастов от самых маленьких до подростков в поселке Горки Академпарка предусмотрена специально оборудованная игровая площадка. Время, проведенное на свежем воздухе, станет веселым, полезным и безопасным. Также для жителей поселка уже решен вопрос дошкольного и школьного образования. Достигнута договоренность об обеспечении детей, проживающих на территории Барышевского сельсовета, местами в школах Академгородка. На въезде в поселок Ложок построен современный детский сад, он уже принимает маленьких посетителей.<br> Райский уголок природы со всеми коммуникациями и близостью к развитой инфраструктуре Академгородка - эту мечту Вы можете воплотить в жизнь!! Звоните, все покажем и расскажем!<br>Возможен обмен на вашу недвижимость.<br>	<br>	При звонке, пожалуйста, сообщите номер варианта - <br>       JV000040330011",106.8 м²,,,,,,1/3,106.8 м²,106.8,1,7,2814855206,Sale,/4-komnatnaya-kvartira-na-prodazhu-novosibirsk-2814855206,,6 621 600 ₽,62 000 ₽ за м²,62000,6621600,Apartment,2020-08-25T10:20:33.332371Z,78,Listing,4,4.0,2021-01-03T11:35:57.614673+03:00,1994345220,2020-08-25T13:10:53.763978+03:00,2020-12-04T11:35:57.614673+03:00,,,,,"4-комн. квартира, 106.8 м², 1/3 эт.",2020-12-04T08:45:43.266576Z
"Новосибирская область, Барабинск, квартал Д, 3",15880283,Александр,Resale,3266,2020-10-04T11:22:32.593241Z,"К продаже подготовлена 4-х комнатная квартира, третий этаж, теплая, современная планировка, окна ПВХ, есть и лоджия, и балкон. Двор благоустроен, огород у дома, 1 сотка.",87 м²,,,,,,3/3,87 м²,87.0,3,10,2907155403,Sale,/4-komnatnaya-kvartira-na-prodazhu-barabinsk-2907155403,,2 000 000 ₽,22 989 ₽ за м²,22989,2000000,Apartment,2020-10-04T11:22:32.593241Z,78,Listing,4,4.0,2021-01-02T18:56:46.748457+03:00,2009215336,2020-10-04T14:13:06.000867+03:00,2020-12-03T18:56:46.748457+03:00,,,,,"4-комн. квартира, 87 м², 3/3 эт.",2020-12-03T16:06:30.077709Z
"Новосибирск, улица Станиславского, 14, подъезд 1",7500643,ИП Цурикова Н.П.,Resale,3285,2020-12-06T05:23:42.038243Z,Продажа от собственника. 2-х комнатная полногабаритная удобная теплая квартира. Хорошая транспортная развязка.,59 м²,,,,,654.0,4/5,59 м²,59.0,4,0,3055513531,Sale,/2-komnatnaya-kvartira-na-prodazhu-novosibirsk-3055513531,267.0,6 000 000 ₽,101 695 ₽ за м²,101695,6000000,Apartment,2020-12-06T05:23:42.038243Z,78,Listing,2,2.0,2021-01-05T08:14:40.507535+03:00,2049312060,2020-12-06T07:07:05.172241+03:00,2020-12-06T08:14:40.507535+03:00,1.446,267.0,#FF0000,Площадь Маркса,"2-комн. квартира, 59 м², 4/5 эт.",2020-12-06T05:23:44.88451Z
