address,agencyId,agencyName,apartmentSaleType,cityId,createdAt,description,details,developmentId,developmentName,developmentParentId,developmentParentName,districtId,floor,floorArea,floorAreaCalculated,floorInt,galleryImagesCount,id,itemType,itemUrl,metroId,price,pricePerArea,pricePerAreaValue,priceValue,propertyType,publishDate,regionId,resultType,rooms,roomsOrdinal,sourceFinishTime,sourceId,sourceStartTime,sourceUpdateTime,station_distance,station_id,station_lineColors,station_name,title,updatedAt
"ул. Михаила Немыткина, д. 1",111821583,Купидом Агентство хороших квартир,New,3285,2020-12-01T09:52:30.570525Z,"Жилой комплекс возводится в микрорайоне Родники на улице Немыткина. Это одноподъездный 19-ти этажный дом, который рассчитан всего на 190 квартир. Архитектурное решение дома отличается стильным дизайном, комфортными семейными планировками, а также уникальной концепцией благоустройства двора.<br>Двор максимально безопасен и комфортен: закрытая территория, зона для игр и отдыха изолирована от автомобилей. Вся территория спроектирована по принципу беспорогового пространства, входная группа в подъезд находится на одном уровне с придомовой территорией.<br>Инфраструктура района хорошо развита. В непосредственной близости находятся школа и детский сад, магазины, гипермаркет ""Лента"", остановки общественного транспорта.",36.9 м²,1008208064.0,ЖД «Ника»,1008208064.0,ЖД «Ника»,648.0,4/19,36.9 м²,36.9,4,6,3044748073,Sale,/1-komnatnaya-kvartira-na-prodazhu-novosibirsk-3044748073,,2 696 000 ₽,73 062 ₽ за м²,73062,2696000,Apartment,2020-12-01T09:52:30.570525Z,78,Listing,1,1.0,2020-12-31T12:43:14.809086+03:00,2029479051,2020-12-01T12:42:47.252652+03:00,2020-12-01T12:43:14.809086+03:00,,,,,"1-комн. квартира, 36.9 м², 4/19 эт.",2020-12-01T09:53:06.268675Z
"ул. Плахотного, стр. 7",23367994,Компания «ЭТАЖИ»,New,3285,2020-12-01T10:12:15.176982Z,"В продаже уютная, светлая, теплая полноценная трехкомнатная квартира под самоотделку в ЖК КрымSKY. <br>ДОМ НА СДАЧЕ! Выдача ключей ориентировочно Декабрь 2020 - Январь 2021<br>Комиссия агентству 0 рублей! <br>Подходит под ипотеку. <br>Помощь в получении положительного ипотечного решения от 4,5 %. <br>Экскурсия по жилому комплексу бесплатно. <br>Бронь бесплатно. <br>Можно заказать дополнительный ремонт по выгодной цене. <br>Жилой комплекс расположен в районе с развитой инфраструктурой. На расстоянии 500 метров находятся школы и детские сады. В шаговой доступности магазины формата «у дома», крупные универсамы, торговый центр, аптеки. Рядом ЛДС «Звёздный», футбольный клуб и бассейн.<br>В доме установлены современные лифты, общедомовая сеть на базе WiFi с высокоскоростным подключением к сети интернет. Служба консьержа и SKY Сервис. На придомовой территории ведется видеонаблюдение и располагается благоустроенный, озелененный двор с детскими и спортивными площадками.",78.6 м²,74987.0,ЖК «КрымSKY» (КрымСкай),74987.0,ЖК «КрымSKY» (КрымСкай),654.0,1/18,78.6 м²,78.6,1,9,3044828280,Sale,/3-komnatnaya-kvartira-na-prodazhu-novosibirsk-3044828280,267.0,5 978 000 ₽,76 056 ₽ за м²,76056,5978000,Apartment,2020-12-01T10:12:15.176982Z,78,Listing,3,3.0,2020-12-31T13:03:13.550056+03:00,2071929689,2020-12-01T13:02:47.512497+03:00,2020-12-01T13:03:13.550056+03:00,3.15,267.0,#FF0000,Площадь Маркса,"3-комн. квартира, 78.6 м², 1/18 эт.",2020-12-01T10:20:28.209212Z
"Новосибирск, улица Александра Невского, 32",122634585,Академия Недвижимости,Resale,3285,2020-09-28T06:37:41.616536Z,"В продаже полноценная двухкомнатная квартира в развитом микрорайоне. В квартире выполнен обычный ремонт. Без изысков. Высота потолков 3 метра, комнаты все квадратной формы. Продается вместе с мебелью. На кухне есть погреб, так же вместе с квартирой идет ячейка в подвале. Дом расположен в тихом (спальном) районе, двор закрыт от дороги.<br>В шаговой доступности: ПКиО Сосновый бор, магазины с различным ассортиментом, остановка, детская площадка, школы, дет.сады.<br>Чистая продажа, без обременений. Приглашаем на просмотр . Звоните.",58.1 м²,,,,,648.0,1/2,58.1 м²,58.1,1,15,2893508413,Sale,/2-komnatnaya-kvartira-na-prodazhu-novosibirsk-2893508413,260.0,2 560 000 ₽,44 062 ₽ за м²,44062,2560000,Apartment,2020-09-28T06:37:41.616536Z,78,Listing,2,2.0,2020-12-31T13:04:13.610506+03:00,2007761438,2020-09-28T09:28:11.818518+03:00,2020-12-01T13:04:13.610506+03:00,3.73,260.0,#FF0000,Заельцовская,"2-комн. квартира, 58.1 м², 1/2 эт.",2020-12-01T10:13:15.734867Z
"ул. Плахотного, стр. 7",23367994,Компания «ЭТАЖИ»,New,3285,2020-12-01T10:17:16.201178Z,"В продаже уютная, светлая, теплая полноценная двухкомнатная квартира под самоотделку в ЖК КрымSKY.<br>ДОМ НА СДАЧЕ! Выдача ключей ориентировочно Декабрь 2020 - Январь 2021 <br>Комиссия агентству 0 рублей! <br>Подходит под ипотеку. <br>Помощь в получении положительного ипотечного решения от 4,5 %.  <br>Экскурсия по жилому комплексу бесплатно.  <br>Бронь бесплатно. <br>Можно заказать дополнительный ремонт по выгодной цене.   <br>Жилой комплекс расположен в районе с развитой инфраструктурой. На расстоянии 500 метров находятся школы и детские сады. В шаговой доступности магазины формата «у дома», крупные универсамы, торговый центр, аптеки. Рядом ЛДС «Звёздный», футбольный клуб и бассейн.  <br>В доме установлены современные лифты, общедомовая сеть на базе WiFi с высокоскоростным подключением к сети интернет. Служба консьержа и SKY Сервис. На придомовой территории ведется видеонаблюдение и располагается благоустроенный, озелененный двор с детскими и спортивными площадками.",56.8 м²,74987.0,ЖК «КрымSKY» (КрымСкай),74987.0,ЖК «КрымSKY» (КрымСкай),654.0,1/18,56.8 м²,56.8,1,9,3044837667,Sale,/2-komnatnaya-kvartira-na-prodazhu-novosibirsk-3044837667,267.0,4 410 000 ₽,77 641 ₽ за м²,77641,4410000,Apartment,2020-12-01T10:17:16.201178Z,78,Listing,2,2.0,2020-12-31T13:08:14.382194+03:00,2072410025,2020-12-01T13:07:48.849962+03:00,2020-12-01T13:08:14.382194+03:00,3.15,267.0,#FF0000,Площадь Маркса,"2-комн. квартира, 56.8 м², 1/18 эт.",2020-12-01T10:22:08.827066Z
"Новосибирск, улица Владимира Заровного, 42",45473436,«Город 54»  Агентство Недвижимости,Resale,3285,2020-12-08T17:18:06.471029Z,рочная продажа,37 м²,,,,,650.0,9/25,37 м²,37.0,9,0,3061930674,Sale,/kvartira-na-prodazhu-novosibirsk-3061930674,265.0,4 350 000 ₽,117 568 ₽ за м²,117568,4350000,Apartment,2020-12-08T17:18:06.471029Z,78,Listing,Студия,,2021-01-07T20:09:03.397377+03:00,2074004634,2020-12-08T20:08:43.652594+03:00,2020-12-08T20:09:03.397377+03:00,3.24,265.0,#FF0000,Речной вокзал,"Квартира-студия, 37 м², 9/25 эт.",2020-12-08T17:18:13.34853Z
"Новосибирск, улица Владимира Заровного, 22",45473436,«Город 54»  Агентство Недвижимости,Resale,3285,2020-12-08T17:18:07.496115Z,Срочня продажа,27 м²,,,,,650.0,20/25,27 м²,27.0,20,1,3061930752,Sale,/kvartira-na-prodazhu-novosibirsk-3061930752,265.0,2 850 000 ₽,105 556 ₽ за м²,105556,2850000,Apartment,2020-12-08T17:18:07.496115Z,78,Listing,Студия,,2021-01-07T20:09:03.688361+03:00,2074374324,2020-12-08T20:08:44.320779+03:00,2020-12-08T20:09:03.688361+03:00,2.653,265.0,#FF0000,Речной вокзал,"Квартира-студия, 27 м², 20/25 эт.",2020-12-08T17:18:10.462675Z
"Новосибирск, улица Дунаевского, 14",45473436,«Город 54»  Агентство Недвижимости,Resale,3285,2020-12-08T17:18:07.968883Z,"Срочная продажа , квартира под с/о , ипотека",46 м²,,,,,648.0,6/10,46 м²,46.0,6,1,3061930784,Sale,/2-komnatnaya-kvartira-na-prodazhu-novosibirsk-3061930784,,3 300 000 ₽,71 739 ₽ за м²,71739,3300000,Apartment,2020-12-08T17:18:07.968883Z,78,Listing,2,2.0,2021-01-07T20:09:03.99329+03:00,2073910245,2020-12-08T20:08:44.029432+03:00,2020-12-08T20:09:03.99329+03:00,,,,,"2-комн. квартира, 46 м², 6/10 эт.",2020-12-08T17:18:10.873837Z
"Новосибирск, Вилюйская улица, 7",45473436,«Город 54»  Агентство Недвижимости,Resale,3285,2020-12-08T17:18:10.873483Z,"Срочная продажа , в квартире произведен ремонт",45 м²,,,,,650.0,23/25,45 м²,45.0,23,1,3061930968,Sale,/1-komnatnaya-kvartira-na-prodazhu-novosibirsk-3061930968,265.0,3 250 000 ₽,72 222 ₽ за м²,72222,3250000,Apartment,2020-12-08T17:18:10.873483Z,78,Listing,1,1.0,2021-01-07T20:09:05.114114+03:00,2073944584,2020-12-08T20:08:43.69045+03:00,2020-12-08T20:09:05.114114+03:00,4.374,265.0,#FF0000,Речной вокзал,"1-комн. квартира, 45 м², 23/25 эт.",2020-12-08T17:18:17.977243Z
"Новосибирск, улица Кошурникова, 23",45473436,«Город 54»  Агентство Недвижимости,Resale,3285,2020-12-08T17:18:07.796688Z,"Квартира под с/о , срочная продажа  ,",35 м²,,,,,651.0,11/17,35 м²,35.0,11,1,3061930770,Sale,/2-komnatnaya-kvartira-na-prodazhu-novosibirsk-3061930770,272.0,3 800 000 ₽,108 571 ₽ за м²,108571,3800000,Apartment,2020-12-08T17:18:07.796688Z,78,Listing,2,2.0,2021-01-07T20:09:05.272038+03:00,2074744598,2020-12-08T20:08:44.317136+03:00,2020-12-08T20:09:05.272038+03:00,0.517,272.0,#008000,Золотая Нива,"2-комн. квартира, 35 м², 11/17 эт.",2020-12-08T17:18:16.665418Z
