address,agencyId,agencyName,apartmentSaleType,cityId,createdAt,description,details,developmentId,developmentName,developmentParentId,developmentParentName,districtId,floor,floorArea,floorAreaCalculated,floorInt,galleryImagesCount,id,itemType,itemUrl,metroId,price,pricePerArea,pricePerAreaValue,priceValue,propertyType,publishDate,regionId,resultType,rooms,roomsOrdinal,sourceFinishTime,sourceId,sourceStartTime,sourceUpdateTime,station_distance,station_id,station_lineColors,station_name,title,updatedAt
"Новосибирская область, Черепановский район, станция Безменово, Элитная улица, 30",31231942,"Агентство недвижимости ""Таурт""",Resale,3241,2020-07-28T04:53:41.37965Z,"Станция Безменово находится в 18 км от Черепаново.Безменово небольшой поселок,с численностью населения в пять тысяч человек.В посёлке есть школа,детский сад, фельдшерский пункт.Квартира в хорошем состоянии.Комнаты изолированные,большая лоджия застеклена.Рядом с домом земля.",46 м²,,,,,,1/2,46 м²,46.0,1,0,2746311919,Sale,/2-komnatnaya-kvartira-na-prodazhu-cherepanovo-2746311919,,800 000 ₽,17 391 ₽ за м²,17391,800000,Apartment,2020-07-28T04:53:41.37965Z,78,Listing,2,2.0,2021-01-02T08:09:35.435041+03:00,1956403117,2020-07-28T07:42:20.404434+03:00,2020-12-03T08:09:35.435041+03:00,,,,,"2-комн. квартира, 46 м², 1/2 эт.",2020-12-03T05:18:38.649103Z
"Новосибирск, проспект Дзержинского, 14/3",23367994,Компания «ЭТАЖИ»,Resale,3285,2020-11-30T13:39:13.474839Z,"В продаже просторная 4-х комнатная, светлая квартира с высокими потолками, панорамными окнами. <br>Дом расположен в престижном микрорайоне (рядом с администрацией Дзержинского района), оборудован камерами видео наблюдения,выходом на подземную парковку, с развитой инфраструктурой досуга и быта (детские сады, школы, гимназия №15, крупные торгово-развлекательные комплексы, банки, медицинские учреждения). Отличная автомобильная транспортная развязка.<br>Звоните!<br>Записывайтесь на просмотры!. Номер в базе: 4919052. Район: Дзержинский.",117 м²,,,,,651.0,3/5,117 м²,117.0,3,17,3042783592,Sale,/4-komnatnaya-kvartira-na-prodazhu-novosibirsk-3042783592,271.0,10 500 000 ₽,89 744 ₽ за м²,89744,10500000,Apartment,2020-11-30T13:39:13.474839Z,78,Listing,4,4.0,2020-12-30T16:30:05.46766+03:00,2072465091,2020-11-30T16:29:34.073449+03:00,2020-11-30T16:30:05.46766+03:00,1.167,271.0,#008000,Берёзовая роща,"4-комн. квартира, 117 м², 3/5 эт.",2020-11-30T13:39:16.418845Z
"Новосибирская область, Бердск, Бердский санаторий, 34",23367994,Компания «ЭТАЖИ»,Resale,3279,2020-11-30T13:39:14.670213Z,"В продаже 1-ая квартира на 1-ом этаже 5-ти этажного кирпичного дома.<br>Дом расположен в санаторно-курортной зоне Бердска. Рядом пляж, сосновый бор, красивое, тихое место.<br>Дом строился по индивидуальному проекту, высота потолков 3 м, большая лоджия на два окна. Квартира очень теплая, светлая. Территория дома закрыта шлагбаумом для парковки, установлено видеонаблюдение.<br>В шаговой доступности остановка общественного транспорта, магазины, рестораны, центры развлечений.<br>Мебель остается, бытовая техника по договоренности<br>Чистая продажа, без обременений, один собственник.<br>Приглашаем на просмотр!!!. Номер в базе: 4991512. Район: БДО.",49.8 м²,,,,,,1/5,49.8 м²,49.8,1,20,3042783655,Sale,/1-komnatnaya-kvartira-na-prodazhu-berdsk-3042783655,,2 600 000 ₽,52 209 ₽ за м²,52209,2600000,Apartment,2020-11-30T13:39:14.670213Z,78,Listing,1,1.0,2020-12-30T16:30:07.759553+03:00,2072665419,2020-11-30T16:29:37.348948+03:00,2020-12-04T22:36:53.588824+03:00,,,,,"1-комн. квартира, 49.8 м², 1/5 эт.",2020-12-04T19:46:56.301207Z
"Новосибирская область, Бердск, территория МК Сибиряк, к4",23367994,Компания «ЭТАЖИ»,Resale,3279,2020-11-30T13:39:20.084966Z,"Продается уютная, комфортабельная квартира (евродвушка) в МК ""Сибиряк"" в 15 минутах езды от Академгородка. В квартире сделан качественный ремонт (делали для себя), вложений не требует. Кухня - гостиная с застекленным балконом выходит на благоустроенную набережную, превосходный вид из окна на Бердский залив. Окна спальни выходят во двор. Сосновый лес, чистый воздух, пляж в 5-ти минутах ходьбы! Территория отгорожена и находится под охраной, видеонаблюдение, въезд осуществляется через контрольно-пропускной пункт. На территории жилого комплекса имеются беговые дорожки, спортивная площадка и спортивный комплекс, детская площадка, зона отдыха, пирс. Место для жизни в живописном месте вблизи города! В стоимость квартиры входит новая кухня с встроенной техникой, оборудованные ванна и туалет (установлен водонагреватель). Другая мебель по договорённости.<br> Звоните, приезжайте смотреть,заезжайте жить в квартиру мечты!. Номер в базе: 5012534. Район: Речкуновская Зона Отдыха.",50 м²,,,,,,1/3,50 м²,50.0,1,13,3042784090,Sale,/2-komnatnaya-kvartira-na-prodazhu-berdsk-3042784090,,3 800 000 ₽,76 000 ₽ за м²,76000,3800000,Apartment,2020-11-30T13:39:20.084966Z,78,Listing,2,2.0,2020-12-30T16:30:08.501891+03:00,2071916314,2020-11-30T16:29:38.442694+03:00,2020-11-30T16:30:08.501891+03:00,,,,,"2-комн. квартира, 50 м², 1/3 эт.",2020-11-30T13:39:25.921604Z
"Новосибирск, улица Связистов, 11",23367994,Компания «ЭТАЖИ»,Resale,3285,2020-11-30T13:39:21.774653Z,"Продам трёхкомнатную квартиру в жилом состоянии. В квартире установлены приборы учета воды, пластиковые окна. Квартира светлая. Солнечная сторона. Очень теплая. В квартире остаётся 2 больших шкафа купе, остальная мебель по отдельной договорённости. Развитая инфраструктура: до автобусной остановки 400 метров пешком, рядом магазины, дет.сад, школа, троицкий сквер. Квартира более пяти лет в собственности,перепланировок и обременения нет. Подходит под любые формы расчета. Реальному покупателю хороший торг.ЗВОНИТЕ!!!. Номер в базе: 4982081. Район: Ленинский.",63.5 м²,,,,,654.0,4/9,63.5 м²,63.5,4,20,3042784168,Sale,/3-komnatnaya-kvartira-na-prodazhu-novosibirsk-3042784168,267.0,3 800 000 ₽,59 843 ₽ за м²,59843,3800000,Apartment,2020-11-30T13:39:21.774653Z,78,Listing,3,3.0,2020-12-30T16:30:09.047203+03:00,2072205821,2020-11-30T16:29:38.588146+03:00,2020-12-07T10:06:57.278286+03:00,3.869,267.0,#FF0000,Площадь Маркса,"3-комн. квартира, 63.5 м², 4/9 эт.",2020-12-07T07:16:28.773325Z
"Новосибирск, улица Николая Грицюка, 1, подъезд 3",60067648,Ирина,Resale,3285,2020-12-02T04:00:45.164917Z,"Предлагается к продаже новая, стильно оборудованная  квартира - студия в ЖК Художник для людей - ценителей  здоровый образ жизни и комфорт.<br>Удобное расположение комплекса решает ряд ключевых потребностей современного жителя большого города : удобная транспортная развязка (15 минут до метро К. Маркса); хорошая инфраструктура;  спокойствие и безопасность : огражденная территория с въездом через  шлагбаум, круглосуточная охрана и видео наблюдение, а самое главное - свежий воздух.<br>Показ квартиры по договоренности.",21 м²,,,,,655.0,3/3,21 м²,21.0,3,2,3046400267,Sale,/kvartira-na-prodazhu-novosibirsk-3046400267,,1 590 000 ₽,75 714 ₽ за м²,75714,1590000,Apartment,2020-12-02T04:00:45.164917Z,78,Listing,Студия,,2021-01-01T07:19:46.990914+03:00,2014184667,2020-12-02T06:47:39.636205+03:00,2020-12-02T07:19:46.990914+03:00,,,,,"Квартира-студия, 21 м², 3/3 эт.",2020-12-02T04:28:52.040094Z
"Новосибирск, Кировский район, Северо-Чемской жилмассив, улица Герцена, 1/1",152810530,Центральное агентство недвижимости,Resale,3285,2020-09-03T02:38:23.049967Z,"Близится сдача ЖК Прибрежный. Квартира-студия на берегу ркки Обь. Инфраструктура- сад, школа рядом. Хорошая транспортная развязка. Реальному покупателю-торг.<br>С проектной декларацией можно ознакомиться на сайте застройщика.<br>При звонке, пожалуйста, назовите номер объявления - 0<br>Консультируем подробно по телефону.",32.2 м²,,,,,655.0,4/11,32.2 м²,32.2,4,11,2835215718,Sale,/1-komnatnaya-kvartira-na-prodazhu-novosibirsk-2835215718,,1 650 000 ₽,51 242 ₽ за м²,51242,1650000,Apartment,2020-09-03T02:38:23.049967Z,78,Listing,1,1.0,2020-12-31T15:27:09.693304+03:00,1984589407,2020-09-03T05:25:39.666532+03:00,2020-12-01T15:33:21.35132+03:00,,,,,"1-комн. квартира, 32.2 м², 4/11 эт.",2020-12-01T12:43:01.498923Z
"Новосибирск, улица Новая Заря, 25",152810530,Центральное агентство недвижимости,Resale,3285,2020-09-30T02:27:14.239227Z,"Предлагается к продается 3-комнатная светлая и теплая квартира. Комнаты изолированны. Окна на две стороны выходят. Во дворе дома школа и детский сад.  Для комфортной жизни все в шаговой доступности:  поликлиника,  множество магазинов, остановка общественного транспорта.<br> Тихий и уютный двор. Есть парковочные места.<br> Просмотр квартиры по договоренности.<br>При звонке, пожалуйста, назовите номер объявления - 116 376<br>Консультируем подробно по телефону.",60.5 м²,,,,,648.0,1/5,60.5 м²,60.5,1,7,2897730990,Sale,/3-komnatnaya-kvartira-na-prodazhu-novosibirsk-2897730990,272.0,3 200 000 ₽,52 893 ₽ за м²,52893,3200000,Apartment,2020-09-30T02:27:14.239227Z,78,Listing,3,3.0,2020-12-31T15:27:09.637928+03:00,1984228991,2020-09-30T05:17:45.775188+03:00,2020-12-07T05:23:45.766373+03:00,4.244,271.0,#008000,Берёзовая роща,"3-комн. квартира, 60.5 м², 1/5 эт.",2020-12-07T02:34:01.351143Z
"Новосибирск, Хилокская улица, 1В",152810530,Центральное агентство недвижимости,Resale,3285,2020-09-30T02:16:02.850842Z,"Предлагаем вашему вниманию 3-комнатную квартиру улучшенной планировки для большой и дружной семьи. В квартире выполнен качественный  ремонт дорогими материалами. Показываем в удобное для Вас время. <br>При звонке, пожалуйста, назовите номер объявления - 113 229<br>Консультируем подробно по телефону.",73.6 м²,,,,,654.0,5/10,73.6 м²,73.6,5,17,2897720941,Sale,/3-komnatnaya-kvartira-na-prodazhu-novosibirsk-2897720941,267.0,3 250 000 ₽,44 158 ₽ за м²,44158,3250000,Apartment,2020-09-30T02:16:02.850842Z,78,Listing,3,3.0,2020-12-31T15:27:09.892196+03:00,1984165291,2020-09-30T05:06:32.474844+03:00,2020-12-08T05:24:35.908728+03:00,4.67,267.0,#FF0000,Площадь Маркса,"3-комн. квартира, 73.6 м², 5/10 эт.",2020-12-08T02:34:10.109161Z
"Новосибирск, улица Татьяны Снежиной, 39/1",152810530,Центральное агентство недвижимости,Resale,3285,2020-09-15T08:00:37.528672Z,"Срочная продажа<br>При звонке, пожалуйста, назовите номер объявления - 116 388<br>Консультируем подробно по телефону.",32.5 м²,,,,,650.0,6/10,32.5 м²,32.5,6,18,2864032425,Sale,/1-komnatnaya-kvartira-na-prodazhu-novosibirsk-2864032425,272.0,2 170 000 ₽,66 769 ₽ за м²,66769,2170000,Apartment,2020-09-15T08:00:37.528672Z,78,Listing,1,1.0,2020-12-31T15:27:13.534721+03:00,1984322881,2020-09-15T10:51:05.587669+03:00,2020-12-07T15:39:08.08566+03:00,3.331,272.0,#008000,Золотая Нива,"1-комн. квартира, 32.5 м², 6/10 эт.",2020-12-07T12:48:53.87549Z
"Новосибирск, улица Кирова, 110",152810530,Центральное агентство недвижимости,Resale,3285,2020-12-01T12:36:50.569263Z,"Уютная квартира в отличном состоянии. Сделан качественный ремонт по индивидуальному проекту. Встроенные шкафы и гардеробная. <br>При звонке, пожалуйста, назовите номер объявления - 116 254<br>Консультируем подробно по телефону.",62 м²,,,,,650.0,3/9,62 м²,62.0,3,7,3045206351,Sale,/3-komnatnaya-kvartira-na-prodazhu-novosibirsk-3045206351,265.0,6 500 000 ₽,104 839 ₽ за м²,104839,6500000,Apartment,2020-12-01T12:36:50.569263Z,78,Listing,3,3.0,2020-12-31T15:27:49.065155+03:00,2048624499,2020-12-01T15:27:21.458721+03:00,2020-12-07T05:23:50.703055+03:00,1.106,265.0,#FF0000,Речной вокзал,"3-комн. квартира, 62 м², 3/9 эт.",2020-12-07T02:33:59.951785Z
