address,agencyId,agencyName,apartmentSaleType,cityId,createdAt,description,details,developmentId,developmentName,developmentParentId,developmentParentName,districtId,floor,floorArea,floorAreaCalculated,floorInt,galleryImagesCount,id,itemType,itemUrl,metroId,price,pricePerArea,pricePerAreaValue,priceValue,propertyType,publishDate,regionId,resultType,rooms,roomsOrdinal,sourceFinishTime,sourceId,sourceStartTime,sourceUpdateTime,station_distance,station_id,station_lineColors,station_name,title,updatedAt
"Новосибирск, улица Юности, 1",147244801,Отдел Продаж Недвижимости,Resale,3285,2020-11-30T02:23:22.489148Z,"Полноценная однокомнатная квартира с лоджией.Классическая кирпичная кладка, надежные пластиковые окна с гарантией от застройщика и дополнительная шумоизоляция, остекление лоджий в едином стиле. На микрорайоне своя газовая котельная, это значит что вы всегда будете с горячей водой и отоплением. Квартиру можно приобрести с ремонтом под ключ, от застройщика. Дополнительная стоимость такой квартиры 8000 руб. за м2. Подходит под все виды расчётов!!! Комиссия 0%!!!",44.7 м²,,,,,654.0,12/12,44.7 м²,44.7,12,7,3041280360,Sale,/1-komnatnaya-kvartira-na-prodazhu-novosibirsk-3041280360,,2 546 760 ₽,56 974 ₽ за м²,56974,2546760,Apartment,2020-11-30T02:23:22.489148Z,78,Listing,1,1.0,2020-12-30T05:14:20.218559+03:00,2047646015,2020-11-30T05:13:56.938766+03:00,2020-11-30T05:14:20.218559+03:00,,,,,"1-комн. квартира, 44.7 м², 12/12 эт.",2020-11-30T02:23:23.640195Z
"Новосибирск, улица Сибиряков-Гвардейцев, 44/7",152810530,Центральное агентство недвижимости,Resale,3285,2020-11-30T02:23:27.453348Z,"Продается большая, уютная квартира с качественным ремонтом. Приглашаем на просмотр, время по договоренности<br>При звонке, пожалуйста, назовите номер объявления - 115 769<br>Консультируем подробно по телефону.",86 м²,,,,,655.0,2/17,86 м²,86.0,2,3,3041280372,Sale,/3-komnatnaya-kvartira-na-prodazhu-novosibirsk-3041280372,267.0,6 800 000 ₽,79 070 ₽ за м²,79070,6800000,Apartment,2020-11-30T02:23:27.453348Z,78,Listing,3,3.0,2020-12-30T05:14:26.087951+03:00,2048552455,2020-11-30T05:14:03.112192+03:00,2020-12-07T05:32:42.745485+03:00,1.799,267.0,#FF0000,Площадь Маркса,"3-комн. квартира, 86 м², 2/17 эт.",2020-12-07T02:42:16.188001Z
"Новосибирск, Кировский район, Северо-Чемской жилмассив, улица Герцена, 1/1",152810530,Центральное агентство недвижимости,Resale,3285,2020-11-30T02:23:30.381851Z,"Продается квартира в новостройке.Окна выходят на поликлинику. Дом сдан. Документы готовы к сделке, один собственник. Спешите купить<br>При звонке, пожалуйста, назовите номер объявления - 115 853<br>Консультируем подробно по телефону.",41.5 м²,,,,,655.0,4/11,41.5 м²,41.5,4,9,3041280389,Sale,/1-komnatnaya-kvartira-na-prodazhu-novosibirsk-3041280389,,2 500 000 ₽,60 241 ₽ за м²,60241,2500000,Apartment,2020-11-30T02:23:30.381851Z,78,Listing,1,1.0,2020-12-30T05:14:29.558285+03:00,2048660213,2020-11-30T05:14:03.406798+03:00,2020-12-07T05:32:42.275593+03:00,,,,,"1-комн. квартира, 41.5 м², 4/11 эт.",2020-12-07T02:42:18.880181Z
"Новосибирск, Ленинский район, микрорайон Горский, 56",22659655,ОГНИ НОВОСИБИРСКА,Resale,3285,2020-11-27T08:41:17.33272Z,"Предлагается в продажу уютная 6ти комнатная квартира с удобной, узаконенной перепланировкой.<br>На 1м этаже: большая гардеробная, кухня-столовая, гостиная, спальня, санузел с душевой кабиной.<br>На 2м этаже две спальни, санузел с ванной-джакузи.<br>новым хозяевам при необходимости, частично останется мебель.<br>Вся инфраструктура рядом: детские сады, школы, парк, бассейн!<br>Отличная транспортная развязка. До метро Студенческая 5 минут пешком.<br>Выезды на Коммунальный и Димитровский мосты.<br>Красивый вид из окна на реку!<br>Возможен обмен на недвижимость, с доплатой.<br>Номер объекта: #2/688026/51",136 м²,,,,,654.0,10/10,136 м²,136.0,10,38,3035854169,Sale,/5-komnatnaya-kvartira-na-prodazhu-novosibirsk-3035854169,266.0,8 350 000 ₽,61 397 ₽ за м²,61397,8350000,Apartment,2020-11-27T08:41:17.33272Z,78,Listing,5,5.0,2020-12-27T11:32:14.378707+03:00,2021158700,2020-11-27T11:27:17.669367+03:00,2020-11-27T12:55:31.117155+03:00,0.596,266.0,#FF0000,Студенческая,"5-комн. квартира, 136 м², 10/10 эт.",2020-11-27T10:04:51.606078Z
"Новосибирск, улица Виталия Потылицына, 11",73350676,Оксана,Resale,3285,2020-11-27T08:47:52.862282Z,"В продаже просторная, светлая, полноценная 2-х комнатная квартира с ремонтом, дом с единым остеклением. Комфортный средний этаж, чистый подъезд. Во дворе всегда есть место для парковки автомобиля. В шаговой доступности новая современная школа, детский сад, строится новая поликлиника. Рядом с домом остановка общественного транспорта, 5 минут до ТЦ ""Панорама"" с фитнес-клубом ""Europa"", множество магазинов, аптек и т.д. Развитая инфраструктура. <br>Подходит под все виды расчета, без обременений. <br>Быстрый выход на сделку. Звоните, с удовольствием ответим на все интересующие вас вопросы! <br>На приобретение Объекта возможно использование средств МАТЕРИНСКОГО (семейного) капитала.<br>Помощь в получении кредитного решения на выгодных условиях.",58 м²,,,,,650.0,2/10,58 м²,58.0,2,13,3035874523,Sale,/2-komnatnaya-kvartira-na-prodazhu-novosibirsk-3035874523,272.0,3 850 000 ₽,66 379 ₽ за м²,66379,3850000,Apartment,2020-11-27T08:47:52.862282Z,78,Listing,2,2.0,2020-12-27T11:38:50.112562+03:00,2066827838,2020-11-27T11:33:32.87192+03:00,2020-11-27T11:38:50.112562+03:00,3.085,272.0,#008000,Золотая Нива,"2-комн. квартира, 58 м², 2/10 эт.",2020-11-27T08:47:57.326513Z
"Новосибирск, Ленинский район, микрорайон Дивногорский, улица Романтиков, 8/1",147244801,Отдел Продаж Недвижимости,Resale,3285,2020-11-30T02:36:40.029712Z,"Полноценная двухкомнатная квартира с ремонтом от застройщика.Классическая кирпичная кладка дома, надежные пластиковые окна с гарантией от застройщика и дополнительная шумоизоляция, остекление лоджий в едином стиле. На микрорайоне своя газовая котельная, это значит что вы всегда будете с горячей водой и отоплением. Подходит под все виды расчётов!!! Комиссия 0%!!!",55.6 м²,,,,,654.0,9/12,55.6 м²,55.6,9,5,3041299158,Sale,/2-komnatnaya-kvartira-na-prodazhu-novosibirsk-3041299158,,3 557 760 ₽,63 988 ₽ за м²,63988,3557760,Apartment,2020-11-30T02:36:40.029712Z,78,Listing,2,2.0,2020-12-30T05:27:38.487412+03:00,2047842166,2020-11-30T05:27:14.959853+03:00,2020-11-30T05:27:38.487412+03:00,,,,,"2-комн. квартира, 55.6 м², 9/12 эт.",2020-11-30T02:36:42.627404Z
"Новосибирская область, Искитим, Томская улица, 1А",152810530,Центральное агентство недвижимости,Resale,3252,2020-08-30T12:47:20.87844Z,"Продается просторная  квартира в центре города Искитим.  В шаговой доступности вокзал, детские сады, школа, магазины. Планировка смежно-изолированная, есть кладовая,Требуется косметический ремонт. Один взрослый собственник. Чистая продажа. Пройдет одобрение по ипотеке в любом банке. Возможна покупка с использованием материнского капитала. Есть вариант покупки квартиры под сдачу с квартирантами. <br>При звонке, пожалуйста, назовите номер объявления - 66 161<br>Консультируем подробно по телефону.",41 м²,,,,,,2/5,41 м²,41.0,2,3,2827213961,Sale,/2-komnatnaya-kvartira-na-prodazhu-iskitim-2827213961,,1 350 000 ₽,32 927 ₽ за м²,32927,1350000,Apartment,2020-08-30T12:47:20.87844Z,78,Listing,2,2.0,2020-12-30T05:28:38.916652+03:00,1984118889,2020-08-30T15:37:52.569415+03:00,2020-12-07T05:23:34.396792+03:00,,,,,"2-комн. квартира, 41 м², 2/5 эт.",2020-12-07T02:33:40.52775Z
"Новосибирск, Киевская улица, 8",152810530,Центральное агентство недвижимости,Resale,3285,2020-06-05T01:50:58.103202Z,"В продаже хорошая квартира в удобном месте.<br>Подходит как для проживания так и для сдачи в аренду.Показ по договорённости.<br>Возможна продажа со всей мебелью.<br>При звонке, пожалуйста, назовите номер объявления - 116 443<br>Консультируем подробно по телефону.",28.7 м²,,,,,654.0,4/5,28.7 м²,28.7,4,8,2613664775,Sale,/1-komnatnaya-kvartira-na-prodazhu-novosibirsk-2613664775,267.0,2 350 000 ₽,81 882 ₽ за м²,81882,2350000,Apartment,2020-06-05T01:50:58.103202Z,78,Listing,1,1.0,2020-12-30T05:28:45.839706+03:00,1920843935,2020-06-04T05:10:42.417958+03:00,2020-12-07T05:23:47.26733+03:00,2.662,267.0,#FF0000,Площадь Маркса,"1-комн. квартира, 28.7 м², 4/5 эт.",2020-12-07T02:33:37.936083Z
"Новосибирск, Широкая улица, 19",152810530,Центральное агентство недвижимости,Resale,3285,2020-09-15T08:00:54.471431Z,"При звонке, пожалуйста, назовите номер объявления - 116 113<br>Консультируем подробно по телефону.",46 м²,,,,,654.0,3/5,46 м²,46.0,3,35,2864033257,Sale,/2-komnatnaya-kvartira-na-prodazhu-novosibirsk-2864033257,267.0,3 580 000 ₽,77 826 ₽ за м²,77826,3580000,Apartment,2020-09-15T08:00:54.471431Z,78,Listing,2,2.0,2020-12-30T05:28:52.335231+03:00,1984130454,2020-09-15T10:51:24.195597+03:00,2020-12-08T15:35:25.283844+03:00,2.325,267.0,#FF0000,Площадь Маркса,"2-комн. квартира, 46 м², 3/5 эт.",2020-12-08T12:44:55.668794Z
"Новосибирск, улица Юности, 1",147244801,Отдел Продаж Недвижимости,Resale,3285,2020-11-30T02:48:00.495984Z,"Ул.ЮНОСТИ 3. Дом построен и сдан в эксплуатацию в ноябре 2020 года.Классическая кирпичная кладка дома, надежные пластиковые окна с гарантией от застройщика и дополнительная шумоизоляция, остекление лоджий в едином стиле. На микрорайоне своя газовая котельная, это значит что вы всегда будете с горячей водой и отоплением. Подходит под все виды расчётов!!! Комиссия 0%!!!",29.6 м²,,,,,654.0,4/12,29.6 м²,29.6,4,7,3041316210,Sale,/kvartira-na-prodazhu-novosibirsk-3041316210,,1 952 000 ₽,65 946 ₽ за м²,65946,1952000,Apartment,2020-11-30T02:48:00.495984Z,78,Listing,Студия,,2020-12-30T05:38:59.424283+03:00,2047898183,2020-11-30T05:38:35.757906+03:00,2020-11-30T05:47:45.609554+03:00,,,,,"Квартира-студия, 29.6 м², 4/12 эт.",2020-11-30T02:56:45.356769Z
"Новосибирск, проспект Карла Маркса, 35",16304255,Екатерина,Resale,3285,2020-11-27T09:13:41.084796Z,"Продается просторная 4-комнатная квартира в полногабаритном, кирпичном доме (с возможностью полной перепланировки) в центре левого берега. Три комнаты изолированы, одна смежная. В квартире пластиковые окна и новые радиаторы отопления. Высота потолков - 3 метра, железобетонные перекрытия. Вид из окон открывается на три стороны. Тихий двор. Огороженная территория с парковкой (КПП, шлагбаум). Развитая инфраструктура, станция метро ""Студенческая"" в одной минуте ходьбы. В шаговой доступности супермаркеты, магазины, торговые центры. Рядом несколько школ и детские сады. Идеальный вариант для большой семьи.<br>Продажа под Ипотеку и Материнский капитал.",88 м²,,,,,654.0,5/5,88 м²,88.0,5,24,3035954646,Sale,/4-komnatnaya-kvartira-na-prodazhu-novosibirsk-3035954646,266.0,6 500 000 ₽,73 864 ₽ за м²,73864,6500000,Apartment,2020-11-27T09:13:41.084796Z,78,Listing,4,4.0,2020-12-27T12:04:16.832273+03:00,2045175752,2020-11-27T12:03:55.350692+03:00,2020-12-02T11:25:06.283969+03:00,0.229,266.0,#FF0000,Студенческая,"4-комн. квартира, 88 м², 5/5 эт.",2020-12-02T08:34:38.33059Z
"Новосибирск, Бронная улица, 45/1",178825960,"2ПН, покупка-продажа недвижимости",Resale,3285,2020-09-01T03:15:59.192201Z,"В продаже 3-к квартира-студия с ремонтом от собственника. В квартире остается кухонный гарнитур, обеденная зона и частично мебель.<br>Окна выходят на две стороны. С балкона шикарный вид на парк.<br>В шаговой доступности остановки общественного транспорта, магазины, детский сад, школа.<br>Продажа по переуступке.",59 м²,,,,,655.0,7/10,59 м²,59.0,7,16,2830533809,Sale,/3-komnatnaya-kvartira-na-prodazhu-novosibirsk-2830533809,,2 750 000 ₽,46 610 ₽ за м²,46610,2750000,Apartment,2020-09-01T03:15:59.192201Z,78,Listing,3,3.0,2021-01-01T07:09:11.455612+03:00,1958279932,2020-09-01T06:06:32.681727+03:00,2020-12-02T07:09:11.455612+03:00,,,,,"3-комн. квартира, 59 м², 7/10 эт.",2020-12-02T04:18:14.975182Z
"Новосибирск, Советская улица, 8",6605255,Марина,Resale,3285,2020-09-30T09:55:27.699437Z,"Продам 3-комнатную квартиру (перепланировка согласована): кухня-гостиная, детская, спальня с самостоятельной гардеробной. Ремонт сделан по дизайн-проекту в 2019 году. В рамках ремонта полностью заменена электропроводка, трубы и сантехника. В квартире останется вся мебель, бытовая техника, текстиль. Ограничение: это ипотека в Газпромбанке (меньше 3 млн.).Продажа лично от собственника.",70 м²,,,,,649.0,2/9,70 м²,70.0,2,7,2898637468,Sale,/3-komnatnaya-kvartira-na-prodazhu-novosibirsk-2898637468,263.0,10 500 000 ₽,150 000 ₽ за м²,150000,10500000,Apartment,2020-09-30T09:55:27.699437Z,78,Listing,3,3.0,2020-12-30T05:52:24.170342+03:00,1989006687,2020-09-30T12:46:03.726883+03:00,2020-11-30T05:52:24.170342+03:00,0.72,263.0,#FF0000,Площадь Ленина,"3-комн. квартира, 70 м², 2/9 эт.",2020-11-30T03:01:29.370204Z
"ул. Александра Чистякова, стр. 1",176123877,"ООО ""Новосибирскстрой-Недвижимость+""",New,3285,2020-10-01T09:41:58.609518Z,"Предлагаем к продаже квартиры студии в ЖК ""Акварельный 3.0"", четыре дома по улице Александра Чистякова. Квартиры под чистовую отделку (после сдачи возможна отделка под ключ), оформленные фасады, остекленные лоджии (площадь лоджии 3,6 м.кв.). Дом расположен рядом с лесопарком им. академика И. И. Синягина., свежий воздух, красивый вид. Ипотека от 6,5%. Приглашаем на экскурсии.",26.2 м²,1027094375.0,ЖК «Акварельный 3.0»,1027094375.0,ЖК «Акварельный 3.0»,655.0,17/17,26.2 м²,26.2,17,5,2900895696,Sale,/kvartira-na-prodazhu-novosibirsk-2900895696,267.0,1 750 000 ₽,66 794 ₽ за м²,66794,1750000,Apartment,2020-10-01T09:41:58.609518Z,78,Listing,Студия,,2020-12-30T13:45:24.6863+03:00,1986998311,2020-10-01T12:32:28.919766+03:00,2020-11-30T13:45:24.6863+03:00,,,,,"Квартира-студия, 26.2 м², 17/17 эт.",2020-11-30T10:56:20.299174Z
"Новосибирская область, Сузунский район, село Болтово",165036377,RW,Resale,3264,2020-05-02T06:01:43.389384Z,"СРОЧНО!!! Дешево!<br>Видео есть<br>Документы подготовлены к продаже.<br> Обмен на авто (газель,спец.техника)!Продам/сдам 3-х комнатную квартиру в 2-х квартирном доме. Возможен обмен на авто. Во всех комнатах пластиковые окна. Хозпостроек много (сарай, баня, 2 гаража( в одном из которых стоит жигули 7ка), летняя кухня). Водопровод, канализация. Отопление печное (капиталилось). Урожая будет много: жимолость ведёрко уже собрали. Вишней все усыпано на 2-х кустах. И малиииины! И крыжовника!ранеткой и т.д. Большая ограда ( на фото стоят универсал и девятка с прицепом и место еще достаточно). Так же удобный, широкий проезд до дома. За огородом красивейший пруд. Очень хорошее место для постоянного проживания или дачи. <br>Возможно под мат.капитал.<br>С документами порядок, готов к продаже. Самое время покупать!",78 м²,,,,,,1/1,78 м²,78.0,1,11,2529476878,Sale,/3-komnatnaya-kvartira-na-prodazhu-suzun-2529476878,,450 000 ₽,5 769 ₽ за м²,5769,450000,Apartment,2020-05-02T06:01:43.389384Z,78,Listing,3,3.0,2020-12-29T06:59:24.593499+03:00,1942944328,2020-05-02T08:23:07.206137+03:00,2020-11-29T06:59:35.293918+03:00,,,,,"3-комн. квартира, 78 м², 1/1 эт.",2020-11-29T04:08:57.765414Z
"Новосибирск, Бронная улица, 34/1, подъезд 1",176123877,"ООО ""Новосибирскстрой-Недвижимость+""",Resale,3285,2020-10-01T08:53:00.618918Z,"Предлагаю Вам светлую, просторную двухкомнатную квартиру с БАЛКОНОМ.<br>Удобный для жизни район с полной инфраструктурой. ЖК расположен в 7 км от станции метро ""Площадь К. Маркса"", 15 мин на транспорте.<br>Про ремонт: Ламинат 33 класса 8 мм, натяжные потолки, хорошие межкомнатные двери и качественная входная дверь.",58.8 м²,,,,,655.0,3/10,58.8 м²,58.8,3,15,2900744016,Sale,/2-komnatnaya-kvartira-na-prodazhu-novosibirsk-2900744016,,2 850 000 ₽,48 469 ₽ за м²,48469,2850000,Apartment,2020-10-01T08:53:00.618918Z,78,Listing,2,2.0,2021-01-01T07:19:41.013471+03:00,1987574721,2020-10-01T11:33:07.931694+03:00,2020-12-02T07:19:41.013471+03:00,,,,,"2-комн. квартира, 58.8 м², 3/10 эт.",2020-12-02T04:28:43.660556Z
