address,agencyId,agencyName,apartmentSaleType,cityId,createdAt,description,details,developmentId,developmentName,developmentParentId,developmentParentName,districtId,floor,floorArea,floorAreaCalculated,floorInt,galleryImagesCount,id,itemType,itemUrl,metroId,price,pricePerArea,pricePerAreaValue,priceValue,propertyType,publishDate,regionId,resultType,rooms,roomsOrdinal,sourceFinishTime,sourceId,sourceStartTime,sourceUpdateTime,station_distance,station_id,station_lineColors,station_name,title,updatedAt
"ул. Декабристов, д. 115",107238416,"Отдел продаж Застройщика ""Инвест-плюс""",New,3285,2020-10-12T15:06:05.017181Z,"АКЦИЯ!!! ИПОТЕКА ПАО ""СБЕРБАНК"" ОТ ЗАСТРОЙЩИКА 0,1%<br>ПРОСТОРНАЯ 1-КОМНАТНАЯ КВАРТИРА от Застройщика в Октябрьском районе.<br>Панорамный вид на реку Обь и Октябрьский мост!!!<br>10 квартир на этаже. Два грузовых лифта и один пассажирский лифт (спуск на подземный двухуровневый паркинг).<br>В подъезде выполнено декоративное оштукатуривание стен, смонтированы навесные потолки, на полу уложен керамогранит, установлена капитальная входная дверь от Застройщика.<br>В квартире выполнена чистовая отделка стен и пола, установлены радиаторы отопления (горизонтальная разводка), розетки и выключатели. Счетчики воды и отопления находятся в блоке на площадке. Остается только воплотить в жизнь Ваши самые смелые дизайнерские фантазии<br>ВИТРАЖНОЕ ОСТЕКЛЕНИЕ ЛОДЖИИ В ПОДАРОК ОТ ЗАСТРОЙЩИКА.<br>Зеленый тихий двор без машин на второй линии от автомагистралей (закрытая территория) с видеонаблюдением, детская игровая площадка с большой песочницей, горками и каруселями, мини-стадион, зона отдыха, дорожки для утренней пробежки, спортивные тренажеры, беседка-барбекю.<br>Холл с камином, мягкими диванами, кофе-баром, пеленальными столиками. Места для колясок и велосипедов.<br>Прямой выезд на две главные магистрали города - ул. Кирова и ул. Большевистская.<br>Рядом с домом лицей им. Пушкина, общеобразовательная школа, школа искусств, детский сад, Октябрьский рынок, универмаг ""Октябрьский"", продуктовые магазины ""Мария-Ра"" и ""Пятерочка"", остановки общественного транспорта, ВУЗы.<br>В пешей доступности станция метро ""Речной вокзал"" и ""Октябрьская"". Ж/д станция ""Новосибирск-Южный"".<br>МЕСТА НА ПОДЗЕМНОЙ ПАРКОВКЕ В РАССРОЧКУ!!!<br>СДАЧА ДОМА - ДЕКАБРЬ 2020г.<br>____________________________________________________________________________<br>ЭСКРОУ-СЧЕТ (безопасная система расчетов с Застройщиком), Проектное финансирование ПАО ""СБЕРБАНК""<br>— ИПОТЕКА С ГОС. ПОДДЕРЖКОЙ ОТ ЗАСТРОЙЩИКА 0,1%<br>— ИПОТЕКА ДЛЯ СЕМЕЙ С ДЕТЬМИ<br>— МАТЕРИНСКИЙ КАПИТАЛ<br>___________________________________________________________________________<br>Покажем в любое удобное для Вас время по согласованию!<br>Поможем с оформлением и подачей документов для получения ипотечного решения по самой выгодной ставке!<br>Юридическое сопровождение сделки!!! Без комиссии!!!",43.8 м²,91288.0,ЖК «Октябрьский квартал»,91288.0,ЖК «Октябрьский квартал»,650.0,19/22,43.8 м²,43.8,19,22,2924887775,Sale,/1-komnatnaya-kvartira-na-prodazhu-novosibirsk-2924887775,265.0,3 900 000 ₽,89 041 ₽ за м²,89041,3900000,Apartment,2020-10-12T15:06:05.017181Z,78,Listing,1,1.0,2020-12-26T10:24:43.731809+03:00,1998515863,2020-10-12T17:56:39.30398+03:00,2020-12-04T17:12:34.385619+03:00,1.463,265.0,#FF0000,Речной вокзал,"1-комн. квартира, 43.8 м², 19/22 эт.",2020-12-04T14:22:03.122299Z
"ул. Краузе, стр. 8",17367072,"Агентство недвижимости ""Аванта""",New,3285,2020-11-26T07:35:07.086892Z,"ЖК ""Онега"" - уникальный проект не только для Новосибирска, но и для страны!<br> Калининский район г. Новосибирска - самый развитый по транспортной развязке и инфраструктуре, молодой и быстрорастущий микрорайон города. В жк «Онега» очень красивая современная архитектура. Скатные крыши, квартиры с мансардами, второй свет, двухуровневые, с антресолями и классические варианты. Европланировка.<br>Строительство ведется  за счет проектного финансирования Сбербанка и с использованием эскроу счетов. Квартиры сдаются под улучшенную самоотделку. На кирпичные стены нанесена гипсовая штукатурка, швы между пазогребневыми плитами заштукатурены. Стены санузлов изнутри оштукатурены марочным цементно-песчаным раствором. Во всех квартирах установлены приборы учета воды, электроэнергии и качественные металлические утепленные входные двери с двумя замками и внутренним мдф-щитком. Окна и двери балконов изготовлены  из пятикамерного ПВХ, профиль белого цвета с заполнением стеклопакетом, на откосы балконных и оконных блоков изнутри нанесена штукатурка, снаружи - в полном объеме ПВХ-профиль. Ограждения «французских» окон находятся на высоте 1,2 м и установлены по всей ширине проема. <br>Для вас: ипотека без первоначального взноса, рассрочка, обмен (трейд-ин), помощь в получении кредитного решения-бесплатно. Цена застройщика, без комиссии и переплат.",52.5 м²,1003935880.0,ЖК «Онега»,1003935880.0,ЖК «Онега»,648.0,2/9,52.5 м²,52.5,2,12,3033292044,Sale,/2-komnatnaya-kvartira-na-prodazhu-novosibirsk-3033292044,,3 850 000 ₽,73 333 ₽ за м²,73333,3850000,Apartment,2020-11-26T07:35:07.086892Z,78,Listing,2,2.0,2020-12-26T10:26:04.475067+03:00,2014533167,2020-11-26T10:25:17.157186+03:00,2020-11-26T10:26:04.475067+03:00,,,,,"2-комн. квартира, 52.5 м², 2/9 эт.",2020-11-26T07:45:50.522034Z
"ул. Сибиряков-Гвардейцев, д. 44/7",10159103,Александр,New,3285,2020-10-31T18:03:16.749933Z,"Продаётся однокомнатная студия. Общая площадь 37 кв. м. Просторная лоджия с остеклением в пол. Дом в процессе строительства, сдача июнь 2021.",37 м²,,,,,655.0,15/16,37 м²,37.0,15,11,2973026793,Sale,/1-komnatnaya-kvartira-na-prodazhu-novosibirsk-2973026793,267.0,2 100 000 ₽,56 757 ₽ за м²,56757,2100000,Apartment,2020-10-31T18:03:16.749933Z,78,Listing,1,1.0,2020-12-30T20:55:44.588876+03:00,2045056246,2020-10-31T20:53:55.399354+03:00,2020-12-01T09:46:53.353295+03:00,1.774,267.0,#FF0000,Площадь Маркса,"1-комн. квартира, 37 м², 15/16 эт.",2020-12-01T06:56:13.959702Z
"Новосибирск, Красный проспект, 181",10283412,Вероника,Resale,3285,2020-11-26T07:37:57.452531Z,"ОТЛИЧНЫЙ ВАРИАНТ!!! Дом расположен в районе с развитой инфраструктурой, удобной транспортной развязкой, до метро ""Заельцовская"" 1 км. Придомовая территория огорожена, благоустроена и находится под охраной. Элементы благоустройства включают в себя: площадки для игр детей, занятий спорта, отдыха, парковку для автотранспорта жильцов дома. <br>Квартира  очень теплая, из окон открывается прекрасный панорамный вид на город. Этаж 7. Вместительная прихожая 12 кв.м., сан узел  раздельный, 2 кондиционера, (современный кафель от пола до потолка), жилая площадь : включает в себя кухню-гостиную 25 кв.м. и спальню 22 кв.м. Сделан очень красивый ремонт и можно наслаждаться пейзажами и отдыхать прямо не выходя из дома.  Если вы молодая семья - это ваша квартира!",60 м²,,,,,653.0,7/17,60 м²,60.0,7,19,3033306366,Sale,/2-komnatnaya-kvartira-na-prodazhu-novosibirsk-3033306366,260.0,6 150 000 ₽,102 500 ₽ за м²,102500,6150000,Apartment,2020-11-26T07:37:57.452531Z,78,Listing,2,2.0,2020-12-26T10:29:21.154816+03:00,2066042096,2020-11-26T10:27:06.887004+03:00,2020-11-26T10:31:51.111536+03:00,1.516,260.0,#FF0000,Заельцовская,"2-комн. квартира, 60 м², 7/17 эт.",2020-11-26T07:48:13.16728Z
"ул. Краузе, стр. 8",17367072,"Агентство недвижимости ""Аванта""",New,3285,2020-11-26T07:39:18.160021Z,"ЖК ""Онега"" - уникальный проект не только для Новосибирска, но и для страны!<br> Калининский район г. Новосибирска - самый развитый по транспортной развязке и инфраструктуре, молодой и быстрорастущий микрорайон города. В жк «Онега» очень красивая современная архитектура. Скатные крыши, квартиры с мансардами, второй свет, двухуровневые, с антресолями и классические варианты. Европланировка.<br> Строительство ведется  за счет проектного финансирования Сбербанка и с использованием эскроу счетов. Квартиры сдаются под улучшенную самоотделку. На кирпичные стены нанесена гипсовая штукатурка, швы между пазогребневыми плитами заштукатурены. Стены санузлов изнутри оштукатурены марочным цементно-песчаным раствором. Во всех квартирах установлены приборы учета воды, электроэнергии и качественные металлические утепленные входные двери с двумя замками и внутренним мдф-щитком. Окна и двери балконов изготовлены  из пятикамерного ПВХ, профиль белого цвета с заполнением стеклопакетом, на откосы балконных и оконных блоков изнутри нанесена штукатурка, снаружи - в полном объеме ПВХ-профиль. Ограждения «французских» окон находятся на высоте 1,2 м и установлены по всей ширине проема. <br>Для вас: ипотека без первоначального взноса, льготная ипотека,  рассрочка, обмен (трейд-ин), помощь в получении кредитного решения-бесплатно. Цена застройщика, без комиссии и переплат.",50.5 м²,1003935880.0,ЖК «Онега»,1003935880.0,ЖК «Онега»,648.0,4/9,50.5 м²,50.5,4,12,3033311442,Sale,/2-komnatnaya-kvartira-na-prodazhu-novosibirsk-3033311442,,3 750 000 ₽,74 257 ₽ за м²,74257,3750000,Apartment,2020-11-26T07:39:18.160021Z,78,Listing,2,2.0,2020-12-26T10:30:16.32553+03:00,2014001136,2020-11-26T10:29:52.401859+03:00,2020-11-26T10:30:16.32553+03:00,,,,,"2-комн. квартира, 50.5 м², 4/9 эт.",2020-11-26T07:39:19.237117Z
"ул. Охотская, д. 88",23367994,Компания «ЭТАЖИ»,New,3285,2020-11-27T11:47:03.905378Z,"СРОЧНАЯ ПРОДАЖА!!!!!<br>Квартира по переуступке! У застройщика таких уже нет!<br>Полное сопровождение сделки!<br>ВОЗМОЖЕН ОБМЕН НА ВАШУ НЕДВИЖИМОСТЬ В Г. НОВОСИБИРСКЕ!!!<br>Экскурсия бесплатно!<br>Подходит под ипотеку. <br>Помощь в получении положительного ипотечного решения от 4,5 %.<br>ЗВОНИ!!!",39.5 м²,83694.0,ЖК «Эволюция»,83694.0,ЖК «Эволюция»,653.0,10/12,39.5 м²,39.5,10,11,3036340026,Sale,/1-komnatnaya-kvartira-na-prodazhu-novosibirsk-3036340026,,3 300 000 ₽,83 544 ₽ за м²,83544,3300000,Apartment,2020-11-27T11:47:03.905378Z,78,Listing,1,1.0,2020-12-27T14:38:01.36079+03:00,2072441727,2020-11-27T14:37:34.80342+03:00,2020-11-27T14:38:01.36079+03:00,,,,,"1-комн. квартира, 39.5 м², 10/12 эт.",2020-11-27T11:47:05.730944Z
"ул. Краузе, стр. 8",17367072,"Агентство недвижимости ""Аванта""",New,3285,2020-11-26T07:42:22.898098Z,"ЖК ""Онега"" - уникальный проект не только для Новосибирска, но и для страны!<br> Калининский район г. Новосибирска - самый развитый по транспортной развязке и инфраструктуре, молодой и быстрорастущий микрорайон города. В жк «Онега» очень красивая современная архитектура. Скатные крыши, квартиры с мансардами, второй свет, двухуровневые, с антресолями и классические варианты. Европланировка.<br> Строительство ведется  за счет проектного финансирования Сбербанка и с использованием эскроу счетов. Квартиры сдаются под улучшенную самоотделку. На кирпичные стены нанесена гипсовая штукатурка, швы между пазогребневыми плитами заштукатурены. Стены санузлов изнутри оштукатурены марочным цементно-песчаным раствором. Во всех квартирах установлены приборы учета воды, электроэнергии и качественные металлические утепленные входные двери с двумя замками и внутренним мдф-щитком. Окна и двери балконов изготовлены  из пятикамерного ПВХ, профиль белого цвета с заполнением стеклопакетом, на откосы балконных и оконных блоков изнутри нанесена штукатурка, снаружи - в полном объеме ПВХ-профиль. Ограждения «французских» окон находятся на высоте 1,2 м и установлены по всей ширине проема. <br>Для вас: ипотека без первоначального взноса, рассрочка, обмен (трейд-ин), помощь в получении кредитного решения-бесплатно. Цена застройщика, без комиссии и переплат.",37 м²,1003935880.0,ЖК «Онега»,1003935880.0,ЖК «Онега»,648.0,3/9,37 м²,37.0,3,12,3033318297,Sale,/1-komnatnaya-kvartira-na-prodazhu-novosibirsk-3033318297,,3 050 000 ₽,82 432 ₽ за м²,82432,3050000,Apartment,2020-11-26T07:42:22.898098Z,78,Listing,1,1.0,2020-12-26T10:33:20.930841+03:00,2014522069,2020-11-26T10:32:57.364428+03:00,2020-11-26T10:33:20.930841+03:00,,,,,"1-комн. квартира, 37 м², 3/9 эт.",2020-11-26T07:48:30.359412Z
"Новосибирская область, Мошковский район, село Сокур",122634585,Академия Недвижимости,Resale,3262,2020-11-26T07:45:17.839578Z,"Продается 1-комнатная светлая, уютная квартира. В квартире сделан качественный ремонт: электропроводка поменена на медную, установлены пластиковые окна, ванная комната, туалет выложена современными пластиковыми панелями, сантехника вся новая, качественная входная дверь, большая остекленная лоджия, натяжные потолки, квартира вложений не требует. В квартире тепло, два входа на балкон, один с зала, другой с кухни. Есть свой погреб для хранения овощей либо заготовок, встроенная гардеробная в прихожей, в квартире остается все самое необходимое. Поселок спокойный, отличный вариант для тихой и спокойной жизни. Дом образцового содержания, ухоженный подъезд, спокойные, приличные соседи, облагороженная придомовая территория. В поселке достаточно организаций, которые могут предоставить трудоустройство. Развитая инфраструктура, в шаговой доступности находятся различные магазины, супермаркет ""Мария-Ра"",  детские сады, школа, поликлиника, отделение банка ""СберБанк"", дом культуры. До Новосибирска легко добраться на автобусе за 40 минут, автобусы ходят каждые пол часа, ходит маршрутное такси. На машине можно доехать за 30 минут по федеральной трассе. До Новосибирска так же можно добраться на Электропоезде(по расписанию). Уютное гнездышко ищет своего хозяина. Звоните, приходите на просмотры, всегда Вам рады. Цена ПОДАРОК! Естественно присутствует ТОРГ. Успейте приобрести до Нового Года! ПОМОЩЬ В ПОЛУЧЕНИИ ИПОТЕКИ!",41.9 м²,,,,,,1/3,41.9 м²,41.9,1,12,3033326205,Sale,/1-komnatnaya-kvartira-na-prodazhu-sokur-3033326205,,1 500 000 ₽,35 800 ₽ за м²,35800,1500000,Apartment,2020-11-26T07:45:17.839578Z,78,Listing,1,1.0,2020-12-26T10:36:10.853895+03:00,2039412035,2020-11-26T10:35:42.729431+03:00,2020-11-26T10:36:10.853895+03:00,,,,,"1-комн. квартира, 41.9 м², 1/3 эт.",2020-11-26T07:51:40.459585Z
"Новосибирск, Троллейная улица, 1",183262990,Агентство недвижимости ЖИЛФОНД,Resale,3285,2020-08-11T09:33:58.694824Z,"Прекрасная светлая квартира с благоприятной аурой ждет Вас на просмотр! у нас чистая продажа, один взрослый собственник. Помощь в получении положительного ипотечного решения.",40 м²,,,,,654.0,6/12,40 м²,40.0,6,21,2780026067,Sale,/1-komnatnaya-kvartira-na-prodazhu-novosibirsk-2780026067,267.0,2 900 000 ₽,72 500 ₽ за м²,72500,2900000,Apartment,2020-08-11T09:33:58.694824Z,78,Listing,1,1.0,2021-01-02T12:36:11.704024+03:00,1964580428,2020-08-11T12:24:18.83326+03:00,2020-12-03T12:36:11.704024+03:00,2.52,267.0,#FF0000,Площадь Маркса,"1-комн. квартира, 40 м², 6/12 эт.",2020-12-03T09:45:15.142578Z
"ул. Дуси Ковальчук, д. 238",91304654,Ксения,New,3285,2020-12-07T10:13:37.251486Z,"Строящийся жилой дом, чистая продажа.",39.9 м²,36703.0,ЖК «Дом на Плановой»,36703.0,ЖК «Дом на Плановой»,653.0,4/21,39.9 м²,39.9,4,1,3058413664,Sale,/kvartira-na-prodazhu-novosibirsk-3058413664,261.0,2 200 000 ₽,55 138 ₽ за м²,55138,2200000,Apartment,2020-12-07T10:13:37.251486Z,78,Listing,Студия,,2021-01-06T13:04:36.062864+03:00,2060025525,2020-12-07T13:04:16.056804+03:00,2020-12-07T13:04:36.062864+03:00,0.967,261.0,#FF0000,Гагаринская,"Квартира-студия, 39.9 м², 4/21 эт.",2020-12-07T10:13:38.721799Z
