address,agencyId,agencyName,apartmentSaleType,cityId,createdAt,description,details,developmentId,developmentName,developmentParentId,developmentParentName,districtId,floor,floorArea,floorAreaCalculated,floorInt,galleryImagesCount,id,itemType,itemUrl,metroId,price,pricePerArea,pricePerAreaValue,priceValue,propertyType,publishDate,regionId,resultType,rooms,roomsOrdinal,sourceFinishTime,sourceId,sourceStartTime,sourceUpdateTime,station_distance,station_id,station_lineColors,station_name,title,updatedAt
"Новосибирск, улица Плахотного, 72/1",105420114,Ольга,Resale,3285,2020-10-29T07:24:48.541849Z,"Продаётся отличая квартира в кирпичной доме. Закрытая территория ...внутри двора детская площадка ...окна выходят и во двор и на улицу ...магазины ,остановка, вся инфраструктура ,всё рядом.. Требуется ремонт по этому цена снижена .......",64.3 м²,,,,,654.0,9/9,64.3 м²,64.3,9,4,2966182223,Sale,/2-komnatnaya-kvartira-na-prodazhu-novosibirsk-2966182223,267.0,4 500 000 ₽,69 984 ₽ за м²,69984,4500000,Apartment,2020-10-29T07:24:48.541849Z,78,Listing,2,2.0,2020-12-28T10:16:21.246055+03:00,2032656070,2020-10-29T10:15:21.165545+03:00,2020-11-28T10:16:21.246055+03:00,2.792,267.0,#FF0000,Площадь Маркса,"2-комн. квартира, 64.3 м², 9/9 эт.",2020-11-28T07:25:26.395696Z
"Новосибирская область, Бердск, Микрорайон, 48А",163831226,Компания Елка МФЦ Недвижимость,Resale,3279,2020-11-26T10:39:29.484221Z,"Арт. 43896528 В продаже просторная трёхкомнатная квартира в одном из наиболее развитых районов Бердска.<br>Комфортный средний этаж, просторный тамбур, удобная планировка, большая кухня-гостиная, качественный ремонт.<br>Территория дома огорожена, всегда есть место для парковки. Во дворе находится благоустроенная детская площадка.<br>Район обеспечен развитой инфраструктурой, необходимой для комфортной жизни в городе.<br>В шаговой доступности: Дворец культуры ""Родина"", остановки общественного транспорта (можно доехать в любую часть Бердска, а также в Новосибирск), школы, детские сады, торговые центры со всеми необходимыми магазинами (2-5 минут), спорткомплекс ""Зима-Лето"" (8 минут).<br>В подарок покупателю — кухонный гарнитур, шкаф-купе в спальне, остальное - по договорённости.<br>Один взрослый собственник, документы готовы к продаже.<br>Рассмотрим покупателей с любым видом расчёта, возможен торг.",98.2 м²,,,,,,3/10,98.2 м²,98.2,3,28,3033823340,Sale,/3-komnatnaya-kvartira-na-prodazhu-berdsk-3033823340,,5 950 000 ₽,60 591 ₽ за м²,60591,5950000,Apartment,2020-11-26T10:39:29.484221Z,78,Listing,3,3.0,2020-12-26T13:30:28.225122+03:00,2040385817,2020-11-26T13:30:05.261114+03:00,2020-12-07T13:14:40.138634+03:00,,,,,"3-комн. квартира, 98.2 м², 3/10 эт.",2020-12-07T10:23:41.623553Z
"Новосибирск, Охотская улица, 88",28107259,Авангард,Resale,3285,2020-12-04T08:10:20.169603Z,"В продаже 2 ком квартира студия в новом , сданном доме.<br>Лоджия 2.5 м, <br>Данную квартиру можно купить в ипотеку!",45.7 м²,,,,,653.0,1/12,45.7 м²,45.7,1,0,3051872576,Sale,/2-komnatnaya-kvartira-na-prodazhu-novosibirsk-3051872576,,3 850 000 ₽,84 245 ₽ за м²,84245,3850000,Apartment,2020-12-04T08:10:20.169603Z,78,Listing,2,2.0,2021-01-03T11:01:19.225417+03:00,2073042491,2020-12-04T11:00:58.288878+03:00,2020-12-04T12:51:39.783836+03:00,,,,,"2-комн. квартира, 45.7 м², 1/12 эт.",2020-12-04T10:00:44.595285Z
"Новосибирская область, Искитимский район, рабочий поселок Линёво, проспект Мира, 32",21185204,Наталья,Resale,3260,2020-11-27T08:40:59.116329Z,"квартира с ремонтом, мебелью и бытовой техникой, очень теплая, средний этаж, всегда найдется место для парковки, хорошие соседи, спокойный район, в шаговой доступности магазины, аптека в доме, садик, школы. бассейн, храм видны из окна. стены потолки выровненые, двери входные, межкомнатные новые хорошего качества. плитка в ванне туалете новая. в кухне остается кухонный гарнитур и бытовая техника, чистый кран установлен недавно. звоните в любое время, договоримся о встрече, или покажу квартиру по видеосвязи. оформим сделку через агенство недвижимости",68 м²,,,,,,6/9,68 м²,68.0,6,14,3035852568,Sale,/3-komnatnaya-kvartira-na-prodazhu-linevo-3035852568,,2 750 000 ₽,40 441 ₽ за м²,40441,2750000,Apartment,2020-11-27T08:40:59.116329Z,78,Listing,3,3.0,2020-12-27T11:34:50.823892+03:00,2066691801,2020-11-27T11:31:14.932883+03:00,2020-11-27T11:36:55.105205+03:00,,,,,"3-комн. квартира, 68 м², 6/9 эт.",2020-11-27T08:46:22.629584Z
"ул. Александра Чистякова, стр. 1",176123877,"ООО ""Новосибирскстрой-Недвижимость+""",New,3285,2020-10-01T08:58:48.896177Z,"Предлагаем к продаже однокомнатные квартиры в ЖК ""Акварельный 3.0"",  четыре дома по улице Александра Чистякова. Квартиры под чистовую отделку  (после сдачи возможна отделка под ключ), оформленные фасады,  остекленные лоджии. Дом расположен рядом с лесопарком им. академика И.  И. Синягина., свежий воздух, красивый вид. Ипотека от 6,5%. Приглашаем  на экскурсии.",49 м²,1027094375.0,ЖК «Акварельный 3.0»,1027094375.0,ЖК «Акварельный 3.0»,655.0,9/17,49 м²,49.0,9,5,2900761070,Sale,/1-komnatnaya-kvartira-na-prodazhu-novosibirsk-2900761070,267.0,2 550 000 ₽,52 041 ₽ за м²,52041,2550000,Apartment,2020-10-01T08:58:48.896177Z,78,Listing,1,1.0,2020-12-30T11:51:24.708652+03:00,1987743933,2020-10-01T11:49:20.860945+03:00,2020-11-30T11:51:24.708652+03:00,,,,,"1-комн. квартира, 49 м², 9/17 эт.",2020-11-30T09:00:29.66572Z
"ул. Краузе, стр. 8",28107259,Авангард,New,3285,2020-12-04T08:21:52.024679Z,"В продаже 4 ком квартира студия<br>Лоджия 2 м, 2 сан.узла, кухня гостиная 35.8 м<br>Данную квартиру можно купить в ипотеку!",87.6 м²,1003935880.0,ЖК «Онега»,1003935880.0,ЖК «Онега»,648.0,7/9,87.6 м²,87.6,7,0,3051895102,Sale,/4-komnatnaya-kvartira-na-prodazhu-novosibirsk-3051895102,,6 340 000 ₽,72 374 ₽ за м²,72374,6340000,Apartment,2020-12-04T08:21:52.024679Z,78,Listing,4,4.0,2021-01-03T11:12:48.93551+03:00,2072910785,2020-12-04T11:12:29.702075+03:00,2020-12-04T12:51:39.748939+03:00,,,,,"4-комн. квартира, 87.6 м², 7/9 эт.",2020-12-04T10:00:42.595215Z
"Новосибирский район, Новосибирская область, село Новолуговое",75178580,real2,New,3257,2020-10-31T08:37:01.855143Z,"Продам долевку, студию, в новом доме, Новолуговое, Октябрьская 75/4. Самая низкая цена-за срочность.",23 м²,,,,,,3/3,23 м²,23.0,3,4,2971876934,Sale,/kvartira-na-prodazhu-novolugovoe-2971876934,,860 000 ₽,37 391 ₽ за м²,37391,860000,Apartment,2020-10-31T08:37:01.855143Z,78,Listing,Студия,,2020-12-30T15:16:29.905221+03:00,1248628058,2018-07-03T04:06:18+03:00,2020-12-05T14:16:03.149302+03:00,,,,,"Квартира-студия, 23 м², 3/3 эт.",2020-12-05T11:25:14.109866Z
"Новосибирская область, Бердск, Ключевая улица, 59/1",32229857,Отдел продаж,Resale,3279,2020-11-18T08:23:56.642118Z,Горячее предложение!!!! Продается отличная квартира в новом сданном доме.Квартира на 2 стороны.Чистая продажа.!!!!! Переуступка в отделе продаж застройщика.Сразу регистрация дкп!!!,36 м²,,,,,,2/9,36 м²,36.0,2,6,3014607415,Sale,/1-komnatnaya-kvartira-na-prodazhu-berdsk-3014607415,,1 850 000 ₽,51 389 ₽ за м²,51389,1850000,Apartment,2020-11-18T08:23:56.642118Z,78,Listing,1,1.0,2020-12-18T11:14:52.88046+03:00,2047208803,2020-11-18T11:14:27.42653+03:00,2020-11-30T12:57:26.226247+03:00,,,,,"1-комн. квартира, 36 м², 2/9 эт.",2020-11-30T10:07:18.374928Z
"ул. Владимира Заровного, стр. 31",84247383,Агентство недвижимости Ривьера,New,3285,2020-11-02T02:04:39.120229Z,"Предлагаем к Продаже 2 к студию , в доме Гп 31 по генплану , уникальный дом повышенной комфортности .<br>Звоните помощь в оформлении данного объекта , возможен обмен на вашу квартиру .",54.7 м²,23887.0,Микрорайон «Европейский Берег»,23887.0,Микрорайон «Европейский Берег»,650.0,8/23,54.7 м²,54.7,8,5,2975642884,Sale,/1-komnatnaya-kvartira-na-prodazhu-novosibirsk-2975642884,265.0,4 990 000 ₽,91 225 ₽ за м²,91225,4990000,Apartment,2020-11-02T02:04:39.120229Z,78,Listing,1,1.0,2021-01-01T09:14:15.214994+03:00,2037091628,2020-11-02T04:55:37.119219+03:00,2020-12-02T09:14:15.214994+03:00,2.338,265.0,#FF0000,Речной вокзал,"1-комн. квартира, 54.7 м², 8/23 эт.",2020-12-02T06:23:17.372501Z
"Новосибирская область, Бердск, Ключевая улица",32229857,Отдел продаж,Resale,3279,2020-10-26T08:37:34.340741Z,Предлагается к продаже отличная квартира .Дом сдается под с/отделку в декабре 2020 года Дом строительный 11,37 м²,,,,,,2/9,37 м²,37.0,2,8,2957958779,Sale,/1-komnatnaya-kvartira-na-prodazhu-berdsk-2957958779,,1 750 000 ₽,47 297 ₽ за м²,47297,1750000,Apartment,2020-10-26T08:37:34.340741Z,78,Listing,1,1.0,2020-12-25T12:46:22.074286+03:00,2015112837,2020-10-26T11:24:23.916659+03:00,2020-12-06T17:09:41.423508+03:00,,,,,"1-комн. квартира, 37 м², 2/9 эт.",2020-12-06T14:18:42.512521Z
"ул. Александра Чистякова, стр. 1",176123877,"ООО ""Новосибирскстрой-Недвижимость+""",New,3285,2020-10-01T09:04:33.392006Z,"Предлагаем к продаже однокомнатные квартиры в ЖК ""Акварельный 3.0"", четыре дома по улице Александра Чистякова. Квартиры под чистовую отделку (после сдачи возможна отделка под ключ), оформленные фасады, остекленные лоджии (площадь лоджии 3,5 м.кв.). Дом расположен рядом с лесопарком им. академика И. И. Синягина, свежий воздух, красивый вид. Ипотека от 6,5%. Приглашаем на экскурсии.",38.7 м²,1027094375.0,ЖК «Акварельный 3.0»,1027094375.0,ЖК «Акварельный 3.0»,655.0,5/17,38.7 м²,38.7,5,6,2900775433,Sale,/1-komnatnaya-kvartira-na-prodazhu-novosibirsk-2900775433,267.0,2 200 000 ₽,56 848 ₽ за м²,56848,2200000,Apartment,2020-10-01T09:04:33.392006Z,78,Listing,1,1.0,2020-12-30T11:57:24.956156+03:00,1987420771,2020-10-01T11:55:08.176208+03:00,2020-11-30T11:57:24.956156+03:00,,,,,"1-комн. квартира, 38.7 м², 5/17 эт.",2020-11-30T09:06:28.752668Z
