address,agencyId,agencyName,apartmentSaleType,cityId,createdAt,description,details,developmentId,developmentName,developmentParentId,developmentParentName,districtId,floor,floorArea,floorAreaCalculated,floorInt,galleryImagesCount,id,itemType,itemUrl,metroId,price,pricePerArea,pricePerAreaValue,priceValue,propertyType,publishDate,regionId,resultType,rooms,roomsOrdinal,sourceFinishTime,sourceId,sourceStartTime,sourceUpdateTime,station_distance,station_id,station_lineColors,station_name,title,updatedAt
"Новосибирск, улица Чехова, 384",23367994,Компания «ЭТАЖИ»,Resale,3285,2020-11-30T07:26:50.385798Z,"Продам двухкомнатную квартиру! Удачное месторасположение дома - ориентир ул.Кирова , в шаговой доступности остановка общественного транспорта, дом в хорошем состоянии, в 2019 году был произведен ремонт кровли, в 2016 был ремонт системы водоснабжения, а в 2022 году будет произведен ремонт фасада здания. В квартире сделан косметический ремонт, пластиковые окна, натяжной потолок. Квартира подходит ,как для проживания,так и для сдачи в аренду. Документы готовы к сделке, чистая продажа, просмотр по договоренности, звоните!. Номер в базе: 4956097. Район: Октябрьский.",42 м²,,,,,650.0,1/2,42 м²,42.0,1,5,3041716034,Sale,/2-komnatnaya-kvartira-na-prodazhu-novosibirsk-3041716034,265.0,1 800 000 ₽,42 857 ₽ за м²,42857,1800000,Apartment,2020-11-30T07:26:50.385798Z,78,Listing,2,2.0,2020-12-30T10:17:45.239298+03:00,2072056982,2020-11-30T10:17:15.546791+03:00,2020-12-01T13:39:09.621863+03:00,3.101,265.0,#FF0000,Речной вокзал,"2-комн. квартира, 42 м², 1/2 эт.",2020-12-01T10:48:50.315437Z
"Новосибирская область, Новосибирский район, посёлок Мичуринский, Солнечная улица, 3",178741684,Дмитрий Юдин,Resale,3285,2020-07-15T07:21:04.446971Z,"В продаже 3-ех комнатная студия с ремонтом. Окна на две стороны. До реки 500 м., До школы и детского сада тоже, только в другую сторону. До Затулинки 10 мин. на авто. В квартире остается вся мебель и техника. Квартира для ценителей свежего воздуха, рыбалки и водных процедур. Закрытая территория, видео наблюдение по периметру дома.",58 м²,,,,,,3/5,58 м²,58.0,3,22,2716395809,Sale,/3-komnatnaya-kvartira-na-prodazhu-novosibirsk-2716395809,,4 500 000 ₽,77 586 ₽ за м²,77586,4500000,Apartment,2020-07-15T07:21:04.446971Z,78,Listing,3,3.0,2020-12-28T08:11:55.367508+03:00,1970734442,2020-07-15T10:11:34.333645+03:00,2020-11-28T08:13:51.934105+03:00,,,,,"3-комн. квартира, 58 м², 3/5 эт.",2020-11-28T05:32:53.209074Z
"Новосибирск, Октябрьский район, жилмассив Плющихинский",7059203,Пользователь,New,3285,2020-11-03T12:25:54.119241Z,Квартира в строящемся доме Высоцкого 171/12 продажа по переуступке у застройщика за наличный расчет,59 м²,,,,,650.0,9/10,59 м²,59.0,9,1,2979236572,Sale,/3-komnatnaya-kvartira-na-prodazhu-novosibirsk-2979236572,272.0,2 500 000 ₽,42 373 ₽ за м²,42373,2500000,Apartment,2020-11-03T12:25:54.119241Z,78,Listing,3,3.0,2021-01-03T22:42:49.229649+03:00,2017173007,2020-11-03T15:16:28.460067+03:00,2020-12-04T22:42:49.229649+03:00,3.444,272.0,#008000,Золотая Нива,"3-комн. квартира, 59 м², 9/10 эт.",2020-12-04T19:51:53.516728Z
"Новосибирск, Кировский район, Северо-Чемской жилмассив, улица Аникина, 16, подъезд 2",182908345,Whitebrok,Resale,3285,2020-11-30T07:44:07.168952Z,"Время - деньги.<br>Именно это выражение как никакое другое подходит к описанию ЖК ""Шесть звёзд""<br>Евродвушка с ремонтом и мебелью. Спальня с тёплой лоджией. Большая гардеробная и высокие потолки. <br>Месторасположение ЖК это спокойный район и доступность как правого берега через новый ""Бугринский мост"", так и левого берега в 15 минутах метро ""Маркса"", а также выезд в сторону Алтая по ""Советскому шоссе""",47 м²,,,,,655.0,6/26,47 м²,47.0,6,18,3041797092,Sale,/2-komnatnaya-kvartira-na-prodazhu-novosibirsk-3041797092,266.0,4 400 000 ₽,93 617 ₽ за м²,93617,4400000,Apartment,2020-11-30T07:44:07.168952Z,78,Listing,2,2.0,2020-12-30T10:35:23.048842+03:00,2071831992,2020-11-30T09:55:55.905824+03:00,2020-12-09T06:29:08.012744+03:00,3.616,266.0,#FF0000,Студенческая,"2-комн. квартира, 47 м², 6/26 эт.",2020-12-09T03:38:37.006727Z
"Новосибирская область, Искитим, улица Карла Маркса, 9А",193686358,Тамара,Resale,3252,2020-11-30T07:48:01.418461Z,"Продам или обменяю на благоустроенный дом с газом. 3-х комнатная квартира после капитального ремонта, все в шаговой доступности. 2лоджии,хорошие соседи,детские площадки,стоянка для авто,рядом гаражи.Подробно по телефону.",80 м²,,,,,,3/5,80 м²,80.0,3,13,3041806789,Sale,/3-komnatnaya-kvartira-na-prodazhu-iskitim-3041806789,,3 700 000 ₽,46 250 ₽ за м²,46250,3700000,Apartment,2020-11-30T07:48:01.418461Z,78,Listing,3,3.0,2020-12-30T10:45:37.286044+03:00,2036860440,2020-11-30T10:38:35.383793+03:00,2020-12-06T18:30:01.176681+03:00,,,,,"3-комн. квартира, 80 м², 3/5 эт.",2020-12-06T15:40:05.209496Z
"Новосибирск, улица Краузе, 509",184063293,"Родники, Квартиры - Заходи и живи",New,3285,2020-12-04T09:15:14.396194Z,"квартира расположена в новом комплексе,серия RED- это компактный жилой комплекс состоящий из двух 4-х  подъездных домов переменной этажности!Огороженная придомовая территория! Квартиры с отделкой ""ПОД КЛЮЧ ""!<br>Наши услуги- 0 %!",86.2 м²,,,,,648.0,14/17,86.2 м²,86.2,14,1,3052062398,Sale,/3-komnatnaya-kvartira-na-prodazhu-novosibirsk-3052062398,,5 400 000 ₽,62 645 ₽ за м²,62645,5400000,Apartment,2020-12-04T09:15:14.396194Z,78,Listing,3,3.0,2021-01-03T12:06:12.44341+03:00,2075615332,2020-12-04T12:05:49.004763+03:00,2020-12-04T12:06:12.44341+03:00,,,,,"3-комн. квартира, 86.2 м², 14/17 эт.",2020-12-04T09:15:16.591577Z
"Новосибирск, улица 25 лет Октября, 1",190088773,Галина,Resale,3285,2020-09-29T10:23:07.998687Z,"Предлагаю к продаже теплую, солнечную, не угловую, уютную 2-х комнатную квартиру на 8 этаже 9- ти этажного кирпичного дома. Дом находится рядом с парком. Прекрасная детская площадка. В квартире окна деревянные, металлическая дверь, балкон, удовлетворительное состояние. Документы готовы, без перепланировки, подходит под ипотеку, под сертификаты, в том числе под материнский капитал. Чистая продажа. Покажем в любое, удобное для Вас время. Звоните.",34.3 м²,,,,,651.0,8/9,34.3 м²,34.3,8,13,2896385219,Sale,/2-komnatnaya-kvartira-na-prodazhu-novosibirsk-2896385219,271.0,2 500 000 ₽,72 886 ₽ за м²,72886,2500000,Apartment,2020-09-29T10:23:07.998687Z,78,Listing,2,2.0,2020-12-30T10:49:56.443739+03:00,1987353618,2020-09-29T13:10:24.034098+03:00,2020-12-08T13:08:30.277939+03:00,3.054,271.0,#008000,Берёзовая роща,"2-комн. квартира, 34.3 м², 8/9 эт.",2020-12-08T10:17:53.045901Z
"Новосибирская область, Новосибирский район, Мичуринский сельсовет, посёлок Элитный, Венская улица, 19",149136553,Игорь Николаевич,Resale,3285,2020-11-29T14:56:12.05539Z,Отличная ТРЕХКОМНАТНАЯ КВАРТИРА под чистовую самоотделку.<br>Для покупателя:<br>Полная финансовая гарантия<br>Полное юридическое сопровождение<br>Ипотека с преференциями по сниженной ставке<br>Возможен обмен на Вашу недвижимость,67.3 м²,,,,,,4/5,67.3 м²,67.3,4,2,3040614231,Sale,/3-komnatnaya-kvartira-na-prodazhu-novosibirsk-3040614231,,3 800 000 ₽,56 464 ₽ за м²,56464,3800000,Apartment,2020-11-29T14:56:12.05539Z,78,Listing,3,3.0,2020-12-29T17:47:10.638891+03:00,2023642469,2020-11-29T17:46:47.86325+03:00,2020-11-29T17:47:10.638891+03:00,,,,,"3-комн. квартира, 67.3 м², 4/5 эт.",2020-11-29T14:56:14.025399Z
,45473436,«Город 54»  Агентство Недвижимости,New,3285,2020-07-23T11:22:13.007242Z,"Предлагаем к покупке  просторную  квартиру-студию в строящемся доме ЖК Акварельный 3.0.<br>ОЧЕНЬ удачная планировка для однокомнатной студии! В прихожей можно легко можно разместить встроенный шкаф, в кухонной зоне прекрасно разместится полноценная кухня,  есть зона для ТВ и дивана. А наличие выхода на лоджию их кухонной зоны позволяет разместить на лоджии обеденную зону и любоваться видами на прекрасные закаты на лоне природы.<br>Два окна большая редкость для однокомнатной студии, что позволяет использовать жилую зону как полноценную спальню площадью в  10 (!) кв.м. <br>Доступна покупка как под чистовую отделку, так и ремонт под ключ. Выбирая вариант ""ремонт под ключ"" стоимость квартиры увеличиться ориентировочно на 300 000 р.<br>ПРЕКРАСНЫЙ СТАРТ для НОВОЙ ЖИЗНИ!<br>ВАЖНО! Возможно приобретение в ипотеку по сниженной ставке, ипотека с гос.поддержкой.<br>ВАЖНО! Сообщаем о том, что  в настоящий момент при покупке действует программа ОБМЕНА старого жилья на новое! <br>Недвижимость котроая может быть принята по программе обмена это: <br>- квартиры, в любых районах г. Новосибирска, включая спальные (обременение<br> и опека не проблема) <br>-  по дополнительному согласованию принмаются квартиры в ближайшем пригороде (Обь, Криводановка, Бердск, Садовый и др.<br>Не попадают под программу обмена:<br>-  коммерческая недвижимость<br>- а (и любая загородная недвижимость)<br>- аварийные и проблемные объекты<br>- комнаты в общежитиях<br>При покупке в ипотеку, получение кредитного решения для клиентов АН Город 54 в срок от 1-го до 3-х дней и на самых выгодных для клиентов условиях.  Услуги агентства недвижимости 0%, работаем по договору с застройщиком.<br>Просмтор квартиры возможен по предварительной договоренности. Звоните, расскажем БОЛЬШЕ!",29 м²,71876.0,ЖК «Акварельный»,71876.0,ЖК «Акварельный»,655.0,3/17,29 м²,29.0,3,7,2735087896,Sale,/1-komnatnaya-kvartira-na-prodazhu-novosibirsk-2735087896,,1 950 000 ₽,67 241 ₽ за м²,67241,1950000,Apartment,2020-07-23T11:22:13.007242Z,78,Listing,1,1.0,2020-12-30T11:20:11.505678+03:00,1978523027,2020-07-23T14:06:33.981152+03:00,2020-11-30T11:20:45.968583+03:00,,,,,"1-комн. квартира, 29 м², 3/17 эт.",2020-11-30T08:30:42.127562Z
"Новосибирск, Линейная улица, 33/1",45473436,«Город 54»  Агентство Недвижимости,Resale,3285,2020-10-28T06:19:52.880408Z,"Предлагается к продаже уюная, светлая трех комнатная изолированная квартира .Развитая инфраструктура в шаговой доступности три детских садика (ближайший во [дворе дома), Гимназия 9 и Школа ""Журавушка"" с хоровым уклоном в 5 минутах ходьбы. Различные магазины: Бахетле, Магнит, Пятерочка, молочная кухня, Теннисный клуб, спортивные залы и два плавательных бассейна, Аптека круглосуточная, крупный торгово - развлекательный центр ""Роял Парк"", На расстоянии одной остановки расположены Нарымский сквер, Цирк и Зоопарк /дендро-парк/ дельфинарий.  Прогулочным шагом до метро Гагаринская 5 минут и Ж/д вокзал 15 мин. Транспортная развязка во все направления города, остановка в трех минутах ходьбы. Во дворе новая детская площадка. В доме установлен новый лифт, имеется видео- наблюдение. Собственное ТСЖ. В квартире выполнен ремонт. Окна во двор. Заменены все радиаторы, окна пластик. Сантехника и трубы заменены, установлены счетчики.",60 м²,,,,,653.0,7/9,60 м²,60.0,7,0,2963045689,Sale,/3-komnatnaya-kvartira-na-prodazhu-novosibirsk-2963045689,261.0,4 850 000 ₽,80 833 ₽ за м²,80833,4850000,Apartment,2020-10-28T06:19:52.880408Z,78,Listing,3,3.0,2020-12-30T11:20:17.118682+03:00,2042442430,2020-10-28T09:10:01.138347+03:00,2020-11-30T11:21:12.936691+03:00,0.562,261.0,#FF0000,Гагаринская,"3-комн. квартира, 60 м², 7/9 эт.",2020-11-30T08:30:15.032959Z
