address,agencyId,agencyName,apartmentSaleType,cityId,createdAt,description,details,developmentId,developmentName,developmentParentId,developmentParentName,districtId,floor,floorArea,floorAreaCalculated,floorInt,galleryImagesCount,id,itemType,itemUrl,metroId,price,pricePerArea,pricePerAreaValue,priceValue,propertyType,publishDate,regionId,resultType,rooms,roomsOrdinal,sourceFinishTime,sourceId,sourceStartTime,sourceUpdateTime,station_distance,station_id,station_lineColors,station_name,title,updatedAt
"Новосибирск, Красный проспект, 94/3",71571703,Алиса,Resale,3285,2020-04-04T01:08:05.292622Z,"Продается полноценная 4-комнатная квартира (5 окон). Дом расположен в 5 минутах ходьбы от метро  Гагаринская. В тихом месте жилого массива. Рядом с домом детский сад Монтесори и гимназия №13. Зал и три спальни, большой коридор и кухня. В квартире выполнен качественный ремонт. На кухне и в коридоре система ""Теплый пол"". Квартира продается с мебелью. Один собственник, более 5 лет в собственности. Без обременения.",65 м²,,,,,653.0,5/5,65 м²,65.0,5,17,2459483610,Sale,/4-komnatnaya-kvartira-na-prodazhu-novosibirsk-2459483610,261.0,4 690 000 ₽,72 154 ₽ за м²,72154,4690000,Apartment,2020-04-04T01:08:05.292622Z,78,Listing,4,4.0,2020-12-26T09:59:14.397234+03:00,1909021990,2020-04-03T09:57:13.162296+03:00,2020-12-07T10:54:57.452002+03:00,0.285,261.0,#FF0000,Гагаринская,"4-комн. квартира, 65 м², 5/5 эт.",2020-12-07T09:04:25.942138Z
"Новосибирская область, Бердск, Лунная улица, 9",193979042,Татьяна,Resale,3279,2020-12-04T08:06:32.980319Z,"Продам трехкомнатную квартиру, все комнаты изолированные, требует вложения на ремонт. Дом расположен в удобном месте садики, школы, стоянки, парковки, больницы, спортивные комплексы. На сайте рекламируется наша квартира по неправильным ценам звоните.",58 м²,,,,,,4/5,58 м²,58.0,4,0,3051859709,Sale,/3-komnatnaya-kvartira-na-prodazhu-berdsk-3051859709,,2 470 000 ₽,42 586 ₽ за м²,42586,2470000,Apartment,2020-12-04T08:06:32.980319Z,78,Listing,3,3.0,2021-01-03T10:57:30.815582+03:00,2048035968,2020-12-04T10:57:10.400534+03:00,2020-12-04T12:52:53.02079+03:00,,,,,"3-комн. квартира, 58 м², 4/5 эт.",2020-12-04T10:02:21.335416Z
"Новосибирск, улица Героев Революции, 29",22053818,"Агентство недвижимости""Жилищный вопрос""",Resale,3285,2020-11-26T07:11:57.760278Z,"Продается 1 комнатная квартира в отличном состоянии. В квартире произведен ремонт из высококачественных материалов по дизайн-проекту. На балконе выполнен так же хороший ремонт. Бонусом, бесплатно, в подарок остается шкаф и кондиционер. В доме имеется два лифта, консьерж",44 м²,,,,,657.0,16/16,44 м²,44.0,16,17,3033195897,Sale,/1-komnatnaya-kvartira-na-prodazhu-novosibirsk-3033195897,,3 800 000 ₽,86 364 ₽ за м²,86364,3800000,Apartment,2020-11-26T07:11:57.760278Z,78,Listing,1,1.0,2020-12-26T10:02:56.351547+03:00,2040387172,2020-11-26T08:36:37.117898+03:00,2020-11-27T20:05:04.502807+03:00,,,,,"1-комн. квартира, 44 м², 16/16 эт.",2020-11-27T17:14:29.208149Z
"ул. Тополевая, д. 5",30716286,НСН СибЖилКом,New,3285,2020-12-03T11:04:12.417962Z,Квартира на плане № 30   ,50.3 м²,78221.0,Комплекс «Pool House» (Пул Хаус),78221.0,Комплекс «Pool House» (Пул Хаус),650.0,13/17,50.3 м²,50.3,13,2,3049850356,Sale,/2-komnatnaya-kvartira-na-prodazhu-novosibirsk-3049850356,264.0,3 200 000 ₽,63 618 ₽ за м²,63618,3200000,Apartment,2020-12-03T11:04:12.417962Z,78,Listing,2,2.0,2021-01-02T13:55:11.289202+03:00,2044014305,2020-12-03T13:54:45.206882+03:00,2020-12-03T13:55:11.289202+03:00,1.319,264.0,#FF0000,Октябрьская,"2-комн. квартира, 50.3 м², 13/17 эт.",2020-12-03T11:04:14.875684Z
"ул. Бородина, д. 1",61734665,Агентство недвижимости «НИАН»,New,3285,2020-07-29T11:02:37.459335Z,"В Новом строящемся жилом комплексе ""Новые Матрешки"" есть просторная квартира студию, которую можно изменить по желанию и в однокомнотную квартиру.  Общая площадь квартиры 32.80 кв. м. 2 этаж. Два дома будут расположены напротив друг друга, образуя между собой общую придомовую территорию со своей атмосферой.    Квартиры сдаются с ремонтом ""под ключ"" в нейтральном стиле, который легко переделать под свои желания, а также застекляет лоджии. После получения ключей вы сразу же сможете отпраздновать новоселье.  Расположение жилого комплекса в 5 минутах езды от пл. Кирова. Льготная ипотека от 5,85%. Помощь в получении кредитного решения. Звоните, на все вопросы отвечу. Экскурсия на объект.",32.8 м²,1025391321.0,ЖК «Новые Матрешки»,1025391321.0,ЖК «Новые Матрешки»,655.0,2/24,32.8 м²,32.8,2,6,2749999807,Sale,/1-komnatnaya-kvartira-na-prodazhu-novosibirsk-2749999807,267.0,2 017 000 ₽,61 494 ₽ за м²,61494,2017000,Apartment,2020-07-29T11:02:37.459335Z,78,Listing,1,1.0,2020-12-26T17:23:03.796822+03:00,1959138166,2020-07-29T13:48:37.842624+03:00,2020-12-04T07:16:20.77595+03:00,,,,,"1-комн. квартира, 32.8 м², 2/24 эт.",2020-12-04T04:25:49.352265Z
"Новосибирская область, Обь, улица Ломоносова, 46",79698940,zuravlik,Resale,3277,2020-11-26T06:31:21.987Z,"Абсолютно новая квартира после ремонта. Качественные материалы. Двери ,мебель из массива. Остекленная лоджия. Пол ккрамогранит. Встроенная кухня и шкаф - купе. Большая ванная комната. Остекленная душевая кабина. Высокие потолки. Дизайн выполнен в классическом стиле. Очень тёплая, светлая. Установлена сплит-система. Вся бытовая техника. Рабочая зона кухни выполнена изразцами испанского производства. На полу качественный керамогранит. Отличный дизайн ванной комнаты.",43.5 м²,,,,,,7/15,43.5 м²,43.5,7,13,3033058470,Sale,/kvartira-na-prodazhu-ob-3033058470,,3 700 000 ₽,85 057 ₽ за м²,85057,3700000,Apartment,2020-11-26T06:31:21.987Z,78,Listing,Своб. планировка,,2020-12-26T10:06:18.830315+03:00,2042236626,2020-11-26T09:20:54.297363+03:00,2020-11-27T19:09:36.297826+03:00,,,,,"Квартира своб. планировки, 43.5 м², 7/15 эт.",2020-11-27T16:19:04.983658Z
"Новосибирск, Большевистская улица, 165",135126086,сергей,Resale,3285,2019-10-23T07:37:24.498107Z,"Продается, квартира, тихий двор, детская площадка, сепермаркет Лента, мебель по договоренности. Продажа в РАССРОЧКУ до 10 лет.,Возможность использовать материнский капитал, как первоначальный взнос.",31 м²,,,,,650.0,3/5,31 м²,31.0,3,3,1939184822,Sale,/1-komnatnaya-kvartira-na-prodazhu-novosibirsk-1939184822,265.0,1 950 000 ₽,62 903 ₽ за м²,62903,1950000,Apartment,2019-10-23T07:37:24.498107Z,78,Listing,1,1.0,2020-12-31T12:58:36.271753+03:00,1796696427,2019-10-23T10:28:16.67353+03:00,2020-12-01T12:58:36.271753+03:00,2.404,265.0,#FF0000,Речной вокзал,"1-комн. квартира, 31 м², 3/5 эт.",2020-12-01T10:11:03.662408Z
"ул. Тульская, стр. 82",107238416,"Отдел продаж Застройщика ""Инвест-плюс""",New,3285,2020-11-26T07:18:14.416496Z,"Отличный ДЕФИЦИТНЫЙ вариант однокомнатной квартиры.<br>Кладовая в подарок!<br>Локация по линии МЕТРО Студенческая и К.Маркса (15 минут ПЕШКОМ)<br>Торговые центры, кинотеатры, магазины - всё рядом.<br>ЗАПИСЫВАЙТЕСЬ НА ЭКСКУРСИЮ!!!",39 м²,39341.0,ЖК «Тульский»,39341.0,ЖК «Тульский»,655.0,9/17,39 м²,39.0,9,14,3033214315,Sale,/1-komnatnaya-kvartira-na-prodazhu-novosibirsk-3033214315,266.0,2 950 000 ₽,75 641 ₽ за м²,75641,2950000,Apartment,2020-11-26T07:18:14.416496Z,78,Listing,1,1.0,2020-12-26T10:09:12.912695+03:00,2029990591,2020-11-26T08:40:03.582792+03:00,2020-11-28T15:41:06.851002+03:00,1.427,266.0,#FF0000,Студенческая,"1-комн. квартира, 39 м², 9/17 эт.",2020-11-28T12:50:43.229136Z
"Новосибирск, Гурьевская улица, 31",122202276,Женя Суслова,Resale,3285,2020-11-29T13:45:50.506471Z,"Квартира в нормальном состоянии. срочная, чистая продажа. Работаем с агентством, просьба агентствам  не беспокоить.",31 м²,,,,,650.0,3/5,31 м²,31.0,3,5,3040480490,Sale,/1-komnatnaya-kvartira-na-prodazhu-novosibirsk-3040480490,265.0,2 680 000 ₽,86 452 ₽ за м²,86452,2680000,Apartment,2020-11-29T13:45:50.506471Z,78,Listing,1,1.0,2020-12-29T16:36:20.952535+03:00,2050722620,2020-11-29T16:31:35.335353+03:00,2020-11-30T08:57:10.227328+03:00,0.47,265.0,#FF0000,Речной вокзал,"1-комн. квартира, 31 м², 3/5 эт.",2020-11-30T06:06:39.183379Z
"Новосибирская область, Бердск, улица Островского, 95",51464857,"АН ""ЖилМассив""",Resale,3279,2020-10-26T07:45:29.257555Z,"В продаже двухкомнатная квартира после капитального ремонта. Произведена замена электрики и сантехнического оборудования. Продажа квартиры со всей мебелью и бытовой техникой. Рядом с домом школа, детские сады, множество магазинов. Квартира менее 5 лет в собственности. 1 собственник. ЧП.",44 м²,,,,,,2/5,44 м²,44.0,2,17,2957822268,Sale,/2-komnatnaya-kvartira-na-prodazhu-berdsk-2957822268,,2 750 000 ₽,62 500 ₽ за м²,62500,2750000,Apartment,2020-10-26T07:45:29.257555Z,78,Listing,2,2.0,2020-12-26T10:15:44.881844+03:00,2039042326,2020-10-26T10:35:59.496112+03:00,2020-11-26T10:15:44.881844+03:00,,,,,"2-комн. квартира, 44 м², 2/5 эт.",2020-11-26T07:24:53.247012Z
"Новосибирск, улица Серебряные Ключи, 6",61734665,Агентство недвижимости «НИАН»,Resale,3285,2020-11-25T03:26:42.758644Z,"СРОЧНАЯ ПРОДАЖА!!!!  К продаже предлагается уютная 1-ая квартира в отличном состоянии, в кирпичном многоэтажном доме, расположенном в тихом месте, нет шума и пыли!!! Квартира теплая, солнечная, с прекрасной шумоизоляцией, что уже является преимуществом!!! Выполнен качественный ремонт, готова к проживанию с момента покупки. По желанию, вся мебель остается!!!  Территория огорожена, детская площадка, подземная парковка. Прекрасная транспортная доступность, поблизости есть все от продуктовых магазинов до учебных заведений!!! До метро ст. Заельцовская 15 минут пешком!  Чистая продажа, один взрослый собственник, никаких обременений!!! Просмотр в любое удобное время!!!",41 м²,,,,,648.0,4/17,41 м²,41.0,4,12,3030460697,Sale,/1-komnatnaya-kvartira-na-prodazhu-novosibirsk-3030460697,260.0,4 249 000 ₽,103 634 ₽ за м²,103634,4249000,Apartment,2020-11-25T03:26:42.758644Z,78,Listing,1,1.0,2020-12-25T06:17:39.730088+03:00,2023408307,2020-11-25T06:17:16.556347+03:00,2020-11-25T06:17:39.730088+03:00,1.742,260.0,#FF0000,Заельцовская,"1-комн. квартира, 41 м², 4/17 эт.",2020-11-25T03:26:44.45144Z
"Новосибирск, Троллейная улица, 134",61734665,Агентство недвижимости «НИАН»,Resale,3285,2020-08-14T01:50:38.215631Z,"Продам  ухоженную и уютную квартиру  хорошей планировки на ост. Автокомбинат.  Территория дома огорожена, благоустроена, есть консъерж и шлакбаум.   Для отдыха на природе  в пешеходной доступности  расположено  красивое озеро . Рядом с домом находятся  торговые центры "" Континент"" и   ""7  Дней"",  множество магазинов.   Для занятий спортом  оборудована  площадка. В непосредственной  близости   несколько  школ, детских  садов.  В районе есть все необходимое для  удобного проживания семьи.   Возможен обмен на  правый берег 2-х комнатную квартиру в новом доме. Приглашаем на просмотр.(отложен до 16.11.2020 Домнина Оксана Евгеньевна)(отложен до  Домнина Оксана Евгеньевна)",85 м²,,,,,654.0,3/16,85 м²,85.0,3,30,2787307670,Sale,/3-komnatnaya-kvartira-na-prodazhu-novosibirsk-2787307670,267.0,5 160 000 ₽,60 706 ₽ за м²,60706,5160000,Apartment,2020-08-14T01:50:38.215631Z,78,Listing,3,3.0,2020-12-25T06:17:39.898427+03:00,1959247593,2020-08-14T04:41:11.549462+03:00,2020-11-25T06:17:39.898427+03:00,3.623,267.0,#FF0000,Площадь Маркса,"3-комн. квартира, 85 м², 3/16 эт.",2020-11-25T03:26:45.563031Z
"Новосибирская область, Бердск, улица Красная Сибирь, 138",11583180,Ваш Выбор,Resale,3279,2020-11-26T07:30:04.110643Z,"Предлагается в продажу 1-я квартира на 10-ом этаже 10-ти этажного дома.<br>В шаговой доступности остановка ""Лунная"", магазины, супермаркеты, аптеки, школа, детский садик.<br>На территории дома есть детская площадка, парковка, стоит шлагбаум.<br>Квартира уютная, светлая. <br>Приобретая эту квартиру Вам остается вся мебель и  встроенный кухонный гарнитур (возможно продажа с бытовой техникой).<br>Один взрослый собственник, долгов  нет.",42 м²,,,,,,10/10,42 м²,42.0,10,10,3033262410,Sale,/1-komnatnaya-kvartira-na-prodazhu-berdsk-3033262410,,2 700 000 ₽,64 286 ₽ за м²,64286,2700000,Apartment,2020-11-26T07:30:04.110643Z,78,Listing,1,1.0,2020-12-26T10:25:26.741412+03:00,2058326701,2020-11-26T10:19:01.225414+03:00,2020-11-26T10:37:21.03478+03:00,,,,,"1-комн. квартира, 42 м², 10/10 эт.",2020-11-26T07:51:50.249229Z
"Новосибирск, улица Федосеева, 14",149136553,Игорь Николаевич,Resale,3285,2020-11-29T13:57:02.727551Z,Продается ТРЕХКОМНАТНАЯ КВАРТИРА в 7 минутах хотьбы от метро «Березовая роща».<br>Для покупателя:<br>Полная финансовая гарантия<br>Полное юридическое сопровождение<br>Ипотека с преференциями по сниженной ставке<br>Возможен обмен на Вашу недвижимость,84 м²,,,,,650.0,5/8,84 м²,84.0,5,2,3040509938,Sale,/3-komnatnaya-kvartira-na-prodazhu-novosibirsk-3040509938,272.0,7 300 000 ₽,86 905 ₽ за м²,86905,7300000,Apartment,2020-11-29T13:57:02.727551Z,78,Listing,3,3.0,2020-12-29T16:48:00.681461+03:00,2023662781,2020-11-29T16:47:38.709266+03:00,2020-11-29T16:48:00.681461+03:00,0.774,272.0,#008000,Золотая Нива,"3-комн. квартира, 84 м², 5/8 эт.",2020-11-29T13:57:05.063919Z
"Новосибирская область, Бердск, Комсомольская улица, 2Г",12628842,АН Славянское,Resale,3279,2020-10-26T12:17:57.427436Z,Двухкомнатная улучшенной планировки в самом центре г.Бердска. Компактная но гораздо просторнее квартир в 5-этажных квартир стандартной планировок и хрущевок. Санузел раздельный. Имеется тамбур на две квартиры. Готовы к быстрому выходу на сделку. Квартира свободна готова к быстрому заселению. Более 5 лет в собственности. Полная цена в договоре без всяких занижений.Лоджия на два окна застеклена. Номер в базе #1_5_9292 ,49 м²,,,,,,8/9,49 м²,49.0,8,12,2958533432,Sale,/2-komnatnaya-kvartira-na-prodazhu-berdsk-2958533432,,2 650 000 ₽,54 082 ₽ за м²,54082,2650000,Apartment,2020-10-26T12:17:57.427436Z,78,Listing,2,2.0,2020-12-26T10:34:44.788872+03:00,2024584942,2020-10-26T15:08:26.26644+03:00,2020-11-26T10:34:44.788872+03:00,,,,,"2-комн. квартира, 49 м², 8/9 эт.",2020-11-26T07:48:26.247622Z
"ул. Лескова/Покатная, жилые дома",17604731,Ольга,New,3285,2020-10-29T04:58:52.544758Z,"B прoдажe oднoкомнатная квapтиpa в coвpеменном жилом кoмплекcе ""Оазиc"", нa кoмфоpтнoм этaже с видом вo двор.<br>Комфopтная планиpoвкa: кухня 10,48 кв.м., спальня 18,22 кв.м. с лоджией 2,70 кв.м., бoльшой холл 10,13 кв.м. и пpоcтоpнaя ваннaя комната 4,58 кв.м. Высокиe потoлки 2,75 м, кaчественнaя чиcтoвaя отделка, дорогие окна и дверь.<br>ЖК ""Оазис"" новый семейный микрорайон, расположенный в одном из престижных районов Новосибирска.<br>Территория огорожена и оснащена шлагбаумом, автоматическими воротами и видео наблюдением.<br>На территории комплекса свой сити парк, один из лучших в городе, разбитый на несколько зон:<br>- тихие зоны для прогулки с детьми и отдыха<br>- детские игровые зоны с тренажерами на открытом воздухе<br>- игровые площадки<br>- беговые и велосипедные дорожки<br>- в центре парка расположен фонтан и собственный скейт парк<br>- зимой два катка<br>Много деревьев и кустарников, изумительный ландшафтный дизайн, арт-объекты.<br>На территории комплекса английский детский сад ""Sun Sсhооl"" , сеть центров бережного развития интеллекта детей ""Бэби-клуб"",фитнес - студия ""Fitbоdy"", стоматологическая клиника ""Вита-Стом"", аптека ""Эдельвейс"", медицинский центр ""Медикофармсервис"", продуктовый магазин ""Фермер-центр"", ""Вкусный"".<br>В шаговой доступности 3 детских сада, 4 средних школы, лицей № 185.<br>Все необходимое для комфортного проживания в радиусе 1 километра: метро ""Октябрьская"", роддом, поликлиника,банки, стадион и бассейн СКА, ТРЦ ""Аура"", супермаркет ""Бахетле"".<br>До центра города вы можете пешком добраться за 15 минут.<br>На машине к ЖК ""Оазис"" можно подъехать с трех сторон: со стороны улиц Сакко и Ванцетти, Военной и Карла Либнехта.",43.4 м²,,,,,650.0,11/25,43.4 м²,43.4,11,1,2965853627,Sale,/1-komnatnaya-kvartira-na-prodazhu-novosibirsk-2965853627,264.0,4 350 000 ₽,100 230 ₽ за м²,100230,4350000,Apartment,2020-10-29T04:58:52.544758Z,78,Listing,1,1.0,2020-12-28T08:03:33.127632+03:00,2041733560,2020-10-29T07:49:27.219567+03:00,2020-11-28T08:03:33.127632+03:00,1.117,264.0,#FF0000,Октябрьская,"1-комн. квартира, 43.4 м², 11/25 эт.",2020-11-28T05:12:37.453313Z
"ул. Тульская, стр. 82",107238416,"Отдел продаж Застройщика ""Инвест-плюс""",New,3285,2019-02-05T20:13:29.724605Z,"Выбор этажей и планировок<br>Кладовая в подарок!<br>Успей купить выгодно!<br>- TRADE IN ( обменяем Ваше жилье на новую квартиру в нашем комплексе.).<br>С необходимыми документами можно ознакомиться в офисе Застройщика.<br>Жилой комплекс «Тульский»- это дома переменной этажности 8, 15, 19 (в том числе жилых - 5, 12, 16) с помещениями общественно-торгового назначения с подземной автостоянкой. Секции дома объединены единым архитектурным решением, представляют собой вариант рационального освоения территории, образуют замкнутое внутридворовое пространство.<br>I этап - дом переменной этажности: 8-15-19 этажей, состоящий из трех блок-секций, с помещениями общественного и торгового назначения и подземной автостоянкой.<br>II этап – дом переменной этажности: от 6 до 19 этажей, состоящий из пяти блок-секций, с помещениями общественного и торгового назначения.<br>Преимущества комплекса:<br>- развитая инфраструктура<br>- удобная транспортная развязка<br>- прекрасные виды на реку и ПКиО «Бугринская роща»<br>- благоустроенная внутридомовая территория<br>Вся подробная информация по телефону, звони!",85.7 м²,39341.0,ЖК «Тульский»,39341.0,ЖК «Тульский»,655.0,4/17,85.7 м²,85.7,4,12,255627074,Sale,/3-komnatnaya-kvartira-na-prodazhu-novosibirsk-255627074,266.0,4 900 000 ₽,57 176 ₽ за м²,57176,4900000,Apartment,2019-02-05T20:13:29.724605Z,78,Listing,3,3.0,2020-12-25T06:29:04.35728+03:00,1414498983,2018-07-10T09:40:44+03:00,2020-11-28T15:55:43.497859+03:00,1.427,266.0,#FF0000,Студенческая,"3-комн. квартира, 85.7 м², 4/17 эт.",2020-11-28T13:05:10.228541Z
