address,agencyId,agencyName,apartmentSaleType,cityId,createdAt,description,details,developmentId,developmentName,developmentParentId,developmentParentName,districtId,floor,floorArea,floorAreaCalculated,floorInt,galleryImagesCount,id,itemType,itemUrl,metroId,price,pricePerArea,pricePerAreaValue,priceValue,propertyType,publishDate,regionId,resultType,rooms,roomsOrdinal,sourceFinishTime,sourceId,sourceStartTime,sourceUpdateTime,station_distance,station_id,station_lineColors,station_name,title,updatedAt
"Новосибирск, улица Авиастроителей, 1",152810530,Центральное агентство недвижимости,Resale,3285,2020-11-24T12:40:10.306544Z,"В квартире сделан капитальный ремонт (заменены трубы, электропроводка, выровнены стены, утеплен пол по всей квартире), натяжные потолки, сигнализация на окнах и дверях, лоджия остеклена пластиковыми окнами и имеет погреб (теплый и благоустроенный). Теплая отсечка на две квартиры, доброжелательные соседи. Остается большая часть мебели.  В радиусе 500 метров три детских сада и две школы, супермаркет в соседнем доме. До остановки транспорта с 9 маршрутами 138 метров. Квартира без обременений. <br>При звонке, пожалуйста, назовите номер объявления - 114 891<br>Консультируем подробно по телефону.",43 м²,,,,,651.0,1/9,43 м²,43.0,1,17,3029340481,Sale,/2-komnatnaya-kvartira-na-prodazhu-novosibirsk-3029340481,271.0,3 400 000 ₽,79 070 ₽ за м²,79070,3400000,Apartment,2020-11-24T12:40:10.306544Z,78,Listing,2,2.0,2020-12-24T15:31:05.324947+03:00,2015977067,2020-11-24T15:30:20.837341+03:00,2020-12-03T05:29:39.024981+03:00,2.986,271.0,#008000,Берёзовая роща,"2-комн. квартира, 43 м², 1/9 эт.",2020-12-03T02:39:14.642726Z
"ул. Лескова, д. 30а",173701179,Макромир,New,3285,2020-11-29T16:27:40.627584Z,"Жилой комплекс «Оазис» — новый семейный микрорайон, расположенный в одном из престижных районов Новосибирска. Поблизости находится станция метро «Октябрьская» и ТРЦ «Аура», что делает легкодоступными деловой центр города и основные места проведения досуга. Площадь Ленина, популярные рестораны, кофейни, бары, кинотеатры, торговые и деловые улицы Правобережья — все рядом.<br>Название «Оазис» выбрано не случайно — на территории комплекса будет реализован масштабный проект озеленения и благоустройства. Настоящим украшением «Оазиса» станет уникальный сити-парк, занимающий 1,5 гектара, и два мини-парка меньшей площади. Удобные подземные парковки позволят реализовать концепцию «территории без машин», равно как и уникальный для Новосибирска механизированный паркинг с системой штабелирования машин. В ЖК «Оазис» каждый по достоинству оценит комфортное проживание вблизи центра города и возможность дышать чистым свежим воздухом во дворе своего дома.<br>Новострой без комиссии.<br>Не продаю, а помогаю Вам! 20 лет успешных сделок!",40 м²,36699.0,ЖК «Оазис»,36699.0,ЖК «Оазис»,650.0,14/25,40 м²,40.0,14,2,3040767249,Sale,/1-komnatnaya-kvartira-na-prodazhu-novosibirsk-3040767249,264.0,4 376 900 ₽,109 423 ₽ за м²,109423,4376900,Apartment,2020-11-29T16:27:40.627584Z,78,Listing,1,1.0,2020-12-29T19:18:39.673684+03:00,2041499244,2020-11-29T19:18:18.8386+03:00,2020-11-29T19:27:55.706502+03:00,1.102,264.0,#FF0000,Октябрьская,"1-комн. квартира, 40 м², 14/25 эт.",2020-11-29T16:37:19.144144Z
"Новосибирск, Полтавская улица, 19",23367994,Компания «ЭТАЖИ»,Resale,3285,2020-11-26T07:32:17.510624Z,"Продаётся 2-х комнатная квартира с изолированными просторными комнатами и раздельным санузлом. Дом имеет удобное месторасположение, развитая инфраструктура: в шаговой доступности остановка общественного транспорта (автобус, трамвай), детский сад «Калейдоскоп», школа N 188, Лицей, библиотека им.В.Бианки, а также торговый центр «Континент», супермаркеты («Лента»), продуктовые магазины, аптеки, банки, парикмахерские. Комфортный 3 этаж, в подъезде проведён ремонт, заменена кабина лифта. Квартира солнечная, окна выходят на две стороны: во двор (придомовая парковка, детская площадка), второе окно выходит на улицу Полтавская. В квартире установлены счетчики на холодную и горячую воду, требуется ремонт.<br>Специалист Компании ответит на все Ваши вопросы и организует просмотр в удобное для Вас время! Звоните прямо сейчас!. Номер в базе: 5004030. Район: Ленинский.",52.9 м²,,,,,654.0,3/10,52.9 м²,52.9,3,20,3033276414,Sale,/2-komnatnaya-kvartira-na-prodazhu-novosibirsk-3033276414,267.0,3 150 000 ₽,59 546 ₽ за м²,59546,3150000,Apartment,2020-11-26T07:32:17.510624Z,78,Listing,2,2.0,2020-12-26T10:22:47.328796+03:00,2040312922,2020-11-26T10:06:06.262907+03:00,2020-12-07T13:16:54.43791+03:00,3.074,267.0,#FF0000,Площадь Маркса,"2-комн. квартира, 52.9 м², 3/10 эт.",2020-12-07T10:26:50.709488Z
"Новосибирская область, Новосибирский район, рабочий посёлок Краснообск, 22",23367994,Компания «ЭТАЖИ»,Resale,3287,2020-11-26T07:31:50.792675Z,"В продаже 3-х комнатная квартира на 5- ом этаже нового кирпичного дома в микрорайоне Фламинго. Современная продуманная планировка.<br>В квартире выполнен высокачественный ремонт с использованием дорогих отделочных материалов. В подарок новым жильцам достанется кухня с фасадами из натурального дерева, мебель в большом зале, шкафы прихожей и шкаф- купе в спальне. Системы водоснабжения и электрики полностью переделаны. Смонтирован натяжной потолок. В ванной установлена функциональная душевая кабина. В квартире смонтирован охранный комплекс.<br>Площадь квартиры 69 м2+ утепленная лоджия 10 м2.<br>Окна квартиры выходят на внутренний двор с детскими и игровыми площадками.<br>Отличное месторасположение. В шаговой доступности поликлинники, детские сады, школы, магазины, кинотеатр, стадион ит.д.<br>Звоните, записывайтесь на просмотр.. Номер в базе: 4957410. Район: Элитный пос..",79 м²,,,,,,5/5,79 м²,79.0,5,18,3033273541,Sale,/3-komnatnaya-kvartira-na-prodazhu-krasnoobsk-3033273541,,5 600 000 ₽,70 886 ₽ за м²,70886,5600000,Apartment,2020-11-26T07:31:50.792675Z,78,Listing,3,3.0,2020-12-26T10:22:47.984743+03:00,2040123189,2020-11-26T10:06:06.274147+03:00,2020-11-26T10:22:47.984743+03:00,,,,,"3-комн. квартира, 79 м², 5/5 эт.",2020-11-26T07:32:29.264804Z
"ул. Лескова, д. 30а",173701179,Макромир,New,3285,2020-11-29T16:31:38.54205Z,"Жилой комплекс «Оазис» — новый семейный микрорайон, расположенный в одном из престижных районов Новосибирска. Поблизости находится станция метро «Октябрьская» и ТРЦ «Аура», что делает легкодоступными деловой центр города и основные места проведения досуга. Площадь Ленина, популярные рестораны, кофейни, бары, кинотеатры, торговые и деловые улицы Правобережья — все рядом.<br>Название «Оазис» выбрано не случайно — на территории комплекса будет реализован масштабный проект озеленения и благоустройства. Настоящим украшением «Оазиса» станет уникальный сити-парк, занимающий 1,5 гектара, и два мини-парка меньшей площади. Удобные подземные парковки позволят реализовать концепцию «территории без машин», равно как и уникальный для Новосибирска механизированный паркинг с системой штабелирования машин. В ЖК «Оазис» каждый по достоинству оценит комфортное проживание вблизи центра города и возможность дышать чистым свежим воздухом во дворе своего дома.<br>Без комиссии.<br>Не продаю, а помогаю Вам! 20 лет успешных сделок!",66 м²,36699.0,ЖК «Оазис»,36699.0,ЖК «Оазис»,650.0,3/25,66 м²,66.0,3,2,3040771452,Sale,/2-komnatnaya-kvartira-na-prodazhu-novosibirsk-3040771452,264.0,5 598 950 ₽,84 833 ₽ за м²,84833,5598950,Apartment,2020-11-29T16:31:38.54205Z,78,Listing,2,2.0,2020-12-29T19:22:37.37543+03:00,2041100116,2020-11-29T19:22:14.77566+03:00,2020-11-29T19:26:54.20483+03:00,1.102,264.0,#FF0000,Октябрьская,"2-комн. квартира, 66 м², 3/25 эт.",2020-11-29T16:36:18.48292Z
"Новосибирская область, Татарск, Краснофлотская улица, 1Б",166706268,Анастасия Григорьева,Resale,3281,2020-12-02T10:36:15.484781Z,Продам квартиру 1 комнатную. Реальному покупателю торг.,19 м²,,,,,,2/3,19 м²,19.0,2,3,3047315889,Sale,/1-komnatnaya-kvartira-na-prodazhu-tatarsk-3047315889,,750 000 ₽,39 474 ₽ за м²,39474,750000,Apartment,2020-12-02T10:36:15.484781Z,78,Listing,1,1.0,2021-01-01T13:27:14.38853+03:00,2042743952,2020-12-02T13:26:51.332052+03:00,2020-12-02T16:22:00.386585+03:00,,,,,"1-комн. квартира, 19 м², 2/3 эт.",2020-12-02T13:31:24.264902Z
"ул. Ядринцевская, ЖК «Расцветай на Ядринцевской»",186619795,Grand 21,New,3285,2020-12-04T04:51:21.95273Z,"В продаже 1-комнатная квартира студия в доме ""Бизнес-лайт"" в ЖК ""Расцветай на Ядринцевской""!<br>Прекрасно развита инфраструктура, в пешей доступности ТРЦ ""Аура"", Центральный парк с Новосибирским музыкальным театром, Новосибирский театр оперы и балета и пр.!",42.3 м²,1031398824.0,ЖК «Расцветай на Ядринцевской»,1031398824.0,ЖК «Расцветай на Ядринцевской»,649.0,14/25,42.3 м²,42.3,14,4,3051432798,Sale,/kvartira-na-prodazhu-novosibirsk-3051432798,263.0,5 100 000 ₽,120 567 ₽ за м²,120567,5100000,Apartment,2020-12-04T04:51:21.95273Z,78,Listing,Студия,,2021-01-03T07:42:20.300104+03:00,2065340567,2020-12-04T07:41:59.484553+03:00,2020-12-04T07:42:20.300104+03:00,0.818,263.0,#FF0000,Площадь Ленина,"Квартира-студия, 42.3 м², 14/25 эт.",2020-12-04T04:51:24.208942Z
"Новосибирск, улица Пермитина, 3",26461135,Сергей,Resale,3285,2020-12-01T05:22:00.492231Z,"рядом с домом стадион Сибсельмаш, пять садиков, несколько школ, франсузкая гимназия, магазины все в шаговой  доступности. Все вопросы  по телефону.",55.6 м²,,,,,654.0,5/5,55.6 м²,55.6,5,3,3044013095,Sale,/3-komnatnaya-kvartira-na-prodazhu-novosibirsk-3044013095,267.0,3 970 000 ₽,71 403 ₽ за м²,71403,3970000,Apartment,2020-12-01T05:22:00.492231Z,78,Listing,3,3.0,2020-12-31T08:12:59.596779+03:00,2029556466,2020-12-01T08:12:37.835023+03:00,2020-12-08T12:47:00.592179+03:00,0.929,267.0,#FF0000,Площадь Маркса,"3-комн. квартира, 55.6 м², 5/5 эт.",2020-12-08T09:56:22.738454Z
"Новосибирская область, Искитим, улица Космонавтов",92049691,Наталья,Resale,3252,2020-10-22T07:32:17.668559Z,"Квартира с удобным местом расположения, все в шаговой доступности сады, школы, супермаркеты, остановки, ж д станция. Тихое место, нет шума дорог и проходимости людей. В подъезде чистота, придомовая территория чистая, со своим небольшим огородиком. В доме всего четыре квартиры. Сама квартира просторная, теплая, с большой лоджией. К квартире в подарок большое подвальное отавливаемое помещение площадью в 50 кв м, с 3 метров и потолками. Один собственник, готовы к быстрой сделке. Просмотр в любое удобное для вас время.",70 м²,,,,,,2/2,70 м²,70.0,2,19,2948078236,Sale,/3-komnatnaya-kvartira-na-prodazhu-iskitim-2948078236,,2 550 000 ₽,36 429 ₽ за м²,36429,2550000,Apartment,2020-10-22T07:32:17.668559Z,78,Listing,3,3.0,2020-12-22T15:55:12.624733+03:00,2041679301,2020-10-22T10:22:19.56261+03:00,2020-11-24T15:53:01.081755+03:00,,,,,"3-комн. квартира, 70 м², 2/2 эт.",2020-11-24T13:01:35.987412Z
"Новосибирск, улица Дмитрия Шмонина, 10",23367994,Компания «ЭТАЖИ»,Resale,3285,2020-08-27T06:43:16.92659Z,"В квартире чисто и аккуратно. В шаговой доступности, парк имени Синягина, крытый каток, магазины, аптеки, школы детские сады. Остановка общественного транспорта в 50 метрах от дома. Ремонт от застройщика. Поменяли все смесители, на окнах жалюзи! В квартире остается: кухонный гарнитур, гардеробная в комнате и вместительный шкаф в прихожей!<br>Обременение ПРОМСВЯЗЬБАНКА. Кухонный гарнитур изготовлен из дорогих и качественных материалов, окна выходят во двор, в юго-западном направлении.<br>Просмотр по договоренности.. Номер в базе: 4564741. Район: Кировский.",33.3 м²,,,,,655.0,14/17,33.3 м²,33.3,14,20,2819533691,Sale,/1-komnatnaya-kvartira-na-prodazhu-novosibirsk-2819533691,,2 450 000 ₽,73 574 ₽ за м²,73574,2450000,Apartment,2020-08-27T06:43:16.92659Z,78,Listing,1,1.0,2020-12-25T13:06:31.93742+03:00,2008682079,2020-08-27T09:33:47.736144+03:00,2020-11-30T05:22:08.469239+03:00,,,,,"1-комн. квартира, 33.3 м², 14/17 эт.",2020-11-30T02:31:36.481878Z
"Новосибирск, Октябрьский район, жилмассив Плющихинский, 142/5",178825960,"2ПН, покупка-продажа недвижимости",Resale,3285,2020-12-03T07:44:59.492681Z,"  В продаже 1- комнатная квартира студия, в хорошем состоянии. Выполнен качественный ремонт. Продажа по переуступке.",39 м²,,,,,650.0,9/10,39 м²,39.0,9,2,3049268748,Sale,/1-komnatnaya-kvartira-na-prodazhu-novosibirsk-3049268748,272.0,2 140 000 ₽,54 872 ₽ за м²,54872,2140000,Apartment,2020-12-03T07:44:59.492681Z,78,Listing,1,1.0,2021-01-02T10:35:57.384767+03:00,2022294529,2020-12-03T10:35:31.085595+03:00,2020-12-03T10:35:57.384767+03:00,3.324,272.0,#008000,Золотая Нива,"1-комн. квартира, 39 м², 9/10 эт.",2020-12-03T07:45:03.372169Z
"Индустриальный пер, 37/2",110358286,Нина Николаевна,Resale,3266,2019-02-05T20:36:34.545626Z,"Продам или обменяю на квартиру в г. Новосибирске  3-х комн. квартиру 74,7/48,5/10,7 кв.м. на 3 этаже 4-этажного  кирпичного дома. Квартира теплая, имеется балкон, домофон, установлены счетчики воды. Окна пластиковые, стены подготовлены под обои или покраску, навесные потолки. <br>Квартира отличается удобной планировкой: просторная кухня, большой и светлый зал, раздельный санузел, имеется возможность устройства гардеробной комнаты. Кроме этого имеется кладовая (4 кв. м.), не входящая в площадь квартиры. <br>Недалеко автобусная остановка. До площади Ленина 10 мин. пешком.<br>Форма оплаты любая. Торг.",74.7 м²,,,,,,3/4,74.7 м²,74.7,3,1,179998187,Sale,/3-komnatnaya-kvartira-na-prodazhu-barabinsk-179998187,,1 500 000 ₽,20 080 ₽ за м²,20080,1500000,Apartment,2019-02-05T20:36:34.545626Z,78,Listing,3,3.0,2020-12-27T17:52:11.03501+03:00,1047677479,2017-03-18T14:56:05+03:00,2020-11-27T17:52:11.03501+03:00,,,,,"3-комн. квартира, 74.7 м², 3/4 эт.",2020-11-27T15:01:13.796654Z
"Новосибирская область, Бердск, улица Красная Сибирь, 122",12333942,Эдуард,Resale,3279,2020-09-12T18:25:25.224413Z,"Продам квартиру ЛИЧНО. Тёплая, светлая, уютная с современным ремонтом. В шаговой доступности магазины, школа, детский сад, остановки общественного транспорта в любом направлении. Во дворе имеется детская площадка. Въезд во двор через шлагбаум, проблем с парковкой нет, всегда есть свободные места. Домовая территория и подъезд оборудованы камерами видео-наблюдения. Двор тихий, соседи дружелюбные. ",38.8 м²,,,,,,6/10,38.8 м²,38.8,6,21,2858575723,Sale,/1-komnatnaya-kvartira-na-prodazhu-berdsk-2858575723,,2 680 000 ₽,69 072 ₽ за м²,69072,2680000,Apartment,2020-09-12T18:25:25.224413Z,78,Listing,1,1.0,2020-12-11T21:40:58.261081+03:00,2004510665,2020-09-12T21:15:17.830839+03:00,2020-11-25T20:26:00.473475+03:00,,,,,"1-комн. квартира, 38.8 м², 6/10 эт.",2020-11-25T17:35:05.419618Z
"Новосибирск, Красный проспект, 313",23367994,Компания «ЭТАЖИ»,Resale,3285,2020-11-25T10:36:16.542486Z,"Квартира реальная.Дом сдан<br>Продам 2 Комнатную квартиру площадью 56,4 метров квадратных в доме комфорт класса ЖК ""Северная Корона"".<br>По квартире разработан дизайн проект,который достанется в ПОДАРОК покупателю.<br>Рассчитан каждый сантиметр,что нужно купить и в каких количествах.<br>Территория комплекса огорожена и находится под охраной и видео наблюдением. Очень красивый двор , для детей сделаны удобные спортивные площадки.Школы и Детские сады. Шк. № 211 Считается одной из Лучших в регионе!<br>На первом этаже есть большая колясочная. Бассейны детский и взрослый, Фехтовальный центр, Поликлиника детская и взрослая №29.Все известные сети магазинов ""ЛЕНТА"" и ""Леруа Мерлен"". Магазины шаговой Доступности на территории ЖК,Кофейня,Суши.<br>Для автомобилей имеется открытая парковка и подземная стоянка в 2 уровня, в 1-й очереди ЖК ""Северная Корона (можно приобрести или брать в аренду на зимний период).Дом построен в 2018 году.. Номер в базе: 4975267. Район: Калининский.",56.4 м²,,,,,648.0,12/16,56.4 м²,56.4,12,18,3031462936,Sale,/2-komnatnaya-kvartira-na-prodazhu-novosibirsk-3031462936,,4 000 000 ₽,70 922 ₽ за м²,70922,4000000,Apartment,2020-11-25T10:36:16.542486Z,78,Listing,2,2.0,2020-12-25T13:27:14.512647+03:00,2040253385,2020-11-25T13:26:47.308653+03:00,2020-12-03T10:17:57.098547+03:00,,,,,"2-комн. квартира, 56.4 м², 12/16 эт.",2020-12-03T07:27:43.127126Z
"Новосибирск, Дачная улица, 23/5",148081145,Mila,Resale,3285,2020-10-27T22:41:40.099657Z,"Квартира  в отличном состоянии, потолки 3,2 м, встроенный шкаф, встроенная кухня, духовка, встроенная вытяжка, ремонт делали для себя, в квартире все останется. Один взрослый собственник, без обременения, до метро 7 минут. Просьба риелторов без покупателей не беспокоить.",25 м²,,,,,653.0,15/19,25 м²,25.0,15,6,2962481889,Sale,/kvartira-na-prodazhu-novosibirsk-2962481889,260.0,3 770 000 ₽,150 800 ₽ за м²,150800,3770000,Apartment,2020-10-27T22:41:40.099657Z,78,Listing,Студия,,2020-12-29T11:37:53.45831+03:00,2039905721,2020-10-28T01:32:16.700774+03:00,2020-11-29T11:37:53.45831+03:00,0.602,260.0,#FF0000,Заельцовская,"Квартира-студия, 25 м², 15/19 эт.",2020-11-29T08:47:09.815625Z
