address,agencyId,agencyName,apartmentSaleType,cityId,createdAt,description,details,developmentId,developmentName,developmentParentId,developmentParentName,districtId,floor,floorArea,floorAreaCalculated,floorInt,galleryImagesCount,id,itemType,itemUrl,metroId,price,pricePerArea,pricePerAreaValue,priceValue,propertyType,publishDate,regionId,resultType,rooms,roomsOrdinal,sourceFinishTime,sourceId,sourceStartTime,sourceUpdateTime,station_distance,station_id,station_lineColors,station_name,title,updatedAt
"Новосибирск, Вилюйская улица, 11",152810530,Центральное агентство недвижимости,Resale,3285,2020-11-24T02:47:55.196015Z,"В продаже полноценная двухкомнатная квартира в новом кирпичном доме ЖК Гринвилл. Дом находится в живописном месте Новосибирска в пяти минутах пешком от соснового бора, десять минут на авто до рек Обь и Иня. Развитая инфраструктура, в шаговой доступности Педагогический институт, Колледж связи, две школы, детские сады, лыжная база, остановка общественного транспорта, торговые центры. Большие детская, спортивная площадки, автопарковка. <br>Площадь кухни позволяет использовать квартиру как трехкомнатную студию. В подарок новому владельцу остается кухонный гарнитур со встроенной варочной поверхностью, гардеробная, шкаф для хранения одежды. <br>Отличный вариант как для проживания так и для сдачи в аренду. <br>При звонке, пожалуйста, назовите номер объявления - 114 799<br>Консультируем подробно по телефону.",56 м²,,,,,650.0,7/17,56 м²,56.0,7,35,3028082424,Sale,/2-komnatnaya-kvartira-na-prodazhu-novosibirsk-3028082424,265.0,4 400 000 ₽,78 571 ₽ за м²,78571,4400000,Apartment,2020-11-24T02:47:55.196015Z,78,Listing,2,2,2020-12-24T05:38:53.166408+03:00,2016395223,2020-11-24T05:38:25.672398+03:00,2020-12-07T05:32:38.811708+03:00,4.394,265.0,#FF0000,Речной вокзал,"2-комн. квартира, 56 м², 7/17 эт.",2020-12-07T02:42:12.926087Z
"Новосибирск, Ленинградская улица, 101/2",28131570,не  агенство,Resale,3285,2020-11-24T02:47:49.097374Z,"В продаже просторная трехкомнатная Квартира  в центре Октябрьского района .  <br>До центра города 5 минут на автомобиле.<br>До станции метро Октябрьская  7 минут пешком.  Рядом с домом школа, детский сад, рынок, магазины ,  институты, сквер ГПНТБ, трамвай. Удобная транспортная развязка. <br>Квартира теплая и уютная  в доме классической кирпичной  кладки, а значит в ней комфортно в любое время года. Квартира была перепланирована для удобного  проживания семьей . Перепланировка  официально узаконена.. Единственный собственник квартиры с момента постройки дома. . Полный пакет документов для продажи готов. Кухонный гарнитур , встроеные шкафы в прихожей, светильники, кондиционер, душевая кабина, мебель в ванной комнате, водонагреватель в подарок собственнику . Квартира оборудована сигнализацией.   Приглашаю на просмотр.",80 м²,,,,,650.0,6/11,80 м²,80.0,6,11,3028082354,Sale,/3-komnatnaya-kvartira-na-prodazhu-novosibirsk-3028082354,264.0,7 900 000 ₽,98 750 ₽ за м²,98750,7900000,Apartment,2020-11-24T02:47:49.097374Z,78,Listing,3,3,2020-12-24T05:39:10.17721+03:00,2032193485,2020-11-24T05:36:19.293927+03:00,2020-12-04T11:42:57.979507+03:00,1.151,264.0,#FF0000,Октябрьская,"3-комн. квартира, 80 м², 6/11 эт.",2020-12-04T08:52:35.52429Z
"Новосибирск, улица Виктора Шевелёва, 24",23367994,Компания «ЭТАЖИ»,Resale,3285,2020-10-08T12:14:03.184225Z,"Продам трехкомнатную квартиру с современным ремонтом. Окна выходят на две стороны. Рядом с домом остановка транспорта, в 5 минутах лесопарк имени академика И. И. Синягина место для отдыха прогулок, занятий спортом. Квартира редко посещаема так как основное проживание за городом. Квартира не здавалась в аренду.куплена за наличный расчетЧистовая отделка. В отделке использованы современные материалы. Ровный пол, стены, белая шпатлевка на потолке. Качественная шумоизоляция - кирпичные перегородки в квартире, высокая стяжка пола за счет горизонтальной разводки..Добротная входная дверь с двумя замками.Лоджия застеклена.Установлены подоконники и откосы.. Номер в базе: 4728748. Район: Кировский.",59 м²,,,,,655.0,3/10,59 м²,59.0,3,5,2916277400,Sale,/3-komnatnaya-kvartira-na-prodazhu-novosibirsk-2916277400,,3 400 000 ₽,57 627 ₽ за м²,57627,3400000,Apartment,2020-10-08T12:14:03.184225Z,78,Listing,3,3,2020-12-26T15:36:33.017432+03:00,2008534831,2020-10-08T15:04:29.447128+03:00,2020-11-26T15:40:16.446085+03:00,,,,,"3-комн. квартира, 59 м², 3/10 эт.",2020-11-26T12:51:02.938636Z
"Новосибирск, улица Мясниковой, 30",26253391,Ольга,Resale,3285,2020-06-24T00:19:58.941684Z,"СРОЧНАЯ ПРОДАЖА!!! <br>ТОЛЬКО ЗА НАЛИЧНЫЙ РАСЧЁТ! ЛИЧНО!!!<br>РИЭЛТОРАМ НЕ БЕСПОКОИТЬ!!!!!!!!!<br>Уютная двухкомнатная квартира находится по адресу ул Мясниковой д 30 Калининский район. Рядом с улицей Красный проспект. ЖК Северная Корона. Ведущий застройщик ""Стрижи"" От метро Заельцовская на общественном транспорте 32 мин. Остановка общественного транспорта в 5 минутах ходьбы.<br>13-й этаж. Комнаты изолированные. Сделан частично ремонт: ламинат; кафель в туалете и ванной комнате; поставлена сантехника; двери в туалет и ванную. В квартире стоят надёжные металлические входные двери с двумя замками, французские окна, 3 балкона (один закрытый и два открытые). Пол с подогревом. Отличная шумоизоляция! Не слышно ни соседей, ни лифт!!! Прекрасный панорамный вид из окна!<br>Вся территория является закрытой и находится под круглосуточной охраной. По всему комплексу работают камеры видеонаблюдения, вход на территорию осуществляется через контрольно- пропускной пункт.<br>Территория комплекса имеет ландшафтный дизайн<br>с цветочными клумбами, дорожками, озеленением и местами для отдыха. На территории двора расположены современная безопасная детская игровая площадка с разнообразными горками и ковровым прорезиненным покрытием; спортивная площадка с турниками и стадионом!; отдельная зона для выгула собак; парковка для авто. Отапливает дом своя котельная.<br>Так как дом расположен вдали от главных магистралей и заводов города, это обеспечивает чистый воздух и отсутствие пыли и шума. Рядом находится всё необходимое для комфортной жизни: лесная зона; несколько скверов и 2 озера; ТЦ Голден Парк, ТЦ Кристалл, Пятёрочка, Ярче, Магнит, Лента, Леруа Мерлен; аптеки и поликлиника; салоны красоты и фитнес-залы; 3 школы и 5 детских садов! Есть и своя школа от Стрижей. Она новая и просто шикарная!!! Там бесплатное обучение. В этом году первый набор учеников!",48 м²,,,,,648.0,13/13,48 м²,48.0,13,20,2662304757,Sale,/2-komnatnaya-kvartira-na-prodazhu-novosibirsk-2662304757,,3 800 000 ₽,79 167 ₽ за м²,79167,3800000,Apartment,2020-06-24T00:19:58.941684Z,78,Listing,2,2,2020-12-24T05:40:37.282103+03:00,1933048607,2020-06-23T19:07:07.111025+03:00,2020-11-24T05:40:37.282103+03:00,,,,,"2-комн. квартира, 48 м², 13/13 эт.",2020-11-24T02:49:40.853658Z
"Новосибирск, улица Марата, 2",22053818,"Агентство недвижимости""Жилищный вопрос""",Resale,3285,2020-11-25T06:59:42.192652Z,"Продам 1 комнатную квартиру в новом доме . Общая площадь квартиры 46+14 квадратов лоджия. В квартире имеется дополнительная комната 4,4 кв. Рассмотрим как чистую продажу, так и варианты обмена. Квартира находится в очень хорошем месте Центр Первомайского района . В хорошем состоянии , красивая и просторная лоджия . Вся инфраструктура в шаговой доступности ШКОЛА , ДЕТСКИЙ САД , ПОЛИКЛИНИКА ДЕТСКАЯ ,ВЗРОСЛАЯ ,МАГАЗИНЫ , ТРАНСПАРТ , ПАРК .Рядом река ИНЯ.",60 м²,,,,,657.0,2/18,60 м²,60.0,2,12,3030799444,Sale,/1-komnatnaya-kvartira-na-prodazhu-novosibirsk-3030799444,,3 800 000 ₽,63 333 ₽ за м²,63333,3800000,Apartment,2020-11-25T06:59:42.192652Z,78,Listing,1,1,2020-12-25T09:50:40.734694+03:00,2040578971,2020-11-25T08:45:52.783662+03:00,2020-11-25T09:50:40.734694+03:00,,,,,"1-комн. квартира, 60 м², 2/18 эт.",2020-11-25T06:59:43.1439Z
