address,agencyId,agencyName,apartmentSaleType,cityId,createdAt,description,details,developmentId,developmentName,developmentParentId,developmentParentName,districtId,floor,floorArea,floorAreaCalculated,floorInt,galleryImagesCount,id,itemType,itemUrl,metroId,price,pricePerArea,pricePerAreaValue,priceValue,propertyType,publishDate,regionId,resultType,rooms,roomsOrdinal,sourceFinishTime,sourceId,sourceStartTime,sourceUpdateTime,station_distance,station_id,station_lineColors,station_name,title,updatedAt
"Новосибирск, улица Котовского, 33",23367994,Компания «ЭТАЖИ»,Resale,3285,2020-11-25T02:30:32.218658Z,"Продается очень уютная 1 к квартира на 1 этаже кирпичного дома.<br>Окна все выходят за дом, на черемуху. Очень тихое место, нет машин под окном. Квартира очень теплая и солнечная. <br>1 этаж достаточно высокий.<br>Квартира не торцевая, в среднем подъезде. Соседи все очень хорошие и дружелюбные. <br>Рядом вся необходимая инфраструктура, школы, сады, магазины. Очень удобная транспортная развязка -легко уехать в любую точку города.<br>Звоните! Покажем в любое время!. Номер в базе: 4960047. Район: Ленинский.",31 м²,,,,,654.0,1/5,31 м²,31.0,1,20,3030437514,Sale,/1-komnatnaya-kvartira-na-prodazhu-novosibirsk-3030437514,267.0,2 590 000 ₽,83 548 ₽ за м²,83548,2590000,Apartment,2020-11-25T02:30:32.218658Z,78,Listing,1,1.0,2020-12-25T05:21:30.98568+03:00,2040264500,2020-11-25T05:21:02.523605+03:00,2020-12-07T10:06:52.228+03:00,1.89,267.0,#FF0000,Площадь Маркса,"1-комн. квартира, 31 м², 1/5 эт.",2020-12-07T07:16:29.791178Z
"Новосибирск, Междуреченская улица, 1",23367994,Компания «ЭТАЖИ»,Resale,3285,2020-07-28T06:19:41.697801Z,"К покупке предлагается полноценная 1-комнатная квартира с ремонтом ""под ключ"". Дом находится в комфортном для проживания новом ЖК Аквамарин. Из просторной лоджии 7,5 м.кв. открывается прекрасный вид на реку. Восточная сторона. Дом находится в Ленинском районе в 15 минутной доступности до Площади Ленина и Карла Маркса. Есть своя набережная, зона отдыха для прогулок и спорта. На первом этаже большое продуктовый магазин. Во дворе дома построен детский сад. Строится школа. Вблизи хорошая транспортная развязка на Димитровский мост. Вблизи Аквапарк «Аквамир». Остановка автобуса рядом.<br>Приглашаем на просмотр. Номер в базе: 4072940. Район: Ленинский.",38.4 м²,,,,,654.0,13/17,38.4 м²,38.4,13,17,2746463446,Sale,/1-komnatnaya-kvartira-na-prodazhu-novosibirsk-2746463446,268.0,2 300 000 ₽,59 896 ₽ за м²,59896,2300000,Apartment,2020-07-28T06:19:41.697801Z,78,Listing,1,1.0,2020-12-25T13:06:31.5692+03:00,1976759761,2020-07-28T09:09:55.265695+03:00,2020-11-28T13:17:10.299559+03:00,2.757,268.0,#008000,Площадь Гарина-Михайловского,"1-комн. квартира, 38.4 м², 13/17 эт.",2020-11-28T10:26:53.421095Z
"Новосибирск, Междуреченская улица, 1",23367994,Компания «ЭТАЖИ»,Resale,3285,2020-07-28T06:25:27.045512Z,"К покупке предлагается полноценная 2-комнатная квартира с ремонтом ""под ключ"". Дом находится в комфортном для проживания новом ЖК Аквамарин. Из просторной лоджии 7,5 м.кв. открывается прекрасный вид на реку. Дом находится в Ленинском районе в 15 минутной доступности до Площади Ленина и Карла Маркса. Есть своя набережная, зона отдыха для прогулок и спорта. На первом этаже есть продуктовый магазин. Во дворе дома построен детский сад. Строится школа. Вблизи хорошая транспортная развязка на Димитровский мост. Вблизи Аквапарк «Аквамир». Остановка автобуса рядом. Приглашаем на просмотр. Номер в базе: 4161118. Район: Ленинский.",66 м²,,,,,654.0,5/17,66 м²,66.0,5,15,2746485970,Sale,/2-komnatnaya-kvartira-na-prodazhu-novosibirsk-2746485970,268.0,3 350 000 ₽,50 758 ₽ за м²,50758,3350000,Apartment,2020-07-28T06:25:27.045512Z,78,Listing,2,2.0,2020-12-25T13:06:31.619744+03:00,1976662467,2020-07-28T09:09:53.388474+03:00,2020-11-28T13:17:10.198921+03:00,2.757,268.0,#008000,Площадь Гарина-Михайловского,"2-комн. квартира, 66 м², 5/17 эт.",2020-11-28T10:26:54.692306Z
"Новосибирск, улица Красина, 54/1",23367994,Компания «ЭТАЖИ»,Resale,3285,2020-10-26T08:19:53.378099Z,"Выгодное предложение!<br>Продам уютную квартиру с классной планировкой, один из последних вариантов в этом доме.<br>Высокий этаж, окна во двор, закрытая территория.<br>ЖК на стадии сдачи ведется благоустройство. Квартиры на данном объекте дорожают с каждым днем, особенно двухкомнатные. На сегодня это прекрасное вложение средств. Отличное место для проживание или сдачи в аренду.<br>Локацию оценивайте самостоятельно, на мой взгляд она очень не плохая!<br>Возможно переделать в 3 к студию! 51 кв.м ждем на просмотр.. Номер в базе: 4653491. Район: Дзержинский.",51 м²,,,,,651.0,15/17,51 м²,51.0,15,11,2957900011,Sale,/2-komnatnaya-kvartira-na-prodazhu-novosibirsk-2957900011,271.0,2 900 000 ₽,56 863 ₽ за м²,56863,2900000,Apartment,2020-10-26T08:19:53.378099Z,78,Listing,2,2.0,2020-12-25T13:06:32.76811+03:00,2040754112,2020-10-26T11:10:09.362606+03:00,2020-12-07T19:06:47.234087+03:00,0.585,271.0,#008000,Берёзовая роща,"2-комн. квартира, 51 м², 15/17 эт.",2020-12-07T16:16:17.926575Z
"Новосибирская область, Новосибирский район, село Верх-Тула, 1-й квартал, 4",23367994,Компания «ЭТАЖИ»,Resale,3268,2020-11-25T10:15:48.356793Z,"Предлагается в продажу полноценная трехкомнатная квартира в экологически чистом месте с.Верх-тула в 10-ти минутах от города. Дом кирпичный,2-х этажный,чистый подъезд,хорошие соседи,находится в центре села ,школа напротив дома,спорткомплекс и каток на территории школы,через дорогу от дома Поликлиника. Квартира очень тепла,комнаты смежно-изолированные,санузел изолирован.Сделан капитальный ремонт. Так же к квартире есть своё парковочное место и металический гараж ,. Номер в базе: 4839978. Район: Верх-Тула.",63.7 м²,,,,,,2/2,63.7 м²,63.7,2,4,3031406731,Sale,/3-komnatnaya-kvartira-na-prodazhu-verh_tula-3031406731,,2 300 000 ₽,36 107 ₽ за м²,36107,2300000,Apartment,2020-11-25T10:15:48.356793Z,78,Listing,3,3.0,2020-12-25T13:06:38.495744+03:00,2040644542,2020-11-25T13:06:10.102056+03:00,2020-11-25T13:06:38.495744+03:00,,,,,"3-комн. квартира, 63.7 м², 2/2 эт.",2020-11-25T10:16:05.785064Z
"ул. Гурьевская, д. 1, корп. 1",62844843,Агентство недвижимости Калининское,New,3285,2020-10-22T15:26:07.495229Z,"Просторная  3- комнатная квартира <br>в первом доме нового жилого комплекса. Официальный срок сдачи - 4 кв.2021 г. Безупречная репутация застройщика  ООО ЗС ""КМС"" гарантирует своевременный или досрочный ввод объекта в эксплуатацию. Качественная чистовая отделка, высота помещений 2,7 метров, качественные входные двери, приборы учета, бесшумные лифты и помещение для консьержа. Благоустроенная огороженная придомовая территория и подземный паркинг.  Комплекс, расположен недалеко от метро, в шаговой доступности: школы, детские сады, кинотеатры, спортивные клубы, развлекательные центры.  Квартира от подрядчика ПОДХОДИТ ПОД ВСЕ ЛЬГОТНЫЕ ПРОГРАММЫ ИПОТЕЧНОГО КРЕДИТОВАНИЯ ОТ 4,65 %.  Поможем в получении ипотечного решения.",87 м²,1006213401.0,ЖК «Гурьевский»,1006213401.0,ЖК «Гурьевский»,650.0,19/25,87 м²,87.0,19,9,2949306494,Sale,/3-komnatnaya-kvartira-na-prodazhu-novosibirsk-2949306494,272.0,5 867 000 ₽,67 437 ₽ за м²,67437,5867000,Apartment,2020-10-22T15:26:07.495229Z,78,Listing,3,3.0,2020-12-21T18:23:45.025188+03:00,2025859405,2020-10-22T18:15:51.161823+03:00,2020-11-21T18:23:45.025188+03:00,1.458,272.0,#008000,Золотая Нива,"3-комн. квартира, 87 м², 19/25 эт.",2020-11-21T15:33:19.181666Z
"Новосибирская область, Новосибирский район, Станционный сельсовет, посёлок Садовый, Байкальская улица, 11",62844843,Агентство недвижимости Калининское,Resale,3285,2020-10-22T15:29:09.554228Z,"Предлагаем рассмотреть как альтернативу <br>4к квартиры на Родниках, готовый дом под Ключ от Застройщика в Жилом комплексе, в поселке Садовый, 2 км от черты города, от микрорайона Родники. <br>Дом 144 м2, кухня-гостиная 22,6 м2, три спальни <br>16,9м2, 16,5м2, 13,5м2. Два сан.узла. Гараж на 2 машины. Ровный участок, прямоугольной формы. <br>Встроенная мебель: кухонный гарнитур, плита, <br>духовой шкаф, вытяжка и два встроенных шкафа в спальнях на втором этаже, входит в стоимость.<br>Инфраструктура поселка Садовый включает: <br>Школу и школьный автобус, Детский сад «Лучик», <br>Спортивные площадки и культурный центр, Супермаркеты «Магнит» и «Мария Ра», Врачебная Амбулатория и Аптека, Опорный пункт полиции и Отделение Почты, Два СТО и Автомойка.<br>Дом построен из качественных материалов <br>и по современным инженерным решениям (вся документация прилагается): <br>Фундамент - свайно-ростверковый, прочный <br>и долговечный <br>Стены - автоклавный газобетон сибит, экологически <br>чистый, долговечный материал <br>Перекрытия - железобетонные плиты, придают <br>надежность дому <br>Крыша металлочерепица Супермонтерей, срок <br>службы 50 лет <br>Фасад профессиональная штукатурка и краска <br>Монтерио <br>Теплый пол полимерные трубы Royal Thermo PE-RT, <br>с антидиффузионным слоем, срок службы до 45 лет! <br>Окна система Премиум-класса 4LifeGlass, срок <br>службы 40 лет!<br>Рассмотрим варианты вашей квартиры в зачет.",144 м²,,,,,,2/2,144 м²,144.0,2,21,2949317271,Sale,/4-komnatnaya-kvartira-na-prodazhu-novosibirsk-2949317271,,6 300 000 ₽,43 750 ₽ за м²,43750,6300000,Apartment,2020-10-22T15:29:09.554228Z,78,Listing,4,4.0,2020-12-21T18:23:54.096377+03:00,2025410851,2020-10-22T18:15:30.681783+03:00,2020-11-21T18:23:54.096377+03:00,,,,,"4-комн. квартира, 144 м², 2/2 эт.",2020-11-21T15:33:16.17517Z
"Барабинск, Новосибирская область, Советская улица, 112",118009494,Алексей,Resale,3266,2019-09-15T12:58:49.071582Z,"благоустроенная  квартира 2-ой этаж  пластиковые окна ,металлическая дверь.<br>очень теплая не угловая , большая кухня 17.7 кв/м.",37.4 м²,,,,,,2/3,37.4 м²,37.4,2,8,1814429074,Sale,/2-komnatnaya-kvartira-na-prodazhu-barabinsk-1814429074,,1 200 000 ₽,32 086 ₽ за м²,32086,1200000,Apartment,2019-09-15T12:58:49.071582Z,78,Listing,2,2.0,2020-12-28T16:06:38.67053+03:00,1359401630,2018-08-04T17:57:43+03:00,2020-11-28T16:06:38.67053+03:00,,,,,"2-комн. квартира, 37.4 м², 2/3 эт.",2020-11-28T13:15:43.159587Z
"ул. Серафимовича, стр. 8",7452828,Дмитрий,New,3285,2019-03-09T05:01:01.455892Z,"Прямая уступка прав по ДДУ, зарегистрирован на физическое лицо. Агентских комиссий нет. Дом комфорт класса. Конструктив дома - классическая кирпичная кладка. Внешние стены толщиной 80 см .Балконы с кирпичным ограждением с полным остеклением. Отделка квартиры чистовая с установкой розеток, выключателей, радиаторы биметалл, разводка вертикальная. Установлены пластиковые окна, откосы, подоконники. Коммуникационные выводы без установки сантехнических приборов. Двери металлические полимер. Дом расположен в центре Ленинского района в десяти минутах ходьбы от метро, рядом школы и детские сады, много магазинов и ТРЦ. Сдача 4-кв. 2020 г.<br> Просьба -не переспрашивать про то, что уже написано в объявлении. Заинтересованным - пишите в Вотсап.",53 м²,71488.0,ЖК на ул. Серафимовича,71488.0,ЖК на ул. Серафимовича,654.0,4/9,53 м²,53.0,4,8,1109943391,Sale,/1-komnatnaya-kvartira-na-prodazhu-novosibirsk-1109943391,267.0,5 300 000 ₽,100 000 ₽ за м²,100000,5300000,Apartment,2019-03-09T05:01:01.455892Z,78,Listing,1,1.0,2020-12-24T14:54:25.256644+03:00,1390480367,2019-03-09T07:50:33.931364+03:00,2020-11-26T15:57:35.341433+03:00,0.861,267.0,#FF0000,Площадь Маркса,"1-комн. квартира, 53 м², 4/9 эт.",2020-11-26T13:06:35.566125Z
"ул. Костычева, д. 74/1",77735449,Георгий,New,3285,2020-06-22T01:15:36.527582Z,"Продаю квартиру в отличном состоянии по ул Костычева 74/1 ,жили в нем всего пол года.Свежий качественный ремонт со вкусом.Развитая инфраструктура,в шаговой доступности школы садики остановки и любые магазины.Полностью меблированная .Балкон застеклен и сделан ремонт.<br>Все что на фотографии,(мебель техника)все остаётся покупателю.",74 м²,22945.0,ЖК «Театральный»,22945.0,ЖК «Театральный»,655.0,15/17,74 м²,74.0,15,13,2657991147,Sale,/2-komnatnaya-kvartira-na-prodazhu-novosibirsk-2657991147,267.0,6 800 000 ₽,91 892 ₽ за м²,91892,6800000,Apartment,2020-06-22T01:15:36.527582Z,78,Listing,2,2.0,2020-12-24T07:37:26.794758+03:00,1943746889,2020-06-21T04:50:19.94681+03:00,2020-11-24T07:37:26.794758+03:00,1.72,267.0,#FF0000,Площадь Маркса,"2-комн. квартира, 74 м², 15/17 эт.",2020-11-24T04:46:31.04325Z
"Новосибирск, 1-я Чулымская улица, 122",61734665,Агентство недвижимости «НИАН»,Resale,3285,2020-10-29T03:23:18.753714Z,"«Венеция» представляет собой современный жилой комплекс, построенный с помощью новейших  передовых технологий в строительстве. Новостройка находится в Ленинском  районе, на берегу реки Обь. В шаговой доступности  детский сад, школа, а также такие   торговые комплексы, как «Лента», «Леруа Мерлен» и «Гигант». Недалеко от жилого комплекса  аквапарк. До остановоки 5 минут.Дом сдан, выдают ключи. Квртира 3х-ком полноценная,   кухня м2, большая лоджия 7,4м2   В наших квартирах: Возведены межкомнатные перегородки Произведена разводка электричества по квартире Установлены розетки и выключатели Установлены окна с откосами и подоконной доской Выполнено остекление лоджии Сделана стяжка пола В квартиру заведены трубы горячей и холодной воды, канализация, установлены заглушки",85.8 м²,,,,,654.0,9/17,85.8 м²,85.8,9,0,2965705925,Sale,/3-komnatnaya-kvartira-na-prodazhu-novosibirsk-2965705925,268.0,5 202 000 ₽,60 629 ₽ за м²,60629,5202000,Apartment,2020-10-29T03:23:18.753714Z,78,Listing,3,3.0,2020-12-28T07:23:58.986578+03:00,2023484428,2020-10-29T06:13:53.594342+03:00,2020-11-28T07:23:58.986578+03:00,2.607,268.0,#008000,Площадь Гарина-Михайловского,"3-комн. квартира, 85.8 м², 9/17 эт.",2020-11-28T04:33:02.71107Z
"Новосибирск, Большевистская улица, 128",16480856,Ирина,Resale,3285,2020-09-11T05:32:44.99632Z,"ВЫГОДНО в ""ЕВРОПЕЙСКОМ БЕРЕГЕ""<br>Продаю 2 комнатную квартиру в современном микрорайоне ЖК ""Европейский берег""<br>Большие светлые комнаты: 20 м.кв. 12 м.кв. Кухня 10 кв.м. Большой квадратный коридор. Два сан узла облицованы кафелем. Лоджия на две комнаты.<br>Ремонт оформлен в светло-пастельных тонах.<br>Рядом — гипермаркет «Лента», детские сады, школа, поликлиника, почта. Во дворе строиться еще одна школа.  <br>Цена ниже, чем у застройщика на аналогичную квартиру со сроком сдачи в 2023 год.<br>Один собственник. в квартире никто не прописан.<br>Расставь красивую мебель. Живи и радуйся.",60 м²,,,,,650.0,2/10,60 м²,60.0,2,8,2854204833,Sale,/2-komnatnaya-kvartira-na-prodazhu-novosibirsk-2854204833,265.0,5 780 000 ₽,96 333 ₽ за м²,96333,5780000,Apartment,2020-09-11T05:32:44.99632Z,78,Listing,2,2.0,2020-12-24T15:05:19.45056+03:00,2006450137,2020-09-11T08:22:03.436544+03:00,2020-11-26T15:21:36.896274+03:00,3.201,265.0,#FF0000,Речной вокзал,"2-комн. квартира, 60 м², 2/10 эт.",2020-11-26T12:31:04.549503Z
"Новосибирск, улица Владимира Высоцкого, 39/3",182684196,Перспектива 54,Resale,3285,2020-08-30T18:51:19.919207Z,"Продам прекрасную, а главное просторную 4х комнатную квартиру .Квартира  теплая , высокая ,просторная ,очень вместительная ,с 2 балконами. Ждёт своих новых владельцев .",80 м²,,,,,650.0,8/9,80 м²,80.0,8,20,2827753550,Sale,/4-komnatnaya-kvartira-na-prodazhu-novosibirsk-2827753550,272.0,3 900 000 ₽,48 750 ₽ за м²,48750,3900000,Apartment,2020-08-30T18:51:19.919207Z,78,Listing,4,4.0,2021-01-01T19:42:56.287562+03:00,1985956814,2020-08-30T21:41:56.783321+03:00,2020-12-02T19:42:56.287562+03:00,3.074,272.0,#008000,Золотая Нива,"4-комн. квартира, 80 м², 8/9 эт.",2020-12-02T16:52:50.68679Z
"Новосибирск, проспект Дзержинского, 32А",152810530,Центральное агентство недвижимости,Resale,3285,2020-11-24T12:20:52.003307Z,"Студия в сданном доме, ключи получены, можно заходить на ремонт.<br>Площадь студии 27.9м2  плюс лоджия 4,12м2. Этаж средний, красивый вид на город, квартира под самоотделку: стяжка по плитам перекрытия под устройство полов, пластиковые окна, разводка системы отопления с установкой приборов отопления и контроля, электротехническая разводка, лоджия без остекления. Любимая возможность сделать ремонт только по своему вкусу, не переплачивая за чужой.<br>Отличное место расположения, дом находится внутри квартала, т.е чисто, тихо, вся инфраструктура, магазины, школы и дет.сады, остановка общественного транспорта. парк Березовая роща.<br>При звонке, пожалуйста, назовите номер объявления - 115 386<br>Консультируем подробно по телефону.",27.9 м²,,,,,651.0,6/19,27.9 м²,27.9,6,7,3029279939,Sale,/kvartira-na-prodazhu-novosibirsk-3029279939,272.0,2 250 000 ₽,80 645 ₽ за м²,80645,2250000,Apartment,2020-11-24T12:20:52.003307Z,78,Listing,Студия,,2020-12-24T15:11:48.54578+03:00,2016240268,2020-11-24T15:11:22.117815+03:00,2020-12-07T05:32:41.473784+03:00,2.277,272.0,#008000,Золотая Нива,"Квартира-студия, 27.9 м², 6/19 эт.",2020-12-07T02:42:12.29478Z
"Новосибирская область, Татарск, улица Пушкина, 1А",21728143,Денис,Resale,3281,2020-11-29T17:26:19.630148Z,"Продам или обменяю на 2-х, 3-х комнатную квартиру. Квартира после ремонта. Все вопросы по телефону. Приезжайте смотрите. Торг",30 м²,,,,,,3/6,30 м²,30.0,3,7,3040846308,Sale,/1-komnatnaya-kvartira-na-prodazhu-tatarsk-3040846308,,800 000 ₽,26 667 ₽ за м²,26667,800000,Apartment,2020-11-29T17:26:19.630148Z,78,Listing,1,1.0,2020-12-29T20:17:17.109644+03:00,2029814095,2020-11-29T19:36:54.646446+03:00,2020-11-29T20:17:17.109644+03:00,,,,,"1-комн. квартира, 30 м², 3/6 эт.",2020-11-29T17:26:23.546997Z
