address,agencyId,agencyName,apartmentSaleType,cityId,createdAt,description,details,developmentId,developmentName,developmentParentId,developmentParentName,districtId,floor,floorArea,floorAreaCalculated,floorInt,galleryImagesCount,id,itemType,itemUrl,metroId,price,pricePerArea,pricePerAreaValue,priceValue,propertyType,publishDate,regionId,resultType,rooms,roomsOrdinal,sourceFinishTime,sourceId,sourceStartTime,sourceUpdateTime,station_distance,station_id,station_lineColors,station_name,title,updatedAt
"Новосибирск, Советский район, микрорайон Академгородок, Полевая улица, 9",152810530,Центральное агентство недвижимости,Resale,3285,2020-11-24T12:40:08.835557Z,"В продаже просторная 3- комнатная квартира в самом востребованном месте Нижней зоны Академгородка. <br>Квартира в очень хорошем состоянии. <br> Окна на две стороны.<br>Вся инфраструктура в шаговой доступности: гимназия  Горностай , бассейн, Технопарк, детские сады, поликлиники детская и взрослая, аптеки, ТРЦ  Эдем , рынок , продовольственные магазины конечная остановка общественного транспорта по всем направлениям города Новосибирска и Бердска.<br>Возможен обмен на 3ч ком. квартиру ВЗ.<br>При звонке, пожалуйста, назовите номер объявления - 115 202<br>Консультируем подробно по телефону.",62.5 м²,,,,,656.0,3/9,62.5 м²,62.5,3,8,3029340349,Sale,/3-komnatnaya-kvartira-na-prodazhu-novosibirsk-3029340349,,5 190 000 ₽,83 040 ₽ за м²,83040,5190000,Apartment,2020-11-24T12:40:08.835557Z,78,Listing,3,3.0,2020-12-24T15:31:04.392803+03:00,2016059181,2020-11-24T15:30:20.400899+03:00,2020-12-09T05:19:46.623654+03:00,,,,,"3-комн. квартира, 62.5 м², 3/9 эт.",2020-12-09T02:29:17.135622Z
"Новосибирск, улица Одоевского, 1/8",152810530,Центральное агентство недвижимости,Resale,3285,2020-10-20T02:38:46.758482Z,"В продаже эксклюзивный вариант четырёхкомнатной квартиры на ЖМ Берёзовое с индивидуальной планировкой. Ремонт на 11 баллов из 10 возможных. Шикарный вид на две стороны. Отсечка на одну квартиру, так что площади добавляется бонусных 6 метров. Плюс индивидуальная кладовка на этаже 4 метра. Так же бонусом покупателю оставляем большую часть мебели, зеркала, кондиционер. Квартира под противопожарной и противоугонной сигнализацией. Тёплые полы по всей квартире. В шаговой доступности проще написать чего нет, чем рассказать о том, что есть. В общем есть всё! И даже озеро. Про остальные особенности и достоинства расскажем на просмотре.<br>Подходит под любые виды расчета.<br>Помощь в получении ипотечного решения. Процентная ставка с Центральным агентством ниже.<br>При звонке, пожалуйста, назовите номер объявления - 115 097<br>Консультируем подробно по телефону.",114.7 м²,,,,,657.0,17/17,114.7 м²,114.7,17,27,2942515158,Sale,/4-komnatnaya-kvartira-na-prodazhu-novosibirsk-2942515158,,5 500 000 ₽,47 951 ₽ за м²,47951,5500000,Apartment,2020-10-20T02:38:46.758482Z,78,Listing,4,4.0,2020-12-24T15:31:10.698965+03:00,2016418856,2020-10-20T05:29:18.233261+03:00,2020-12-07T05:23:51.106722+03:00,,,,,"4-комн. квартира, 114.7 м², 17/17 эт.",2020-12-07T02:34:04.435643Z
"Новосибирская область, Бердск, Лунная улица, 30",28578485,"""Модуль С""",Resale,3279,2020-10-27T10:29:37.179034Z,"Продается квартира светлая, теплая с хорошим ремонтом. Один собственник.",42 м²,,,,,,3/4,42 м²,42.0,3,8,2960950993,Sale,/1-komnatnaya-kvartira-na-prodazhu-berdsk-2960950993,,2 100 000 ₽,50 000 ₽ за м²,50000,2100000,Apartment,2020-10-27T10:29:37.179034Z,78,Listing,1,1.0,2020-12-27T14:40:01.990756+03:00,2035469024,2020-10-27T13:20:11.984684+03:00,2020-11-27T14:40:01.990756+03:00,,,,,"1-комн. квартира, 42 м², 3/4 эт.",2020-11-27T11:49:10.186059Z
"Новосибирская область, Новосибирский район, Станционный сельсовет, посёлок Садовый, Каспийская улица, 1",62844843,Агентство недвижимости Калининское,Resale,3285,2020-09-25T05:01:38.178926Z,"Жилой комплекс «Приозёрный» — это современное <br>пространство для жизни. Развитая инфраструктура, благоустроенные дворы без машин, просторные прогулочные и игровые зоны. <br>Квартиры улучшенной планировки с отделкой <br>«под ключ»! Получим кредитное решение БЕСПЛАТНО!",43.1 м²,,,,,648.0,10/19,43.1 м²,43.1,10,2,2887386006,Sale,/1-komnatnaya-kvartira-na-prodazhu-novosibirsk-2887386006,,3 400 000 ₽,78 886 ₽ за м²,78886,3400000,Apartment,2020-09-25T05:01:38.178926Z,78,Listing,1,1.0,2020-12-24T08:18:45.293909+03:00,1993573757,2020-09-25T07:52:17.815666+03:00,2020-11-24T08:18:45.293909+03:00,,,,,"1-комн. квартира, 43.1 м², 10/19 эт.",2020-11-24T05:27:49.345217Z
"Новосибирск, улица Владимира Высоцкого, 40/2",30653976,Перспектива24-Новосибирск,Resale,3285,2020-11-24T05:28:41.700702Z,"К продаже предлагается трехкомнатная квартира студия общей площадью 63,5м2,<br>Объект находится в районе с развитой инфраструктурой. Магазины, школы, детские сады- все в шаговой доступности.<br>Интеллигентные соседи.<br>Один взрослый собственник.<br>Любой вид расчета.<br>Объект №74222",63.5 м²,,,,,650.0,8/10,63.5 м²,63.5,8,18,3028219474,Sale,/3-komnatnaya-kvartira-na-prodazhu-novosibirsk-3028219474,272.0,3 900 000 ₽,61 417 ₽ за м²,61417,3900000,Apartment,2020-11-24T05:28:41.700702Z,78,Listing,3,3.0,2020-12-24T08:19:40.409495+03:00,2038656049,2020-11-24T08:19:17.012604+03:00,2020-11-24T08:19:40.409495+03:00,3.176,272.0,#008000,Золотая Нива,"3-комн. квартира, 63.5 м², 8/10 эт.",2020-11-24T05:28:43.89543Z
"Новосибирск, улица Владимира Высоцкого, 41/2",21206492,Яна,Resale,3285,2020-09-21T02:20:00.125137Z,"Отличная 1- комнатная квартира на среднем этаже с хорошим ремонтом ,с остекленным балконом , частично с мебелью,Остаётся -кухонный гарнитур ,духовка,стеклокерамическая плита,шкаф-купе в зале,встроенный шкаф -купе в коридоре,Лифт работает. Показы по договоренности. Подходит под все виды расчета.<br>Выгодное расположение - близко к автобусной остановке, в шаговой доступности действующая школа 199 ,детские сады( д/с Кораблик во дворе),магазины.. Очень перспективный район – рядом озеро, природа, отличная экология. <br>Агентства прошу беспокоить только с потенциальным клиентом,на договор не приглашать,если объявление видите,значит актуально.<br>Чистая продажа,обременений нет,документы готовы.<br>Звоните прямо сейчас.",34 м²,,,,,650.0,5/10,34 м²,34.0,5,15,2877580652,Sale,/1-komnatnaya-kvartira-na-prodazhu-novosibirsk-2877580652,272.0,2 660 000 ₽,78 235 ₽ за м²,78235,2660000,Apartment,2020-09-21T02:20:00.125137Z,78,Listing,1,1.0,2020-12-23T04:16:09.542058+03:00,2010512423,2020-09-21T05:10:32.185035+03:00,2020-11-23T04:16:09.542058+03:00,3.236,272.0,#008000,Золотая Нива,"1-комн. квартира, 34 м², 5/10 эт.",2020-11-23T01:25:16.791034Z
"Новосибирская область, Бердск, Советская улица, 85",28578485,"""Модуль С""",Resale,3279,2020-08-19T06:30:27.29954Z,Продается квартира в хорошем состоянии. В санузле- кафель.,45 м²,,,,,,4/5,45 м²,45.0,4,9,2799075629,Sale,/2-komnatnaya-kvartira-na-prodazhu-berdsk-2799075629,,2 150 000 ₽,47 778 ₽ за м²,47778,2150000,Apartment,2020-08-19T06:30:27.29954Z,78,Listing,2,2.0,2020-12-27T14:46:21.021472+03:00,1970997417,2020-08-19T09:21:05.398325+03:00,2020-11-27T14:46:21.021472+03:00,,,,,"2-комн. квартира, 45 м², 4/5 эт.",2020-11-27T11:56:11.057727Z
Кирова 336,130118711,Владислав,Resale,3285,2019-02-05T20:11:36.128436Z,"Жк ключевой, расположенный в Октябрьском районе рядом с Инюшенским парком. Малоэтажная застройка. Территория находится под круглосуточной охраной, имеется огромная парковка. Индивидуальная система отопления и горячего водоснабжения от газового котла. Наличие внутреннего двора, живые насаждения, прогулочные зоны, мощеные дорожки, детские и спортивные площадки, уличные тренажёры, есть также пруд с фонтаном, территория обслуживается, поэтому здесь всегда чисто и убрано. <br>Окна квартиры выходят на две стороны. Была сделана перепланировка, расширили кухню и санузел. В квартире жили меньше года, качественный ремонт с мебелью. Отличное место для семьи. В жилом комплексе есть частный детский сад, также в двух минутах магазин Ярче. На парковке всегда имеются парковочные места. До остановки минут 7 пешком.",99.1 м²,,,,,650.0,4/4,99.1 м²,99.1,4,18,210877134,Sale,/3-komnatnaya-kvartira-na-prodazhu-novosibirsk-210877134,265.0,7 900 000 ₽,79 717 ₽ за м²,79717,7900000,Apartment,2019-02-05T20:11:36.128436Z,78,Listing,3,3.0,2020-12-23T04:21:27.742416+03:00,1342148600,2018-02-12T09:11:35+03:00,2020-11-23T04:21:27.742416+03:00,4.707,265.0,#FF0000,Речной вокзал,"3-комн. квартира, 99.1 м², 4/4 эт.",2020-11-23T01:30:45.356199Z
"ул. Краузе, стр. 5",173701179,Макромир,New,3285,2020-09-22T02:11:40.212925Z,"Описание жилого комплекса<br>Жилой Комплекс «Онега» располагается в микрорайоне Родники. Эта часть Калининского района находится недалеко от одноименной площади и станции метро «Заельцовская». Дорога на автомобиле через Красный проспект займет 20 минут, через ул. Богдана Хмельницкого — около 25-30.<br>Рядом с жилым комплексом есть остановки общественного транспорта. Автобусы и маршрутные такси ходят как по самим «Родникам», так и связывают этот район с центром Новосибирска. На автобусе или маршрутке дорога до метро «Заельцовская» займет 30-40 минут, в час пик время в пути может доходить до 50 минут. До станции электропоездов «Иня-Восточная» можно добраться за 20 минут.<br>Район обладает развитой инфраструктурой. В шаговой доступности от «Онеги» — сразу 8 детских садов, общеобразовательные школы № 51 и № 211, которая, кстати, признана лучшей за Уралом. В новой поликлинике № 29 достаточно мест, чтобы без задержек и очередей принимать взрослых и совсем юных пациентов.<br>Нет недостатка и в спортивных объектах: рядом с ЖК работает спортивный фехтовальный центр и бассейн, а в 15 минутах ходьбы от «Онеги» есть ледовая арена «Родник», где функционируют секции хоккея и фигурного катания.<br>Помимо небольших продуктовых магазинов, расположенных в 5 минутах от ЖК, недоалеко есть ТЦ «Лента» и «Леруа Мерлен», а также два торгово-развлекательных центра: «Голден парк» и «Кристалл», где можно приятно провести время. Чуть дальше расположен «НордМолл», дорога до него займет минут 20-30.<br>Недалеко от жилого комплекса «Онега» есть сразу два озера, территория вокруг которых благоустроена, в районе много зелени и прогулочных зон.<br>Жилой комплекс «Онега» состоит из 4 домов, построенных по кирпично-монолитной технологии. В двух домах по 9 этажей, еще в двух — по 10, на каждом этаже расположено от 2 до 6 квартир. Всего в жилом комплексе 154 жилых помещения, а у 2 из 4 домов ЖК — скошенные крыши мансардного типа.<br>Фасады зданий оформлены в стиле современной классики: первые этажи декорированы темным кирпичом, верхние — светлыми отделочными материалами. Балконы и окна гармонично вписываются в общий дизайн ЖК.<br>Застройщик называет планировочные решения «Онеги» уникальными. В жилом комплексе есть 1, 2, 3 и 4-комнатные квартиры площадью от 31 до 111 м2. В большинстве квартир, за исключением однокомнатных, проектом предусмотрены компактные, но вместительные гардеробные, а в 3 и 4-комнатных квартирах расположено по 2 санузла. На последних этажах помимо обычных 3-комнатных студий находятся двухуровневые квартиры с высокими — по 5.05 м — потолками и окнами в пол.<br>Во всех квартирах выполнена горизонтальная разводка коммуникаций и установлены современные алюминиевые радиаторы отопления: они занимают немного места, но эффективно поддерживают необходимую температуру в здании.<br>Территория жилого комплекса полностью благоустроена. Здесь есть игровые площадки для совсем маленьких детей и ребят школьного возраста, отдельная площадка для выгула собак, спортивная и прогулочная зоны. По территории проложены пешеходные дорожки, есть специальные пандусы для маломобильных граждан.<br>Парковка наземная, рассчитана на 94 автомобиля.<br>Ответственность застройщика застрахована по закону 214-ФЗ.<br>Онега - жилой комплекс, созданный по канонам настоящего искусства.<br>Традиции застройки северных русских деревень, формы, линии и цвета, воплощенные современными технологиями строительства. Кирпич оттенков состаренного дерева, красное окно, скатные кровли в архитектуре домов; камень, мох, дерево, палисадники в благоустройстве двора - культурный код считывается бессознательно, возвращая к наследной памяти и создавая уникальную атмосферу уюта, творчества и русского добрососедств. В Онеге не будет заборов, ведь безопасность будет обеспечена множеством камер с системой распознавания лиц.<br>В рейтинге Единого Ресурса Застройщиков ЖК ""Онега"" с оценкой «5 звёзд» занимает 5 место в ТОП жилых комплексов Новосибирска, что подтверждает высший уровень качества.<br>Расположение Онеги в зелёной зоне бурно развивающихся Родников превращает комплекс в то самое заповедное место, город в городе, из которого можно не выезжать. Здесь есть всё для того, чтобы творить, растить детей, строить бизнес и строить свою счастливую жизнь.<br>I очередь<br>Сроки строительства I квартал 2019 – II квартал 2020<br>1,2,3,4 дом<br>9-10 этажей<br>2-6 квартир на этажей, 154 квартиры<br>II очередь<br>Сроки строительства III квартал 2019 – III квартал 2021<br>10 домов<br>9-13 этажей<br>2-6 квартир на этаже , 785 квартир<br>Способы покупки:<br>Ипотека От 1% годовых<br>По 2 документам<br>Trade-In<br>Квартира в зачет новой<br>Наличный расчет<br>Скидки<br>Материнский капитал<br>В качестве первого взноса<br>Дистанционная покупка<br>Экономия денег и времени<br>Рассрочка от застройщика",23.2 м²,1003935880.0,ЖК «Онега»,1003935880.0,ЖК «Онега»,648.0,4/7,23.2 м²,23.2,4,18,2880001061,Sale,/kvartira-na-prodazhu-novosibirsk-2880001061,,2 379 777 ₽,102 577 ₽ за м²,102577,2379777,Apartment,2020-09-22T02:11:40.212925Z,78,Listing,Студия,,2020-12-26T05:58:41.176026+03:00,2009095392,2020-09-22T05:02:13.862647+03:00,2020-11-26T05:58:41.176026+03:00,,,,,"Квартира-студия, 23.2 м², 4/7 эт.",2020-11-26T03:07:49.360277Z
