address,agencyId,agencyName,apartmentSaleType,cityId,createdAt,description,details,developmentId,developmentName,developmentParentId,developmentParentName,districtId,floor,floorArea,floorAreaCalculated,floorInt,galleryImagesCount,id,itemType,itemUrl,metroId,price,pricePerArea,pricePerAreaValue,priceValue,propertyType,publishDate,regionId,resultType,rooms,roomsOrdinal,sourceFinishTime,sourceId,sourceStartTime,sourceUpdateTime,station_distance,station_id,station_lineColors,station_name,title,updatedAt
"ул. Романтиков, д. 10",173701179,Макромир,New,3285,2020-09-14T12:34:53.040599Z,"Дивногорский – один из самых динамично растущих микрорайонов Новосибирска.<br>Такую оценку дают эксперты по строительству и эксплуатации жилья, а рейтинговые агентства ставят «Дивногорский» в ТОП-10 застройщиков Новосибирской области.<br>Так, по итогам 2019 года Компания-застройщик Дивногорского микрорайона занимает «4» место среди лидеров строительного рынка НСО по объемам ввода жилья в эксплуатацию*.<br>Да, мы еще раз подтверждаемперед своими покупателями репутацию надежного Застройщика, ведь все дома сдаем точно в срок и даже с опережением.Именно поэтому, приобретая квартиру в «Дивногорском», вы обеспечиваете себе и своим близким спокойствие и уверенность в завтрашнем дне.<br>В продаже студия с двумя окнами в кирпичном доме.<br>Дом классической кирпичной кладки, сдан в 2019 году.<br>В квартире выполнена чистовая отделка, лоджия застеклена.<br>На территории микрорайона работает новый детский сад, так же расположено много современных детских площадок для детей различного возраста.<br>Строительные технологии комфорта:<br>-Кирпичные дома<br>-Подъезды и холлы<br>-Улучшенная звукоизоляция<br>-Вместительные лифты<br>-Остекление лоджий<br>-Газовая котельная<br>Площадки для спорта и игр:<br>-Безопасные детские и игровые площадки<br>-Площадки для футбола и баскетбола<br>-Ледовый каток и хоккейная коробка Парковки и проезды:<br>-Просторные парковочные места для жителей и гостей микрорайона<br>-Широкие проезды для автомобилей и служебного транспорта Благоустройство<br>-Вечернее освещение<br>-Асфальтированные дорожки<br>-Скамейки и качели<br>-Озелененная территория<br>-Удобное расположение и инфраструктура<br>-Аптеки<br>-Детские сады<br>-Школы<br>-Больницы.<br>Способы покупки:<br>-Наличный расчет<br>-Рассрочка<br>-Ипотека<br>-Использование средств материнского капитала<br>-Использование различных сертификатов<br>-Военная ипотека<br>Цена квартиры под само-отделку от 3 045 000 рублей , при необходимости застройщик сделает для вас ремонт под ключ в течении от 1 месяца, цена за ремонт составит 8 000 рублей за 1 квадратный метр.<br>Есть квартиры с готовым ремонтом, оплачивай и переезжай в день сделки!<br>Звоните и запишитесь на экскурсию до повышения цен!",55 м²,23140.0,Мкр. «Дивногорский»,23140.0,Мкр. «Дивногорский»,654.0,5/9,55 м²,55.0,5,33,2862184374,Sale,/2-komnatnaya-kvartira-na-prodazhu-novosibirsk-2862184374,267.0,3 045 000 ₽,55 364 ₽ за м²,55364,3045000,Apartment,2020-09-14T12:34:53.040599Z,78,Listing,2,2.0,2020-12-23T04:56:49.997605+03:00,2009803552,2020-09-14T15:23:30.762101+03:00,2020-11-23T04:56:49.997605+03:00,,,,,"2-комн. квартира, 55 м², 5/9 эт.",2020-11-23T02:05:54.634773Z
"Новосибирск, Калининский район, микрорайон Снегири, Рассветная улица, 9",62844843,Агентство недвижимости Калининское,Resale,3285,2020-10-22T09:56:50.496778Z,"В продаже 1-комнатная квартира, в которой <br>вы сможете проявить свои дизайнерские способности. Очень удачное расположение дома в трех минутах ходьбы от остановки, торговых центров, магазинов, школы и садика, при этом достаточно далеко от шума главной дороги. Крайний 9 этаж спасет вас от не шумных соседей, ведь выше только тех.этаж. Потолки сухие, протечек не было. Взрослые собственники, отсутствие обременения, чистая продажа, в собственности более 5 лет, препятствия для быстрого выхода на сделку отсутствуют. Приходите! Смотрите! Покупайте! Ждем только Вас!!!",34 м²,,,,,648.0,9/9,34 м²,34.0,9,7,2948450246,Sale,/1-komnatnaya-kvartira-na-prodazhu-novosibirsk-2948450246,,2 300 000 ₽,67 647 ₽ за м²,67647,2300000,Apartment,2020-10-22T09:56:50.496778Z,78,Listing,1,1.0,2020-12-21T13:18:46.947787+03:00,2025026827,2020-10-22T12:47:24.948927+03:00,2020-11-21T13:18:46.947787+03:00,,,,,"1-комн. квартира, 34 м², 9/9 эт.",2020-11-21T10:27:58.876343Z
"ул. Советская, д. 75",94957031,Сибирь Девелопмент,New,3285,2020-10-22T10:49:58.826793Z,"Продаётся роскошный пентхаус на 22 этаже ЖК Prime House в самом центре Новосибирска!<br>Дом сдан! Быстрое оформление и получение ключей!<br>Оцените преимущества этой квартиры:<br>- Общая площадь 139,55 кв.м<br>- Более 90 квадратных метров пространства для свободной планировки<br>- Большая площадь остекления<br>- Панорамные окна немецкого бренда SHUCO <br>- Впечатляющие виды на закаты и восходы, Вознесенский собор, Нарымский сквер, улицы Советская и Сибирская <br>- Потолки высотой 4,3 м<br>- Гардеробная 5 кв.м<br>- 2 санузла<br>ЖК PRIME HOUSE – это респектабельный 23-этажный жилой комплекс премиум-класса, расположенный по адресу ул. Советская, 75.<br>Квартира в ЖК PRIME HOUSE - ваша уникальная возможность жить в современном здании в центре Новосибирска, пользуясь всеми преимуществами большого города. <br>ЖК PRIME HOUSE располагается на площади Кондратюка, в 5 минутах ходьбы до станции метро «Красный проспект» и 10 минутах от площади Ленина.<br>В шаговой доступности от ЖК находятся главные культурные, образовательные и развлекательные заведения Новосибирска, торговые и бизнес-центры. Рядом находятся Нарымский сквер и Центральный парк, площадь Ленина, театры НОВАТ и Красный факел, рестораны, банки и фитнес клубы, ВУЗы, детские сады, школы, лицей №22, гимназии №1 и №4.<br>Своя парковка в центре<br>На территории комплекса расположена крытая гостевая автостоянка на 22 машиноместа, а также двухуровневая подземная автостоянка на 130 машиномест. <br>Сквер у дома<br>Особое украшение жилого комплекса - городской сквер Альгамбра, воссозданный на месте легендарного одноименного исторического сада. Сквер Альгамбра – совместный проект застройщика и мэрии Новосибирска. Здесь можно отдохнуть от суеты большого города в тени деревьев, насладиться видом оригинального ландшафта и полюбоваться на арт-объекты, провести время с семьёй и детьми.<br>Комфортная среда<br>ЖК PRIME HOUSE – это жилая среда премиум-класса, уникальный дизайн интерьеров мест общего пользования и входных групп. Все квартиры в жилом комплексе предполагают свободную планировку. Верхние этажи занимают просторные пентхаусы. <br>Для удобства жителей в доме работают служба ресепшн и круглосуточный консьерж-сервис. <br>Особое преимущество ЖК PRIME HOUSE – исключительные панорамные виды из окон, позволяющие окинуть взглядом весь город. <br>Дом сдан!<br>Продажи осуществляются в офисе продаж застройщика по договору купли-продажи.<br>Ипотека, рассрочка с фиксацией цены, скидки за быстрый полный расчет!*<br>ЖК PRIME HOUSE входит в девелоперское портфолио бренда ""Сибирь Девелопмент"".<br>*Подробности у менеджеров офиса продаж<br>Застройщик ООО ""Квадратный МЭТР""",139.6 м²,85569.0,ЖК «Prime House» (Прайм Хаус),85569.0,ЖК «Prime House» (Прайм Хаус),652.0,22/23,139.6 м²,139.6,22,21,2948624701,Sale,/kvartira-na-prodazhu-novosibirsk-2948624701,262.0,18 839 250 ₽,134 952 ₽ за м²,134952,18839250,Apartment,2020-10-22T10:49:58.826793Z,78,Listing,Своб. планировка,,2020-12-23T05:25:39.60814+03:00,1989004697,2020-10-22T13:39:29.819798+03:00,2020-12-01T12:00:14.296728+03:00,0.462,262.0,#FF0000,Красный проспект,"Квартира своб. планировки, 139.6 м², 22/23 эт.",2020-12-01T09:09:39.759508Z
"Красный пр-т, жилой дом",94957031,Сибирь Девелопмент,New,3285,2019-07-16T06:39:09.93987Z,"Продается двухкомнатная студия в ЖК ""Classic House"".<br>Плюсы этой квартиры:<br>- Просторная прихожая<br>- Большая кухня-гостиная<br>- Французский балкон<br>- Лоджия с панорамным остеклением<br>Жилой комплекс Classic House – это 25-этажный дом бизнес-класса на ул. Дмитрия Донского, строящийся в тихом квартале Центрального округа Новосибирска, вблизи Красного проспекта и площади Калинина.<br>Жители будущего дома оценят комфортабельный двор, окружающее спокойствие и доступный «выход в город».<br>Инфраструктура<br>Впечатляющая архитектура и уникальная локация являются несомненными преимуществами комплекса. ЖК Classic House расположен в 10 минутах ходьбы до станции метро «Заельцовская». В шаговой доступности находятся несколько школ, гимназий и детских садов, два дома культуры со множеством детских творческих студий, торгово-развлекательные центры, банки, кафе и рестораны. За 20 минут прогулочным шагом можно добраться до новосибирского зоопарка и дендрария.<br>Территория<br>Придомовое пространство жилого комплекса Classic House – это территория комфорта и повышенной безопасности. Двор ЖК Classic House изолирован от машин, оборудован широкими тротуарами и пандусами и разделен на игровые, спортивные и релакс-площадки для детей и взрослых. Максимум свободного пространства здесь займут цветы и деревья. Для удобства жильцов в жилом комплексе будет работать консьерж-сервис. На территории ЖК предусмотрено круглосуточное видеонаблюдение.<br>Для парковки автомобилей жителей ЖК Classic House предусмотрена бесплатная автостоянка на 227 машиномест, изолированная от двора.<br>Квартиры<br>Квартиры в жилом комплексе Classic House предполагают свободную планировку. Отсутствие перегородок позволит жителям жилого комплекса воплотить собственные дизайнерские идеи и организовать жилую среду по своему вкусу. Панорамные окна зрительно расширяют пространство, а французские балконы добавляют интерьерам изящества и создают в квартирах неповторимую атмосферу.<br>Срок сдачи<br>III квартал 2021 года.<br>Продажи<br>Продажи осуществляются собственным офисом продаж застройщика.<br>Ипотека, рассрочка с фиксацией цены, скидки за быстрый полный расчет!*<br>*Подробности у менеджеров офиса продаж",47.2 м²,1006213323.0,ЖК «Classic House» (Классик Хаус),1006213323.0,ЖК «Classic House» (Классик Хаус),653.0,17/25,47.2 м²,47.2,17,15,1617253515,Sale,/2-komnatnaya-kvartira-na-prodazhu-novosibirsk-1617253515,260.0,4 815 420 ₽,102 022 ₽ за м²,102022,4815420,Apartment,2019-07-16T06:39:09.93987Z,78,Listing,2,2.0,2020-12-23T05:28:39.098019+03:00,1765451799,2019-07-16T09:05:59.854735+03:00,2020-11-23T05:28:39.098019+03:00,0.789,260.0,#FF0000,Заельцовская,"2-комн. квартира, 47.2 м², 17/25 эт.",2020-11-23T02:37:45.279628Z
"Красный пр-т, жилой дом",94957031,Сибирь Девелопмент,New,3285,2019-07-16T06:39:09.99282Z,"Продаётся трёхкомнатная студия в ЖК ""Classic House""<br>Плюсы этой квартиры:<br>- Просторная прихожая<br>- Большая кухня-гостиная<br>- Две спальни<br>- Два санузла<br>- Французский балкон<br>- Лоджия с панорамным остеклением<br>Жилой комплекс Classic House – это 25-этажный дом бизнес-класса на ул. Дмитрия Донского, строящийся в тихом квартале Центрального округа Новосибирска, вблизи Красного проспекта и площади Калинина.<br>Жители будущего дома оценят комфортабельный двор, окружающее спокойствие и доступный «выход в город».<br>Инфраструктура<br>Впечатляющая архитектура и уникальная локация являются несомненными преимуществами комплекса. ЖК Classic House расположен в 10 минутах ходьбы до станции метро «Заельцовская». В шаговой доступности находятся несколько школ, гимназий и детских садов, два дома культуры со множеством детских творческих студий, торгово-развлекательные центры, банки, кафе и рестораны. За 20 минут прогулочным шагом можно добраться до новосибирского зоопарка и дендрария.<br>Территория<br>Придомовое пространство жилого комплекса Classic House – это территория комфорта и повышенной безопасности. Двор ЖК Classic House изолирован от машин, оборудован широкими тротуарами и пандусами и разделен на игровые, спортивные и релакс-площадки для детей и взрослых. Максимум свободного пространства здесь займут цветы и деревья. Для удобства жильцов в жилом комплексе будет работать консьерж-сервис. На территории ЖК предусмотрено круглосуточное видеонаблюдение.<br>Для парковки автомобилей жителей ЖК Classic House предусмотрена бесплатная автостоянка на 227 машиномест, изолированная от двора.<br>Квартиры<br>Квартиры в жилом комплексе Classic House предполагают свободную планировку. Отсутствие перегородок позволит жителям жилого комплекса воплотить собственные дизайнерские идеи и организовать жилую среду по своему вкусу. Панорамные окна зрительно расширяют пространство, а французские балконы добавляют интерьерам изящества и создают в квартирах неповторимую атмосферу.<br>Срок сдачи<br>III квартал 2021 года.<br>Продажи<br>Продажи осуществляются собственным офисом продаж застройщика.<br>Ипотека, рассрочка с фиксацией цены, скидки за быстрый полный расчет!*<br>*Подробности у менеджеров офиса продаж",64.5 м²,1006213323.0,ЖК «Classic House» (Классик Хаус),1006213323.0,ЖК «Classic House» (Классик Хаус),653.0,20/25,64.5 м²,64.5,20,17,1617253523,Sale,/2-komnatnaya-kvartira-na-prodazhu-novosibirsk-1617253523,260.0,6 321 000 ₽,98 000 ₽ за м²,98000,6321000,Apartment,2019-07-16T06:39:09.99282Z,78,Listing,2,2.0,2020-12-23T05:28:39.147024+03:00,1765547831,2019-07-16T08:23:54.207695+03:00,2020-11-23T05:28:39.147024+03:00,0.789,260.0,#FF0000,Заельцовская,"2-комн. квартира, 64.5 м², 20/25 эт.",2020-11-23T02:37:41.620067Z
