address,agencyId,agencyName,apartmentSaleType,cityId,createdAt,description,details,developmentId,developmentName,developmentParentId,developmentParentName,districtId,floor,floorArea,floorAreaCalculated,floorInt,galleryImagesCount,id,itemType,itemUrl,metroId,price,pricePerArea,pricePerAreaValue,priceValue,propertyType,publishDate,regionId,resultType,rooms,roomsOrdinal,sourceFinishTime,sourceId,sourceStartTime,sourceUpdateTime,station_distance,station_id,station_lineColors,station_name,title,updatedAt
"ул. Объединения, блок-секция 1.1-1.4",94957031,Сибирь Девелопмент,New,3285,2019-07-19T09:32:53.611132Z,"Продается 3-комнатная студия в ЖК Цивилизация!<br>Плюсы этой квартиры:<br>- Две большие раздельные комнаты<br>- Просторная кухня-гостиная с лоджией<br>- Французский балкон в спальне<br>«Цивилизация» – это новый жилой комплекс комфорт-класса в Калининском районе, на пересечении улиц Объединения и Б. Хмельницкого. (ул. Объединения 102/4 стр).<br>Расположение<br>Жилой комплекс расположен в непосредственной близости к ул. Богдана Хмельницкого – одной из основных автомагистралей Новосибирска, обеспечивающей выход транспорта в центральную часть города.<br>Рядом находятся парк «Сосновый бор», крупные шопинг-зоны - ТРЦ «Голден Парк», «Леруа Мерлен», ТЦ «Колорлон».<br>Инфраструктура<br>В шаговой доступности расположены 2 школы, детский сад, остановка общественного транспорта (16 маршрутов), детский оздоровительный центр, спортивные секции и развивающие студии, дом детского творчества, аптеки и банки. На первых этажах зданий будет развиваться собственная инфраструктура, удобная для жителей - магазины, кафе, заведения сферы услуг.<br>Территория<br>Обширная территория жилого комплекса представляет собой приватную и комфортную среду для будущих жителей «Цивилизации». Большой зелёный двор, свободный от машин, широкие дорожки, игровые и спортивные городки с безопасным покрытием понравятся любителям спокойных прогулок и активных игр.<br>В вестибюлях первых этажей будут расположены помещения для колясок и велосипедов, в подъездах для удобства жильцов предусмотрены санузлы.<br>Вдоль внешнего периметра зданий расположится бесплатная наземная парковка для жителей «Цивилизации».<br>Конструктив<br>В основе несущей системы зданий жилого комплекса «Цивилизация» - надёжный и экологичный монолитный железобетон. Кирпичные межквартирные стены и внутренние перегородки обеспечивают высокую звукоизоляцию, а трёхслойные наружные стены – повышенную прочность и тепло. Отделка фасадов выполнена высококачественным кирпичом.<br>Квартиры<br>Квартиры в жилом комплексе «Цивилизация» отличаются разнообразием планировок, просторными кухнями, комфортной высотой потолков (2,68 м). Французские окна в квартирах украшают жилое пространство, а панорамное остекление лоджий зрительно расширяет жилище, впуская в квартиры больше света.<br>Срок сдачи<br>Срок сдачи 1-го этапа ЖК «Цивилизация» – IV квартал 2020 года.<br>Продажи осуществляются собственным офисом продаж застройщика.<br>Ипотека, рассрочка с фиксацией цены, скидки за быстрый полный расчет!*<br>*Подробности у менеджеров офиса продаж",59.3 м²,1006213353.0,ЖК «Цивилизация»,1006213353.0,ЖК «Цивилизация»,648.0,4/9,59.3 м²,59.3,4,27,1627879273,Sale,/3-komnatnaya-kvartira-na-prodazhu-novosibirsk-1627879273,260.0,4 151 000 ₽,70 000 ₽ за м²,70000,4151000,Apartment,2019-07-19T09:32:53.611132Z,78,Listing,3,3.0,2020-12-23T05:28:39.766266+03:00,1765006176,2019-07-19T09:33:47.824135+03:00,2020-11-23T05:28:39.766266+03:00,,,,,"3-комн. квартира, 59.3 м², 4/9 эт.",2020-11-23T02:37:45.742868Z
"Красный пр-т, жилой дом",94957031,Сибирь Девелопмент,New,3285,2019-07-16T06:39:10.518984Z,"Продается двухкомнатная студия в ЖК ""Classic House"".<br>Плюсы этой квартиры:<br>- Просторная прихожая<br>- Большая кухня-гостиная<br>- Французский балкон<br>- Лоджия с панорамным остеклением<br>Жилой комплекс Classic House – это 25-этажный дом бизнес-класса на ул. Дмитрия Донского, строящийся в тихом квартале Центрального округа Новосибирска, вблизи Красного проспекта и площади Калинина.<br>Жители будущего дома оценят комфортабельный двор, окружающее спокойствие и доступный «выход в город».<br>Инфраструктура<br>Впечатляющая архитектура и уникальная локация являются несомненными преимуществами комплекса. ЖК Classic House расположен в 10 минутах ходьбы до станции метро «Заельцовская». В шаговой доступности находятся несколько школ, гимназий и детских садов, два дома культуры со множеством детских творческих студий, торгово-развлекательные центры, банки, кафе и рестораны. За 20 минут прогулочным шагом можно добраться до новосибирского зоопарка и дендрария.<br>Территория<br>Придомовое пространство жилого комплекса Classic House – это территория комфорта и повышенной безопасности. Двор ЖК Classic House изолирован от машин, оборудован широкими тротуарами и пандусами и разделен на игровые, спортивные и релакс-площадки для детей и взрослых. Максимум свободного пространства здесь займут цветы и деревья. Для удобства жильцов в жилом комплексе будет работать консьерж-сервис. На территории ЖК предусмотрено круглосуточное видеонаблюдение.<br>Для парковки автомобилей жителей ЖК Classic House предусмотрена бесплатная автостоянка на 227 машиномест, изолированная от двора.<br>Квартиры<br>Квартиры в жилом комплексе Classic House предполагают свободную планировку. Отсутствие перегородок позволит жителям жилого комплекса воплотить собственные дизайнерские идеи и организовать жилую среду по своему вкусу. Панорамные окна зрительно расширяют пространство, а французские балконы добавляют интерьерам изящества и создают в квартирах неповторимую атмосферу.<br>Срок сдачи<br>III квартал 2021 года.<br>Продажи<br>Продажи осуществляются собственным офисом продаж застройщика.<br>Ипотека, рассрочка с фиксацией цены, скидки за быстрый полный расчет!*<br>*Подробности у менеджеров офиса продаж",53.8 м²,1006213323.0,ЖК «Classic House» (Классик Хаус),1006213323.0,ЖК «Classic House» (Классик Хаус),653.0,6/25,53.8 м²,53.8,6,21,1617253533,Sale,/2-komnatnaya-kvartira-na-prodazhu-novosibirsk-1617253533,260.0,5 272 400 ₽,98 000 ₽ за м²,98000,5272400,Apartment,2019-07-16T06:39:10.518984Z,78,Listing,2,2.0,2020-12-23T05:28:40.499526+03:00,1765956820,2019-07-16T07:59:44.376368+03:00,2020-11-23T05:28:40.499526+03:00,0.789,260.0,#FF0000,Заельцовская,"2-комн. квартира, 53.8 м², 6/25 эт.",2020-11-23T02:37:45.628457Z
"Красный пр-т, жилой дом",94957031,Сибирь Девелопмент,New,3285,2019-07-16T06:39:09.859115Z,"Продается двухкомнатная студия в ЖК ""Classic House"".<br>Плюсы этой квартиры:<br>- Просторная прихожая<br>- Большая кухня-гостиная<br>- Французский балкон<br>- Лоджия с панорамным остеклением<br>Жилой комплекс Classic House – это 25-этажный дом бизнес-класса на ул. Дмитрия Донского, строящийся в тихом квартале Центрального округа Новосибирска, вблизи Красного проспекта и площади Калинина.<br>Жители будущего дома оценят комфортабельный двор, окружающее спокойствие и доступный «выход в город».<br>Инфраструктура<br>Впечатляющая архитектура и уникальная локация являются несомненными преимуществами комплекса. ЖК Classic House расположен в 10 минутах ходьбы до станции метро «Заельцовская». В шаговой доступности находятся несколько школ, гимназий и детских садов, два дома культуры со множеством детских творческих студий, торгово-развлекательные центры, банки, кафе и рестораны. За 20 минут прогулочным шагом можно добраться до новосибирского зоопарка и дендрария.<br>Территория<br>Придомовое пространство жилого комплекса Classic House – это территория комфорта и повышенной безопасности. Двор ЖК Classic House изолирован от машин, оборудован широкими тротуарами и пандусами и разделен на игровые, спортивные и релакс-площадки для детей и взрослых. Максимум свободного пространства здесь займут цветы и деревья. Для удобства жильцов в жилом комплексе будет работать консьерж-сервис. На территории ЖК предусмотрено круглосуточное видеонаблюдение.<br>Для парковки автомобилей жителей ЖК Classic House предусмотрена бесплатная автостоянка на 227 машиномест, изолированная от двора.<br>Квартиры<br>Квартиры в жилом комплексе Classic House предполагают свободную планировку. Отсутствие перегородок позволит жителям жилого комплекса воплотить собственные дизайнерские идеи и организовать жилую среду по своему вкусу. Панорамные окна зрительно расширяют пространство, а французские балконы добавляют интерьерам изящества и создают в квартирах неповторимую атмосферу.<br>Срок сдачи<br>III квартал 2021 года.<br>Продажи<br>Продажи осуществляются собственным офисом продаж застройщика.<br>Ипотека, рассрочка с фиксацией цены, скидки за быстрый полный расчет!*<br>*Подробности у менеджеров офиса продаж",49 м²,1006213323.0,ЖК «Classic House» (Классик Хаус),1006213323.0,ЖК «Classic House» (Классик Хаус),653.0,10/25,49 м²,49.0,10,17,1617253501,Sale,/2-komnatnaya-kvartira-na-prodazhu-novosibirsk-1617253501,260.0,4 943 950 ₽,100 897 ₽ за м²,100897,4943950,Apartment,2019-07-16T06:39:09.859115Z,78,Listing,2,2.0,2020-12-23T05:28:40.584255+03:00,1765897801,2019-07-16T09:02:45.489739+03:00,2020-11-23T05:28:40.584255+03:00,0.789,260.0,#FF0000,Заельцовская,"2-комн. квартира, 49 м², 10/25 эт.",2020-11-23T02:37:45.637891Z
"Красный пр-т, жилой дом",94957031,Сибирь Девелопмент,New,3285,2019-07-16T06:39:09.90592Z,"Продается большая студия свободной планировки в ЖК Classic House!<br>Преимущества этой квартиры:<br>- Обширное пространство для жизни (96 кв.м)<br>- Кухня-гостиная 19 м<br>- Два санузла<br>- Два французских балкона<br>- Лоджия с панорамным остеклением<br>- Возможность планировки под полноценную 3-комнатную квартиру<br>Жилой комплекс Classic – это 25-этажный дом бизнес-класса на ул. Дмитрия Донского, строящийся в тихом квартале Центрального округа Новосибирска, вблизи Красного проспекта и площади Калинина. <br>Жители будущего дома оценят комфортабельный двор, окружающее спокойствие и доступный «выход в город».<br>Инфраструктура<br>Впечатляющая архитектура и уникальная локация являются несомненными преимуществами комплекса. ЖК Classic расположен в 10 минутах ходьбы до станции метро «Заельцовская». В шаговой доступности находятся несколько школ, гимназий и детских садов, два дома культуры со множеством детских творческих студий, торгово-развлекательные центры, банки, кафе и рестораны. За 20 минут прогулочным шагом можно добраться до новосибирского зоопарка и дендрария. <br>Территория <br>Придомовое пространство жилого комплекса Classic – это территория комфорта и повышенной безопасности. Двор ЖК Classic изолирован от машин, оборудован широкими тротуарами и пандусами и разделен на игровые, спортивные и релакс-площадки для детей и взрослых. Максимум свободного пространства здесь займут цветы и деревья. Для удобства жильцов в жилом комплексе будет работать консьерж-сервис. На территории ЖК предусмотрено круглосуточное видеонаблюдение.<br>Для парковки автомобилей жителей ЖК Classic предусмотрена бесплатная автостоянка на 227 машиномест, изолированная от двора.<br>Квартиры<br>Квартиры в жилом комплексе Classic предполагают свободную планировку. Отсутствие перегородок позволит жителям жилого комплекса воплотить собственные дизайнерские идеи и организовать жилую среду по своему вкусу. Панорамные окна зрительно расширяют пространство, а французские балконы добавляют интерьерам изящества и создают в квартирах неповторимую атмосферу.<br>Срок сдачи<br>3 квартал 2021 года.<br>Продажи<br>Продажи осуществляются собственным отделом продаж застройщика ООО ""Академ Консалтинг"".<br>Ипотека, рассрочка с фиксацией цены, скидки за быстрый полный расчет!*<br>*Подробности у менеджеров отдела продаж",96.1 м²,1006213323.0,ЖК «Classic House» (Классик Хаус),1006213323.0,ЖК «Classic House» (Классик Хаус),653.0,12/25,96.1 м²,96.1,12,18,1617253508,Sale,/3-komnatnaya-kvartira-na-prodazhu-novosibirsk-1617253508,260.0,8 165 950 ₽,84 973 ₽ за м²,84973,8165950,Apartment,2019-07-16T06:39:09.90592Z,78,Listing,3,3.0,2020-12-23T05:28:40.706089+03:00,1765882372,2019-07-16T07:41:23.791782+03:00,2020-11-23T05:28:40.706089+03:00,0.789,260.0,#FF0000,Заельцовская,"3-комн. квартира, 96.1 м², 12/25 эт.",2020-11-23T02:37:48.801178Z
"ул. Объединения, блок-секция 1.1-1.4",94957031,Сибирь Девелопмент,New,3285,2020-04-14T00:53:59.36401Z,"Продаётся полноценная двухкомнатная квартира в ЖК Цивилизация!<br>Преимущества этой квартиры:<br>- 2 раздельные комнаты<br>- Большая кухня 11,5 кв.м с лоджией<br>- Панорамное остекление<br>- Комфортный 2-й этаж<br>«Цивилизация» – это новый жилой комплекс комфорт-класса в Калининском районе, на пересечении улиц Объединения и Б. Хмельницкого.<br>Расположение<br>Жилой комплекс расположен в непосредственной близости к ул. Богдана Хмельницкого – одной из основных автомагистралей Новосибирска, обеспечивающей выход транспорта в центральную часть города.<br>Рядом находятся парк «Сосновый бор», крупные шопинг-зоны - ТРЦ «Голден Парк», «Леруа Мерлен», ТЦ «Колорлон».<br>Инфраструктура<br>В шаговой доступности расположены 2 школы, детский сад, остановка общественного транспорта (16 маршрутов), детский оздоровительный центр, спортивные секции и развивающие студии, дом детского творчества, аптеки и банки. На первых этажах зданий будет развиваться собственная инфраструктура, удобная для жителей - магазины, кафе, заведения сферы услуг.<br>Территория<br>Обширная территория жилого комплекса представляет собой приватную и комфортную среду для будущих жителей «Цивилизации». Большой зелёный двор, свободный от машин, широкие дорожки, игровые и спортивные городки с безопасным покрытием понравятся любителям спокойных прогулок и активных игр.<br>В вестибюлях первых этажей будут расположены помещения для колясок и велосипедов, в подъездах для удобства жильцов предусмотрены санузлы.<br>Вдоль внешнего периметра зданий расположится бесплатная наземная парковка для жителей «Цивилизации».<br>Конструктив<br>В основе несущей системы зданий жилого комплекса «Цивилизация» - надёжный и экологичный монолитный железобетон. Кирпичные межквартирные стены и внутренние перегородки обеспечивают высокую звукоизоляцию, а трёхслойные наружные стены – повышенную прочность и тепло. Отделка фасадов выполнена высококачественным кирпичом.<br>Квартиры<br>Квартиры в жилом комплексе «Цивилизация» отличаются разнообразием планировок, просторными кухнями, комфортной высотой потолков (2,68 м). Французские окна в квартирах украшают жилое пространство, а панорамное остекление лоджий зрительно расширяет жилище, впуская в квартиры больше света.<br>Срок сдачи<br>Срок сдачи 1-го этапа ЖК «Цивилизация» – IV квартал 2020 года.<br>Продажи осуществляются собственным офисом продаж застройщика.<br>Ипотека, рассрочка с фиксацией цены, скидки за быстрый полный расчет!*<br>*Подробности у менеджеров офиса продаж",50.5 м²,1006213353.0,ЖК «Цивилизация»,1006213353.0,ЖК «Цивилизация»,648.0,2/9,50.5 м²,50.5,2,26,2484297512,Sale,/2-komnatnaya-kvartira-na-prodazhu-novosibirsk-2484297512,260.0,3 785 250 ₽,74 955 ₽ за м²,74955,3785250,Apartment,2020-04-14T00:53:59.36401Z,78,Listing,2,2.0,2020-12-23T05:28:41.078423+03:00,1892981939,2020-04-13T11:32:11.951443+03:00,2020-11-23T05:28:41.078423+03:00,,,,,"2-комн. квартира, 50.5 м², 2/9 эт.",2020-11-23T02:37:45.731229Z
