address,agencyId,agencyName,apartmentSaleType,cityId,createdAt,description,details,developmentId,developmentName,developmentParentId,developmentParentName,districtId,floor,floorArea,floorAreaCalculated,floorInt,galleryImagesCount,id,itemType,itemUrl,metroId,price,pricePerArea,pricePerAreaValue,priceValue,propertyType,publishDate,regionId,resultType,rooms,roomsOrdinal,sourceFinishTime,sourceId,sourceStartTime,sourceUpdateTime,station_distance,station_id,station_lineColors,station_name,title,updatedAt
,188663210,"Квартал «Авиатор», застройщик Брусника",New,3285,2020-09-11T04:33:01.01694Z,"Квартира с объединенной кухней-гостиной и одной спальней в квартале «Авиатор». <br>                  ОБЪЯВЛЕНИЕ ОТ ЗАСТРОЙЩИКА. Покупка квартиры защищена банком.<br>Квартиру можно купить онлайн.<br>Однокомнатная квартира в ЖК «Авиатор» — это квартира с объединенной кухней-гостиной, отдельной спальней и просторной ванной комнатой. Предусмотрены дополнительные ниши под хранение вещей, гардеробные или постирочные комнаты. Есть варианты планировок с французским балконом, протяжённым открытым балконом, глубокой террасой. Купить однокомнатную квартиру выгодно напрямую от застройщика Брусника. <br>На сдаче в 1-комнатных квартирах ЖК «Авиатор» выполнена отделка под чистовую. Стены выровнены и оштукатурены, на полу ー цементно-песчаная стяжка. В квартирах установлены розетки, выключатели, приборы учёта. Сделаны выводы под сантехнику и разводка электрики. Радиаторы установлены в каждой комнате и оборудованы терморегулятором. Нет стояков и вертикальных коммуникаций. В межкомнатных стенах и полу проложена шумоизоляция. В квартирах установлены пластиковые окна и надёжная сейф-дверь с замком. Отделка под чистовую экономит время и затраты на ремонт. Она включена в стоимость квартиры и не требует замены. <br>ЖК «Авиатор» расположен на пересечении улицы Аэропорт и Мочищенского шоссе, рядом с остановками «Байкальская», «Жуковского» и «Городской аэропорт», в 7 минутах ходьбы от сквера им. Чаплыгина и 10 минутах от крупной транспортной магистрали – Красного проспекта. До станции метро «Заельцовская» и площади «Калинина» – около 10 минут на автомобиле. Сформированная инфраструктура локации – школы, детские сады, магазины, спортивный стадион – делают жизнь в квартале комфортной. Первые новостройки в районе Аэропорта Северного сдаются в 3 квартале 2023 года. <br>«Авиатор» в Новосибирске строит компания Брусника. ЖК состоит из 11 домов. В центре квартала расположены 6-8-этажные урбан-виллы и 9-этажные парные дома с общим холлом. По периметру они отделены от городских улиц двумя секционными домами от 6 до 18 этажей со стилобатом и паркингом. Расположенная рядом школа будет интегрирована в проект при помощи элементов благоустройства и общественных пространств. Первая очередь строительства ЖК «Авиатор» включает возведение двух одноподъездных урбан-вилл и двух подъездов секционного дома, расположенного по улице Аэропорт. <br>Купить однокомнатную квартиру в новостройках вблизи Красного проспекта Новосибирске выгодно с использованием программ покупки и сервисов от застройщика Брусника: <br>— ипотека 5,85% по госпрограмме от ПАО Промсвязьбанк;<br>— ипотека с отсрочкой платежей на год от ПАО Сбербанк;<br>— беспроцентная рассрочка на квартиру;<br>— обмен своей квартиры на новую.<br>Получить одобрение ипотеки или рассрочку, а также осуществить обмен квартиры можно онлайн. Запишитесь на онлайн презентацию по телефону или на сайте.<br>            № квартиры в нашей базе: НСК17594.",47.6 м²,1027376811.0,Квартал «Авиатор»,1027376811.0,Квартал «Авиатор»,653.0,16/18,47.6 м²,47.6,16,9,2854125588,Sale,/1-komnatnaya-kvartira-na-prodazhu-novosibirsk-2854125588,260.0,4 400 000 ₽,92 437 ₽ за м²,92437,4400000,Apartment,2020-09-11T04:33:01.01694Z,78,Listing,1,1.0,2020-12-17T14:20:12.252859+03:00,1992501332,2020-09-11T07:23:38.288948+03:00,2020-12-01T05:06:00.233182+03:00,2.459,260.0,#FF0000,Заельцовская,"1-комн. квартира, 47.6 м², 16/18 эт.",2020-12-01T02:15:02.255865Z
"ул. Татьяны Снежиной, д. 42",173701179,Макромир,New,3285,2020-08-15T02:28:11.71506Z,"Описание комплекса На Снежиной<br>Немного о застройщике:<br>Муниципальная строительная компания (АО МСК)<br>Сроки Качество Лицензии Гарантии Социальная ответственность Квартира от застройщика и это говорит о то, что отсутствуют комиссии за оформление сделки<br>Так же для вас бесплатно получим ипотечный кредит<br>Жилой комплекс состоит из двух комфортных современных домов с благоустроенной территорией. Для отдыха детей современная детская площадка, а для любителей спорта спортивная.<br>Инфраструктура района развита: рядом находятся два корпуса детского сада, в 10 минутах ходьбы — еще один детский сад. До строящейся на Плющихинском школы — 5 минут пешком, пока она не введена в эксплуатацию, к услугам жителей ЖК три СОШ, расположенные в соседнем жилмассиве, в 10 минутах езды.<br>В шаговой доступности от ЖК есть: киоск фруктово-овощной продукции, магазин, торговый центр, спортивная площадка и каток, студия красоты.<br>В пределах получаса ходьбы — торговый комплекс, аптека, клуб и закрытый паркинг на ул. Высоцкого. В целом, рядом с жилым комплексом, есть все необходимое для комфортной жизни.<br>Недалеко, в пределах 10-15 минут езды, расположен соседний жилмассив, где помимо общеобразовательных и художественных школ, есть спортивные залы, танцевальные секции. До ближайшего кинотеатра и крупного ТРЦ дорога займет 15 минут на автомобиле.<br>От жилого комплекса до остановки общественного транспорта «Детский сад № 100» — 3 минуты пешком. Отсюда можно уехать на одном из 6 автобусных маршрутов и 7 маршрутных такси.<br>— - Развитая инфраструктура<br>— - Транспортная доступность<br>— - Детские и спортивные площадки<br>— - ЖК находиться в окружении зелени<br>— - Благоустроенная территория<br>— - Рядом торговый центр<br>Застройщиком жилого комплекса «На Снежиной» является компания МСК — надёжный застройщик и проверенная временем компания:<br>— работает на рынке с 2005 года;<br>— построила более 110 000 м2 жилья;<br>— построила более 200 000 м2 зданий, в том числе больниц, спорткомплексов, объектов коммерческого назначения.<br>Точность сроков — один из ключевых принципов МСК. Мы делаем всё, чтобы возводимые объекты сдавались точно в срок. Выполняем работы с использованием современной техники и материалов,позволяющих значительно сократить сроки строительства, сохранив высокий уровень качества и экологической безопасности.<br>Высочайший уровень работ, выполнение строительства с соблюдением всех норм и стандартов, использование самых современных высокотехнологичных материалов и оборудования — отличительные особенности компании.<br>Компания имеет разрешения на выполнение всех видов строительных работ на любых объектах, включая особо опасные и технически сложные объекты капитального строительства.<br>Сотни тысяч квадратных метров введённых в строй зданий, тысячи счастливых семей, получивших ключи от своих квартир — весомая гарантия качества наших работ. Мы работаем в тесном сотрудничестве с проектными, подрядными и другими организациями и берём на себя полную ответственность за весь процесс строительства.<br>Мы искренне любим свой регион и с удовольствием работаем над строительством новых, социально значимых объектов, способствующих улучшению жизни, сохранению здоровья и укреплению спортивных традиций Сибирского федерального округа.<br>Способы покупки:<br>-Наличный расчет<br>-Ипотека<br>-Материнский капитал<br>-Рассрочка без переплат на время строительства<br>Приобретая данную квартиру вы экономите на комиссионных ( т.е. услуга для вас полностью бесплатна)",74 м²,1006283073.0,ЖК «На Снежиной»,1006283073.0,ЖК «На Снежиной»,650.0,5/10,74 м²,74.0,5,17,2789799594,Sale,/3-komnatnaya-kvartira-na-prodazhu-novosibirsk-2789799594,272.0,3 829 567 ₽,51 751 ₽ за м²,51751,3829567,Apartment,2020-08-15T02:28:11.71506Z,78,Listing,3,3.0,2020-12-27T05:44:47.900778+03:00,1977656194,2020-08-14T08:48:31.61012+03:00,2020-11-27T05:44:47.900778+03:00,3.448,272.0,#008000,Золотая Нива,"3-комн. квартира, 74 м², 5/10 эт.",2020-11-27T02:53:51.747079Z
"Новосибирск, Советский район, микрорайон Академгородок, улица Иванова, 8",131493005,Александр,Resale,3285,2020-11-22T07:58:23.727723Z,"Лучшее предложение и самая низкая цена! <br>Успейте купить полноценную четырёхкомнатную квартиру с шикарным видом на три стороны света (Ю, З, В)! Потрясающий вид на Академгородок с 23 этажа. Самая высокая квартира в продаже во всём Академе! <br>Квартира выполнена под чистовую самоотделку: на полу ровная стяжка, стены отштукатурены, установлены пластиковые окна, радиаторы отопления и хорошая входная дверь, межкомнатные стены кирпич.<br>В подарок новым собственникам готовый дизайн-проект, сделанный известной новосибирской студией (первые три фото как пример). <br>VIVANOVA уникальный для Академгородка проект комфорт-класса. Подземный паркинг со спуском прямо на лифте, закрытая территория, видеонаблюдение, консьерж, спортивные и детские площадки. <br>Чистая продажа! Нет обременений. Возможна покупка в ипотеку, все документы готовы, никто не прописан, быстрый выход на сделку и ключи в день расчёта! <br>Звоните, записывайтесь на просмотр! Ключи в АН, показ в любое время, по договоренности.",91.7 м²,,,,,656.0,23/25,91.7 м²,91.7,23,21,3024076098,Sale,/4-komnatnaya-kvartira-na-prodazhu-novosibirsk-3024076098,,8 290 000 ₽,90 403 ₽ за м²,90403,8290000,Apartment,2020-11-22T07:58:23.727723Z,78,Listing,4,4.0,2020-12-22T10:49:45.390912+03:00,2027080748,2020-11-22T10:44:44.101223+03:00,2020-11-22T10:53:00.17045+03:00,,,,,"4-комн. квартира, 91.7 м², 23/25 эт.",2020-11-22T08:02:29.253073Z
"Новосибирск, улица Ермака, 4",23540643,олег,Resale,3285,2020-05-30T01:19:21.358826Z,"Предлагается на продажу квартиру в доме «премиум-класса»!<br>Квартира с удобной функциональной планировкой. Потолки 3 метра. В Холле и сан.узлах лоджиях на полу уложена плитка производство  Италия.<br>В квартире все комнаты изолированы, выход на лоджию с кухни-столовой, кухню с залом объединяет  широкий проем,  взрослая спальная комната со своим элегантным сан.узлом и джакузи, просторный холл с гардеробной комнатой. <br>Двери массив на сделаны на заказ. <br>Если вы хотите жить в квартире, которая подчеркнет ваш статус и индивидуальность, тогда это ваша квартира.<br>Полы плитка, в комнатах паркет, так же квартире установлены центральная система кондиционирования что позволяет создать комфортный микроклимат в квартире, а неповторимая атмосфера квартиры, где главенствует свет, пространство, стиль, классическая элегантность и продуманная функциональность позволит вам расслабиться и хорошо отдохнуть после трудового дня. <br>Зал соединен с просторной кухней-столовой 20кв.м, с угловым кухонным гарнитуром по всему периметру кухни, вся встроенная техника ,(холодильник ,  посудомоечная машина, СВЧ, жарочный шкаф, варочная поверхность, вытяжка). <br>125 квадратных метра комфорта, безопасности и уюта вокруг которой сосредоточена основная деловая и культурная жизнь города.<br>В пешей доступности от вашего дома, расположены самые лучшие школы города – 22 лицей 400м , гимназия № 1 500м, гимназия № 4 в 500 метрах, а так же множество детских кружков и секций, таких как: «Динамекс» -клуб спортивных единоборств, «ЦЕНТР» школа футбола, «5/5» - школа баскетбола, Академия дизайна и программирования, Инотекс – школа иностранных языков, РОБОКОД – школа робототехники, шахматный клуб, «Мастерская знаний» -центр гармоничного развития. Школа развития интеллекта -«АЙКЬЮ»,Творческая студия «hobbyroom»,Школа цифровых технологий.<br>Так же плюсом является что в семи минутах от дома находится, ТРЦ Галерея Новосибирск, где есть все необходимое для жизни, ТРЦ Юпитер в котором находится детский театрально-развлекательный центр Лукоморье, Цирк, нотариальные конторы, салоны красоты, масса магазинов и супермаркетов.<br> <br>В этом доме большая редкость увидеть квартиры в продаже. <br>Дом построен в 2000 году. В Доме 1 подъезд и 25 квартир, классическая кирпичная кладка, толщиной стен 80 см, что позволяет обеспечивать прекрасную звуко и теплоизоляцию квартиры. <br>Ваше спокойствие и безопасность обеспечит круглосуточная консьерж и видеонаблюдение, что обеспечит вам повышенный  уровень проживания.<br>Окна во двор. Оживленных дорог не слышно совсем. Тихо и чисто. Отремонтированный, чистый подъезд с сознательными соседями.  Вхoд в метpо- станция метро «КРАСНЫЙ ПРОСПЕКТ» в соседнем дворе (идти меньше минуты), в соседнем дворе дет.сад № 24 и в 5 минутах ходьбы располагаются еще два детских садика.<br>В шаговой доступности «Центральный парк» и Нарымский сквер.<br>Ваши гости обязательно по достоинству оценят эстетическое окружение вашего местожительства и ваш непревзойденный вкус в выборе данной квартиры.<br>Продажа квартиры осуществляется с мебелью , встроенной техникой <br>Эта квартира может стать Вашей уже сегодня!<br>Прямая продажа. Один собственник. Полная стоимость в договоре. Без обременений ограничений, детей опек и т.д, документы готовы к сделке. Ипотека от любого банка. Продается в связи с переездом в другой город.<br> Позвоните прямо сейчас, и мы договоримся об удобном для Вас времени просмотра квартиры.",125 м²,,,,,649.0,2/9,125 м²,125.0,2,40,2597714565,Sale,/3-komnatnaya-kvartira-na-prodazhu-novosibirsk-2597714565,262.0,12 000 000 ₽,96 000 ₽ за м²,96000,12000000,Apartment,2020-05-30T01:19:21.358826Z,78,Listing,3,3.0,2020-12-25T04:33:33.146409+03:00,1921593871,2020-05-29T12:58:15.382192+03:00,2020-11-25T04:33:33.146409+03:00,0.287,262.0,#FF0000,Красный проспект,"3-комн. квартира, 125 м², 2/9 эт.",2020-11-25T01:42:42.860597Z
"Новосибирская область, Мошковский район, село Ташара, Октябрьская улица",79980570,Лилия,Resale,3259,2019-02-05T20:35:22.131118Z,"Продаётся от собственника двухкомнатная квартира с мебелью на втором этаже двухэтажного многоквартирного дома. Ремонт косметический, сам дом после капремонта в 2015 году.   Санузел раздельный, отопление и водоснабжение  - центральные, радиаторы новые.  С квартирой продаётся новые капитальный гараж и сарай с погребом, выложенным кирпичом, построенные летом 2017 года, и также участок огорода 4 сотки.. Квартира находится в самом центре посёлка Ташара, в радиусе 100 метров находятся: супермаркет, школа, больница, поликлиника, остановка общественного транспорта, рынок, парикмахерская, отделение почты России, Сбербанк, церковь и различные магазины. Сам посёлок находится в живописном месте, рядом с рекой Обь и лесом. <br>До города Новосибирск - 65.6 км, 1.5 часа, ходят автобусы. До Мошкова - 30 минут, можно добраться на автобусе и маршрутке. От Мошково в город ездят электрички,маршрукти и автобусы.<br>Все документы готовы, звоните в любое время . Продажа от собственника.Документы готовы. Продажа от собственника, без комиссий.",40 м²,,,,,,2/2,40 м²,40.0,2,17,223174452,Sale,/2-komnatnaya-kvartira-na-prodazhu-tashara-223174452,,999 000 ₽,24 975 ₽ за м²,24975,999000,Apartment,2019-02-05T20:35:22.131118Z,78,Listing,2,2.0,2020-12-22T10:51:19.922524+03:00,1709669734,2018-03-30T19:51:54+03:00,2020-11-22T10:51:19.922524+03:00,,,,,"2-комн. квартира, 40 м², 2/2 эт.",2020-11-22T08:00:23.186188Z
