address,agencyId,agencyName,apartmentSaleType,cityId,createdAt,description,details,developmentId,developmentName,developmentParentId,developmentParentName,districtId,floor,floorArea,floorAreaCalculated,floorInt,galleryImagesCount,id,itemType,itemUrl,metroId,price,pricePerArea,pricePerAreaValue,priceValue,propertyType,publishDate,regionId,resultType,rooms,roomsOrdinal,sourceFinishTime,sourceId,sourceStartTime,sourceUpdateTime,station_distance,station_id,station_lineColors,station_name,title,updatedAt
"Новосибирск, Советский район, микрорайон Правые Чёмы, Балтийская улица, 35",145205200,Агентство Недвижимости,Resale,3285,2020-10-20T10:25:12.869013Z,"Просторная уютная квартира в современном кирпичном доме, построенном в экологически чистом районе в непосредственной близости к сосновому бору, ЖК «Балтийский». Придомовая территория оснащена большой парковкой и детскими площадками, установлено видеонаблюдение, дом обслуживается консьержами. На территории ЖК находятся: торговый центр, супермаркет, аптеки, медицинские клиники, стоматология, фитнес-клуб, парикмахерские, вет.клиника, пункты выдачи ozon, wildberries, СДЭК. Район обеспечен отличной инфраструктурой и хорошей транспортной доступностью: школы, дет.сады, поликлиника и остановка общественного транспорта. <br>Планировка квартиры позволила организовать и использовать пространство, совместив комфорт и уют. Ремонт выполнен по дизайн проекту с использованием европейских материалов.<br> В квартире остается всё (мебель, техника, текстиль и т.д.).<br>Квартира оборудована качественной современной техникой: Bosch, LG, Sharp, Best, Cata, Yamaha, Thermex. В гостиной и спальне висят телевизоры с диагональю 55 дюймов, на кухне – 22 дюйма. В спальне установлены инверторный кондиционер с функцией обогрева и бризер Tion 3S Smart.<br>Сантехника и санфаянс: Германия, Испания, Италия, Швейцария.<br>Кухня: фасады акрилайн, каменная столешница, фурнитура Blum, посудомоечная машина, мощная встроенная вытяжка (1000 м3/ч).<br>Диван в гостиной Брайтон (Добрый стиль) из натуральной кожи: 2 реклайнера с электроприводом и подогревом, широкое спальное место.<br>Надежная входная дверь Gerda.<br>Приглашаем покупателей, ценящих уют, комфорт и безопасность для своей семьи. Просмотр по предварительной договоренности.",85 м²,,,,,656.0,7/16,85 м²,85.0,7,22,2943428298,Sale,/2-komnatnaya-kvartira-na-prodazhu-novosibirsk-2943428298,,8 800 000 ₽,103 529 ₽ за м²,103529,8800000,Apartment,2020-10-20T10:25:12.869013Z,78,Listing,2,2.0,2020-12-20T05:24:45.349972+03:00,2030874450,2020-10-20T13:14:10.945816+03:00,2020-12-03T13:06:50.68824+03:00,,,,,"2-комн. квартира, 85 м², 7/16 эт.",2020-12-03T10:16:20.338396Z
"Новосибирск, Кировский район, Затулинский жилмассив, улица Зорге, 217",152810530,Центральное агентство недвижимости,Resale,3285,2020-09-15T08:00:51.19468Z,"Солнечная, изолированная квартира, требует ремонта. <br> - Третий этаж с балконом с видом на аккуратный ухоженный двор, <br>   рядом два детских садика, школа. <br>   Это преимущества -  ради которых можно сделать ремонт, который будет устраивать именно Вас.<br>    Можно жить не делая ремонта, можно сдавать. Большой выбор - ради хорошей квартиры на третьем этаже.<br> Приглашаем на просмотр. Время согласуем.<br> Хорошему человеку - хороший торг.<br>При звонке, пожалуйста, назовите номер объявления - 111 991<br>Консультируем подробно по телефону.",43 м²,,,,,655.0,3/5,43 м²,43.0,3,11,2864033087,Sale,/2-komnatnaya-kvartira-na-prodazhu-novosibirsk-2864033087,,2 380 000 ₽,55 349 ₽ за м²,55349,2380000,Apartment,2020-09-15T08:00:51.19468Z,78,Listing,2,2.0,2020-12-20T05:26:15.279656+03:00,1984822945,2020-09-15T10:51:23.158166+03:00,2020-12-03T05:29:36.141257+03:00,,,,,"2-комн. квартира, 43 м², 3/5 эт.",2020-12-03T02:39:15.082106Z
"Новосибирск, Ленинский район, микрорайон Горский, 12",152810530,Центральное агентство недвижимости,Resale,3285,2020-10-20T12:23:42.082703Z,"Срочная продажа, выгодное предложение. Предлагается к продаже видовая квартира под самоотделку в микрорайоне Горский в новом кирпичном доме с потрясающим видом на р. Обь. Квартира спроектирована по индивидуальному проекту, очень тёплая и сухая, два санузла, один из которых по своим габаритам  позволяет одновременно установить  джакузи, душевую кабину и постирочную. В  комнатах установлены французские окна в пол, две лоджии, есть место для гардеробной. Дом сдан. Дополнительно имеются два теплых парковочных места, одно из них на две машины.<br>Подходит под ипотеку, материнский капитал.<br>При звонке, пожалуйста, назовите номер объявления - 112 868<br>Консультируем подробно по телефону.",102.1 м²,,,,,654.0,21/25,102.1 м²,102.1,21,10,2943674617,Sale,/3-komnatnaya-kvartira-na-prodazhu-novosibirsk-2943674617,266.0,8 180 000 ₽,80 118 ₽ за м²,80118,8180000,Apartment,2020-10-20T12:23:42.082703Z,78,Listing,3,3.0,2020-12-20T05:26:15.269466+03:00,2016440329,2020-10-20T15:14:12.718358+03:00,2020-12-07T05:24:00.061335+03:00,0.867,266.0,#FF0000,Студенческая,"3-комн. квартира, 102.1 м², 21/25 эт.",2020-12-07T02:34:09.865026Z
"Новосибирск, улица Бориса Богаткова, 226/1",152810530,Центральное агентство недвижимости,Resale,3285,2020-09-15T08:00:51.662061Z,"Предлагаем вашему вниманию полноценную двухкомнатную квартиру улучшенной планировки. 3 минуты до станции метро   Золотая Нива <br> Квартира в хорошем  состоянии - пластиковые окна, хороший ремонт. Высокий первый этаж, видеонаблюдение по всему дому, на всех крайних этажах и во дворе.<br>Окна с решетками выходят на зеленый газон. Чистый подъезд и ухоженная придомовая территория.<br>Кирпичный дом имеет явные преимущества от других типов домостроения.<br>Вся инфраструктура центра города в шаговой доступности.<br>При звонке, пожалуйста, назовите номер объявления - 112 142<br>Консультируем подробно по телефону.",56.5 м²,,,,,650.0,1/10,56.5 м²,56.5,1,20,2864033132,Sale,/2-komnatnaya-kvartira-na-prodazhu-novosibirsk-2864033132,272.0,3 880 000 ₽,68 673 ₽ за м²,68673,3880000,Apartment,2020-09-15T08:00:51.662061Z,78,Listing,2,2.0,2020-12-20T05:26:15.439036+03:00,1984693595,2020-09-15T10:51:21.732876+03:00,2020-12-07T05:23:58.935198+03:00,0.513,272.0,#008000,Золотая Нива,"2-комн. квартира, 56.5 м², 1/10 эт.",2020-12-07T02:34:17.711401Z
"Новосибирск, улица Дуси Ковальчук, 83",152810530,Центральное агентство недвижимости,Resale,3285,2020-09-15T08:00:55.073673Z,"В продаже уютная солнечная квартира. Отличный вариант как для сдачи в аренду, так и для проживания молодой семье. В квартире остаётя мебель, холодильник, стиральная машина, кухонный гарнитур. Заходи и живи. Развитая инфраструктура: магазины, школа, детская поликлиника, транспортная остановка, до метро  Заельцовская  10 минут. Документы к продаже готовы, один взрослый собственник, чистая продажа. Показ по договорённости.<br>При звонке, пожалуйста, назовите номер объявления - 112 097<br>Консультируем подробно по телефону.",31.3 м²,,,,,653.0,2/5,31.3 м²,31.3,2,14,2864033303,Sale,/1-komnatnaya-kvartira-na-prodazhu-novosibirsk-2864033303,260.0,2 430 000 ₽,77 636 ₽ за м²,77636,2430000,Apartment,2020-09-15T08:00:55.073673Z,78,Listing,1,1.0,2020-12-20T05:26:15.484345+03:00,1984308828,2020-09-15T10:51:26.903961+03:00,2020-12-07T05:23:59.084356+03:00,1.034,260.0,#FF0000,Заельцовская,"1-комн. квартира, 31.3 м², 2/5 эт.",2020-12-07T02:34:12.530902Z
"Новосибирск, улица Журавлёва, 11А",152810530,Центральное агентство недвижимости,Resale,3285,2020-09-18T02:03:23.089217Z,"В продаже большая квартира рядом с метро. <br>Квартира удивительной планировки просторная комната с двумя окнами, большая кухня. Можно кухню перенести в комнату и получится большая кухня-гостиная, а в кухне расположить уютную спальню или детскую. А можно оставить и все как есть.<br>Комфортный этаж, удобное местоположение дома, через дорогу аграрный университет. <br>Квартира идеальна как для личного проживания, так и для сдачи в аренду. Близость метро и ВУЗов всегда обеспечит вам долгосрочную аренду.<br> Детский сад и школа во дворе. <br>Подходят все виды расчетов.<br>Просмотры по договоренности в удобное для вас время.<br>При звонке, пожалуйста, назовите номер объявления - 113 086<br>Консультируем подробно по телефону.",44 м²,,,,,650.0,3/5,44 м²,44.0,3,15,2871169531,Sale,/1-komnatnaya-kvartira-na-prodazhu-novosibirsk-2871169531,272.0,2 590 000 ₽,58 864 ₽ за м²,58864,2590000,Apartment,2020-09-18T02:03:23.089217Z,78,Listing,1,1.0,2020-12-20T05:26:15.426024+03:00,1984769995,2020-09-18T04:53:53.980689+03:00,2020-12-07T15:39:09.041263+03:00,0.961,272.0,#008000,Золотая Нива,"1-комн. квартира, 44 м², 3/5 эт.",2020-12-07T12:55:22.498247Z
"Новосибирск, улица Адриена Лежена, 6",152810530,Центральное агентство недвижимости,Resale,3285,2020-09-15T08:00:51.553693Z,"Предлагается к продаже полноценная однокомнатная квартира в шаговой доступности от метро  Золотая Нива . Квартира находится на комфортном втором этаже, окна выходят на зеленую зону.Двор хорошо озеленен и обустроен. В шаговой доступности находятся дет. сад, школа, магазины, остановки общественного транспорта, ст. метро  Золотая Нива . Приглашаем на просмотр в любое удобное для Вас время. Приветствуются все формы расчета.<br>При звонке, пожалуйста, назовите номер объявления - 111 590<br>Консультируем подробно по телефону.",31 м²,,,,,651.0,2/5,31 м²,31.0,2,21,2864033119,Sale,/1-komnatnaya-kvartira-na-prodazhu-novosibirsk-2864033119,272.0,2 850 000 ₽,91 935 ₽ за м²,91935,2850000,Apartment,2020-09-15T08:00:51.553693Z,78,Listing,1,1.0,2020-12-20T05:26:18.438753+03:00,1984215165,2020-09-15T10:51:20.895944+03:00,2020-12-07T05:23:58.262921+03:00,0.541,272.0,#008000,Золотая Нива,"1-комн. квартира, 31 м², 2/5 эт.",2020-12-07T02:34:17.570193Z
"Новосибирская область, Новосибирский район, рабочий посёлок Краснообск, 2-й микрорайон, 229",152810530,Центральное агентство недвижимости,Resale,3287,2020-10-20T12:23:50.425747Z,"Площадь квартиры 74,2 кв.м. Гостиная объединена с кухонной зоной - площадь 34,9 кв.м, спальная комната 17,6 кв.м, прихожая 15,7 кв.м, совмещенный санузел 6,0 кв.м., лоджия остеклена двойным стеклопакетом -8,7 кв.м. Квартира с евроремонтом - новая стяжка , новая проводка , стены выравнивались !<br>- в двух комнатах сделана шумоизоляция стен, теплый пол в ванной комнате!<br>- по всей квартире применены только качественные материалы :<br>- потолок - матовый сатин бесшовный с точечными светильниками,<br>- пол - белый дуб 12 мм 33 класс от ЕGGЕR (Германия ) ,<br>- стены - итальянские обои постельных тонов ,<br>- с/у - кафель и сан.фаянс от известных брендов ,<br>- входная дверь - антивандальная высокой надежности от взлома - ЗЕВС-Z6,<br>- в квартире остается вся мебель(изготовлена на заказ ) со встроенной техникой (TЕKА Германия). Во дворе дома находится детский сад «Колосок», (сдан в декабре 2019 г.), рядом 13-ый лицей, храм, 2 магазина  Мария-Ра  и  Магнит , конечная остановка общественного транспорта. Строится ещё одна большая школа. В непосредственной близости: Армада, дендропарк им. И.И. Синягина, лес, лыжня. Есть открытая парковка перед домом, а так же во дворе есть многоуровневая.<br>На 1-м этаже дома расположены: оптика, Белорусские продукты, кондитерская, пиццерия, овощи и фрукты. Один собственник. Обременений нет.<br>При звонке, пожалуйста, назовите номер объявления - 113 412<br>Консультируем подробно по телефону.",74 м²,,,,,,8/15,74 м²,74.0,8,28,2943674858,Sale,/2-komnatnaya-kvartira-na-prodazhu-krasnoobsk-2943674858,,6 400 000 ₽,86 486 ₽ за м²,86486,6400000,Apartment,2020-10-20T12:23:50.425747Z,78,Listing,2,2.0,2020-12-20T05:26:18.587565+03:00,2016452354,2020-10-20T15:14:18.898434+03:00,2020-12-06T15:40:33.460743+03:00,,,,,"2-комн. квартира, 74 м², 8/15 эт.",2020-12-06T12:50:21.215645Z
"Новосибирск, Охотская улица, 88/2",152810530,Центральное агентство недвижимости,Resale,3285,2020-10-20T12:27:17.012616Z,"Дом сдан.  Предлогается к продаже полноценная трешка. Ключи на руках получили 24.09..2020. Подходит под ипотеку. Вид на озеро. Окна на обе стороны,  7,9 км до пл. Калинина, 30 минут до пл. Ленина. <br>   В Эволюции реализуется принцип интеграции жилого пространства в окружающую, нетронутую человеком природную среду. Ледник, сосновый бор и озеро составили неповторимый рельеф площадки под дома. Обычно строители сравнивают перепады высот, но мы развили идею присутствия человека в природе. Дома  встроены  в ландшафт, используется темная, естественная тональность кирпича, выполненного баварской кладкой и  камуфлирующего  в пространстве, озеро является сердцем композиции, эпицентр зоны отдыха - автомобилям физически не попасть в эту зону, перепады высот преобразованы в ступени для отдыха, скамейки также встроены в окружающую среду. Здесь нет обыденных детских горок, вместо этого мы предлагаем окунуться в атмосферу естественности и комфорта в вопросе реализации мест релаксации взрослых и детей.<br>           Территория жилого комплекса «Эволюция» огорожена и находится под круглосуточным видеонаблюдением.<br>Особую безопасность детям дарит двор, в который машины попасть физически не могут.<br>Оборудованы КПП для въезда на территорию ЖК, организована круглосуточная охрана силами Управляющей компании.          <br>Помощь в получении ипотеки.<br>8 маршрутов общественного транспорта<br>При звонке, пожалуйста, назовите номер объявления - 112 844<br>Консультируем подробно по телефону.",77 м²,,,,,653.0,10/12,77 м²,77.0,10,10,2943679990,Sale,/3-komnatnaya-kvartira-na-prodazhu-novosibirsk-2943679990,,6 050 000 ₽,78 571 ₽ за м²,78571,6050000,Apartment,2020-10-20T12:27:17.012616Z,78,Listing,3,3.0,2020-12-20T05:26:18.571335+03:00,2016086410,2020-10-20T15:14:12.724479+03:00,2020-12-07T05:23:59.845425+03:00,,,,,"3-комн. квартира, 77 м², 10/12 эт.",2020-12-07T02:34:12.401361Z
"Новосибирск, улица Бориса Богаткова, 171",152810530,Центральное агентство недвижимости,Resale,3285,2020-10-20T12:23:49.022343Z,"Квартира в 500 метрах от метро Золотая Нива. Просторный двор с парковочными местами. В шаговой доступности две школы №№ 189,11  детские сады №№ 453,490, медицинский центр. Дом после капитального ремонта.В подъезде чисто, установлены  пластиковые окна. Квартира расположена на комфортном этаже.Соседи замечательные.Обслуживает дом УК Октябрьская .<br>Рассмотрим варианты обмена на квартиру меньшей площади в районе педагогического института.Так же предлагаем, капитальный гараж 20 м2 во дворе дома, за отдельную плату.<br> Ждем вас на просмотр.<br>При звонке, пожалуйста, назовите номер объявления - 113 401<br>Консультируем подробно по телефону.",60 м²,,,,,650.0,4/5,60 м²,60.0,4,15,2943674819,Sale,/4-komnatnaya-kvartira-na-prodazhu-novosibirsk-2943674819,272.0,4 100 000 ₽,68 333 ₽ за м²,68333,4100000,Apartment,2020-10-20T12:23:49.022343Z,78,Listing,4,4.0,2020-12-20T05:26:18.758924+03:00,2016728990,2020-10-20T15:14:19.070492+03:00,2020-12-07T05:24:00.684686+03:00,0.548,272.0,#008000,Золотая Нива,"4-комн. квартира, 60 м², 4/5 эт.",2020-12-07T02:34:21.48817Z
"Новосибирск, улица Краузе, 21/1",152810530,Центральное агентство недвижимости,Resale,3285,2020-09-16T01:57:37.932282Z,"В продаже просторная, светлая, уютная полноценная однокомнатная квартира, расположенная в экологически чистом районе города Новосибирска. <br>Высокоразвитая инфраструктура, все в шаговой доступности: школа, детский садик, различная сеть магазинов, супермаркетов, аптек, отделений банков, почтовое отделение. Остановка общественного транспорта во все направления города. <br>В квартире выполнен высококачественный ремонт из дорогих материалов. Установлена качественная, стальная  водная дверь, а так же хорошая межкомнатная дверь и дверь в сан. узле. Сан. узел плитка кафель, новая дорогая сан. техника. В коридоре встроенный просторный шкаф-купе. Кухня встроенный кухонный гарнитур под заказ. Застекленная лоджия (пластик), есть шкаф под различные предметы обихода. Все выполнено качественно, вложений пракически не требуется никаких. Готовы вести диалог по поводу мебели. <br>Просмотр в удобное для Вас время. Дополнительно консультируем по телефону. <br>При звонке, пожалуйста, назовите номер объявления - 112 837<br>Консультируем подробно по телефону.",37 м²,,,,,648.0,13/17,37 м²,37.0,13,18,2865896643,Sale,/1-komnatnaya-kvartira-na-prodazhu-novosibirsk-2865896643,,3 290 000 ₽,88 919 ₽ за м²,88919,3290000,Apartment,2020-09-16T01:57:37.932282Z,78,Listing,1,1.0,2020-12-20T05:26:31.792238+03:00,1984337400,2020-09-16T04:48:08.354125+03:00,2020-12-07T05:23:59.50553+03:00,,,,,"1-комн. квартира, 37 м², 13/17 эт.",2020-12-07T02:34:03.112669Z
