address,agencyId,agencyName,apartmentSaleType,cityId,createdAt,description,details,developmentId,developmentName,developmentParentId,developmentParentName,districtId,floor,floorArea,floorAreaCalculated,floorInt,galleryImagesCount,id,itemType,itemUrl,metroId,price,pricePerArea,pricePerAreaValue,priceValue,propertyType,publishDate,regionId,resultType,rooms,roomsOrdinal,sourceFinishTime,sourceId,sourceStartTime,sourceUpdateTime,station_distance,station_id,station_lineColors,station_name,title,updatedAt
,162753784,"Микрорайон «Европейский берег», застройщик Брусника",New,3285,2020-11-14T13:18:12.345295Z,"Квартира с объединенной кухней-гостиной и одной спальней в микрорайоне «Европейский Берег». <br>                  ОБЪЯВЛЕНИЕ ОТ ЗАСТРОЙЩИКА<br>Квартиру можно купить онлайн.<br>Однокомнатная квартира в ЖК «Европейский Берег» в 15 минутах от метро «Речной вокзал» — это квартира с объединённой кухней-гостиной и отдельной спальней. Однокомнатная может быть укомплектована балконом или тёплой лоджией, где удобно организовать рабочее место. В квартирах также спроектированы дополнительные помещения — гардеробные или ниши под хранение, второй санузел, постирочная. Купить однокомнатную квартиру в Октябрьском районе Новосибирска выгодно напрямую от застройщика «Брусника. Сибакадемстрой».<br>На сдаче в 1-комнатных «Европейского Берега» выполнена отделка под чистовую. Установлена надёжная сейф-дверь. В каждой квартире — приборы учёта, радиаторы, розетки и выключатели, разводка отопления и электрики. Стены в студиях оштукатурены. Пол готов к финишному покрытию — ламинату, линолеуму, плитке.<br>ЖК «Европейский Берег» расположен на берегу Оби, между двумя мостами — Коммунальным и Бугринским, 15 минут на автомобиле по улице Большевистской до метро «Речной вокзал». В «Европейском Береге» построено 22 дома и проживает 5 000 семей. Внутри микрорайона расположен детский сад на 320 мест, открыты магазины, аптеки, кафе. Предусмотрено место под строительство школы и второго детского сада.<br>Сейчас в «Европейском Береге» ведётся строительство домов от 6 до 25 этажей на береговой линии ЖК вдоль улицы Владимира Заровного: три закрытых квартала с камерным двором-садом, две башни-доминанты и один сблокированный дом. Под строящимися домами «Европейского Берега» спроектированы подземные паркинги, в цокольных этажах — кладовые помещения. <br>Купить 1-комнатную квартиру в новостройках ЖК «Европейский Берег» в Октябрьском районе можно с помощью программ покупки от застройщика «Брусника. Сибакадемстрой»:<br>— ипотека с отсрочкой платежей на год от ПАО Сбербанк;<br>— беспроцентная рассрочка на 1-комнатные в «Европейском Береге»;<br>— обмен своей квартиры на однокомнатную в новостройках на набережной Оби;<br>— возможность заказать отделку и оформить её вместе с 1-комнатной квартирой в ипотеку;<br>— бесплатный юридический сервис по оформлению квартиры.<br>Получить одобрение ипотеки или рассрочку, а также осуществить обмен квартиры можно онлайн. Запишитесь на онлайн презентацию по телефону или на сайте.<br>            № квартиры в нашей базе: НСК19833.",54 м²,23887.0,Микрорайон «Европейский Берег»,23887.0,Микрорайон «Европейский Берег»,650.0,5/8,54 м²,54.0,5,12,3005862092,Sale,/1-komnatnaya-kvartira-na-prodazhu-novosibirsk-3005862092,265.0,4 400 000 ₽,81 481 ₽ за м²,81481,4400000,Apartment,2020-11-14T13:18:12.345295Z,78,Listing,1,1.0,2020-12-14T16:09:10.364234+03:00,2038615605,2020-11-14T16:08:48.277567+03:00,2020-11-26T07:14:36.097745+03:00,2.997,265.0,#FF0000,Речной вокзал,"1-комн. квартира, 54 м², 5/8 эт.",2020-11-26T05:30:07.118102Z
"Новосибирск, Ленинский район, микрорайон Дивногорский, улица Романтиков, 2",23367994,Компания «ЭТАЖИ»,Resale,3285,2020-06-20T00:26:50.973763Z,"Продается замечательная трехкомнатная студия в микрорайоне «Дивногорский» − семейном микрорайоне, расположенном рядом с Димитровским мостом, на Левом берегу Оби.<br>Дом сдан в 2017 году, что подразумевает минимальный износ коммуникаций и жилых помещений. Отделка от застройщика ""под ключ"": выровненные стены, натяжные потолки с энергосберегающими точечными светильниками, межкомнатные двери. Лоджия застеклена, пол вымощен плиткой. Микроклимат благоприятный: летом прохладно (работает вентиляция), зимой тепло. Окна выходят на обе стороны - на парковку (во двор) и на проезжую часть. Из лоджии открывается живописный вид на правый берег.<br>В доме есть консьерж. Собственная управляющая компания.<br>При продаже частично остается современная мебель и бытовая техника (по договоренности).<br>Придомовая территория постоянно облагораживается. В проекте – дополнительные спортивные зоны, фитнес-центр, школа, магазины и другое. На территории запроектирован парк отдыха с пешими, велосипедными и скейт-дорожками для прогулок всей семьей. Ваши дети с удовольствием будут проводить время на уютных безопасных площадках.<br>Рядом с домом располагаются остановка общественного транспорта (несколько маршрутов до площади Маркса), торговый центр, детский сад ""Егорка"". <br>Документы готовы, один собственник. Обременений нет.<br>Звоните!. Номер в базе: 4346194. Район: Ленинский.",53.6 м²,,,,,654.0,8/12,53.6 м²,53.6,8,20,2651938103,Sale,/3-komnatnaya-kvartira-na-prodazhu-novosibirsk-2651938103,,3 470 000 ₽,64 739 ₽ за м²,64739,3470000,Apartment,2020-06-20T00:26:50.973763Z,78,Listing,3,3.0,2020-12-16T11:16:57.995221+03:00,1944118233,2020-06-19T14:13:26.978548+03:00,2020-11-18T13:10:57.505264+03:00,,,,,"3-комн. квартира, 53.6 м², 8/12 эт.",2020-11-18T10:20:37.00309Z
"Новосибирск, улица Красина, 54/1",74870606,Елена,Resale,3285,2020-11-18T05:13:39.080494Z,"Продаётся отличная квартира по линии метро! <br>Сделан современный ремонт. В квартире полностью остаётся вся мебель и бытовая техника. Для комфортной жизни. Заходи и живи.<br>Тихий двор, спокойные соседи. Из окна открывается красивый вид. Поблизости вся инфраструктура: магазины, ТЦ, школа, поликлиники, парк Берёзовая роща.Удобная транспортная развязка, рядом станции метро Берёзовая роща, Золотая Нива, а так же автобусные остановки.<br>ТОЛЬКО НАЛИЧНЫЙ РАСЧЁТ",48 м²,,,,,651.0,13/17,48 м²,48.0,13,8,3014231558,Sale,/2-komnatnaya-kvartira-na-prodazhu-novosibirsk-3014231558,271.0,3 300 000 ₽,68 750 ₽ за м²,68750,3300000,Apartment,2020-11-18T05:13:39.080494Z,78,Listing,2,2.0,2020-12-18T08:05:47.670954+03:00,2027985971,2020-11-18T08:02:39.829349+03:00,2020-11-21T14:11:08.233967+03:00,0.57,271.0,#008000,Берёзовая роща,"2-комн. квартира, 48 м², 13/17 эт.",2020-11-21T11:20:32.939899Z
"ул. Владимира Заровного, д. 22",162753784,"Микрорайон «Европейский берег», застройщик Брусника",New,3285,2019-06-13T00:32:13.431525Z,"Квартира с объединенной кухней-гостиной и тремя спальнями в микрорайоне «Европейский Берег». <br>                  ОБЪЯВЛЕНИЕ ОТ ЗАСТРОЙЩИКА<br>Квартиру можно купить онлайн.<br>Трёхкомнатная квартира в ЖК «Европейский Берег» в 15 минутах от метро «Речной вокзал» — это квартира с объединённой кухней-гостиной и тремя спальнями. В «Европейском Береге» можно купить 3-комнатную квартиру с собственной террасой, тёплой лоджией или открытым балконом. В квартирах также спроектированы дополнительные помещения — гардеробные или ниши под хранение, второй санузел, постирочная. Есть особенные квартиры увеличенной площади с несколькими балконами и летними террасами. Купить 3-комнатную квартиру в Октябрьском районе Новосибирска выгодно напрямую от застройщика «Брусника. Сибакадемстрой».<br>На сдаче в 3-комнатных от застройщика «Брусника. Сибакадемстрой» выполнена отделка под чистовую. Установлена надёжная сейф-дверь. В каждой квартире — приборы учёта, радиаторы, розетки и выключатели, разводка отопления и электрики. Стены в студиях оштукатурены. Пол готов к финишному покрытию — ламинату, линолеуму, плитке.<br>ЖК «Европейский Берег» расположен на берегу Оби, между двумя мостами — Коммунальным и Бугринским, 15 минут на автомобиле по улице Большевистской до метро «Речной вокзал». В «Европейском Береге» построено 22 дома и проживает 5 000 семей. Внутри микрорайона расположен детский сад на 320 мест, открыты магазины, аптеки, кафе. Предусмотрено место под строительство школы и второго детского сада.<br>Сейчас в «Европейском Береге» ведётся строительство домов от 6 до 25 этажей на береговой линии ЖК вдоль улицы Владимира Заровного: три закрытых квартала с камерным двором-садом, две башни-доминанты и один сблокированный дом. Под строящимися домами «Европейского Берега» спроектированы подземные паркинги, в цокольных этажах — кладовые помещения. В продаже в ЖК «Европейский Берег» есть квартиры со сдачей в 4 квартале 2020 и 2021.<br>Купить трёхкомнатную квартиру в ЖК «Европейский Берег» в Октябрьском районе Новосибирска выгодно напрямую от застройщика «Брусника. Сибакадемстрой»:<br>— ипотека с отсрочкой платежей на год от ПАО Сбербанк;<br>— беспроцентная рассрочка на 3-комнатные в «Европейском Береге»;<br>— обмен своей квартиры на трёхкомнатную в новостройках на набережной Оби;<br>— возможность заказать отделку и оформить её вместе с 3-комнатной квартирой в ипотеку;<br>— бесплатный юридический сервис по оформлению квартиры.<br>Получить одобрение ипотеки или рассрочку, а также осуществить обмен квартиры можно онлайн. Запишитесь на онлайн презентацию по телефону или на сайте.<br>            № квартиры в нашей базе: НСК1072.",135.6 м²,23887.0,Микрорайон «Европейский Берег»,23887.0,Микрорайон «Европейский Берег»,650.0,24/25,135.6 м²,135.6,24,16,1509705159,Sale,/3-komnatnaya-kvartira-na-prodazhu-novosibirsk-1509705159,265.0,12 900 000 ₽,95 133 ₽ за м²,95133,12900000,Apartment,2019-06-13T00:32:13.431525Z,78,Listing,3,3.0,2020-12-16T18:30:41.671422+03:00,1231001465,2019-06-12T06:20:20.31163+03:00,2020-12-01T10:33:06.127411+03:00,2.649,265.0,#FF0000,Речной вокзал,"3-комн. квартира, 135.6 м², 24/25 эт.",2020-12-01T07:42:40.991834Z
"Новосибирская область, Кочковский район, село Кочки, Пушкинская улица, 62",163876132,Елена,Resale,3245,2020-08-24T10:55:11.83865Z,"Квартира в двухквартирном одноэтажном деревянном жилом доме в с.Кочки, улица Пушкинская 62. Общая площадь - 81,4 кв.м.. жилая площадь - 51,9 кв.м, 4 комнаты, площадь кухни - 9,3 кв.м., печное и электрическое отопление, надворные постройки, земельный участок 2000 кв.м., сад.",81.4 м²,,,,,,1/1,81.4 м²,81.4,1,6,2812339276,Sale,/4-komnatnaya-kvartira-na-prodazhu-kochki-2812339276,,2 500 000 ₽,30 713 ₽ за м²,30713,2500000,Apartment,2020-08-24T10:55:11.83865Z,78,Listing,4,4.0,2020-12-19T08:13:25.496864+03:00,1986901227,2020-08-24T13:43:01.725699+03:00,2020-11-19T08:13:25.496864+03:00,,,,,"4-комн. квартира, 81.4 м², 1/1 эт.",2020-11-19T05:22:28.513655Z
"Новосибирск, Большевистская улица, 126",78280275,Екатерина,Resale,3285,2020-11-15T11:39:03.338058Z,"Замечательная, теплая, уютная, просторная квартира в микрорайоне ""Европейский берег"". Ремонт выполнен качественно. На полу всей квартиры ламинат. Отдельная просторная прихожая со встроенным шкафом с зеркальными дверями. Широкие коридоры между комнатами. А сами комнаты правильной прямоугольной формы, что позволит разместить все имущество и провести зонирование пространства. На кухне фартук выложен плиткой. С кухни есть выход на лоджию. Вторая лоджия в спальне. В сан узлах установлена хорошая сантехника, уложена напольная плитка, установлен теплый пол, также останется встроенный шкаф с раздвижными дверями и водонагреватель на 100 литров. Квартира на 2 стороны. <br>На районе развитая инфраструктура - здесь и детские сады и школа (сдача в 2021 году), которая планируется инновационной по качеству организации учебного процесса. Много разнообразных магазинов, и сетевых, типа мария-ра, и специфических - рыбные, мясные. Уникальный магазин канцелярии, у нас называют своей Грецией, там можно найти всё что угодно и даже больше. А также пекарни, кафе, кофейни, парикмахерские и прочее, прочее, прочее. Отдельно отмечу закрытые дворы, парковки только снаружи. Внутри безопасное пространство для прогулок и игр. Огромное разнообразие площадок и детских и спортивных. Единая система доступа во дворы. Все благоустроено и облагорожено. Много зелени. И бонусом - собственная набережная с парковой зоной и детской площадкой в эко-стиле. <br>Сотрудничаем с Агентством Недвижимости, сделка при участии агенства недвижимости.",82.1 м²,,,,,650.0,2/10,82.1 м²,82.1,2,21,3007688902,Sale,/3-komnatnaya-kvartira-na-prodazhu-novosibirsk-3007688902,265.0,8 700 000 ₽,105 968 ₽ за м²,105968,8700000,Apartment,2020-11-15T11:39:03.338058Z,78,Listing,3,3.0,2020-12-15T14:29:59.861711+03:00,2033457502,2020-11-15T14:29:35.857755+03:00,2020-11-30T02:54:50.41125+03:00,3.088,265.0,#FF0000,Речной вокзал,"3-комн. квартира, 82.1 м², 2/10 эт.",2020-11-30T00:04:15.397494Z
"ул. 1-я Чулымская, д. 112/8, блок-секц. 1-3",8513063,Татьяна,New,3285,2020-11-18T05:22:50.027574Z,"Продам 1к студию в ЖК Ясный берег Дом-Волна. Дом построен в 2020 г, материал стен кирпич. Первый в России дом построенный по данной технологии. Дом на этапе сдачи в вода в эксплуатацию, получение ключей в декабре 2020г. Цена указана на этапе стройки, после сдачи цена будет выше.",27 м²,36449.0,ЖК «Ясный берег»,36449.0,ЖК «Ясный берег»,654.0,9/26,27 м²,27.0,9,6,3014242572,Sale,/1-komnatnaya-kvartira-na-prodazhu-novosibirsk-3014242572,268.0,2 700 000 ₽,100 000 ₽ за м²,100000,2700000,Apartment,2020-11-18T05:22:50.027574Z,78,Listing,1,1.0,2020-12-18T08:13:48.969998+03:00,2021513550,2020-11-18T08:13:29.623882+03:00,2020-11-30T12:19:36.067596+03:00,2.453,268.0,#008000,Площадь Гарина-Михайловского,"1-комн. квартира, 27 м², 9/26 эт.",2020-11-30T09:30:03.997025Z
"рабочий посёлок Сузун, Сузунский район, Новосибирская область, улица Братьев Поповых, 34",146621028,Роман Солдатов,Resale,3264,2019-02-05T20:13:43.860565Z,"Продам или обменяю на квартиру в Новосибирске или Бердске, квартиру в центре Сузуна. Рядом школа, детский сад, много магазинов, аптеки, автовокзал, остановки 3 маршрутов автобусов, центральная площадь, набережная, музейный комплекс. Квартира очень теплая. Отличный вид из окон на 2 стороны дома. Большая кухня. Имеется подсобное помещение в подвале. В квартире установлены пластиковые окна, водонагреватель.<br>Рассмотрим любые варианты по обмену и оплате.<br>Торг.",60 м²,,,,,,5/5,60 м²,60.0,5,7,263656465,Sale,/3-komnatnaya-kvartira-na-prodazhu-suzun-263656465,,1 950 000 ₽,32 500 ₽ за м²,32500,1950000,Apartment,2019-02-05T20:13:43.860565Z,78,Listing,3,3.0,2020-12-19T08:18:51.265094+03:00,1611552655,2019-01-23T18:20:06.130025+03:00,2020-12-01T16:25:35.217231+03:00,,,,,"3-комн. квартира, 60 м², 5/5 эт.",2020-12-01T13:41:44.892303Z
"Новосибирск, улица Сакко и Ванцетти, 77",23367994,Компания «ЭТАЖИ»,Resale,3285,2019-10-30T01:03:21.123314Z,"Срочная продажа!!!Предлагается к продаже 3-к квартира.Удачное месторасположение.Все необходимое рядом:магазины,супермаркеты,метро ""Октябрьская""в пешей доступности.Данный вариант можно рассматривать для покупки -как для жилья и так и для офисного помещения.Есть дизайн-проект. Вы можете внести в дизайн собственные коррективы и сделать эту квартиру максимально удобной для себя.Шикарный вид из окна.Документы готовы,любой расчет.Приглашаем на просмотр!. Номер в базе: 3567751. Район: Октябрьский.",72.6 м²,,,,,650.0,22/22,72.6 м²,72.6,22,20,1960154866,Sale,/3-komnatnaya-kvartira-na-prodazhu-novosibirsk-1960154866,264.0,6 200 000 ₽,85 399 ₽ за м²,85399,6200000,Apartment,2019-10-30T01:03:21.123314Z,78,Listing,3,3.0,2020-12-18T16:14:26.655551+03:00,1848350669,2019-10-29T06:34:57.430063+03:00,2020-12-06T13:06:50.124326+03:00,0.552,264.0,#FF0000,Октябрьская,"3-комн. квартира, 72.6 м², 22/22 эт.",2020-12-06T10:16:18.447292Z
"Новосибирск, улица Кирова, 225",23367994,Компания «ЭТАЖИ»,Resale,3285,2020-08-10T08:22:29.170976Z,"К продаже представлена квартира-студия на пятом этаже. Квартира со свежем ремонтом. Никто не проживал. За домом располагается детский сад, в радиусе 600 метров две школы (Средняя школа № 2 и №75) и два детских сада №449 и 303. В 220 метрах остановка общественного транспорта, до станции метро Октябрьская 4 остановки. Аптеки, магазины продуктовые и остальные - в шаговой доступности. Один взрослый собственник, без обременений. Приглашаем на просмотр.. Номер в базе: 4528952. Район: Октябрьский.",34 м²,,,,,650.0,5/17,34 м²,34.0,5,16,2777314669,Sale,/kvartira-na-prodazhu-novosibirsk-2777314669,265.0,3 450 000 ₽,101 471 ₽ за м²,101471,3450000,Apartment,2020-08-10T08:22:29.170976Z,78,Listing,Студия,,2020-12-18T16:14:35.618033+03:00,1976225427,2020-08-10T11:12:57.934206+03:00,2020-11-21T16:19:27.302415+03:00,1.861,265.0,#FF0000,Речной вокзал,"Квартира-студия, 34 м², 5/17 эт.",2020-11-21T14:29:32.593686Z
