address,agencyId,agencyName,apartmentSaleType,cityId,createdAt,description,details,developmentId,developmentName,developmentParentId,developmentParentName,districtId,floor,floorArea,floorAreaCalculated,floorInt,galleryImagesCount,id,itemType,itemUrl,metroId,price,pricePerArea,pricePerAreaValue,priceValue,propertyType,publishDate,regionId,resultType,rooms,roomsOrdinal,sourceFinishTime,sourceId,sourceStartTime,sourceUpdateTime,station_distance,station_id,station_lineColors,station_name,title,updatedAt
"ул. Хилокская, д. 1б",26122625,Марина,New,3285,2020-11-17T10:57:23.984365Z,"Дом на стадии сдачи и оформления документов. Происходит выдача ключей и можно заходить на ремонт. Квартира под самоотделку. Продажа по переуступке прав. Жилой комплекс в Ленинском районе на пересечении улиц Хилокская и Толмачевская – это оптимальное соотношение цены и качества для тех, кто ищет хорошее решение квартирного вопроса. Так же имеются и 2х-комнатная и 3х-комнатная в этом доме на 10 этаже.",34.4 м²,67123.0,ЖК «Хороший»,67123.0,ЖК «Хороший»,654.0,1/10,34.4 м²,34.4,1,13,3012593271,Sale,/1-komnatnaya-kvartira-na-prodazhu-novosibirsk-3012593271,267.0,1 600 000 ₽,46 512 ₽ за м²,46512,1600000,Apartment,2020-11-17T10:57:23.984365Z,78,Listing,1,1.0,2020-12-17T13:48:22.98173+03:00,2047596003,2020-11-17T13:48:01.434278+03:00,2020-11-23T07:03:06.030038+03:00,4.584,267.0,#FF0000,Площадь Маркса,"1-комн. квартира, 34.4 м², 1/10 эт.",2020-11-23T04:12:27.280689Z
"Новосибирск, улица Одоевского, 1/4",18526757,"Агентство недвижимости ""ЖИЛФОНД""",Resale,3285,2020-11-16T04:40:39.571466Z,"Обратите внимание!!!!!! В этом доме крайне редко продают квартиры. Полноценная , большая 56 кв. с учетом лоджии 3 кв.м, с хорошим ремонтом двух комнатная квартира, комфортный 3 этаж.,лоджия утеплена,застеклена,проведён свет,остаётся кухонный гарнитур(новый).Новый, активно развивающийся микрорайон находится в экологически чистом р-не города - рядом лес, дачи, всегда свежий воздух. Придомовая территория просторная как для прогулок и игр с детьми, так и для парковки машины. Вся инфраструктура в пешей доступности: новые д/сад и школа, гимназия №8, сбербанк, поликлиника, мед.центры, супермаркеты и т.д. Остановка транспорта в 3-5 минутах ходьбы. До Академгородка, Ж/Д Новосибирск Главный, Метро пл.Маркса, ИКЕЯ можно доехать без пересадок и в 5 минутах езды станция Матвеевка.<br>Приглашаем на просмотр в удобное для Вас время.",53 м²,,,,,657.0,3/5,53 м²,53.0,3,8,3009007931,Sale,/3-komnatnaya-kvartira-na-prodazhu-novosibirsk-3009007931,,3 850 000 ₽,72 642 ₽ за м²,72642,3850000,Apartment,2020-11-16T04:40:39.571466Z,78,Listing,3,3.0,2020-12-16T07:31:59.405238+03:00,2019411899,2020-11-16T07:30:08.450507+03:00,2020-11-16T07:35:56.917171+03:00,,,,,"3-комн. квартира, 53 м², 3/5 эт.",2020-11-16T04:44:58.014556Z
"Новосибирск, улица Виктора Шевелёва, 18/1",23367994,Компания «ЭТАЖИ»,Resale,3285,2020-10-15T03:10:13.512791Z,"Продается отличная светлая квартира .Окна выходят на две стороны.В квартире сделан качественный ремонт,что позволяет сразу жить.Остается в квартире встроенный шкаф ,кухонный гарнитур с встроенной техникой ,диван и щкаф в спальне.Рядом с домом детская площадка,остановка в минуте от дома.В шаговой доступности детский сад №54 и два частных детских сада.Открыта новая детская школа №217.В 15 минутах Лесопарк имени Синягина ,велопрогулки,лыжи,много ягод и грибов .Много продуктовых магазинов :в цоколе один ,тд плющихинский,все для вас,магазин продовольственных продуктов и. т.д Квартира без обрименения,подходит под ипотеку готовы к продаже.. Номер в базе: 4774319. Район: Кировский.",58.1 м²,,,,,655.0,8/10,58.1 м²,58.1,8,20,2930751799,Sale,/3-komnatnaya-kvartira-na-prodazhu-novosibirsk-2930751799,,3 400 000 ₽,58 520 ₽ за м²,58520,3400000,Apartment,2020-10-15T03:10:13.512791Z,78,Listing,3,3.0,2020-12-16T15:02:48.20814+03:00,2040590706,2020-10-15T06:00:43.05395+03:00,2020-11-27T13:06:03.960282+03:00,,,,,"3-комн. квартира, 58.1 м², 8/10 эт.",2020-11-27T10:15:47.35424Z
"Новосибирск, улица Кирова, 338",23367994,Компания «ЭТАЖИ»,Resale,3285,2020-10-17T03:29:25.923564Z,"Срочная продажа!!! Только до 13 декабря снижение цены!<br>В продаже полноценная двухкомнатная квартира в экоквартале Ключевой. Кухня, на которой можно и поработать, и кофеёк попить; просторный зал и уютная спальня; отдельная прачечная, которую при желании можно переделать в гостевой санузел; две застекленные лоджии (выходят на парковку и во двор), высокий первый этаж - это далеко не все достоинства данной квартиры.<br>Собственная тепловая система, что позволяет регулировать отопление по собственному желанию, плановые отключения горячей воды отсутствуют. <br>Тёплые водяные полы в прихожей и на кухне, новый кондиционер и ионизатор воздуха.<br>В квартире выполнен свежий ремонт с использованием европейских строительных материалов, установлена качественная встроенная бытовая техника (газовая плита, духовой шкаф, посудомоечная машина, холодильник); квартира полностью готова для проживания.<br>Большая парковка для жильцов, круглосуточная охрана, видеонаблюдение, закрытый двор (заезд только по пропускам, включая доставки и такси). Хорошие, спокойные соседи.<br>На территории ЖК имеется спортивная площадка, детская площадка, зона отдыха с фонтаном, магазин.<br>Район отличается тишиной, чистым воздухом и близостью к сосновому бору, при этом находится недалеко от центра города.. Номер в базе: 4762454. Район: Октябрьский.",73 м²,,,,,650.0,1/4,73 м²,73.0,1,20,2935883975,Sale,/2-komnatnaya-kvartira-na-prodazhu-novosibirsk-2935883975,,6 200 000 ₽,84 932 ₽ за м²,84932,6200000,Apartment,2020-10-17T03:29:25.923564Z,78,Listing,2,2.0,2020-12-16T15:02:48.43589+03:00,2040281244,2020-10-17T06:19:57.556661+03:00,2020-11-24T19:08:21.434642+03:00,4.799,265.0,#FF0000,Речной вокзал,"2-комн. квартира, 73 м², 1/4 эт.",2020-11-24T16:17:56.325313Z
"Красный пр-т, стр. 167 корп. 2",71368327,Открытый Город,New,3285,2020-09-04T07:14:25.713191Z,"Класс «Комфорт+»<br>Жилой комплекс «Расцветай на Красном» - один из крупнейших проектов, реализуемых в Новосибирске.<br>Расположен в «тихом центре», в 5 минутах ходьбы от станции метро «Заельцовская» и пл. Калинина – крупнейшей транспортной и инфраструктурной развязки города.<br>Первая очередь жилого комплекса состоит из трех монолитно- кирпичных домов: 18, 25 и 12 этажей с общей подземной парковкой.<br>На первых этажах будут располагаться коммерческие помещения для создания собственной инфраструктуры комплекса: офисы, магазины, аптеки, салоны красоты, спортивные центры. Также проектом предусмотрены детский сад и школа.<br>Придомовое пространство комплекса – это тихий двор без машин и безопасное проживание. Территория огорожена, оборудована детскими площадками, развивающими игровыми зонами и местами для отдыха.<br>Открыты продажи квартир в домах № 1, № 2, № 8.<br>Срок сдачи - 1 кв. 2023г.<br>Комиссия агентства 0 %.",80.7 м²,1027262785.0,ЖК «Расцветай на Красном» ,1027262785.0,ЖК «Расцветай на Красном» ,653.0,4/25,80.7 м²,80.7,4,7,2838070801,Sale,/3-komnatnaya-kvartira-na-prodazhu-novosibirsk-2838070801,260.0,6 700 000 ₽,83 024 ₽ за м²,83024,6700000,Apartment,2020-09-04T07:14:25.713191Z,78,Listing,3,3.0,2020-12-16T07:38:45.548636+03:00,1989182649,2020-09-04T10:05:01.962504+03:00,2020-11-23T06:52:19.994282+03:00,0.479,260.0,#FF0000,Заельцовская,"3-комн. квартира, 80.7 м², 4/25 эт.",2020-11-23T04:01:20.793341Z
"Красный пр-т, стр. 167 корп. 2",71368327,Открытый Город,New,3285,2020-09-04T07:13:18.397196Z,"Класс «Комфорт+»<br>Жилой комплекс «Расцветай на Красном» - один из крупнейших проектов, реализуемых в Новосибирске.<br>Расположен в «тихом центре», в 5 минутах ходьбы от станции метро «Заельцовская» и пл. Калинина – крупнейшей транспортной и инфраструктурной развязки города.<br>Первая очередь жилого комплекса состоит из трех монолитно- кирпичных домов: 18, 25 и 12 этажей с общей подземной парковкой.<br>На первых этажах будут располагаться коммерческие помещения для создания собственной инфраструктуры комплекса: офисы, магазины, аптеки, салоны красоты, спортивные центры. Также проектом предусмотрены детский сад и школа.<br>Придомовое пространство комплекса – это тихий двор без машин и безопасное проживание. Территория огорожена, оборудована детскими площадками, развивающими игровыми зонами и местами для отдыха.<br>Открыты продажи квартир в домах № 1, № 2, № 8.<br>Срок сдачи - 1 кв. 2023г.<br>Комиссия агентства 0 %.",72.9 м²,1027262785.0,ЖК «Расцветай на Красном» ,1027262785.0,ЖК «Расцветай на Красном» ,653.0,10/25,72.9 м²,72.9,10,5,2838065844,Sale,/3-komnatnaya-kvartira-na-prodazhu-novosibirsk-2838065844,260.0,6 500 000 ₽,89 163 ₽ за м²,89163,6500000,Apartment,2020-09-04T07:13:18.397196Z,78,Listing,3,3.0,2020-12-16T07:38:52.033108+03:00,1989852458,2020-09-04T10:01:46.707319+03:00,2020-11-23T06:52:36.988659+03:00,0.479,260.0,#FF0000,Заельцовская,"3-комн. квартира, 72.9 м², 10/25 эт.",2020-11-23T04:01:37.378817Z
