address,agencyId,agencyName,apartmentSaleType,cityId,createdAt,description,details,developmentId,developmentName,developmentParentId,developmentParentName,districtId,floor,floorArea,floorAreaCalculated,floorInt,galleryImagesCount,id,itemType,itemUrl,metroId,price,pricePerArea,pricePerAreaValue,priceValue,propertyType,publishDate,regionId,resultType,rooms,roomsOrdinal,sourceFinishTime,sourceId,sourceStartTime,sourceUpdateTime,station_distance,station_id,station_lineColors,station_name,title,updatedAt
"Новосибирск, улица Владимира Высоцкого, 139/12",101745489,Вероника,Resale,3285,2020-06-22T01:40:09.199173Z,"Большая студия с балконом! Окна очень высоко на уровне второго этажа, вид на лесную зону. Квартира расположена в отсечке. Переуступка прав! Если не беру трубку, пишите сообщение!",40 м²,,,,,650.0,1/10,40 м²,40.0,1,7,2658390859,Sale,/kvartira-na-prodazhu-novosibirsk-2658390859,,1 830 000 ₽,45 750 ₽ за м²,45750,1830000,Apartment,2020-06-22T01:40:09.199173Z,78,Listing,Студия,,2020-12-20T11:35:28.260945+03:00,1935102327,2020-06-21T08:04:42.408372+03:00,2020-11-29T03:42:53.781606+03:00,3.317,272.0,#008000,Золотая Нива,"Квартира-студия, 40 м², 1/10 эт.",2020-11-29T00:52:16.578232Z
"Новосибирская область, Чановский район, поселок Озеро-Карачи, Железнодорожная улица, 1",168782444,Василий,Resale,3247,2019-09-06T00:51:44.129511Z,продам квартиру в 4 квартирном доме окна пвх переделан пол. новая проводка. центральное отопление вода.  документы на квартиру в наличии.,44 м²,,,,,,1/1,44 м²,44.0,1,2,1783454286,Sale,/2-komnatnaya-kvartira-na-prodazhu-chany-1783454286,,450 000 ₽,10 227 ₽ за м²,10227,450000,Apartment,2019-09-06T00:51:44.129511Z,78,Listing,2,2.0,2020-12-24T07:49:01.102653+03:00,1802201416,2019-09-05T05:14:26.806532+03:00,2020-11-24T07:49:01.102653+03:00,,,,,"2-комн. квартира, 44 м², 1/1 эт.",2020-11-24T04:58:06.238382Z
"Новосибирск, улица Динамовцев, 10",152810530,Центральное агентство недвижимости,Resale,3285,2020-11-18T12:23:32.635691Z,"Квартира,снова в продаже.Квартира, одна из удачных планировок «ленинградка». В этой квартире вы можете полностью воплотить свои фантазия, где уже не придется переделывать  чужой ремонт, а можно сделать уже для «себя». Документы готовы к сделке.<br>При звонке, пожалуйста, назовите номер объявления - 71 383<br>Консультируем подробно по телефону.",44 м²,,,,,656.0,4/5,44 м²,44.0,4,3,3015442287,Sale,/2-komnatnaya-kvartira-na-prodazhu-novosibirsk-3015442287,,2 080 000 ₽,47 273 ₽ за м²,47273,2080000,Apartment,2020-11-18T12:23:32.635691Z,78,Listing,2,2.0,2020-12-18T15:14:30.943421+03:00,2016058242,2020-11-18T15:14:04.389585+03:00,2020-12-04T05:22:45.979574+03:00,,,,,"2-комн. квартира, 44 м², 4/5 эт.",2020-12-04T02:32:30.337044Z
"Новосибирск, Красный проспект, 323/12",152810530,Центральное агентство недвижимости,Resale,3285,2020-11-18T12:23:32.522134Z,"Предлагаем к продаже отличную двухкомнаьную квартиру в сданом доме, в новейшем микрорайоне с развитой инфраструктурой.<br>При звонке, пожалуйста, назовите номер объявления - 109 602<br>Консультируем подробно по телефону.",50 м²,,,,,648.0,3/9,50 м²,50.0,3,2,3015442281,Sale,/2-komnatnaya-kvartira-na-prodazhu-novosibirsk-3015442281,,3 950 000 ₽,79 000 ₽ за м²,79000,3950000,Apartment,2020-11-18T12:23:32.522134Z,78,Listing,2,2.0,2020-12-18T15:14:31.396197+03:00,2016091313,2020-11-18T15:14:04.822888+03:00,2020-12-07T05:23:43.388966+03:00,,,,,"2-комн. квартира, 50 м², 3/9 эт.",2020-12-07T02:33:55.833689Z
"ул. Немировича-Данченко, д. 167/2",163831226,Компания Елка МФЦ Недвижимость,New,3285,2020-11-16T11:54:55.180462Z,"Арт. 43786835 Продаётся по переуступке. В продаже 1-комнатная квартира класса ""Комфорт +"" от инвестора в 1 Доме ЖК ""Расцветай на Маркса"".<br>Дом сдается в этом году!<br>Жилой комплекс расположен вблизи Коммунального моста и реки Обь, а поэтому обеспечен хорошей инфраструктурой и транспортной доступностью:<br>В 7 минутах на автомобиле - будущая хоккейная ледовая арена;<br>В 8 минутах пешком - ст. метро ""Студенческая"";<br>В 10 минутах на транспорте - ТРЦ ""Мега"" с гипермаркетом ""АШАН"" и ""ИКЕА"";<br>В 15 минутах - центр города.<br>В пределах квартала находятся: торговый центр, супермаркеты, аптеки, банки, детские сады, школы, гимназии, ведущие ВУЗы, поликлиники, спортивные центры, кинотеатр и Областная больница. В ближайшей перспективе - новый парк ""Спортивный"", который будет находиться рядом с будущим ЛДС.<br>Каркас дома - монолитный железобетон с кирпичным наполнением. Наружные, внутренние стены и перегородки выполнены из полнотелого керамического кирпича, что обеспечит вам тишину и тепло для комфортного проживания.<br>Огороженная территория, видеонаблюдение, система противопожарной безопасности, охрана и двор без доступа машин - обеспечат вам безопасное пребывание внутри двора. На компактной придомовой территории имеются детские и спортивные площадки с безопасным покрытием.<br>Благоустройство двора включает пешеходные дорожки, озеленение участка кустарниками, деревьями и цветниками.<br>Для автовладельцев - теплый подземный двухуровневый паркинг, связанный лифтами с жилой частью здания.<br>Квартира полностью готова для косметического ремонта. Помещение сдается с чистовой самоотделкой и остекленной лоджией: оштукатуренными стенами, фиброцементной стяжкой пола, установленными кашированными окнами, радиаторами и качественной входной дверью.<br>Поможем получить ипотечное решение в ведущих банках-партнёрах. Осуществим полное сопровождение сделки.",45.5 м²,93361.0,ЖК «Расцветай на Маркса»,93361.0,ЖК «Расцветай на Маркса»,654.0,14/25,45.5 м²,45.5,14,9,3010120469,Sale,/1-komnatnaya-kvartira-na-prodazhu-novosibirsk-3010120469,266.0,4 500 000 ₽,98 901 ₽ за м²,98901,4500000,Apartment,2020-11-16T11:54:55.180462Z,78,Listing,1,1.0,2020-12-16T14:45:54.001485+03:00,2040497224,2020-11-16T14:45:23.089472+03:00,2020-12-07T14:29:54.475092+03:00,0.36,266.0,#FF0000,Студенческая,"1-комн. квартира, 45.5 м², 14/25 эт.",2020-12-07T11:46:56.427577Z
"Новосибирск, Бронная улица, 30/1",147244801,Отдел Продаж Недвижимости,Resale,3285,2020-11-17T03:35:43.281587Z,"В продаже просторная однокомнатная квартира под с/о. Можно заходить на ремонт. Просмотр в любое время.<br>Предлагаю приобрести вышеуказанный объект, заключить соглашение об уступке прав с правопреемником на условиях, согласованных Сторонами.<br>Приобретение объекта возможно путем вступления в жилищно-строительный кооператив и уплаты взносов (паевой, вступительный и др.). Целью ПЖСК является улучшение жилищных условий граждан. Члены ПЖСК своими средствами участвуют в строительстве, реконструкции и последующем содержании многоквартирного дома. С уставом и положениями ПЖСК можно ознакомиться в офисе агентства.",48 м²,,,,,655.0,9/10,48 м²,48.0,9,5,3011580458,Sale,/1-komnatnaya-kvartira-na-prodazhu-novosibirsk-3011580458,,1 900 000 ₽,39 583 ₽ за м²,39583,1900000,Apartment,2020-11-17T03:35:43.281587Z,78,Listing,1,1.0,2020-12-17T06:26:39.83388+03:00,2047889914,2020-11-17T06:26:19.32147+03:00,2020-12-02T06:17:03.320614+03:00,,,,,"1-комн. квартира, 48 м², 9/10 эт.",2020-12-02T03:29:57.079481Z
"Новосибирск, улица Ольги Жилиной, 31",71368327,Открытый Город,Resale,3285,2020-05-27T02:19:40.001393Z,"Продается 3-комнатная квартира в центре города. В шаговой доступности до двух станции метро. Отличная транспортная развязка и инфраструктура. Рядом несколько детских садиков и экономический лицей. Квартира после капитального ремонта, документы готовы, прописанных нет. Показ без проблем.",63 м²,,,,,649.0,3/9,63 м²,63.0,3,16,2591048031,Sale,/3-komnatnaya-kvartira-na-prodazhu-novosibirsk-2591048031,270.0,6 000 000 ₽,95 238 ₽ за м²,95238,6000000,Apartment,2020-05-27T02:19:40.001393Z,78,Listing,3,3.0,2020-12-15T09:00:24.464027+03:00,1925335970,2020-05-26T09:07:41.106175+03:00,2020-11-23T06:52:00.833383+03:00,0.505,270.0,#008000,Маршала Покрышкина,"3-комн. квартира, 63 м², 3/9 эт.",2020-11-23T04:01:01.072642Z
"ул. Центральная, стр. 1",188889653,"Жилой район «Пшеница», застройщик Брусника",New,3287,2020-09-14T13:44:31.385638Z,"Квартира с объединенной кухней-гостиной и двумя спальнями в жилом районе «Пшеница». <br>                  ОБЪЯВЛЕНИЕ ОТ ЗАСТРОЙЩИКА. Покупка квартиры защищена банком.<br>Квартиру можно купить онлайн.<br>Двухкомнатная квартира в жилом районе «Пшеница» в Краснообске — это квартира с объединенной кухней-гостиной, двумя спальнями, ванной комнатой и гостевым санузлом. Предусмотрены дополнительные ниши под хранение вещей или гардеробная и постирочная комнаты. Есть варианты планировок с французским балконом или террасой. Купить двухкомнатную квартиру выгодно напрямую от застройщика Брусника. <br>Качество бетонных стен в 2-комнатных квартирах новостроек на ВАСХНИЛе позволяет сразу наносить финишный материал для декоративной отделки. Сборка дома из готовых элементов, произведённых в условиях тёплого цеха, исключает сварку на площадке: модули здания соединены через болтовые соединения, стыки аккуратные и ровные. На полу сделана сухая стяжка. В квартирах нового ЖК «Пшеница» установлены розетки, выключатели, приборы учёта, клапан приточно-вытяжной вентиляции и механическая вытяжка. Предусмотрены выводы под сантехнику и разводка электрики. Радиаторы установлены в каждой комнате и оборудованы терморегулятором. Нет стояков, вертикальных коммуникаций и ниш с магистральными сетями. В межкомнатных стенах и полу проложена дополнительная шумоизоляция. В квартирах установлены алюминиево-деревянные окна и надёжная сейф-дверь с замком. Под окном — внутриплодный конвектор для правильной циркуляции воздуха. На входе в квартиру сделаны выводы под видеодомофон и интернет. <br>Жилой район «Пшеница» расположен в Краснообске на левом берегу Оби, на пересечении улицы Центральная и Советского шоссе. Рядом — остановки транспорта, выезды на транспортные магистрали. До Бугринского моста — 15 минут на автомобиле. В 15-20 минутах от жилого района расположен крупный ТРЦ «Мега». Внутри посёлка — лицей, школы, детские сады, больница, поликлиника, частные медицинские центры, магазины, спортивные клубы. Рядом находится лесопарк и Обское водохранилище. <br>ЖК «Пшеница» представляет собой крупный жилой район на месте «третьего кольца» ВАСХНИЛа. Это квартальная застройка домами невысокой этажности ー 4-6 и 7-9 этажей, с закрытыми от машин безопасными дворами, спортивными площадками и детскими зонами. Достопримечательность микрорайона «Пшеница» в Краснообске ー круговой зелёный бульвар. Первая очередь строительства ЖК на ВАСХНИле состоит из двух секционных домов г-образной формы 7-9 этажей, которые образуют квартал. <br>Купить двухкомнатную квартиру в Краснообске выгодно с использованием программ покупки и сервисов от застройщика Брусника: <br>— ипотека 5,85% по госпрограмме от ПАО Промсвязьбанк;<br>— ипотека с отсрочкой платежей на год от ПАО Сбербанк;<br>— беспроцентная рассрочка на квартиру;<br>— обмен своей квартиры на новую.<br>Получить одобрение ипотеки или рассрочку, а также осуществить обмен квартиры можно онлайн. Запишитесь на онлайн презентацию по телефону или на сайте.<br>            № квартиры в нашей базе: НСК3313.",85.4 м²,1027594711.0,Жилой район «Пшеница»,1027594711.0,Жилой район «Пшеница»,,9/9,85.4 м²,85.4,9,12,2862396111,Sale,/2-komnatnaya-kvartira-na-prodazhu-krasnoobsk-2862396111,,7 259 000 ₽,85 000 ₽ за м²,85000,7259000,Apartment,2020-09-14T13:44:31.385638Z,78,Listing,2,2.0,2020-12-14T06:28:23.569366+03:00,2003580330,2020-09-14T16:35:07.124457+03:00,2020-11-20T12:07:00.581542+03:00,,,,,"2-комн. квартира, 85.4 м², 9/9 эт.",2020-11-20T09:16:02.689908Z
"Новосибирск, улица Титова, 253/1",152810530,Центральное агентство недвижимости,Resale,3285,2020-11-18T12:52:13.492764Z,"В продаже студия в ЖК  Любимый . В квартире произведен ремонт. Квартира продается с мебелью и техникой.<br>При звонке, пожалуйста, назовите номер объявления - 114 937<br>Консультируем подробно по телефону.",24.8 м²,,,,,654.0,7/14,24.8 м²,24.8,7,6,3015527545,Sale,/kvartira-na-prodazhu-novosibirsk-3015527545,,2 499 000 ₽,100 766 ₽ за м²,100766,2499000,Apartment,2020-11-18T12:52:13.492764Z,78,Listing,Студия,,2020-12-18T15:43:12.283987+03:00,2016274887,2020-11-18T15:39:53.838272+03:00,2020-12-08T05:24:40.098122+03:00,,,,,"Квартира-студия, 24.8 м², 7/14 эт.",2020-12-08T02:34:14.417032Z
"Новосибирская область, Новосибирский район, село Боровое, Советская улица, 12",178110403,Ольга,Resale,3268,2020-02-29T02:21:08.074513Z,"Отличное предложение в Боровом-всего в 30 минутах от города!<br>В срочной продаже 3-х комнатная квартира с изолированными комнатами.<br>Просторные и светлые комнаты.<br>В поселке есть школа,детский сад,поликлиника,кинотеатр.Регулярное рейсовое сообщение до Новосибирска с интервалом 3 часа.<br>До Обского водохранилища 10 минут пешком . Подходит под ипотеку и материнский капитал! <br> Доп. описание: лоджия застеклена,санузел раздельный, сантехника новая, есть горячая вода (нагреватель), водопровод новый, проводка частично заменена, сразу заходи и живи.  Тихое место дом тупиковый,  большой двор много мест под парковку, есть два сарая, два огорода, погреб, так же  есть место под баню, гараж, или ещё один огород.",58.9 м²,,,,,,2/2,58.9 м²,58.9,2,8,2353629673,Sale,/3-komnatnaya-kvartira-na-prodazhu-verh_tula-2353629673,,1 600 000 ₽,27 165 ₽ за м²,27165,1600000,Apartment,2020-02-29T02:21:08.074513Z,78,Listing,3,3.0,2020-12-18T15:47:39.691863+03:00,1889297338,2020-02-28T09:33:50.29799+03:00,2020-11-18T15:47:39.691863+03:00,,,,,"3-комн. квартира, 58.9 м², 2/2 эт.",2020-11-18T12:56:43.31943Z
"ул. Петухова, д. 105/1",23367994,Компания «ЭТАЖИ»,New,3285,2020-11-16T12:26:48.931793Z,"Квартира с ремонтом. На территории ЖК работают школа № 217 и муниципальный детский сад № 53.<br>Ещё два детских сада расположены в радиусе пешей доступности в микрорайонах «Тулинка» и «Просторный».<br>Супермаркеты, магазины с товарами ежедневного спроса, аптеки и салоны красоты работают на первых этажах «Матрешкиного двора», за крупными покупками жители едут в СТЦ «Мега».<br>Обширная зеленая зона Лесопарка имени академика Синягина располагает к прогулкам на свежем воздухе. В 15 минутах езды — ПКиО «Бугринская роща» с пляжной зоной и смотровой площадкой на Бугринский мост.<br>— линолеум и обои под покраску, плинтусы;<br>— натяжной потолок на кухне, покраска стен и керамическая плитка;<br>— сантехника, радиаторы, розетки и электрика.<br> Доп. описание: санузел раздельный, плита электрическая, пластиковые окна, в доме есть: детская площадка, закрытый двор, наземный паркинг, гостевой паркинг, лифт пассажирский, лифт грузовой, косметический ремонт, также имеются: телефон, интернет, кабельное телевидение, счетчики холодной и горячей воды, домофон, железная дверь Номер в базе: 4953254. Район: Кировский",35.1 м²,39193.0,ЖК «Матрешкин двор»,39193.0,ЖК «Матрешкин двор»,655.0,21/24,35.1 м²,35.1,21,6,3010189378,Sale,/1-komnatnaya-kvartira-na-prodazhu-novosibirsk-3010189378,,2 250 000 ₽,64 103 ₽ за м²,64103,2250000,Apartment,2020-11-16T12:26:48.931793Z,78,Listing,1,1.0,2020-12-16T15:17:45.607993+03:00,2040405250,2020-11-16T15:17:20.884597+03:00,2020-11-16T15:17:45.607993+03:00,,,,,"1-комн. квартира, 35.1 м², 21/24 эт.",2020-11-16T12:26:54.250435Z
