address,agencyId,agencyName,apartmentSaleType,cityId,createdAt,description,details,developmentId,developmentName,developmentParentId,developmentParentName,districtId,floor,floorArea,floorAreaCalculated,floorInt,galleryImagesCount,id,itemType,itemUrl,metroId,price,pricePerArea,pricePerAreaValue,priceValue,propertyType,publishDate,regionId,resultType,rooms,roomsOrdinal,sourceFinishTime,sourceId,sourceStartTime,sourceUpdateTime,station_distance,station_id,station_lineColors,station_name,title,updatedAt
"Новосибирск, улица Петухова, 56",152810530,Центральное агентство недвижимости,Resale,3285,2020-08-13T02:28:50.487094Z,"В квартире: новые: трубы, проводка, счётчики. Установленные пластиковые окна. Горячая вода круглый год (максимально отключают за 12 месяцев всего на неделю летом). Зимой очень тепло, т.к подача тепла производится с 9го этажа. Хороший спокойные и понимающие соседи( трое детей-это аргумент), проведен интернет: электронный город. Очень развитая инфраструктура, в радиусе одной остановки распологаются: кинотеатр рассвет, круглосуточный гипермаркет лента, продуктовый магазин ярче, два огромный павильона с одеждой для всей семьи с недорогими ценами(люди приезжают в него даже с правого берега), множество аптек, поликлиники: взрослая, детская, женская консультация, а так же платные мед.центры. Школы, детские сады, детские площадки, хорошая транспортная развязка. Спортивные секции и кружки. Молочная кухня, МФЦ, ЖЕУ,  банкетные залы, кафе, ЗАГС, администрация, ветеринарные клиники, KFS, пиццерии, ателье, ремонт обуви, каток , магазин тканей, аллеи для прогулок и пробежек, парк с атракционами, салоны красоты, парикмахерские,почта, банки, круглосуточные банкоматы, киоск круглосуточный перед домом, зоомагазины  и многое другое<br>При звонке, пожалуйста, назовите номер объявления - 114 426<br>Консультируем подробно по телефону.",34 м²,,,,,655.0,9/9,34 м²,34.0,9,10,2784418801,Sale,/1-komnatnaya-kvartira-na-prodazhu-novosibirsk-2784418801,267.0,1 950 000 ₽,57 353 ₽ за м²,57353,1950000,Apartment,2020-08-13T02:28:50.487094Z,78,Listing,1,1.0,2020-12-13T15:29:24.605334+03:00,1952384114,2020-08-13T05:19:23.275332+03:00,2020-12-07T05:23:54.014727+03:00,4.817,267.0,#FF0000,Площадь Маркса,"1-комн. квартира, 34 м², 9/9 эт.",2020-12-07T02:33:58.429765Z
"Новосибирск, Калининский район, микрорайон Родники, улица Михаила Немыткина, 9/1",152810530,Центральное агентство недвижимости,Resale,3285,2020-09-14T01:21:37.116823Z,"Жилой дом «Ника» -Это одноподъездный 19-ти этажный дом, который рассчитан всего на 190 квартир. Проект станет настоящим украшением этой локации. Архитектурное решение дома отличается стильным дизайном, комфортными семейными планировками, а также уникальной концепцией благоустройства двора.Функциональным преимуществом станут кладовые, расположенные на каждом этаже, - их ровно столько, сколько квартир в доме – 190. Идея кладовых в том, чтобы пространство квартиры оставить свободным от детских колясок, велосипедов, самокатов. Эти помещения вне квартиры, безусловно, сказываются на общем комфорте проживания.В доме предусмотрен подземный паркинг на 59 машин, куда можно спуститься на лифте от своей квартиры - эта опция обеспечит новый уровень комфорта.<br>Двор максимально безопасен и комфортен: закрытая территория, зона для игр и отдыха изолирована от автомобилей. Вся территория спроектирована по принципу беспорогового пространства без резких перепадов, входная группа в подъезд находится на одном уровне с придомовой территорией.Квартира без истории риски отсутствуют. Развитая инфраструктура: обилие магазинов, д/садов и школ. Удобная транспортная развязка. Цена значительно вырастет при сдаче дома в эксплуатацию. Готовность дома 92%. Возможность ипотеки с поддержкой правительства. Без обременений чистая продажа.<br>С проектной декларацией можно ознакомиться на сайте застройщика.<br>При звонке, пожалуйста, назовите номер объявления - 102 677<br>Консультируем подробно по телефону.",44 м²,,,,,648.0,2/19,44 м²,44.0,2,9,2860820715,Sale,/2-komnatnaya-kvartira-na-prodazhu-novosibirsk-2860820715,,3 696 000 ₽,84 000 ₽ за м²,84000,3696000,Apartment,2020-09-14T01:21:37.116823Z,78,Listing,2,2.0,2020-12-13T15:29:24.843555+03:00,1984672281,2020-09-14T04:12:10.568002+03:00,2020-12-06T15:40:12.679295+03:00,,,,,"2-комн. квартира, 44 м², 2/19 эт.",2020-12-06T12:50:03.514801Z
"Новосибирск, Кубовая улица, 51",183262990,Агентство недвижимости ЖИЛФОНД,Resale,3285,2020-11-17T13:58:54.275666Z,"Заельцовский район, г.Новосибирск, ул. Кубовая.  Квартира с новым ремонтом <br>Два взрослых собственника <br>Жилой комплекс Солнечные часы от застройщика группы компаний Стрижи представляет собой лаконичное продолжение возведения уже получившего известность микрорайона Стрижи на Кубовой.<br>Солнечный часы — это дом выполненные из кирпича, с остекленными в пол лоджиями, озелененной придомовой территорией и всей сопутствующей микрорайону инфраструктурой.<br>На территории микрорайона расположено несколько детских садов, детская поликлиника, частные медицинские центры, общеобразовательная средняя школа, множество спортивных площадок, магазинов, центров детского творчества, и даже лыжная база. Торговый центр Крестьянская слобода, расположенный в 5 минутах ходьбы от жилого комплекса.<br>Жилой комплекс Солнечные часы полностью соответствует концепции строительства и благоустройства ГК Стрижи- территория комплекса является закрытой и охраняемой, внутри расположены детские площадки, а уютную атмосферу, и без того густо озелененного двора, дополнит свежий и чистый воздух раскинувшихся во все стороны нетронутых природных лесов.<br>Возможен обмен на вашу недвижимость.<br>	<br>	При звонке, пожалуйста, сообщите номер варианта - <br>       JV001054104572",41.9 м²,,,,,653.0,8/10,41.9 м²,41.9,8,3,3013014452,Sale,/1-komnatnaya-kvartira-na-prodazhu-novosibirsk-3013014452,,3 200 000 ₽,76 372 ₽ за м²,76372,3200000,Apartment,2020-11-17T13:58:54.275666Z,78,Listing,1,1.0,2020-12-17T16:49:51.026053+03:00,2028018585,2020-11-17T16:47:57.50895+03:00,2020-11-17T16:49:51.026053+03:00,,,,,"1-комн. квартира, 41.9 м², 8/10 эт.",2020-11-17T13:58:54.951507Z
"Новосибирск, улица Орджоникидзе, 30",152810530,Центральное агентство недвижимости,Resale,3285,2020-10-14T02:33:58.624722Z,"Продается 3-х комнатная квартира в Центральном районе. Новый, кирпичный дом возле ТЦ «Аура» и Театра Оперы и Балета. В пешей доступности  метро Площадь Ленина и Центральный парк. Территория дома огорожена, видеонаблюдение, охрана, детский городок. В доме имеется двухуровневый подземный паркинг. <br>В квартире выполнен ремонт ,полы ламинат, кафель, натяжные потолки, 2 санузла, гардеробная комната. Высота потолков 2,75 м. <br>При звонке, пожалуйста, назовите номер объявления - 81 817<br>Консультируем подробно по телефону.",88.6 м²,,,,,649.0,10/18,88.6 м²,88.6,10,3,2927921629,Sale,/3-komnatnaya-kvartira-na-prodazhu-novosibirsk-2927921629,263.0,13 400 000 ₽,151 242 ₽ за м²,151242,13400000,Apartment,2020-10-14T02:33:58.624722Z,78,Listing,3,3.0,2020-12-13T15:41:38.153124+03:00,2016227573,2020-10-14T05:24:33.013327+03:00,2020-12-07T05:24:05.453117+03:00,0.694,263.0,#FF0000,Площадь Ленина,"3-комн. квартира, 88.6 м², 10/18 эт.",2020-12-07T02:34:16.521257Z
"ул. Большевистская, стр. 42",162753784,"Микрорайон «Европейский берег», застройщик Брусника",New,3285,2020-11-15T11:10:24.507337Z,"Квартира с объединенной кухней-гостиной и двумя спальнями в микрорайоне «Европейский Берег». <br>                  ОБЪЯВЛЕНИЕ ОТ ЗАСТРОЙЩИКА<br>Квартиру можно купить онлайн.<br>Двухкомнатная квартира в ЖК «Европейский Берег» в 15 минутах от метро «Речной вокзал» — это квартира с объединённой кухней-гостиной и двумя спальнями. В продаже в «Европейском Береге» есть варианты 2-комнатных квартир с террасами, тёплыми лоджиями и балконами. В квартирах также спроектированы дополнительные помещения — гардеробные или ниши под хранение, второй санузел, постирочная. Есть особенные квартиры увеличенной площади с несколькими французскими балконами и большой террасой. Купить двухкомнатную квартиру в Октябрьском районе Новосибирска выгодно напрямую от застройщика «Брусника. Сибакадемстрой».<br>На сдаче в 2-комнатных от застройщика «Брусника. Сибакадемстрой» выполнена отделка под чистовую. Установлена надёжная сейф-дверь. В каждой квартире — приборы учёта, радиаторы, розетки и выключатели, разводка отопления и электрики. Стены в студиях оштукатурены. Пол готов к финишному покрытию — ламинату, линолеуму, плитке.<br>ЖК «Европейский Берег» расположен на берегу Оби, между двумя мостами — Коммунальным и Бугринским, 15 минут на автомобиле по улице Большевистской до метро «Речной вокзал». В «Европейском Береге» построено 22 дома и проживает 5 000 семей. Внутри микрорайона расположен детский сад на 320 мест, открыты магазины, аптеки, кафе. Предусмотрено место под строительство школы и второго детского сада.<br>Сейчас в «Европейском Береге» ведётся строительство домов от 6 до 25 этажей на береговой линии ЖК вдоль улицы Владимира Заровного: три закрытых квартала с камерным двором-садом, две башни-доминанты и один сблокированный дом. Под строящимися домами «Европейского Берега» спроектированы подземные паркинги, в цокольных этажах — кладовые помещения. <br>Купить двухкомнатную квартиру в «Европейском Береге» в Октябрьском районе Новосибирска выгодно напрямую от застройщика «Брусника. Сибакадемстрой»:<br>— ипотека с отсрочкой платежей на год от ПАО Сбербанк;<br>— беспроцентная рассрочка на 2-комнатные в «Европейском Береге»;<br>— обмен своей квартиры на двухкомнатную в новостройках на набережной Оби;<br>— возможность заказать отделку и оформить её вместе с 2-комнатной квартирой в ипотеку;<br>— бесплатный юридический сервис по оформлению квартиры.<br>Получить одобрение ипотеки или рассрочку, а также осуществить обмен квартиры можно онлайн. Запишитесь на онлайн презентацию по телефону или на сайте.<br>            № квартиры в нашей базе: НСК19929.",65.9 м²,23887.0,Микрорайон «Европейский Берег»,23887.0,Микрорайон «Европейский Берег»,650.0,6/8,65.9 м²,65.9,6,2,3007617527,Sale,/2-komnatnaya-kvartira-na-prodazhu-novosibirsk-3007617527,265.0,5 500 000 ₽,83 460 ₽ за м²,83460,5500000,Apartment,2020-11-15T11:10:24.507337Z,78,Listing,2,2.0,2020-12-15T14:01:24.024318+03:00,2038383590,2020-11-15T14:01:03.143894+03:00,2020-11-15T14:01:24.024318+03:00,2.997,265.0,#FF0000,Речной вокзал,"2-комн. квартира, 65.9 м², 6/8 эт.",2020-11-15T11:10:27.794546Z
