address,agencyId,agencyName,apartmentSaleType,cityId,createdAt,description,details,developmentId,developmentName,developmentParentId,developmentParentName,districtId,floor,floorArea,floorAreaCalculated,floorInt,galleryImagesCount,id,itemType,itemUrl,metroId,price,pricePerArea,pricePerAreaValue,priceValue,propertyType,publishDate,regionId,resultType,rooms,roomsOrdinal,sourceFinishTime,sourceId,sourceStartTime,sourceUpdateTime,station_distance,station_id,station_lineColors,station_name,title,updatedAt
"ул. Забалуева, стр. 4",173701179,Макромир,New,3285,2020-11-17T09:41:55.092377Z,"Прекрасный вариант 2-х квартиры студии в 15-20 мин. езды от метро .Наличие собственного озера с благоустроенной набережной. Достаточное количество парковочных мест ,Любые формы расчета - рассрочка, мат. капитал, ипотека. И... отличная цена от достойного застройщика. Комиссия на услуги 0%.",46.7 м²,70114.0,ЖК «Радуга Сибири»,70114.0,ЖК «Радуга Сибири»,654.0,4/17,46.7 м²,46.7,4,1,3012372200,Sale,/2-komnatnaya-kvartira-na-prodazhu-novosibirsk-3012372200,267.0,2 900 000 ₽,62 099 ₽ за м²,62099,2900000,Apartment,2020-11-17T09:41:55.092377Z,78,Listing,2,2.0,2020-12-17T12:32:53.889357+03:00,2041617060,2020-11-17T12:31:44.18569+03:00,2020-11-17T12:37:08.466344+03:00,,,,,"2-комн. квартира, 46.7 м², 4/17 эт.",2020-11-17T09:54:27.328694Z
"ул. Забалуева, стр. 4",173701179,Макромир,New,3285,2020-11-17T09:47:10.147766Z,"Прекрасный вариант 3-х комнатной  квартиры студии в 15-20 мин. езды от метро .Наличие собственного озера с благоустроенной набережной. Достаточное количество парковочных мест ,Любые формы расчета - рассрочка, мат. капитал, ипотека. И... отличная цена от достойного застройщика. Комиссия на услуги 0%.",79.9 м²,70114.0,ЖК «Радуга Сибири»,70114.0,ЖК «Радуга Сибири»,654.0,14/17,79.9 м²,79.9,14,1,3012392974,Sale,/3-komnatnaya-kvartira-na-prodazhu-novosibirsk-3012392974,267.0,4 352 000 ₽,54 468 ₽ за м²,54468,4352000,Apartment,2020-11-17T09:47:10.147766Z,78,Listing,3,3.0,2020-12-17T12:36:56.708989+03:00,2041573369,2020-11-17T12:35:51.978474+03:00,2020-11-17T12:36:56.708989+03:00,,,,,"3-комн. квартира, 79.9 м², 14/17 эт.",2020-11-17T09:47:47.325269Z
"ул. Декабристов, стр. 2",18870782,Дмитрий,New,3285,2020-10-14T11:11:49.547838Z,"Продается двухкомнатная квартира с большой кухней - гостиной (19,3кв.м.) в одном из лучших ЖК города от одного из лучших застройщиков города. Сдача дома 4кв. 2020года. Очень удачная планировка на две стороны. Два сан узла. Двор без машин. Большие окна. Приточные клапана. Современные подъезды и двор. Спуск на парковку на лифте. За отдельную сумму также есть парковка на -1 этаже и кладовка на -2 этаже. Реальному покупателю торг.",68.4 м²,23896.0,Квартал «На Декабристов»,23896.0,Квартал «На Декабристов»,650.0,4/5,68.4 м²,68.4,4,6,2929162093,Sale,/2-komnatnaya-kvartira-na-prodazhu-novosibirsk-2929162093,264.0,8 360 000 ₽,122 222 ₽ за м²,122222,8360000,Apartment,2020-10-14T11:11:49.547838Z,78,Listing,2,2.0,2020-12-13T14:03:25.832285+03:00,2012414145,2020-10-14T14:02:25.707926+03:00,2020-11-13T14:03:25.832285+03:00,0.584,264.0,#FF0000,Октябрьская,"2-комн. квартира, 68.4 м², 4/5 эт.",2020-11-13T11:12:28.622312Z
"Новосибирск, улица Виктора Шевелёва, 34",178825960,"2ПН, покупка-продажа недвижимости",Resale,3285,2020-10-09T11:29:27.7981Z,В продаже 1-квартира-студия под с/отделку! Документы оформлены собственность! Возможна продажа по ипотеке! Красивый парк возле дома!,39.4 м²,,,,,655.0,8/10,39.4 м²,39.4,8,3,2918416267,Sale,/1-komnatnaya-kvartira-na-prodazhu-novosibirsk-2918416267,,1 800 000 ₽,45 685 ₽ за м²,45685,1800000,Apartment,2020-10-09T11:29:27.7981Z,78,Listing,1,1.0,2020-12-19T14:47:10.266505+03:00,1990830667,2020-10-09T14:15:58.095329+03:00,2020-12-01T18:34:10.600667+03:00,,,,,"1-комн. квартира, 39.4 м², 8/10 эт.",2020-12-01T15:43:12.781072Z
"ул. Забалуева, стр. 4",173701179,Макромир,New,3285,2020-11-17T09:57:04.230792Z,"Прекрасный вариант квартиры - студии в 15-20 мин. езды от метро .Наличие собственного озера с благоустроенной набережной. Достаточное количество парковочных мест ,Любые формы расчета - рассрочка, мат. капитал, ипотека. И... отличная цена от достойного застройщика. Комиссия на услуги 0%.",24 м²,70114.0,ЖК «Радуга Сибири»,70114.0,ЖК «Радуга Сибири»,654.0,17/17,24 м²,24.0,17,1,3012418918,Sale,/kvartira-na-prodazhu-novosibirsk-3012418918,267.0,1 442 000 ₽,60 083 ₽ за м²,60083,1442000,Apartment,2020-11-17T09:57:04.230792Z,78,Listing,Студия,,2020-12-17T12:48:00.1416+03:00,2041475443,2020-11-17T12:47:37.627938+03:00,2020-11-17T12:48:00.1416+03:00,,,,,"Квартира-студия, 24 м², 17/17 эт.",2020-11-17T10:03:20.928193Z
"ул. Забалуева, стр. 4",173701179,Макромир,New,3285,2020-11-17T10:02:14.262628Z,"Прекрасный вариант 2 -х комнатной квартиры студии в 15-20 мин. езды от метро .Наличие собственного озера с благоустроенной набережной. Достаточное количество парковочных мест ,Любые формы расчета - рассрочка, мат. капитал, ипотека. И... отличная цена от достойного застройщика. Комиссия на услуги 0%.",45.3 м²,70114.0,ЖК «Радуга Сибири»,70114.0,ЖК «Радуга Сибири»,654.0,14/17,45.3 м²,45.3,14,1,3012443895,Sale,/2-komnatnaya-kvartira-na-prodazhu-novosibirsk-3012443895,267.0,2 763 300 ₽,61 000 ₽ за м²,61000,2763300,Apartment,2020-11-17T10:02:14.262628Z,78,Listing,2,2.0,2020-12-17T12:52:16.064849+03:00,2041455074,2020-11-17T12:51:54.625594+03:00,2020-11-17T12:52:16.064849+03:00,,,,,"2-комн. квартира, 45.3 м², 14/17 эт.",2020-11-17T10:03:36.400604Z
"Новосибирск, Тополёвая улица, 10",23367994,Компания «ЭТАЖИ»,Resale,3285,2020-10-06T03:25:35.51426Z,"Предлагается к продаже 2-комнатная квартира в кирпичном доме в центре города.Высота потолков- 3,5 метра!<br>В квартире удачная планировка- все комнаты изолированные, правильной геометрической формы (две спальни 13,2 кв.м. и 16,4 м.),просторная кухня 10,8 кв.м.<br>Дом является одним из первых кирпичных домов г. Новосибирска, памятник истории.Качественная кирпичная кладка обеспечивает высокий уровень шумоизоляции и теплостойкости дома.В доме в 2014 году был сделан кап. ремонт всех коммуникаций, крыши и фасада.<br>В шаговой доступности ТЦ АУРА, детские сады, школы, спортивные центры, до площади Ленина 15 минут пешком.<br>Квартира без обременений.<br>Приглашаем на просмотр!. Номер в базе: 4720562. Район: Октябрьский.",55.1 м²,,,,,650.0,2/3,55.1 м²,55.1,2,15,2910440235,Sale,/2-komnatnaya-kvartira-na-prodazhu-novosibirsk-2910440235,264.0,2 990 000 ₽,54 265 ₽ за м²,54265,2990000,Apartment,2020-10-06T03:25:35.51426Z,78,Listing,2,2.0,2020-12-14T06:06:06.218744+03:00,2008701625,2020-10-06T06:16:07.915903+03:00,2020-12-07T19:06:52.24764+03:00,1.242,264.0,#FF0000,Октябрьская,"2-комн. квартира, 55.1 м², 2/3 эт.",2020-12-07T16:16:24.048422Z
"Новосибирск, Военная улица, 12",23367994,Компания «ЭТАЖИ»,Resale,3285,2020-11-14T03:15:15.310872Z,"Продается уютная квартира в самом центре города.<br> Прочный кирпичный дом с толстыми стенами, хорошей шумоизоляцией. Высокие потолки 3,1. Большая кухня. Раздельные комнаты. Ухоженный подъезд. Тихие соседи.<br> Вся инфраструктура в пешей доступности: ТЦ Аура в 2 минутах ходьбы пешком, станция метро Площадь Ленина, Центральный парк, школа, детский сад. <br>Квартира требует частичного ремонта ,что увеличивает ваши возможности сделать ремонт под свой вкус и качества. Материалы, двери куплены. Пожалуй самый лучший вариант!!!. Номер в базе: 4871642. Район: Октябрьский.",58 м²,,,,,650.0,5/5,58 м²,58.0,5,17,3004651524,Sale,/2-komnatnaya-kvartira-na-prodazhu-novosibirsk-3004651524,264.0,4 100 000 ₽,70 690 ₽ за м²,70690,4100000,Apartment,2020-11-14T03:15:15.310872Z,78,Listing,2,2.0,2020-12-14T06:06:09.445601+03:00,2040126735,2020-11-14T06:05:44.307663+03:00,2020-11-15T06:16:04.220595+03:00,0.989,264.0,#FF0000,Октябрьская,"2-комн. квартира, 58 м², 5/5 эт.",2020-11-15T03:30:27.651688Z
"ул. Забалуева, стр. 4",173701179,Макромир,New,3285,2020-11-17T10:05:40.034978Z,"Прекрасный вариант 3 -х комнатной квартиры студии  в 15-20 мин. езды от метро .Наличие собственного озера с благоустроенной набережной. Достаточное количество парковочных мест ,Любые формы расчета - рассрочка, мат. капитал, ипотека. И... отличная цена от достойного застройщика. Комиссия на услуги 0%.",69 м²,70114.0,ЖК «Радуга Сибири»,70114.0,ЖК «Радуга Сибири»,654.0,17/17,69 м²,69.0,17,1,3012454557,Sale,/3-komnatnaya-kvartira-na-prodazhu-novosibirsk-3012454557,267.0,4 142 000 ₽,60 029 ₽ за м²,60029,4142000,Apartment,2020-11-17T10:05:40.034978Z,78,Listing,3,3.0,2020-12-17T12:56:39.744295+03:00,2041415576,2020-11-17T12:56:04.826622+03:00,2020-11-17T12:56:39.744295+03:00,,,,,"3-комн. квартира, 69 м², 17/17 эт.",2020-11-17T10:05:43.062128Z
"Новосибирск, Приморская улица, 24",75617003,"ООО ""РУСРИЭЛТ""",Resale,3285,2020-07-22T07:53:36.60892Z,"Продам студию в новом доме, с хорошим ремонтом. Балкон застеклен, утеплен, его можно использовать как полноценное жилое помещение, что не мало важно в небольшой по площади квартире. Квартира очень солнечная, теплая. Вдоль дома парковочные места. Шикарный вид на реку, сделаны дорожки для прогулок с лавочками рядом с домом. Тихое, экологически чистое место на берегу Оби. В доме консьерж, помещения общего пользования улучшенной отделки. Показ по договоренности. Рассматриваем вариант обмена с нашей доплатой на двух-трехкомнатную квартиру на ОбъГэсе рядом со школой №80.",29 м²,,,,,656.0,2/15,29 м²,29.0,2,9,2732298896,Sale,/kvartira-na-prodazhu-novosibirsk-2732298896,,1 950 000 ₽,67 241 ₽ за м²,67241,1950000,Apartment,2020-07-22T07:53:36.60892Z,78,Listing,Студия,,2020-12-12T07:57:49.341577+03:00,1961079616,2020-07-22T10:44:13.082424+03:00,2020-12-05T13:45:16.53769+03:00,,,,,"Квартира-студия, 29 м², 2/15 эт.",2020-12-05T10:54:18.676477Z
"Новосибирск, улица Владимира Высоцкого, 27",128581768,АН СФЕРА,Resale,3285,2020-10-13T11:24:23.103631Z,"Продается уютная,  светлая 3-комнатная квартира в Октябрьском районе. <br>Просторные, изолированные комнаты, удобная планировка  с балконом. Окна выходят на две стороны. Дом расположен в середине микрорайона,шума никакого нет. Квартира в хорошем состояние, сан/узел раздельный, окна пластиковые. Чистый подъезд, новый лифт.<br>В шаговой доступности магазины Магнит, Монетка, Пятерочка, Ярче!, рядом круглосуточная Белая аптека, строительный магазин Доминго, гипермаркет Лента, недавно открылся еще и супермаркет Лента, поликлиника №2 (взрослое и детское отделения), учебные заведения: школы №194 и №195, детские сады №489, №502 и №482, плавательный бассейн Лазурный (""Спортивная школа олимпийского резерва (СШОР)""), детский футбольный клуб ""Центр"" с футбольным полем, много спортивных клубов и секций, <br>почтовое отделение №133, доп. офис Сбербанка России с круглосуточным банкоматом, торгово-развлекательный центр Континент с большой бесплатной детской площадкой, торговый центр Пионер, торговый центр Невский, автовокзал (Автостанция ТЦ Невский).<br>Отличная транспортная развязка позволяет в считанные минуты добраться до центральной части нашего города.<br>Документы юридически чистые, один взрослый собственник, готовы к быстрому выходу на сделку, рассмотрим как наличный расчет так и покупателя с ипотекой.<br> Специалист нашей Компании организует для Вас просмотр данной квартиры в удобное для Вас время, и ответит на все Ваши вопросы. Профессиональное юридическое сопровождение на всех этапах сделки.",64 м²,,,,,650.0,4/10,64 м²,64.0,4,18,2926663730,Sale,/3-komnatnaya-kvartira-na-prodazhu-novosibirsk-2926663730,272.0,4 200 000 ₽,65 625 ₽ за м²,65625,4200000,Apartment,2020-10-13T11:24:23.103631Z,78,Listing,3,3.0,2020-12-12T15:23:40.415555+03:00,1990052811,2020-10-13T14:14:54.910318+03:00,2020-11-12T15:23:40.415555+03:00,2.652,272.0,#008000,Золотая Нива,"3-комн. квартира, 64 м², 4/10 эт.",2020-11-12T12:32:44.48975Z
"Новосибирская область, Черепановский район, рабочий посёлок Посевная, улица Островского, 66Г",157447334,Ольга,Resale,3273,2019-02-24T12:25:03.043286Z,"3 окна пластиковые, 1 окно деревянное, требуется ремонт, горячая вода титан, сан узел совмещен, балкона нет.",58 м²,,,,,,1/3,58 м²,58.0,1,5,266395220,Sale,/3-komnatnaya-kvartira-na-prodazhu-posevnaya-266395220,,750 000 ₽,12 931 ₽ за м²,12931,750000,Apartment,2019-02-24T12:25:03.043286Z,78,Listing,3,3.0,2020-12-18T18:22:10.48621+03:00,1650793537,2019-02-24T15:12:22.712527+03:00,2020-11-18T18:22:10.48621+03:00,,,,,"3-комн. квартира, 58 м², 1/3 эт.",2020-11-18T15:31:52.19178Z
"Новосибирская область, Черепановский район, рабочий посёлок Дорогино, Светлая улица, 30",33832560,Евгения,Resale,3263,2020-11-13T11:27:39.713635Z,"Все вопросы по телефону, квартира тёплая чистая, : пишите, звоните, предоставлю информацию: в Дорогино есть объекты, 2х 3х :",29.8 м²,,,,,,3/5,29.8 м²,29.8,3,19,3003260087,Sale,/1-komnatnaya-kvartira-na-prodazhu-dorogino-3003260087,,750 000 ₽,25 168 ₽ за м²,25168,750000,Apartment,2020-11-13T11:27:39.713635Z,78,Listing,1,1.0,2020-12-13T14:19:03.218933+03:00,2030286694,2020-11-13T14:16:21.682228+03:00,2020-11-22T11:30:56.547062+03:00,,,,,"1-комн. квартира, 29.8 м², 3/5 эт.",2020-11-22T08:40:22.446008Z
"Новосибирск, Спортивная улица, 27",173701179,Макромир,Resale,3285,2020-11-15T12:49:35.136547Z,Отличный вариант однокомнатной квартиры с планировкой на 2 стороны. Санузел раздельный. В квартире выполнен хороший свежий ремонт. Лоджия утеплена. Один взрослый собственник. Вариант обмена подобран.,42 м²,,,,,654.0,2/10,42 м²,42.0,2,11,3007835621,Sale,/1-komnatnaya-kvartira-na-prodazhu-novosibirsk-3007835621,,2 600 000 ₽,61 905 ₽ за м²,61905,2600000,Apartment,2020-11-15T12:49:35.136547Z,78,Listing,1,1.0,2020-12-15T15:40:34.206611+03:00,2041790199,2020-11-15T15:40:10.03835+03:00,2020-11-15T15:40:34.206611+03:00,,,,,"1-комн. квартира, 42 м², 2/10 эт.",2020-11-15T12:49:37.345461Z
