address,agencyId,agencyName,apartmentSaleType,cityId,createdAt,description,details,developmentId,developmentName,developmentParentId,developmentParentName,districtId,floor,floorArea,floorAreaCalculated,floorInt,galleryImagesCount,id,itemType,itemUrl,metroId,price,pricePerArea,pricePerAreaValue,priceValue,propertyType,publishDate,regionId,resultType,rooms,roomsOrdinal,sourceFinishTime,sourceId,sourceStartTime,sourceUpdateTime,station_distance,station_id,station_lineColors,station_name,title,updatedAt
"Новосибирск, Спортивная улица, 23",28262606,Ольга,Resale,3285,2020-11-11T18:43:10.102064Z,"Квартира в Ленинском районе, ЖК Чистая Слобода.<br>Ремонт от застройщика.<br>Хорошо подойдет семейной паре с ребенком.<br>Удобный тихий и чистый район, магазины в шаговой доступности. Школа и сад также рядом.<br>Небольшой торг.<br>Либо обмен с моей доплатой на 2-к.",42 м²,,,,,654.0,6/10,42 м²,42.0,6,10,2998921987,Sale,/1-komnatnaya-kvartira-na-prodazhu-novosibirsk-2998921987,,2 550 000 ₽,60 714 ₽ за м²,60714,2550000,Apartment,2020-11-11T18:43:10.102064Z,78,Listing,1,1.0,2020-12-11T21:34:07.650711+03:00,2028835546,2020-11-11T21:33:44.274175+03:00,2020-11-25T17:35:45.674201+03:00,,,,,"1-комн. квартира, 42 м², 6/10 эт.",2020-11-25T14:45:10.514021Z
"ул. 1-я Чулымская, д. 9",173701179,Макромир,New,3285,2020-11-19T09:03:15.199598Z,"Жилой комплекс ""Венеция"" расположен в живописном месте на левом берегу Оби, дома ориентированы на набережную, а из окон квартир открывается велико­лепный пейзаж на реку и огни города. До центра города 5 мин. на машине.",39.8 м²,1009192613.0,ЖК «Венеция-3»,1009192613.0,ЖК «Венеция-3»,654.0,2/11,39.8 м²,39.8,2,1,3017491296,Sale,/1-komnatnaya-kvartira-na-prodazhu-novosibirsk-3017491296,263.0,3 005 000 ₽,75 503 ₽ за м²,75503,3005000,Apartment,2020-11-19T09:03:15.199598Z,78,Listing,1,1.0,2020-12-19T11:54:12.700061+03:00,2041307774,2020-11-19T11:53:51.163324+03:00,2020-11-19T11:54:12.700061+03:00,1.987,268.0,#008000,Площадь Гарина-Михайловского,"1-комн. квартира, 39.8 м², 2/11 эт.",2020-11-19T09:03:17.291792Z
"Новосибирск, Дивногорская улица, 150/5",128581768,АН СФЕРА,Resale,3285,2020-11-12T09:31:05.598354Z,"Предлагается к продаже двухкомнатная квартиа  в  новом, семейном микрорайоне ""Дивногорский"".<br>Квартира уютная, большая с двумя окнами в большой комнате , что делает очень светлую комнату.<br>Расположена на 4 этаже шестиэтажного кирпичного дома, общая площадь квартиры 51,4  м.кв. Бесшумный лифт !<br> Остановка общественного транспорта в 3 минутах от дома. Кто устал от городской суеты самое время подумать о таком   выгодном варианте!<br>В «Дивногорском»  Развитая инфраструктура удобная транспортная развязка прямые маршруты до центра города, есть просторные обустроенные дворы, детские и спортивные площадки, хоккейная коробка,  дет. Сад,  школы, футбольное поле,  магазины, аптека,  и многое другое для удобной и комфортной жизни. собственная котельная и управляющая компания. <br>Квартира ждет своего покупателя!<br>Приглашаем на просмотр В УДОБНОЕ ДЛЯ ВАС  ВРЕМЯ!<br>Цена- Подарок к Новому Году, успей сделать для себя и своей семьи Праздник!!!<br>Есть обременение Сбер",51 м²,,,,,654.0,4/6,51 м²,51.0,4,32,3000269200,Sale,/2-komnatnaya-kvartira-na-prodazhu-novosibirsk-3000269200,,3 550 000 ₽,69 608 ₽ за м²,69608,3550000,Apartment,2020-11-12T09:31:05.598354Z,78,Listing,2,2.0,2020-12-12T12:21:59.905144+03:00,2022787513,2020-11-12T12:21:22.859548+03:00,2020-12-08T11:09:43.768707+03:00,,,,,"2-комн. квартира, 51 м², 4/6 эт.",2020-12-08T08:21:02.864499Z
"ул. Обская, ЖК «Гранит»",153281337,"ООО ""ПикПро""",New,3285,2020-11-14T16:46:05.718803Z,"Квартира под с/о,  дом на сдаче! <br>Скоро передеча ключей. <br>Квартира продается с парковкой и кладовкой. <br>Только на 24 этаже - потолки 3,5 метров! <br>Все окна в пол, в спальне и комнате французский балкон, на кухне - лоджия. <br>Вид на набережную. <br>По запросу , вышлю на вотс ап подробное видео квартиры. <br>Продажа в связи с переездом в другой город. <br>Торг уместен.",60 м²,1006213290.0,ЖК «Гранит»,1006213290.0,ЖК «Гранит»,650.0,24/24,60 м²,60.0,24,16,3006247871,Sale,/2-komnatnaya-kvartira-na-prodazhu-novosibirsk-3006247871,265.0,7 500 000 ₽,125 000 ₽ за м²,125000,7500000,Apartment,2020-11-14T16:46:05.718803Z,78,Listing,2,2.0,2020-12-14T19:37:28.167764+03:00,2039456339,2020-11-14T19:34:52.438641+03:00,2020-11-19T20:17:50.221844+03:00,0.835,265.0,#FF0000,Речной вокзал,"2-комн. квартира, 60 м², 24/24 эт.",2020-11-19T17:27:55.576637Z
"ул. 1-я Чулымская, д. 9",173701179,Макромир,New,3285,2020-11-19T09:08:29.728572Z,"Жилой комплекс ""Венеция"" расположен в живописном месте на левом берегу Оби, дома ориентированы на набережную, а из окон квартир открывается велико­лепный пейзаж на реку и огни города. До центра города 5 мин. на машине. Сдача 2 кв. .2022г",40 м²,1009192613.0,ЖК «Венеция-3»,1009192613.0,ЖК «Венеция-3»,654.0,6/17,40 м²,40.0,6,1,3017502871,Sale,/1-komnatnaya-kvartira-na-prodazhu-novosibirsk-3017502871,263.0,3 200 000 ₽,80 000 ₽ за м²,80000,3200000,Apartment,2020-11-19T09:08:29.728572Z,78,Listing,1,1.0,2020-12-19T11:59:26.279591+03:00,2041131022,2020-11-19T11:59:05.004303+03:00,2020-11-19T11:59:26.279591+03:00,1.987,268.0,#008000,Площадь Гарина-Михайловского,"1-комн. квартира, 40 м², 6/17 эт.",2020-11-19T09:08:35.879561Z
"пос. Октябрьский, ул. Лучезарная, д. 54",155843931,"Агенство недвижимости ""Е1""",New,3262,2020-07-23T12:31:36.505763Z,"Предложение до конца августа! Цена ниже чем у застройщика!<br>Квартира от физического лица.<br>Комфортный этаж!<br>Дом на сдаче! Ключи уже в августе.<br>Ремонт от застройщика.<br>Удобная планировка, с видом на две стороны. Большая просторная кухня-гостиная.<br>Отличный семейный вариант!",54 м²,1006338021.0,ЖК «Французский квартал»,1006338021.0,ЖК «Французский квартал»,,3/3,54 м²,54.0,3,4,2735278392,Sale,/3-komnatnaya-kvartira-na-prodazhu-sokur-2735278392,,2 060 000 ₽,38 148 ₽ за м²,38148,2060000,Apartment,2020-07-23T12:31:36.505763Z,78,Listing,3,3.0,2020-12-16T15:20:14.956466+03:00,1977261551,2020-07-23T15:22:22.062919+03:00,2020-11-16T15:20:20.48433+03:00,,,,,"3-комн. квартира, 54 м², 3/3 эт.",2020-11-16T12:29:46.05555Z
"ул. Сухарная, блок-секция 3, 4",155843931,"Агенство недвижимости ""Е1""",New,3285,2020-11-16T03:32:49.977966Z,"Продается однокомнатная квартира в ЖК ""Сосны"" которая при желании может быть перепланирована в 2-комнатную студию. Дом на сдаче (4 кв.2020г.)<br>Продажа по переуступке от физического лица, окна смотрят в сторону дома №96/2",40.7 м²,69054.0,ЖК «Сосны»,69054.0,ЖК «Сосны»,653.0,3/21,40.7 м²,40.7,3,2,3008936028,Sale,/1-komnatnaya-kvartira-na-prodazhu-novosibirsk-3008936028,,3 250 000 ₽,79 853 ₽ за м²,79853,3250000,Apartment,2020-11-16T03:32:49.977966Z,78,Listing,1,1.0,2020-12-16T06:23:48.396777+03:00,2041645919,2020-11-16T06:23:28.511557+03:00,2020-11-16T06:23:48.396777+03:00,2.369,268.0,#008000,Площадь Гарина-Михайловского,"1-комн. квартира, 40.7 м², 3/21 эт.",2020-11-16T03:32:52.985492Z
"ул. 1-я Чулымская, д. 9",173701179,Макромир,New,3285,2020-11-19T09:16:36.931071Z,"Жилой комплекс ""Венеция"" расположен в живописном месте на левом берегу Оби, дома ориентированы на набережную, а из окон квартир открывается велико­лепный пейзаж на реку и огни города. До центра города 5 мин. на машине. Сдача дома 2 кв. 2022г.",87.8 м²,1009192613.0,ЖК «Венеция-3»,1009192613.0,ЖК «Венеция-3»,654.0,10/17,87.8 м²,87.8,10,1,3017517642,Sale,/3-komnatnaya-kvartira-na-prodazhu-novosibirsk-3017517642,263.0,5 707 000 ₽,65 000 ₽ за м²,65000,5707000,Apartment,2020-11-19T09:16:36.931071Z,78,Listing,3,3.0,2020-12-19T12:07:35.401299+03:00,2040965782,2020-11-19T12:07:13.874902+03:00,2020-11-19T12:07:35.401299+03:00,1.987,268.0,#008000,Площадь Гарина-Михайловского,"3-комн. квартира, 87.8 м², 10/17 эт.",2020-11-19T09:16:37.941493Z
"Новосибирск, Кировский район, Северо-Чемской жилмассив, улица Саввы Кожевникова, 15",33376136,Агентство Новосибирской недвижимости,Resale,3285,2020-06-16T00:33:29.081353Z,"3- комнатная квартира в кооперативном доме, свое ТСЖ, ухоженные подъезды, двор, разумные коммунальные платежи. Сама квартира в отличном состоянии. Тихое место у реки. Из окон квартиры прекрасный вид на Обь. Один взрослый собственник, документы готовы, более 5 лет в собственности, без обременений. Квартира продаётся без мебели.<br>Местоположение: На берегу реки Обь.( 100м)<br>Дом стоит у реки. Напротив дома конечная остановка автобуса N96. До главной транспортной магистрали 7 мин. хотьбы.<br>На равном расстоянии от остановок Комсомольская или Северо- Чемской ж/м.<br>Развитая инфраструктура. В пешей доступности :Река, оборудованные детская и спортивная площадки под окнами. Школа,  Детские сады 2 шт. Поликлиника № 13, Библиотека,  Школа искусств.  Крытый каток общего пользования. Рынок, Торговый центр,, Магелан""<br>Продуктовые магазины:<br>Горожанка, Пятерочка, Мария Ра, Магнит, Холди, Лидер Экономии, Ярче.<br>На расстоянии 2-3 остановок :Парк,, Бугринская роща"", Лыжная база, Бассейн, <br>Быстроном, Светофор, Торговый центр,, Мега""( Икея, Ашан, Леруа-Мерлен), Посудо-центр.<br>Рекреационная зона города.<br>Чистый воздух и большое количество транспорта",60 м²,,,,,655.0,4/9,60 м²,60.0,4,26,2641345870,Sale,/3-komnatnaya-kvartira-na-prodazhu-novosibirsk-2641345870,,3 900 000 ₽,65 000 ₽ за м²,65000,3900000,Apartment,2020-06-16T00:33:29.081353Z,78,Listing,3,3.0,2020-12-12T12:33:15.554113+03:00,1926074465,2020-06-15T08:56:40.091982+03:00,2020-11-25T05:18:39.223864+03:00,,,,,"3-комн. квартира, 60 м², 4/9 эт.",2020-11-25T02:27:40.829195Z
"Новосибирск, улица Петухова, 14А",33399958,Елена,Resale,3285,2020-11-13T08:43:29.928272Z,"Всё что из мебели видите на фото остаётся новому хозяину! Желательно наличный расчёт, все подробности по телефону. Собственник!!",62 м²,,,,,655.0,12/17,62 м²,62.0,12,12,3002789431,Sale,/3-komnatnaya-kvartira-na-prodazhu-novosibirsk-3002789431,267.0,4 550 000 ₽,73 387 ₽ за м²,73387,4550000,Apartment,2020-11-13T08:43:29.928272Z,78,Listing,3,3.0,2020-12-13T11:34:27.567281+03:00,2036881084,2020-11-13T11:33:55.794113+03:00,2020-12-02T07:31:58.373675+03:00,4.662,267.0,#FF0000,Площадь Маркса,"3-комн. квартира, 62 м², 12/17 эт.",2020-12-02T04:40:58.537754Z
"Новосибирск, улица Галущака, 11",163089393,Елена,Resale,3285,2020-11-11T12:07:32.826262Z,"Квартира в доме с собственной огороженной территорией с видеонаблюдением, детской площадкой, наземным паркингом.<br>В доме консьерж-служба, установлены 3 лифта, видеокамеры.<br>В квартире выполнен ремонт из дорогостоящих качественных материалов.<br>Огромная лоджия (12,4 кв.м) утеплена и представляет собой отдельную комнату отдыха!<br>Вся мебель, предметы интерьера и техника от ведущих производителей. Покупателю остается кухонный гарнитур, современная оборудованная гардеробная, шкаф в гостиной.<br>Удобное расположение дома, отличная транспортная развязка, до метро одна остановка, сложившаяся инфраструктура: рестораны, магазины, супермаркет Бахетле, учебные заведения, детский сад, мед.центры, SPA- салоны.",37 м²,,,,,653.0,6/14,37 м²,37.0,6,13,2998057682,Sale,/1-komnatnaya-kvartira-na-prodazhu-novosibirsk-2998057682,261.0,4 550 000 ₽,122 973 ₽ за м²,122973,4550000,Apartment,2020-11-11T12:07:32.826262Z,78,Listing,1,1.0,2020-12-11T14:58:55.013429+03:00,2031701864,2020-11-11T14:53:39.434054+03:00,2020-11-11T14:58:55.013429+03:00,0.598,261.0,#FF0000,Гагаринская,"1-комн. квартира, 37 м², 6/14 эт.",2020-11-11T12:07:59.188683Z
"Новосибирск, улица Титова, 39",34770364,"Агентство недвижимости ""ВЫСОТА""",Resale,3285,2020-07-30T03:14:17.742302Z,"Предлагается к продаже полноценная однокомнатная квартира в быстроразвивающемся микрорайоне Чистая Слобода! <br>С РЕМОНТОМ ОТ ЗАСТРОЙЩИКА!<br>В квартире установлены пластиковые окна, входная и межкомнатные двери, смонтированы, вся электрика и сантехника, наклеены обои, постелен линолеум, натяжные потолки, лоджия остеклена.<br>Во дворе большая детская площадка и просторная парковка.<br>Развитая инфраструктура микрорайона: детские сады, новая школа на 1500 мест.<br>Магазины, аптеки, детские центры развития, бассейн, дом культуры, спортивный комплекс Заря!<br>Поможем с оформлением ипотеки на выгодных для Вас условиях! Звоните!",38.3 м²,,,,,654.0,3/9,38.3 м²,38.3,3,4,2751638880,Sale,/1-komnatnaya-kvartira-na-prodazhu-novosibirsk-2751638880,267.0,2 350 000 ₽,61 358 ₽ за м²,61358,2350000,Apartment,2020-07-30T03:14:17.742302Z,78,Listing,1,1.0,2020-12-12T05:29:32.310185+03:00,1978174396,2020-07-30T06:04:51.470943+03:00,2020-11-12T05:29:32.310185+03:00,1.908,267.0,#FF0000,Площадь Маркса,"1-комн. квартира, 38.3 м², 3/9 эт.",2020-11-12T02:38:36.807535Z
"Новосибирск, улица Кропоткина, 116/1",23367994,Компания «ЭТАЖИ»,Resale,3285,2020-11-11T12:19:59.601428Z,"Отличная квартира в кирпичном доме 2006 г. постройки. <br>Развитая инфраструктура, всё необходимое в пешей доступности. Метро Гагаринская 14 минут спокойным шагом. До остановка наземного транспорта 2 минуты. В пешей доступности 4 школы и 3 детских сада.<br>Придворовая территория возле подъездов только для загрузки-выгрузки. Достаточное количество парковочных мест за домом.<br>Высокий ПЕРВЫЙ этаж!!! <br>В квартире сделан ремонт по дизайн-проекту. Теплые полы в коридоре, кухонной зоне, гардеробе и в санузлах. Имеется сигнализация. 2 гардеробные внушительных размеров ( в кухне-гостиной и в большой спальне). Большая лоджия на 2 комнаты! В каждой комнате установлен кондиционер!<br>Звоните и приходите на просмотр.. Номер в базе: 4899411. Район: Заельцовский.",104 м²,,,,,653.0,2/10,104 м²,104.0,2,17,2998080559,Sale,/3-komnatnaya-kvartira-na-prodazhu-novosibirsk-2998080559,261.0,8 100 000 ₽,77 885 ₽ за м²,77885,8100000,Apartment,2020-11-11T12:19:59.601428Z,78,Listing,3,3.0,2020-12-11T15:10:50.244963+03:00,2040827215,2020-11-11T15:10:17.534727+03:00,2020-12-08T10:11:51.595966+03:00,0.906,261.0,#FF0000,Гагаринская,"3-комн. квартира, 104 м², 2/10 эт.",2020-12-08T07:21:52.408292Z
,188663210,"Квартал «Авиатор», застройщик Брусника",New,3285,2020-09-10T14:41:51.427265Z,"Трехкомнатная квартира в квартале «Авиатор». <br>                  ОБЪЯВЛЕНИЕ ОТ ЗАСТРОЙЩИКА. Покупка квартиры защищена банком.<br>Квартиру можно купить онлайн.<br>Трёхкомнатная квартира в ЖК «Авиатор» — это квартира с объединенной кухней-гостиной, тремя спальнями, просторной ванной комнатой и гостевым санузлом. Предусмотрены дополнительные ниши под хранение вещей, гардеробные или постирочные комнаты. Есть варианты планировок с французским балконом, протяжённым открытым балконом, глубокой или прогулочной террасой. Во всех квартирах сделаны большие окна, благодаря которым все помещения наполнены светом. Купить трёхкомнатную квартиру выгодно напрямую от застройщика Брусника. <br>На сдаче в 3-комнатных квартирах ЖК «Авиатор» выполнена отделка под чистовую. Стены выровнены и оштукатурены, на полу ー цементно-песчаная стяжка. В квартирах установлены розетки, выключатели, приборы учёта. Сделаны выводы под сантехнику и разводка электрики. Радиаторы установлены в каждой комнате и оборудованы терморегулятором. Нет стояков и вертикальных коммуникаций. В межкомнатных стенах и полу проложена шумоизоляция. В квартирах установлены пластиковые окна и надёжная сейф-дверь с замком. Отделка под чистовую экономит время и затраты на ремонт. Она включена в стоимость квартиры и не требует замены. <br>ЖК «Авиатор» расположен на пересечении улицы Аэропорт и Мочищенского шоссе, рядом с остановками «Байкальская», «Жуковского» и «Городской аэропорт», в 7 минутах ходьбы от сквера им. Чаплыгина и 10 минутах от крупной транспортной магистрали – Красного проспекта. До станции метро «Заельцовская» и площади «Калинина» – около 10 минут на автомобиле. Сформированная инфраструктура локации – школы, детские сады, магазины, спортивный стадион – делают жизнь в квартале комфортной. Первые новостройки в районе Аэропорта Северного сдаются в 3 квартале 2023 года. <br>«Авиатор» в Новосибирске строит компания Брусника. ЖК состоит из 11 домов. В центре квартала расположены 6-8-этажные урбан-виллы и 9-этажные парные дома с общим холлом. По периметру они отделены от городских улиц двумя секционными домами от 6 до 18 этажей со стилобатом и паркингом. Расположенная рядом школа будет интегрирована в проект при помощи элементов благоустройства и общественных пространств. Первая очередь строительства ЖК «Авиатор» включает возведение двух одноподъездных урбан-вилл и двух подъездов секционного дома, расположенного по улице Аэропорт. <br>Купить 3-комнатную квартиру в Новосибирске выгодно с использованием программ покупки и сервисов от застройщика Брусника: <br>— ипотека 5,85% по госпрограмме от ПАО Промсвязьбанк;<br>— ипотека с отсрочкой платежей на год от ПАО Сбербанк;<br>— беспроцентная рассрочка на квартиру;<br>— обмен своей квартиры на новую.<br>Получить одобрение ипотеки или рассрочку, а также осуществить обмен квартиры можно онлайн. Запишитесь на онлайн презентацию по телефону или на сайте.<br>            № квартиры в нашей базе: НСК17473.",165.8 м²,1027376811.0,Квартал «Авиатор»,1027376811.0,Квартал «Авиатор»,653.0,7/18,165.8 м²,165.8,7,10,2853094693,Sale,/3-komnatnaya-kvartira-na-prodazhu-novosibirsk-2853094693,260.0,10 300 000 ₽,62 123 ₽ за м²,62123,10300000,Apartment,2020-09-10T14:41:51.427265Z,78,Listing,3,3.0,2020-12-17T10:41:21.964093+03:00,1992654899,2020-09-10T17:32:18.942279+03:00,2020-11-25T09:56:45.4342+03:00,2.459,260.0,#FF0000,Заельцовская,"3-комн. квартира, 165.8 м², 7/18 эт.",2020-11-25T07:29:58.365982Z
