address,agencyId,agencyName,apartmentSaleType,cityId,createdAt,description,details,developmentId,developmentName,developmentParentId,developmentParentName,districtId,floor,floorArea,floorAreaCalculated,floorInt,galleryImagesCount,id,itemType,itemUrl,metroId,price,pricePerArea,pricePerAreaValue,priceValue,propertyType,publishDate,regionId,resultType,rooms,roomsOrdinal,sourceFinishTime,sourceId,sourceStartTime,sourceUpdateTime,station_distance,station_id,station_lineColors,station_name,title,updatedAt
"ул. Декабристов, д. 115",107238416,"Отдел продаж Застройщика ""Инвест-плюс""",New,3285,2020-04-08T00:29:33.926686Z,"Надёжный объект с проектным финансированием ПАО СБЕРБАНК.<br>Привлекательные процентные ставки по ипотеке с Государственной поддержкой.<br>0.1 % (процентная ставка для ВСЕХ на срок кредитования 1 год).<br>2.6 % (процентная ставка для ВСЕХ на срок кредитования 2 года).<br>6.1 % (процентная ставка для ВСЕХ на ВЕСЬ срок аккредитации).<br>Сдача 4-й квартал 2020 года.<br>Безопасные расчёты через счёт ЭСКРОУ.<br>— Хорошее расположение. В пешей доступности станция метро Речной Вокзал.<br>— Красивый высокий дом. Отличный панорамный вид на реку, Бугринский и Коммунальный мост.<br>— Фасад С ПОДСВЕТКОЙ.<br>— Остеклённые лоджии.<br>Современный высококомфортабельный комплекс с благоустроенной придомовой территорией. Дизайнерское исполнение подъездов в стиле ""Барокко"". УЛУЧШЕННАЯ ЧИСТОВАЯ ОТДЕЛКА. Кофе бар с камином и мягкими диванами. Три скоростных лифта. Двор без машин. Огороженная территория. Наличие беседки барбекю. Мини стадион. Уличные тренажеры и беговая дорожка. Современная детская игровая площадка на высшем уровне.<br>Так же в продаже есть парковочные места 600 000 и 650 000 рублей.<br>ПОМОЩЬ В ПОЛУЧЕНИИ ИПОТЕКИ.<br>Приходите на экскурсию.<br>Более подробную информацию можно получить по телефону либо в отделе продаж застройщика ООО ""ГСФ""",85.5 м²,91288.0,ЖК «Октябрьский квартал»,91288.0,ЖК «Октябрьский квартал»,650.0,17/22,85.5 м²,85.5,17,34,2468865584,Sale,/3-komnatnaya-kvartira-na-prodazhu-novosibirsk-2468865584,265.0,6 600 000 ₽,77 193 ₽ за м²,77193,6600000,Apartment,2020-04-08T00:29:33.926686Z,78,Listing,3,3.0,2020-12-09T09:28:44.629812+03:00,1901969379,2020-04-07T06:55:38.942076+03:00,2020-12-03T10:05:41.995278+03:00,1.463,265.0,#FF0000,Речной вокзал,"3-комн. квартира, 85.5 м², 17/22 эт.",2020-12-03T07:15:09.195028Z
"Новосибирск, улица Некрасова, 63",186669859,СРЕДА агентство недвижимости,Resale,3285,2020-11-14T09:21:55.887082Z,"В продаже трехкомнатная квартира в ЖК «Некрасовский».<br>В квартире сделан дизайнерский ремонт, с индивидуально подобронной мебелью, к каждой комнате. В квартире две изолированные спальни, большая гостиная и кухня. Материалы использованные при ремонте, высокого качества и делалось все для себя! Одним из  преимуществ данной квартиры, являются гардеробные в каждой спальне.<br>Материалы которые использовались в ремонте: венецианская штукатурка, натяжные потолки сатин, плитка пвх высокой прочности, итальянская плитка-мозаика, межкомнатные «скрытые» двери, эксклюзивный кухонный гарнитур, со встроенной техникой, балкон застеклен и утеплен. <br>Дом находится в Центральном районе, пешая доступность к двум станциям метро, отдаленность от  магистралей, которая избавит от шума и ненужной пыли, парковочные места возле дома, а так же подземная парковка в придомовой территории.<br>Квартира продается полностью вся с техникой и мебелью.<br>Рассматривается любая форма расчета, подходит под ипотеку.<br>Номер объекта: #2/550397/13331",105 м²,,,,,649.0,9/17,105 м²,105.0,9,14,3005352191,Sale,/3-komnatnaya-kvartira-na-prodazhu-novosibirsk-3005352191,270.0,12 900 000 ₽,122 857 ₽ за м²,122857,12900000,Apartment,2020-11-14T09:21:55.887082Z,78,Listing,3,3.0,2020-12-14T12:12:53.324011+03:00,2017494859,2020-11-14T12:11:57.636873+03:00,2020-11-14T12:12:53.324011+03:00,0.372,270.0,#008000,Маршала Покрышкина,"3-комн. квартира, 105 м², 9/17 эт.",2020-11-14T09:21:58.365101Z
"ул. Королева, д. 1А",173701179,Макромир,New,3285,2020-10-16T07:41:58.118403Z,"Квартира в новом доме, рядом с метро!",42.6 м²,91281.0,ЖК «На Королева»,91281.0,ЖК «На Королева»,651.0,6/9,42.6 м²,42.6,6,3,2933843836,Sale,/1-komnatnaya-kvartira-na-prodazhu-novosibirsk-2933843836,272.0,3 470 000 ₽,81 455 ₽ за м²,81455,3470000,Apartment,2020-10-16T07:41:58.118403Z,78,Listing,1,1.0,2020-12-19T23:33:45.120538+03:00,2041083676,2020-10-16T10:32:34.809051+03:00,2020-11-19T23:33:45.120538+03:00,1.099,272.0,#008000,Золотая Нива,"1-комн. квартира, 42.6 м², 6/9 эт.",2020-11-19T20:42:51.573502Z
"Новосибирская область, Искитимский район, рабочий поселок Линёво, Листвянская улица, 11",6060247,каскад-недвижимость,Resale,3260,2020-11-10T15:39:26.365804Z,"Предлагаем в чистую продажу 3-х комнатную квартиру в отличном состоянии! Вся инфраструктура в шаговой доступности: 6 дет садов, 4 школы, магазины на выбор (Мария Ра, Пятерочка, Магнит, Ярче и т д все рядом с домом), транспортная развязка (маршрутные такси каждые 10 минут, жел. вокзал и т д), спортивные и развлекательные заведения и многое другое необходимое для жизни. Крупные работающие предприятия: Сибирский антрацит, Электродный завод, Завод металлоконструкций и тд. Квартира светлая и теплая, натяжные потолки, в ванной кафель, 5-ти камерный оконный профиль, новые межкомнатные двери и во всех комнатах новый ленолиум, заходи и живи, соседи замечательные. Документы в порядке, без долгов и обременений, любой расчет. Просмотр по договоренности, звоните и смотрите нашу лучшую квартиру! Фотографии соответствуют.",59 м²,,,,,,1/5,59 м²,59.0,1,23,2995836225,Sale,/3-komnatnaya-kvartira-na-prodazhu-linevo-2995836225,,2 300 000 ₽,38 983 ₽ за м²,38983,2300000,Apartment,2020-11-10T15:39:26.365804Z,78,Listing,3,3.0,2020-12-10T18:30:47.633834+03:00,2037335677,2020-11-10T18:29:02.124779+03:00,2020-11-10T18:30:47.633834+03:00,,,,,"3-комн. квартира, 59 м², 1/5 эт.",2020-11-10T15:39:56.917568Z
"ул. Декабристов, д. 115",107238416,"Отдел продаж Застройщика ""Инвест-плюс""",New,3285,2020-01-14T08:39:43.341929Z,Надёжный объект с проектным финансированием ПАО СБЕРБАНК.<br>Сдача 4-й квартал 2020 года.<br>Безопасные сделки через счёт ЭСКРОУ.<br>* 0.1 % (процентная ставка для ВСЕХ на срок кредитования 1 год).<br>ВЫСОКАЯ СТАДИЯ ГОТОВНОСТИ.<br>Привлекательные процентные ставки по ипотеке с Государственной поддержкой.<br>Строительство ведётся активными темпами.<br>Хорошее расположение. В пешей доступности станция метро Речной Вокзал.<br>Красивый высокий дом. Отличный панорамный вид на реку и город.<br>ФАСАД С ПОДСВЕТКОЙ.<br>Современный высококомфортабельный комплекс с благоустроенной придомовой территорией.<br>Дизайнерское исполнение подъездов в современном стиле.<br>УЛУЧШЕННАЯ ЧИСТОВАЯ ОТДЕЛКА.<br>ШИКАРНАЯ ВХОДНАЯ ГРУППА.<br>Кофе бар с камином и мягкими диванами.<br>Три скоростных лифта.<br>Двор без машин.<br>Огороженная территория.<br>Наличие беседки барбекю.<br>Мини стадион.<br>Уличные тренажеры и беговая дорожка.<br>Современная детская игровая площадка на высшем уровне.<br>Так же в продаже парковочные места 600 000 и 650 000 тысяч.<br>Выход на парковку ИЗ ЛИФТА.<br>Приходите на экскурсию.<br>Более подробную информацию можно получить по телефону либо в отделе продаж...,86 м²,91288.0,ЖК «Октябрьский квартал»,91288.0,ЖК «Октябрьский квартал»,650.0,7/22,86 м²,86.0,7,21,2215221029,Sale,/3-komnatnaya-kvartira-na-prodazhu-novosibirsk-2215221029,265.0,6 400 000 ₽,74 419 ₽ за м²,74419,6400000,Apartment,2020-01-14T08:39:43.341929Z,78,Listing,3,3.0,2020-12-09T09:34:33.925834+03:00,1870818753,2020-01-14T10:48:15.812302+03:00,2020-11-09T09:34:33.925834+03:00,1.458,265.0,#FF0000,Речной вокзал,"3-комн. квартира, 86 м², 7/22 эт.",2020-11-09T06:43:40.608545Z
"Новосибирск, улица Петухова, 55",152810530,Центральное агентство недвижимости,Resale,3285,2020-08-08T07:35:30.834908Z,"В срочной продаже отличная,светлая  и уютная квартира,очень теплая, дом кирпичный, с/у раздельный стены от потолка до пола- кафель,окна пластиковые, просторная кухня с широким окном, ремонт заходи и живи, в квартире остается мебель. Развитый район всё необходимое для комфортного проживания  школы, детский сад, магазины, супермаркеты, остановка общественного транспорта рядом с домом.  Документы в порядке,один взрослый собственник,показ по договоренности.<br>При звонке, пожалуйста, назовите номер объявления - 0<br>Консультируем подробно по телефону.",27 м²,,,,,655.0,2/5,27 м²,27.0,2,13,2773255273,Sale,/1-komnatnaya-kvartira-na-prodazhu-novosibirsk-2773255273,267.0,1 640 000 ₽,60 741 ₽ за м²,60741,1640000,Apartment,2020-08-08T07:35:30.834908Z,78,Listing,1,1.0,2020-12-11T15:32:50.286901+03:00,1952653261,2020-08-08T10:25:43.464068+03:00,2020-11-17T05:26:33.698038+03:00,4.415,267.0,#FF0000,Площадь Маркса,"1-комн. квартира, 27 м², 2/5 эт.",2020-11-17T02:36:01.252684Z
"Новосибирск, улица Челюскинцев, 18",152810530,Центральное агентство недвижимости,Resale,3285,2020-11-11T12:50:20.986332Z,"Таких вариантов уже больше не будет: цена - подарок. Возможен любой вид расчета.<br>Гарантийный сертификат от  Центрального агентства недвижимости  действует на весь срок владения объектом недвижимости  Кооперативный кирпичный теплый дом расположен внутри квартала. Гимназия №4 в трех минутах детский сад в двух. Квартира не угловая классической планировкой, требует ремонта. Жск Венера  превосходно обслуживает этот дом: чистые подъезды без постороннего запаха, видеонаблюдение в подъездах и придомовой территории. показ возможен в любое время. Ключи находятся в агентстве. Звоните напрямую и вы получите подробную информацию из первых уст! Все подробности по телефону. <br>При звонке, пожалуйста, назовите номер объявления - 114 366<br>Консультируем подробно по телефону.",56.4 м²,,,,,652.0,6/9,56.4 м²,56.4,6,26,2998173499,Sale,/3-komnatnaya-kvartira-na-prodazhu-novosibirsk-2998173499,268.0,4 070 000 ₽,72 163 ₽ за м²,72163,4070000,Apartment,2020-11-11T12:50:20.986332Z,78,Listing,3,3.0,2020-12-11T15:41:19.204696+03:00,2016294711,2020-11-11T15:40:53.459456+03:00,2020-11-30T15:43:14.030661+03:00,0.453,268.0,#008000,Площадь Гарина-Михайловского,"3-комн. квартира, 56.4 м², 6/9 эт.",2020-11-30T12:57:35.376624Z
"ул. Бородина, д. 1",182504330,Милый Дом,New,3285,2020-08-09T09:34:06.884244Z,"Открыты продажи в новом строящемся жилом комплексе ""Новые Матрешки!<br>Однокомнатная квартира - студия с отделкой под ключ!<br>Кировский район, недалеко от пл. Кирова.<br>В комплексе «Новые Матрёшки» будут сочетаться новаторские подходы и проверенные временем традиции. Например, на фасадах обоих домов будет арт-изображение матрёшки в современном стиле, делающим отсылку к высоким технологиям и символизирующим связь между комплексами.<br>Дома будут возведены по самой актуальной технологии – монолитно-железобетонный каркас с кирпичным заполнением.<br>Первым этапом возводится дом №1, в котором предусмотрено 848 квартир от 1-комнатных студий до 3-комнатных. Вы можете выбрать размер и планировку, отталкиваясь от желаний и потребностей.<br>Планируя этот проект, Застройщик подумала про все категории будущих жителей. Для молодых людей, которые покупают первую квартиру, часто важна доступная цена, современный стиль и транспортная мобильность; семьям с детьми необходима безопасность, места для прогулок, общения с соседями и активных игр; другим нужен простор в квартире и эстетика общего пространства. Из этих и других важных деталей получилась общая концепция жилого комплекса «Новые Матрёшки».<br>Два дома будут расположены напротив друг друга, образуя между собой общую придомовую территорию со своей атмосферой.<br>На первых этажах в двух секциях расположатся объекты коммерческой инфраструктуры. Вокруг домов предусмотрены парковочные места на 983 автомобиля, за безопасность которых можно не беспокоиться – вся территория комплекса огорожена по периметру.<br>Готовые квартиры с ремонтом – ещё одна визитная карточка комплекса. После получения ключей вы сразу же сможете отпраздновать новоселье. Застройщик делает ремонт в нейтральном стиле, который легко переделать под свои желания, а также застекляет лоджии.<br>Отдельное внимание уделено местам общего пользования: в ЖК «Новые Матрёшки» холлы и лестничные площадки выглядят современно, стильно и продолжают общую концепцию оформления.<br>Льготная ипотека! Помощь в получении кредитного решения.<br>Услуги по покупке квартир в новостройках АБСОЛЮТНО БЕСПЛАТНЫ‼",32.3 м²,1025391321.0,ЖК «Новые Матрешки»,1025391321.0,ЖК «Новые Матрешки»,655.0,7/24,32.3 м²,32.3,7,6,2775442936,Sale,/kvartira-na-prodazhu-novosibirsk-2775442936,267.0,1 980 300 ₽,61 310 ₽ за м²,61310,1980300,Apartment,2020-08-09T09:34:06.884244Z,78,Listing,Студия,,2020-12-16T07:26:19.593111+03:00,1959929405,2020-07-10T12:10:57.70803+03:00,2020-11-16T07:26:19.593111+03:00,,,,,"Квартира-студия, 32.3 м², 7/24 эт.",2020-11-16T04:35:22.126419Z
"ул. Бородина, д. 1",182504330,Милый Дом,New,3285,2020-08-09T09:46:08.748413Z,"Открыты продажи в новом строящемся жилом комплексе ""Новые Матрешки!<br>Однокомнатная квартира с отделкой под ключ!<br>Кировский район, недалеко от пл. Кирова.<br>В комплексе «Новые Матрёшки» будут сочетаться новаторские подходы и проверенные временем традиции. Например, на фасадах обоих домов будет арт-изображение матрёшки в современном стиле, делающим отсылку к высоким технологиям и символизирующим связь между комплексами.<br>Дома будут возведены по самой актуальной технологии – монолитно-железобетонный каркас с кирпичным заполнением.<br>Первым этапом возводится дом №1, в котором предусмотрено 848 квартир от 1-комнатных студий до 3-комнатных. Вы можете выбрать размер и планировку, отталкиваясь от желаний и потребностей.<br>Планируя этот проект, Застройщик подумала про все категории будущих жителей. Для молодых людей, которые покупают первую квартиру, часто важна доступная цена, современный стиль и транспортная мобильность; семьям с детьми необходима безопасность, места для прогулок, общения с соседями и активных игр; другим нужен простор в квартире и эстетика общего пространства. Из этих и других важных деталей получилась общая концепция жилого комплекса «Новые Матрёшки».<br>Два дома будут расположены напротив друг друга, образуя между собой общую придомовую территорию со своей атмосферой.<br>На первых этажах в двух секциях расположатся объекты коммерческой инфраструктуры. Вокруг домов предусмотрены парковочные места на 983 автомобиля, за безопасность которых можно не беспокоиться – вся территория комплекса огорожена по периметру.<br>Готовые квартиры с ремонтом – ещё одна визитная карточка комплекса. После получения ключей вы сразу же сможете отпраздновать новоселье. Застройщик делает ремонт в нейтральном стиле, который легко переделать под свои желания, а также застекляет лоджии.<br>Отдельное внимание уделено местам общего пользования: в ЖК «Новые Матрёшки» холлы и лестничные площадки выглядят современно, стильно и продолжают общую концепцию оформления.<br>Льготная ипотека! Помощь в получении кредитного решения.<br>Услуги по покупке квартир в новостройках АБСОЛЮТНО БЕСПЛАТНЫ‼",33.6 м²,1025391321.0,ЖК «Новые Матрешки»,1025391321.0,ЖК «Новые Матрешки»,655.0,5/24,33.6 м²,33.6,5,6,2775474462,Sale,/1-komnatnaya-kvartira-na-prodazhu-novosibirsk-2775474462,267.0,2 077 000 ₽,61 815 ₽ за м²,61815,2077000,Apartment,2020-08-09T09:46:08.748413Z,78,Listing,1,1.0,2020-12-16T07:26:33.682429+03:00,1960681430,2020-07-10T12:35:45.491377+03:00,2020-11-16T07:26:33.682429+03:00,,,,,"1-комн. квартира, 33.6 м², 5/24 эт.",2020-11-16T04:35:37.277553Z
