address,agencyId,agencyName,apartmentSaleType,cityId,createdAt,description,details,developmentId,developmentName,developmentParentId,developmentParentName,districtId,floor,floorArea,floorAreaCalculated,floorInt,galleryImagesCount,id,itemType,itemUrl,metroId,price,pricePerArea,pricePerAreaValue,priceValue,propertyType,publishDate,regionId,resultType,rooms,roomsOrdinal,sourceFinishTime,sourceId,sourceStartTime,sourceUpdateTime,station_distance,station_id,station_lineColors,station_name,title,updatedAt
"Новосибирск, улица Семьи Шамшиных, 16",23367994,Компания «ЭТАЖИ»,Resale,3285,2020-11-11T03:29:37.532918Z,"В продаже трехкомнатная квартира-студия в самом центре города. Квартира светлая, теплая, шикарная кухня-гостиная 35 кв.м., просторный санузел, гардеробная. Цена без мебели !!! По договоренности покупателям оставляем качественный кухонный гарнитур со встроенной бытовой техникой, встроенные шкафы-купе, кровать в спальне, стол и стулья, кожаный диван.<br>На этаже собственная кладовая для хранения любых вещей, колясок, велосипедов. <br>В продаже имеется два парковочных места. <br>Придомовая территория огорожена, видеонаблюдение по периметру и в подъезде. В шаговой доступности Центральный парк, детские сады № 376, 495, школа № 29 с углублённым изучением истории и обществознания, Театр ГЛОБУС, Новосибирский Государственный Театр Оперы и Балета НОВАТ, торговый центр АУРА, аптеки, отделения банков, кафе, рестораны, все для комфортного проживания рядом. Удобная транспортная развязка, до метро Пл. Ленина 5 минут пешком.<br>Чистая продажа, без обременений, подходит под любой порядок расчетов. <br>Приглашаем к просмотру!. Номер в базе: 4870430. Район: Центральный.",95.7 м²,,,,,649.0,10/17,95.7 м²,95.7,10,20,2996775321,Sale,/3-komnatnaya-kvartira-na-prodazhu-novosibirsk-2996775321,263.0,8 650 000 ₽,90 387 ₽ за м²,90387,8650000,Apartment,2020-11-11T03:29:37.532918Z,78,Listing,3,3.0,2020-12-11T06:20:36.772584+03:00,2040295834,2020-11-11T06:20:10.544559+03:00,2020-12-01T16:14:14.380264+03:00,0.955,263.0,#FF0000,Площадь Ленина,"3-комн. квартира, 95.7 м², 10/17 эт.",2020-12-01T13:30:26.84407Z
"ул. Грибоедова, стр. 4",158578188,"Квартал «Никитина», застройщик Брусника",New,3285,2020-05-14T00:38:12.314745Z,"Квартира с объединенной кухней-гостиной и двумя спальнями в квартале с урбан-виллами на «Никитина». <br>                  ОБЪЯВЛЕНИЕ ОТ ЗАСТРОЙЩИКА<br>Квартиру можно купить онлайн.<br>Купить двухкомнатную квартиру в Октябрьском районе Новосибирска можно в урбан-виллах на «Никитина» от застройщика «Брусника. Сибакадемстрой». Это квартиры с объединённой кухней-гостиной, двумя спальнями, ванной комнатой и гостевым санузлом. Двухкомнатная может быть укомплектована тёплой лоджий, где удобно разместить рабочее место или кресла для отдыха. Есть варианты квартир с открытым французским балконом и террасами. В квартирах также спроектированы дополнительные помещения — гардеробные или ниши под хранение, постирочные, второй санузел. Есть планировки квартир с рядом особенностей и функций: двухуровневые, со вторым светом, отдельным входом, угловыми террасами. Есть варианты квартир с отдельным входом с улицы. <br>На сдаче в 2-комнатных квартирах в новостройках на «Никитина» выполнена отделка под чистовую. В каждой квартире — приборы учёта, радиаторы, розетки и выключатели, выполнена разводка электрики и отопления. Стены оштукатурены. Пол готов к финишному покрытию — ламинату, линолеуму, плитке.<br>Квартал «Никитина» расположен на пересечении улиц Никитина и Декабристов, 15 минут на автомобиле до центра города и 20 минут пешком до станции метро «Речной вокзал». Рядом находятся продуктовые магазины, аптеки, несколько детских садов, школа и гимназия, остановки общественного транспорта. <br>Проект ЖК «Никитина» включает восемь урбан-вилл высотой 7–9 этажей и одну визуальную доминанту — 17-этажную башню, которые окружены парковым пространством двора. Под кварталом расположен подземный паркинг для жителей. Проектом предусмотрено четыре очереди строительства. В первой очереди квартала на пересечении улиц Декабристов и Грибоедова будет 3 урбан-виллы, 145 квартир и 89 паркингов. Ввод квартир в новостройках на Никитина в эксплуатацию запланирован на 4 квартал 2021 года.<br>Купить 2-комнатную квартиру в ЖК «Никитина» в Октябрьском районе Новосибирска можно напрямую от застройщика «Брусника. Сибакадемстрой»:<br>— ипотека с отсрочкой платежей на год от ПАО Сбербанк;<br>— беспроцентная рассрочка на двухкомнатные в новостройках на «Никитина»;<br>— обмен своей квартиры на 2-комнатную в квартале «Никитина»;<br>— возможность заказать отделку и оформить её вместе с двухкомнатной квартирой в ипотеку;<br>— бесплатный юридический сервис по оформлению квартиры.<br>Получить одобрение ипотеки или рассрочку, а также осуществить обмен квартиры можно онлайн. Запишитесь на онлайн презентацию по телефону или на сайте.<br>            № квартиры в нашей базе: НСК15984.",67.2 м²,1004982330.0,Урбан-виллы на «Никитина»,1004982330.0,Урбан-виллы на «Никитина»,650.0,4/10,67.2 м²,67.2,4,19,2556935937,Sale,/2-komnatnaya-kvartira-na-prodazhu-novosibirsk-2556935937,265.0,6 100 000 ₽,90 774 ₽ за м²,90774,6100000,Apartment,2020-05-14T00:38:12.314745Z,78,Listing,2,2.0,2020-12-10T16:17:57.826063+03:00,1930565823,2020-05-13T14:21:34.406382+03:00,2020-11-10T16:17:57.826063+03:00,1.122,265.0,#FF0000,Речной вокзал,"2-комн. квартира, 67.2 м², 4/10 эт.",2020-11-10T13:28:12.637238Z
"ул. Владимира Заровного, стр. 30",162753784,"Микрорайон «Европейский берег», застройщик Брусника",New,3285,2020-09-07T15:30:21.253545Z,"Квартира с объединенной кухней-гостиной и тремя спальнями в микрорайоне «Европейский Берег». <br>                  ОБЪЯВЛЕНИЕ ОТ ЗАСТРОЙЩИКА<br>Квартиру можно купить онлайн.<br>Трёхкомнатная квартира в ЖК «Европейский Берег» в 15 минутах от метро «Речной вокзал» — это квартира с объединённой кухней-гостиной и тремя спальнями. В «Европейском Береге» можно купить 3-комнатную квартиру с собственной террасой, тёплой лоджией или открытым балконом. В квартирах также спроектированы дополнительные помещения — гардеробные или ниши под хранение, второй санузел, постирочная. Есть особенные квартиры увеличенной площади с несколькими балконами и летними террасами. Купить 3-комнатную квартиру в Октябрьском районе Новосибирска выгодно напрямую от застройщика «Брусника. Сибакадемстрой».<br>На сдаче в 3-комнатных от застройщика «Брусника. Сибакадемстрой» выполнена отделка под чистовую. Установлена надёжная сейф-дверь. В каждой квартире — приборы учёта, радиаторы, розетки и выключатели, разводка отопления и электрики. Стены в студиях оштукатурены. Пол готов к финишному покрытию — ламинату, линолеуму, плитке.<br>ЖК «Европейский Берег» расположен на берегу Оби, между двумя мостами — Коммунальным и Бугринским, 15 минут на автомобиле по улице Большевистской до метро «Речной вокзал». В «Европейском Береге» построено 22 дома и проживает 5 000 семей. Внутри микрорайона расположен детский сад на 320 мест, открыты магазины, аптеки, кафе. Предусмотрено место под строительство школы и второго детского сада.<br>Сейчас в «Европейском Береге» ведётся строительство домов от 6 до 25 этажей на береговой линии ЖК вдоль улицы Владимира Заровного: три закрытых квартала с камерным двором-садом, две башни-доминанты и один сблокированный дом. Под строящимися домами «Европейского Берега» спроектированы подземные паркинги, в цокольных этажах — кладовые помещения. В продаже в ЖК «Европейский Берег» есть квартиры со сдачей в 4 квартале 2020 и 2021.<br>Купить трёхкомнатную квартиру в ЖК «Европейский Берег» в Октябрьском районе Новосибирска выгодно напрямую от застройщика «Брусника. Сибакадемстрой»:<br>— ипотека с отсрочкой платежей на год от ПАО Сбербанк;<br>— беспроцентная рассрочка на 3-комнатные в «Европейском Береге»;<br>— обмен своей квартиры на трёхкомнатную в новостройках на набережной Оби;<br>— возможность заказать отделку и оформить её вместе с 3-комнатной квартирой в ипотеку;<br>— бесплатный юридический сервис по оформлению квартиры.<br>Получить одобрение ипотеки или рассрочку, а также осуществить обмен квартиры можно онлайн. Запишитесь на онлайн презентацию по телефону или на сайте.<br>            № квартиры в нашей базе: НСК18595.",135.3 м²,23887.0,Микрорайон «Европейский Берег»,23887.0,Микрорайон «Европейский Берег»,650.0,7/8,135.3 м²,135.3,7,16,2845648759,Sale,/3-komnatnaya-kvartira-na-prodazhu-novosibirsk-2845648759,265.0,10 750 000 ₽,79 453 ₽ за м²,79453,10750000,Apartment,2020-09-07T15:30:21.253545Z,78,Listing,3,3.0,2020-12-10T16:18:04.657013+03:00,2006078130,2020-09-07T18:20:20.477816+03:00,2020-11-10T16:18:04.657013+03:00,2.332,265.0,#FF0000,Речной вокзал,"3-комн. квартира, 135.3 м², 7/8 эт.",2020-11-10T13:27:46.142549Z
"ул. Владимира Заровного, стр. 30",162753784,"Микрорайон «Европейский берег», застройщик Брусника",New,3285,2020-09-07T16:29:25.350852Z,"Квартира с объединенной кухней-гостиной и четырьмя спальнями в микрорайоне «Европейский Берег». <br>                  ОБЪЯВЛЕНИЕ ОТ ЗАСТРОЙЩИКА<br>Квартиру можно купить онлайн.<br>Четырёхкомнатная квартира в ЖК «Европейский Берег» в 15 минутах от метро «Речной вокзал» — это квартира с объединённой кухней-гостиной и четырьмя спальнями. В «Европейском Береге» можно купить 4-комнатную квартиру с собственной террасой, тёплой лоджией или открытым балконом. В квартирах также спроектированы дополнительные помещения — гардеробные или ниши под хранение, второй санузел, постирочная. Есть особенные квартиры увеличенной площади с несколькими балконами и летними террасами. Купить 4-комнатную квартиру в Октябрьском районе Новосибирска выгодно напрямую от застройщика «Брусника. Сибакадемстрой».<br>На сдаче в 4-комнатных от застройщика «Брусника. Сибакадемстрой» выполнена отделка под чистовую. Установлена надёжная сейф-дверь. В каждой квартире — приборы учёта, радиаторы, розетки и выключатели, разводка отопления и электрики. Стены в студиях оштукатурены. Пол готов к финишному покрытию — ламинату, линолеуму, плитке.<br>ЖК «Европейский Берег» расположен на берегу Оби, между двумя мостами — Коммунальным и Бугринским, 15 минут на автомобиле по улице Большевистской до метро «Речной вокзал». В «Европейском Береге» построено 22 дома и проживает 5 000 семей. Внутри микрорайона расположен детский сад на 320 мест, открыты магазины, аптеки, кафе. Предусмотрено место под строительство школы и второго детского сада.<br>Сейчас в «Европейском Береге» ведётся строительство домов от 6 до 25 этажей на береговой линии ЖК вдоль улицы Владимира Заровного: три закрытых квартала с камерным двором-садом, две башни-доминанты и один сблокированный дом. Под строящимися домами «Европейского Берега» спроектированы подземные паркинги, в цокольных этажах — кладовые помещения. В продаже в ЖК «Европейский Берег» есть квартиры со сдачей в 4 квартале 2020 и 2021.<br>Купить четырёхкомнатную квартиру в ЖК «Европейский Берег» в Октябрьском районе Новосибирска выгодно напрямую от застройщика «Брусника. Сибакадемстрой»:<br>— ипотека с отсрочкой платежей на год от ПАО Сбербанк;<br>— беспроцентная рассрочка на 4-комнатные в «Европейском Береге»;<br>— обмен своей квартиры на трёхкомнатную в новостройках на набережной Оби;<br>— возможность заказать отделку и оформить её вместе с 4-комнатной квартирой в ипотеку;<br>— бесплатный юридический сервис по оформлению квартиры.<br>Получить одобрение ипотеки или рассрочку, а также осуществить обмен квартиры можно онлайн. Запишитесь на онлайн презентацию по телефону или на сайте.<br>            № квартиры в нашей базе: НСК18601.",182 м²,23887.0,Микрорайон «Европейский Берег»,23887.0,Микрорайон «Европейский Берег»,650.0,7/8,182 м²,182.0,7,16,2845773150,Sale,/4-komnatnaya-kvartira-na-prodazhu-novosibirsk-2845773150,265.0,11 980 000 ₽,65 824 ₽ за м²,65824,11980000,Apartment,2020-09-07T16:29:25.350852Z,78,Listing,4,4.0,2020-12-10T16:22:22.954465+03:00,2006230314,2020-09-07T18:20:20.526395+03:00,2020-11-10T16:22:22.954465+03:00,2.332,265.0,#FF0000,Речной вокзал,"4-комн. квартира, 182 м², 7/8 эт.",2020-11-10T13:31:27.514703Z
"ул. Владимира Заровного, стр. 30",162753784,"Микрорайон «Европейский берег», застройщик Брусника",New,3285,2020-09-07T16:29:28.436384Z,"Квартира с объединенной кухней-гостиной и одной спальней в микрорайоне «Европейский Берег». <br>                  ОБЪЯВЛЕНИЕ ОТ ЗАСТРОЙЩИКА<br>Квартиру можно купить онлайн.<br>Однокомнатная квартира в ЖК «Европейский Берег» в 15 минутах от метро «Речной вокзал» — это квартира с объединённой кухней-гостиной и отдельной спальней. Однокомнатная может быть укомплектована балконом или тёплой лоджией, где удобно организовать рабочее место. В квартирах также спроектированы дополнительные помещения — гардеробные или ниши под хранение, второй санузел, постирочная. Купить однокомнатную квартиру в Октябрьском районе Новосибирска выгодно напрямую от застройщика «Брусника. Сибакадемстрой».<br>На сдаче в 1-комнатных «Европейского Берега» выполнена отделка под чистовую. Установлена надёжная сейф-дверь. В каждой квартире — приборы учёта, радиаторы, розетки и выключатели, разводка отопления и электрики. Стены в студиях оштукатурены. Пол готов к финишному покрытию — ламинату, линолеуму, плитке.<br>ЖК «Европейский Берег» расположен на берегу Оби, между двумя мостами — Коммунальным и Бугринским, 15 минут на автомобиле по улице Большевистской до метро «Речной вокзал». В «Европейском Береге» построено 22 дома и проживает 5 000 семей. Внутри микрорайона расположен детский сад на 320 мест, открыты магазины, аптеки, кафе. Предусмотрено место под строительство школы и второго детского сада.<br>Сейчас в «Европейском Береге» ведётся строительство домов от 6 до 25 этажей на береговой линии ЖК вдоль улицы Владимира Заровного: три закрытых квартала с камерным двором-садом, две башни-доминанты и один сблокированный дом. Под строящимися домами «Европейского Берега» спроектированы подземные паркинги, в цокольных этажах — кладовые помещения. <br>Купить 1-комнатную квартиру в новостройках ЖК «Европейский Берег» в Октябрьском районе можно с помощью программ покупки от застройщика «Брусника. Сибакадемстрой»:<br>— ипотека с отсрочкой платежей на год от ПАО Сбербанк;<br>— беспроцентная рассрочка на 1-комнатные в «Европейском Береге»;<br>— обмен своей квартиры на однокомнатную в новостройках на набережной Оби;<br>— возможность заказать отделку и оформить её вместе с 1-комнатной квартирой в ипотеку;<br>— бесплатный юридический сервис по оформлению квартиры.<br>Получить одобрение ипотеки или рассрочку, а также осуществить обмен квартиры можно онлайн. Запишитесь на онлайн презентацию по телефону или на сайте.<br>            № квартиры в нашей базе: НСК18608.",58.4 м²,23887.0,Микрорайон «Европейский Берег»,23887.0,Микрорайон «Европейский Берег»,650.0,7/8,58.4 м²,58.4,7,16,2845773335,Sale,/1-komnatnaya-kvartira-na-prodazhu-novosibirsk-2845773335,265.0,5 600 000 ₽,95 890 ₽ за м²,95890,5600000,Apartment,2020-09-07T16:29:28.436384Z,78,Listing,1,1.0,2020-12-10T16:22:23.337585+03:00,2006111510,2020-09-07T18:20:20.183976+03:00,2020-11-10T16:22:23.337585+03:00,2.332,265.0,#FF0000,Речной вокзал,"1-комн. квартира, 58.4 м², 7/8 эт.",2020-11-10T13:31:26.643796Z
