address,agencyId,agencyName,apartmentSaleType,cityId,createdAt,description,details,districtId,floor,floorArea,floorAreaCalculated,floorInt,galleryImagesCount,id,itemType,itemUrl,metroId,price,pricePerArea,pricePerAreaValue,priceValue,propertyType,publishDate,regionId,resultType,rooms,roomsOrdinal,sourceFinishTime,sourceId,sourceStartTime,sourceUpdateTime,station_distance,station_id,station_lineColors,station_name,title,updatedAt
"Новосибирск, улица 1905 года, 2",152810530,Центральное агентство недвижимости,Resale,3285,2020-10-07T13:09:22.361914Z,"Удобная планировка трехкомнатной квартиры. Расположена в самом центре Железнодорожного района, рядом есть вся необходимая инфраструктура для проживания в пешей доступности ст. метро Площадь Гарина Михайловского. Развитая инфраструктура: детский садик № 423, лицей №9, школа №137, Новосибирский Государственный Цирк, Городская поликлиника № 20, БЦ Гринвич, ДК Железнодорожников. Дом классической кирпичной кладки, с толстыми стенами и высокими потолками. В квартире раздельный санузел, большая лоджия. Окна выходят во двор и на улицу 1905 года. Территория дома огорожена и оснащена видеонаблюдением, внутри двора находится детская площадка.<br> Комнаты: гостиная, две спальни, кухня, прихожая 15 кв.м.<br>Документы в полном порядке, любая форма расчета. Приглашаем на просмотр.<br>Торг при осмотре.<br>При звонке, пожалуйста, назовите номер объявления - 113 602<br>Консультируем подробно по телефону.",86.3 м²,652.0,9/10,86.3 м²,86.3,9,25,2914059140,Sale,/3-komnatnaya-kvartira-na-prodazhu-novosibirsk-2914059140,268.0,7 900 000 ₽,91 541 ₽ за м²,91541,7900000,Apartment,2020-10-07T13:09:22.361914Z,78,Listing,3,3,2021-01-08T05:27:44.97333+03:00,1984743100,2020-10-07T15:58:37.651651+03:00,2020-12-09T05:27:44.97333+03:00,0.432,268.0,#008000,Площадь Гарина-Михайловского,"3-комн. квартира, 86.3 м², 9/10 эт.",2020-12-09T02:36:49.787077Z
"Новосибирск, проспект Дзержинского, 58",152810530,Центральное агентство недвижимости,Resale,3285,2020-10-08T13:04:36.92036Z,"Продается 1-комнатная квартира. Расположена в тихом месте пр. Дзержинского. Рядом сад Дзержинского. Сделан качественный ремонт. Рядом остановка общ . транспорта, можно свободно  уехать в любой край города. В 50 метрах школа и д. сад, магазины, поликлиника и больница.Чистая продажа.<br> Помощь с получением ипотечного решения по сниженной процентной ставке  и финансовые гарантии Центрального агентства недвижимости на полную стоимость объекта.<br>При звонке, пожалуйста, назовите номер объявления - 114 436<br>Консультируем подробно по телефону.",31.5 м²,651.0,2/5,31.5 м²,31.5,2,17,2916403012,Sale,/1-komnatnaya-kvartira-na-prodazhu-novosibirsk-2916403012,272.0,2 250 000 ₽,71 429 ₽ за м²,71429,2250000,Apartment,2020-10-08T13:04:36.92036Z,78,Listing,1,1,2021-01-08T05:27:45.055187+03:00,1983948017,2020-10-08T15:55:06.432012+03:00,2020-12-09T05:27:45.055187+03:00,3.378,272.0,#008000,Золотая Нива,"1-комн. квартира, 31.5 м², 2/5 эт.",2020-12-09T02:36:49.356985Z
"Новосибирск, улица Жуковского, 105/2",152810530,Центральное агентство недвижимости,Resale,3285,2020-10-07T13:09:12.169228Z,"Продается солнечная 3-комнатная квартира в теплом кирпичном доме 1978 года постройки. Расположена на комфортном 3 этаже, в подъезде недавно был проведен ремонт.<br>Окна квартиры выходят на 3 стороны, из кухни виден детский сад (для семьи с маленьким ребенком — идеальное расположение). Сам дом удален от проезжей части, поблизости есть 2 школы, супермаркеты, аптеки и самое главное — изумительный Дендрологический парк с белочками и бурундуками. Прогулки по чистому воздуху, утренние пробежки, зимние виды спорта — все удовольствия можно реализовать в одном месте. Чуть подальше находится наша новосибирская достопримечательность — Зоопарк. В 10-15 минутах ходьбы крупнейшая развязка (площадь Калинина) и метро Заельцовская.<br>В квартире один зал и две спальни, все комнаты изолированы (между маленькими комнатами дополнительно есть дверь). В коридоре предусмотрены две ниши, можно снести и поставить вместительный шкаф-купе. Санузел раздельный, счетчики стоят. Из зала выход на большой балкон, можно оборудовать еще одно место для хранения вещей.<br>Адекватные соседи. Документы все в порядке — квартира во владении одной семьи уже не один десяток лет, готовы быстро выйти на сделку. <br>Квартире требуется ремонт. Шанс сделать все по своему вкусу и счастливо жить в тихом месте, окруженном прекрасной природой. Торг обсуждаем, звоните и приходите на просмотр.<br>При звонке, пожалуйста, назовите номер объявления - 82 147<br>Консультируем подробно по телефону.",60.4 м²,653.0,3/9,60.4 м²,60.4,3,23,2914058819,Sale,/3-komnatnaya-kvartira-na-prodazhu-novosibirsk-2914058819,260.0,3 990 000 ₽,66 060 ₽ за м²,66060,3990000,Apartment,2020-10-07T13:09:12.169228Z,78,Listing,3,3,2021-01-08T05:27:48.172135+03:00,1984916731,2020-10-07T15:58:33.575316+03:00,2020-12-09T05:27:48.172135+03:00,1.28,260.0,#FF0000,Заельцовская,"3-комн. квартира, 60.4 м², 3/9 эт.",2020-12-09T02:36:53.749667Z
"Новосибирск, 2-я Обская улица, 71",152810530,Центральное агентство недвижимости,Resale,3285,2020-10-09T02:39:41.261788Z,"Продается 2-х комнатная квартира, улучшенной планировки , на берегу р. Обь. Большая лоджия, с 2 - мя выходами из гостинной и кухни. Из окон квартиры видна Обь, всегда можно полюбоваться прекрасным видом,  есть выход к реке.  Удобная транспортная развязка.Рядом ост. завод Труд, недалеко метро Речной вокзал. Развитая инфраструктура. В шаговой доступности магазины Магнит, Лента, Пятерочка.Много детских садов, школа, гор. поликлиника №7, Во дворе детская площадка. В квартире частично сделан ремонт. Ждем на просмотр в удобное для вас время.<br>При звонке, пожалуйста, назовите номер объявления - 114 027<br>Консультируем подробно по телефону.",56 м²,650.0,4/10,56 м²,56.0,4,20,2917347321,Sale,/2-komnatnaya-kvartira-na-prodazhu-novosibirsk-2917347321,265.0,3 900 000 ₽,69 643 ₽ за м²,69643,3900000,Apartment,2020-10-09T02:39:41.261788Z,78,Listing,2,2,2021-01-08T05:27:48.124606+03:00,1984133046,2020-10-09T05:30:16.062704+03:00,2020-12-09T05:27:48.124606+03:00,1.312,265.0,#FF0000,Речной вокзал,"2-комн. квартира, 56 м², 4/10 эт.",2020-12-09T02:36:52.544842Z
"Новосибирск, Советский район, микрорайон Правые Чёмы, Добровольческая улица, 2",152810530,Центральное агентство недвижимости,Resale,3285,2020-10-09T02:50:01.118876Z,"Продается двухкомнатная квартира в центре Шлюза.<br>Многоэтажный дом стоит в дали от  проезжей части дороги, парковочные места перед домом, окна квартиры выходят на палисадник, из спальной комнаты есть выход на балкон, из большой комнаты – выход на лоджию. (на лоджии есть овощехранилище, больших размеров, с полками и отсеком для овощей). Все комнаты изолированы. В просторной прихожей имеется гардеробная. квартира теплая, уютная с качественным ремонтом.<br>Рядом транспортные остановки во все районы города, Академгородка, Бердска.  Район «Шлюз» имеет свою инфраструктуру, все необходимое для жизни рядом, в шаговой доступности: ТЦ «Маяк», магазины, аптеки, поликлиника, детские сады, школы. <br>Подходит под ипотеку, материнский капитал и другие виды расчета.<br> Центральное агентство недвижимости готово предложить Вам безопасную технологию по Вашей сделке, Свидетельство о материальной ответственности на приобретенный Вами объект недвижимости. В банках-партнерах есть особые условия для наших Клиентов.<br>Индивидуальный подход к покупателю, звоните.<br>При звонке, пожалуйста, назовите номер объявления - 82 537<br>Консультируем подробно по телефону.",51.9 м²,656.0,1/9,51.9 м²,51.9,1,22,2917350635,Sale,/2-komnatnaya-kvartira-na-prodazhu-novosibirsk-2917350635,,3 150 000 ₽,60 694 ₽ за м²,60694,3150000,Apartment,2020-10-09T02:50:01.118876Z,78,Listing,2,2,2021-01-08T05:27:48.113819+03:00,1984474926,2020-10-09T05:40:32.707951+03:00,2020-12-09T05:27:48.113819+03:00,,,,,"2-комн. квартира, 51.9 м², 1/9 эт.",2020-12-09T02:36:55.06689Z
"Новосибирск, улица Кирова, 78",152810530,Центральное агентство недвижимости,Resale,3285,2020-10-07T13:08:58.033184Z,"В продаже 2-х комнатная квартира в полногабаритном доме с с хорошим ремонтом.<br>Высота потолков 3.2 метра<br>Произведена замена сантехники и электрики.<br>Застеклён балкон.<br>Квартира очень тёплая,светлая,уютная,<br>Большая ,вместительная гардеробная.<br>Доброжелательные соседи<br>Много парковочных мест во дворе<br>До метро Октябрьская 5 минут ходьбы<br> В шаговой доступности цветной фонтан, библиотека ГПНТБ, банки, аптеки, торговые центры, магазины, детские садики, школы, поликлиника, магазин Бахетле .<br> Удобная транспортная развязка.<br>При звонке, пожалуйста, назовите номер объявления - 82 727<br>Консультируем подробно по телефону.",54.6 м²,650.0,3/4,54.6 м²,54.6,3,13,2914058102,Sale,/2-komnatnaya-kvartira-na-prodazhu-novosibirsk-2914058102,264.0,4 300 000 ₽,78 755 ₽ за м²,78755,4300000,Apartment,2020-10-07T13:08:58.033184Z,78,Listing,2,2,2021-01-08T05:27:48.333113+03:00,1984902279,2020-10-07T15:58:29.353483+03:00,2020-12-09T05:27:48.333113+03:00,0.401,264.0,#FF0000,Октябрьская,"2-комн. квартира, 54.6 м², 3/4 эт.",2020-12-09T02:36:53.391017Z
"Новосибирск, Кировский район, Затулинский жилмассив, улица Зорге, 40",152810530,Центральное агентство недвижимости,Resale,3285,2020-10-07T13:09:11.496225Z,"Большая квартира с раздельными комнатами в хорошем состоянии. Квартира светлая и теплая, стеклопакеты с широкими подоконниками, заменена входная дверь, в каждой комнате есть встроенные щкафы, которые можно превратить в гардеробные комнаты. Это позволит значительно увеличить пространство квартиры. В массимальной близости школа-гимназия, детский сад, остановки общественного транспорта, магазины, стадион Фламинго, кинотеатр и многое другое. До ближайшей станции метро Площадь Маркса можно добраться за 15 мин. Рассмотрим вариант обмена на вашу недвижимость.<br>При звонке, пожалуйста, назовите номер объявления - 82 711<br>Консультируем подробно по телефону.",57 м²,655.0,1/5,57 м²,57.0,1,21,2914058799,Sale,/3-komnatnaya-kvartira-na-prodazhu-novosibirsk-2914058799,,3 170 000 ₽,55 614 ₽ за м²,55614,3170000,Apartment,2020-10-07T13:09:11.496225Z,78,Listing,3,3,2021-01-08T05:27:48.2641+03:00,1984439162,2020-10-07T15:58:33.838637+03:00,2020-12-09T05:27:48.2641+03:00,,,,,"3-комн. квартира, 57 м², 1/5 эт.",2020-12-09T02:36:53.920799Z
"Новосибирская область, Мошковский район, посёлок Октябрьский, Локтинская улица, 6/2",152810530,Центральное агентство недвижимости,Resale,3262,2020-10-08T13:04:31.377191Z,"Предлагаем вашему вниманию двухуровневую квартиру в поселке Октябрьский. В квартире выполнен частично ремонт. На полу во всех комнатах ламинат. Окна пластиковые, стены обшиты гипсокартоном и наклеены обои под покраску. Заменяна вся проводка. В санузле выполнен ремонт на 50%. Установлена душевая кабина, инсталяция. На полу кафель, стены подготовлены под кафель. Большая просторная кухня-гостинная с кухонной зоной на первом уровне третьего этажа и на втором уровне две комнаты отдыха. Санузел совместный на первом этаже. Ухоженная придомовая территория. Чистый и аккуратный подъезд и дружные соседи. Отличное местоположение дома, так как рядом с домом детский сад и открыта новая школа. В шаговой доступности магазин Магнит. До пл. Калинина 15 минут езды на общественном транспорте. Один взрослый собственник. Чистая продажа. Арестов и обременений по объекту нет. В квартире никто не прописан. Готовы к разумному торгу и быстрому выходу на сделку. <br>При звонке, пожалуйста, назовите номер объявления - 82 847<br>Консультируем подробно по телефону.",67.4 м²,,3/3,67.4 м²,67.4,3,11,2916402842,Sale,/3-komnatnaya-kvartira-na-prodazhu-sokur-2916402842,,2 350 000 ₽,34 866 ₽ за м²,34866,2350000,Apartment,2020-10-08T13:04:31.377191Z,78,Listing,3,3,2021-01-08T05:27:48.20273+03:00,1984671710,2020-10-08T15:55:03.282915+03:00,2020-12-09T05:27:48.20273+03:00,,,,,"3-комн. квартира, 67.4 м², 3/3 эт.",2020-12-09T02:36:51.670566Z
"Новосибирск, улица Державина, 42",152810530,Центральное агентство недвижимости,Resale,3285,2020-10-08T13:04:36.535457Z,"В продаже 3-х комнатная квартира с отличным ремонтом - состояние  заходи и живи  <br>В стоимость квартиры входят встроенные шкафы и кухонный гарнитур.<br>Квартира без обременений, один взрослый собственник, готовы быстро выйти на сделку.<br>Дом по прописке относится к Экономическому лицею.<br>В пешей доступности метро Красный проспект, метро Маршала Покрышкина, Центральный рынок, ТРЦ Галерея, бассейн Спартак, стадион Спартак, Центральный парк, магазины, банки, медучреждения и многое другое для комфортного проживания с минимальными затратами времени.<br>Приглашаем на просмотры.<br>При звонке, пожалуйста, назовите номер объявления - 82 861<br>Консультируем подробно по телефону.",60.3 м²,649.0,3/9,60.3 м²,60.3,3,24,2916402990,Sale,/3-komnatnaya-kvartira-na-prodazhu-novosibirsk-2916402990,270.0,5 650 000 ₽,93 698 ₽ за м²,93698,5650000,Apartment,2020-10-08T13:04:36.535457Z,78,Listing,3,3,2021-01-08T05:27:48.231269+03:00,1984849428,2020-10-08T15:55:08.370117+03:00,2020-12-09T05:27:48.231269+03:00,0.611,270.0,#008000,Маршала Покрышкина,"3-комн. квартира, 60.3 м², 3/9 эт.",2020-12-09T02:36:53.697767Z
"Новосибирск, улица Одоевского, 1/8",152810530,Центральное агентство недвижимости,Resale,3285,2020-10-08T13:04:38.466641Z,"Студия с отличным ремонтом на самом удобном этаже в новом доме.  Лоджия остеклена. Качественный ремонт. Детский сад, школа в 100 метрах от дома, до остановки 50 метров. Супермаркеты, магазины, аптеки, спортивные секции, кружки, ветеринарная клиника, библиотека, спортзал, студии красоты в шаговой доступности. Отличный вариант как для проживания, так и для сдачи в аренду. Любая форма расчета. Приглашаем на просмотр.	<br>При звонке, пожалуйста, назовите номер объявления - 113 499<br>Консультируем подробно по телефону.",21 м²,657.0,4/10,21 м²,21.0,4,16,2916403040,Sale,/1-komnatnaya-kvartira-na-prodazhu-novosibirsk-2916403040,,1 530 000 ₽,72 857 ₽ за м²,72857,1530000,Apartment,2020-10-08T13:04:38.466641Z,78,Listing,1,1,2021-01-08T05:27:48.27701+03:00,1984154683,2020-10-08T15:55:06.166727+03:00,2020-12-09T05:27:48.27701+03:00,,,,,"1-комн. квартира, 21 м², 4/10 эт.",2020-12-09T02:36:52.794754Z
"Новосибирск, Узловая улица, 8/1",152810530,Центральное агентство недвижимости,Resale,3285,2020-10-08T13:04:38.841794Z,"2-х комнатная квартира-студия в новом доме переменной этажности.Дом расположен в Октябрьском районе в 10-ти минутах ходьбы от станции метро  Золотая Нива .В пешей доступности:детские сады,школы,гимназии,НГАУ,всевозможные кружки,секции для детей,поликлиника,сетевые магазины и торговые центры,в самом доме продуктовый магазин.В квартире выполнен отличный,качественный ремонт:на полу плитка ПВХ,натяжные потолки,современные обои.Ремонт делали для себя,всё предусмотренно,всё учтено.Выделена кухонная зона.Стены,пол в ванной выложены дорогостоящей,качественной плиткой,теплый пол,<br>установили вытяжку.Ко всему прочему большой,просторный балкон,остеклен. Приглашаем на просмотр,приходите,оцените,убедитесь квартира идеально вам подходит.<br>При звонке, пожалуйста, назовите номер объявления - 81 646<br>Консультируем подробно по телефону.",51.9 м²,650.0,3/12,51.9 м²,51.9,3,27,2916403065,Sale,/2-komnatnaya-kvartira-na-prodazhu-novosibirsk-2916403065,272.0,4 600 000 ₽,88 632 ₽ за м²,88632,4600000,Apartment,2020-10-08T13:04:38.841794Z,78,Listing,2,2,2021-01-08T05:27:48.187109+03:00,1984632534,2020-10-08T15:55:08.313885+03:00,2020-12-09T05:27:48.187109+03:00,1.479,272.0,#008000,Золотая Нива,"2-комн. квартира, 51.9 м², 3/12 эт.",2020-12-09T02:36:53.339791Z
