address,agencyId,agencyName,apartmentSaleType,cityId,createdAt,description,details,districtId,floor,floorArea,floorAreaCalculated,floorInt,galleryImagesCount,id,itemType,itemUrl,metroId,price,pricePerArea,pricePerAreaValue,priceValue,propertyType,publishDate,regionId,resultType,rooms,roomsOrdinal,sourceFinishTime,sourceId,sourceStartTime,sourceUpdateTime,station_distance,station_id,station_lineColors,station_name,title,updatedAt
"Новосибирск, улица Некрасова, 41",152810530,Центральное агентство недвижимости,Resale,3285,2020-10-09T02:41:22.747893Z,"ЖК   Огни Сибири . Дом сдан. Право собственности от регистрировано. Квартира под чистовую отделку. Чистая продажа.<br>Малонаселённая 8-ми этажная секция. Квартира не угловая. Интересная, удобная планировка- на две стороны. Хороший этаж. Центр мегаполиса.<br>ЖК   Огни Сибири   Современный безопасный квартал в Центре Новосибирска.<br>Уникальный комплекс со своей инфраструктурой - аптеки и салоны красоты, офисы и магазины, супермаркет и химчистка, кофейня, банки, медицинский центр и фитнес центр с бассейном, а так же 2 детских сада прямо на территории внутреннего двора.<br>Полностью изолирован двор от машин, с детскими и спортивными площадками, велодорожками, многоуровневым озеленением и каскадным водопадом.<br>Большой наземный крытый паркинг и подземный.<br>Квартиры под со, стяжка пола, качественная входная дверь, окна Rehau, радиаторы Henrad.<br>При звонке, пожалуйста, назовите номер объявления - 82 981<br>Консультируем подробно по телефону.",60 м²,649.0,6/8,60 м²,60.0,6,10,2917347961,Sale,/2-komnatnaya-kvartira-na-prodazhu-novosibirsk-2917347961,270.0,6 400 000 ₽,106 667 ₽ за м²,106667,6400000,Apartment,2020-10-09T02:41:22.747893Z,78,Listing,2,2,2021-01-08T05:27:48.195857+03:00,1984553288,2020-10-09T05:28:15.859601+03:00,2020-12-09T05:27:48.195857+03:00,0.607,270.0,#008000,Маршала Покрышкина,"2-комн. квартира, 60 м², 6/8 эт.",2020-12-09T02:36:53.859757Z
"Новосибирск, улица Дуси Ковальчук, 238",152810530,Центральное агентство недвижимости,Resale,3285,2020-11-09T02:14:17.313025Z,"В продаже просторная трёшка-студия в ЖК Нарымский квартал, в которой аура семейного счастья и уюта окружит вас с порога. Удобная планировка на две стороны позволит любоваться рассветом с балкона одной из спален и закатом с уютной, обшитой деревом лоджии огромной, 28.1кв.м., кухни-гостиной. В квартире хороший ремонт. При продаже остаётся вся мебель и часть бытовой техники. Приятным бонусом будет индивидуальная небольшая кладовка на этаже. Единственный подъезд с расположением в 4 квартиры на этаж, так что соседей минимум. Отличная транспортная развязка и две остановки от метро Заельцовская позволит быстро попасть в любую точку города. Инфраструктура вокруг развита по максимуму: от продуктовых магазинов на любой уровень дохода до элитной гимназии №9  и зоопарка. Один собственник, без обременений и поиска обменных вариантов.<br>Помощь в получении ипотечного решения от Центрального агентства недвижимости. <br>С нами ипотека дешевле.<br>При звонке, пожалуйста, назовите номер объявления - 72 598<br>Консультируем подробно по телефону.",80 м²,653.0,5/19,80 м²,80.0,5,19,2991763148,Sale,/3-komnatnaya-kvartira-na-prodazhu-novosibirsk-2991763148,261.0,6 150 000 ₽,76 875 ₽ за м²,76875,6150000,Apartment,2020-11-09T02:14:17.313025Z,78,Listing,3,3,2021-01-08T05:27:48.242724+03:00,2016666587,2020-11-09T05:04:46.778041+03:00,2020-12-09T05:27:48.242724+03:00,1.117,261.0,#FF0000,Гагаринская,"3-комн. квартира, 80 м², 5/19 эт.",2020-12-09T02:36:53.214629Z
"Новосибирск, Выборная улица, 99/7",152810530,Центральное агентство недвижимости,Resale,3285,2020-12-09T02:36:50.206221Z,"Продается прекрасная квартира в новом доме, 2 комнатная студия, большая просторная гостиная, полноценная спальня, оборудованная кухня, удобная прихожая, утепленная лоджия, раздельный санузел. Расположена на 5-ом этаже 7-ми этажного кирпичного дома, большая огороженная и охраняемая территория с прекрасной детской площадкой и парковками. Рядом в шаговой доступности школы, детские сады, вузы, магазины, остановка общественного транспорта, высокая степень транспортной доступности.<br>При звонке, пожалуйста, назовите номер объявления - 112 832<br>Консультируем подробно по телефону.",50 м²,650.0,5/7,50 м²,50.0,5,14,3062478634,Sale,/2-komnatnaya-kvartira-na-prodazhu-novosibirsk-3062478634,272.0,4 900 000 ₽,98 000 ₽ за м²,98000,4900000,Apartment,2020-12-09T02:36:50.206221Z,78,Listing,2,2,2021-01-08T05:27:48.210389+03:00,2048718673,2020-12-09T05:27:22.036102+03:00,2020-12-09T05:27:48.210389+03:00,4.314,272.0,#008000,Золотая Нива,"2-комн. квартира, 50 м², 5/7 эт.",2020-12-09T02:36:53.963749Z
"Новосибирск, Калининский район, микрорайон Родники, улица Гребенщикова, 7",62844843,Агентство недвижимости Калининское,Resale,3285,2020-02-10T11:18:26.32454Z,"Дом очень удачно расположен внутри нового <br>и современного жилого массива. Тихий двор. Развитая инфраструктура. Всё рядом: школа №211 им. Л.И.Сидоренко, детские сады, торгово-развлекательный центр Кристалл, торговый комплекс Лента, ""Леруа Мерлен"", Региональный спортивный центр по фехтованию Новосибирской области с бассейном, крытый каток, городская поликлиника, автобусная остановка, детские площадки и многое многое другое. В квартире выполнен ремонт: обои под покраску, натяжные потолки, линолеум, качественная входная дверь, огромнейшая лоджия остеклена. В подарок остается два шкафа в коридоре, кухонный гарнитур, кондиционер. Отличное предложение как для проживания, так и для сдачи в аренду! Покажем квартиру в любое удобное для вас время, ждем покупателей на просмотр.",76.6 м²,648.0,2/17,76.6 м²,76.6,2,15,2295285556,Sale,/3-komnatnaya-kvartira-na-prodazhu-novosibirsk-2295285556,,5 600 000 ₽,73 107 ₽ за м²,73107,5600000,Apartment,2020-02-10T11:18:26.32454Z,78,Listing,3,3,2021-01-05T17:22:01.175289+03:00,1865071947,2020-02-10T08:44:32.398601+03:00,2020-12-06T17:22:01.175289+03:00,,,,,"3-комн. квартира, 76.6 м², 2/17 эт.",2020-12-06T14:31:09.294701Z
"Новосибирск, улица Танкистов, 3",135935792,Инна,Resale,3285,2020-10-09T05:14:42.108941Z,"Продаётся 3-х комнатная квартира с изолированными комнатами, планировка на две стороны дома, балкон и лоджия, установлены счетчики на воду. Над нами техэтаж, никто не будет ходить по головам. Отсечка на две квартиры, хорошие соседи.<br>Дом расположен на  второй линии от дороги по ул. Титова, двор засажен деревьями, большая парковка, недалеко остановки автобуса и трамвая, 15 минут до метро Маркса, рядом расположены магазины, школа и детский сад, поликлиника №11, Троицкий сквер,церковь, в шаговой доступности спорткомплекс Заря.<br>Состояние квартиры удовлетворительное, на полу линолеум застройщика, окна деревянные, балкон и лоджия не застеклены, в ванной современный кафель, новая входная дверь. Квартира чистая, ухоженная, но необходим ремонт.<br>Мебель можем частично оставить.<br>В квартире никто не прописан, 3 взрослых собственника, в собственности более 5 лет, обременений нет, подходит любая форма расчета.<br>Чистая продажа. Быстрый выход на сделку. Заселение сразу после регистрации сделки.",60.1 м²,654.0,9/9,60.1 м²,60.1,9,11,2917487133,Sale,/3-komnatnaya-kvartira-na-prodazhu-novosibirsk-2917487133,267.0,3 100 000 ₽,51 581 ₽ за м²,51581,3100000,Apartment,2020-10-09T05:14:42.108941Z,78,Listing,3,3,2021-01-07T08:07:23.417346+03:00,1998274368,2020-10-09T08:05:13.221082+03:00,2020-12-08T08:07:23.417346+03:00,4.0,267.0,#FF0000,Площадь Маркса,"3-комн. квартира, 60.1 м², 9/9 эт.",2020-12-08T05:16:26.427966Z
