address,agencyId,agencyName,apartmentSaleType,cityId,createdAt,description,details,developmentId,developmentName,developmentParentId,developmentParentName,districtId,floor,floorArea,floorAreaCalculated,floorInt,galleryImagesCount,id,itemType,itemUrl,metroId,price,pricePerArea,pricePerAreaValue,priceValue,propertyType,publishDate,regionId,resultType,rooms,roomsOrdinal,sourceFinishTime,sourceId,sourceStartTime,sourceUpdateTime,station_distance,station_id,station_lineColors,station_name,title,updatedAt
"ул. Королева, жилые дома",182504330,Милый Дом,New,3285,2020-10-09T05:06:19.001585Z,"Уютная 1-комн студия в 10 минутах от метро «Березовая роща». Идеально подойдёт для инвестиций!<br>ЖК на ул. Королева — это жилье различной планировки, от скромных однокомнатных до трехкомнатных студий и квартир с традиционным расположением комнат. Представлены помещения без отделки и с готовым ремонтом. Вам остается только завести мебель и отпраздновать новоселье. Внутренне пространство организовано так, что использовать его можно по собственному желанию.<br>Застройщик ответственно подошел к проекту, и в Дзержинском районе города вырос современный жилой комплекс, в котором есть все для комфортного проживания.<br>Новостройка расположена рядом с двумя автомагистралями с регулярно проходящим общественным транспортом: автобусами и маршрутным такси. В нескольких минутах ходьбы находятся две станции метро. Жители легко добраются в любой район города.<br>В шаговой доступности расположены торгово-развлекательный центр «Сибирский молл», супермаркеты, школы, лицеи, детские сады, аптеки и лечебные учреждения, работают фитнес-клубы и салоны красоты. В 15-и минутах ходьбы находится парк культуры и отдыха «Березовая роща». На придомовой территории есть спортивные и детские площадки.<br>Срок сдачи - 3 квартал 2022 года<br>🔆Записаться на экскурсию, узнать подробности о ЖК ""На Королева"" и забронировать квартиру можно, позвонив по телефону, указанному в объявлении<br>☑️Покупая квартиру в ипотеку, каждому нашему клиенту предоставляется комплексное юридическое сопровождение на любом из этапов сделки - мы даем абсолютную гарантию безопасности сделки по покупке квартиры!<br>👍🏻Услуги по покупке квартир в новостройках АБСОЛЮТНО БЕСПЛАТНЫ‼️<br>☎️Звоните/пишите и мы подберем для Вас идеальную квартиру по самой выгодной цене!",27.6 м²,,,,,651.0,11/20,27.6 м²,27.6,11,18,2917479514,Sale,/kvartira-na-prodazhu-novosibirsk-2917479514,272.0,2 390 000 ₽,86 594 ₽ за м²,86594,2390000,Apartment,2020-10-09T05:06:19.001585Z,78,Listing,Студия,,2021-01-07T14:08:33.558656+03:00,1992840478,2020-10-09T07:57:15.368929+03:00,2020-12-08T14:08:33.558656+03:00,1.143,272.0,#008000,Золотая Нива,"Квартира-студия, 27.6 м², 11/20 эт.",2020-12-08T11:17:37.493311Z
"Новосибирск, Красный проспект, 309",28582264,РК  «Риэлт–Мастер»,Resale,3285,2020-12-07T19:24:17.377041Z,"Продам полноценную 2х комнатную квартиру в новом доме!<br>Квартира под чистовую отделку, огромная лоджия с выходом из всех комнат! Установлена фирменая входная дверь!<br>Дом располоден в новом жилом комплексе Северная Корона.<br>В микрорайоне великолепная инфрастрктура:<br>торгрвые центры школы, детские сады, поликлинникии и т.д.<br>, все для комфортной жизни!<br>Возможна ипотека, окажем помощь в получении положителтного кредитного решения!",54 м²,,,,,648.0,4/12,54 м²,54.0,4,12,3059746816,Sale,/2-komnatnaya-kvartira-na-prodazhu-novosibirsk-3059746816,,4 100 000 ₽,75 926 ₽ за м²,75926,4100000,Apartment,2020-12-07T19:24:17.377041Z,78,Listing,2,2.0,2021-01-06T22:15:13.288384+03:00,2070453060,2020-12-07T22:11:26.355027+03:00,2020-12-07T22:15:13.288384+03:00,,,,,"2-комн. квартира, 54 м², 4/12 эт.",2020-12-07T19:24:22.094511Z
"Новосибирск, Рыбацкая улица, 25",94101510,"Агентство недвижимости ""Дельта""",Resale,3285,2019-04-03T05:22:13.821762Z,"Просторная трёхкомнатная квартира в таунхаусе на улице Рыбацкой. (ЖК ""Золотая долина""). Экологически чистый район в живописнейшем месте ВЗ Академгородка. В шаговой доступности Ботанический сад, пляжи Обского водохранилища. Курортная зона!!! Для любителей жизни на лоне природы, но территориально относится к ВЗ Академгородка, то есть поликлиника, детские сады, школы.<br>Квартира двухуровневая, прекрасная планировка (три гардеробных, два санузла, две лоджии и т.д.). Качественный хороший ремонт.<br>В непосредственной близости супермаркет, две остановки общественного транспорта, остановка электрички. Все подробности при осмотре квартиры.<br>Рассмотрим встречные предложения<br>Звоните!!!",120.7 м²,,,,,656.0,3/4,120.7 м²,120.7,3,8,1207238764,Sale,/3-komnatnaya-kvartira-na-prodazhu-novosibirsk-1207238764,,8 600 000 ₽,71 251 ₽ за м²,71251,8600000,Apartment,2019-04-03T05:22:13.821762Z,78,Listing,3,3.0,2021-01-05T08:19:25.529489+03:00,1466838962,2019-04-03T08:09:32.589617+03:00,2020-12-06T08:19:25.529489+03:00,,,,,"3-комн. квартира, 120.7 м², 3/4 эт.",2020-12-06T05:28:30.680895Z
"ул. Дмитрия Шамшурина, жилой дом",117536457,Камея,New,3285,2020-09-28T18:26:16.367888Z,"Монолитно-кирпичный дом с закрытой территорией и подземным паркингом. Авторская архитектура с элементами классики, вечерняя подсветка фасада и территории, панорамные виды на город и реку для настоящих ценителей красоты.<br>— Двор без машин<br>— Современные детские игровые комплексы от европейских производителей с травмобезопасным покрытием<br>— Функциональные спортивные площадки для занятий на открытом воздухе.<br>— Огороженная территория обеспечена видеонаблюдением и контролем доступа.<br>Современная входная группа без ступеней, с панорамным остеклением, широкие коридоры, просторный холл с зоной ожидания, колясочная и место для хранения велосипедов. Предусмотрены консьерж-сервис и отдельный вход для погрузочных работ.<br>Двухуровневый подземный паркинг со входом из лифта. Паркинг обеспечен видеонаблюдением и системами противопожарной безопасности. Всегда чистый и теплый автомобиль в любой сибирский мороз или непогоду.<br>В доме установлены скоростные программируемые лифты с улучшенной отделкой – 2 пассажирских и 1 грузопассажирский.<br>В проекте представлены самые популярные типы квартир – от студий для современной молодежи до просторных трехкомнатных квартир для семей с детьми. Качественная входная дверь, улучшенная шумоизоляция, увеличенные оконные проемы с системой приточной вентиляции, просторные балконы с панорамным остеклением.<br>В проекте предусмотрены помещения общественного назначения с отдельными входами, что полностью обеспечивает приватность жителей. Современное кафе, детский центр, салон красоты, мини-маркет и прочие необходимые для жителей услуги всегда рядом.",70.5 м²,1024290276.0,ЖК «Оникс»,1024290276.0,ЖК «Оникс»,652.0,2/23,70.5 м²,70.5,2,18,2895079523,Sale,/2-komnatnaya-kvartira-na-prodazhu-novosibirsk-2895079523,268.0,6 650 000 ₽,94 326 ₽ за м²,94326,6650000,Apartment,2020-09-28T18:26:16.367888Z,78,Listing,2,2.0,2021-01-03T07:33:04.894871+03:00,1991461698,2020-09-28T21:16:55.995319+03:00,2020-12-04T07:33:04.894871+03:00,0.509,268.0,#008000,Площадь Гарина-Михайловского,"2-комн. квартира, 70.5 м², 2/23 эт.",2020-12-04T04:42:09.838829Z
"ул. Дмитрия Шамшурина, жилой дом",117536457,Камея,New,3285,2020-09-28T18:24:48.495963Z,"Монолитно-кирпичный дом с закрытой территорией и подземным паркингом. Авторская архитектура с элементами классики, вечерняя подсветка фасада и территории, панорамные виды на город и реку для настоящих ценителей красоты.<br>— Двор без машин<br>— Современные детские игровые комплексы от европейских производителей с травмобезопасным покрытием<br>— Функциональные спортивные площадки для занятий на открытом воздухе.<br>— Огороженная территория обеспечена видеонаблюдением и контролем доступа.<br>Современная входная группа без ступеней, с панорамным остеклением, широкие коридоры, просторный холл с зоной ожидания, колясочная и место для хранения велосипедов. Предусмотрены консьерж-сервис и отдельный вход для погрузочных работ.<br>Двухуровневый подземный паркинг со входом из лифта. Паркинг обеспечен видеонаблюдением и системами противопожарной безопасности. Всегда чистый и теплый автомобиль в любой сибирский мороз или непогоду.<br>В доме установлены скоростные программируемые лифты с улучшенной отделкой – 2 пассажирских и 1 грузопассажирский.<br>В проекте представлены самые популярные типы квартир – от студий для современной молодежи до просторных трехкомнатных квартир для семей с детьми. Качественная входная дверь, улучшенная шумоизоляция, увеличенные оконные проемы с системой приточной вентиляции, просторные балконы с панорамным остеклением.<br>В проекте предусмотрены помещения общественного назначения с отдельными входами, что полностью обеспечивает приватность жителей. Современное кафе, детский центр, салон красоты, мини-маркет и прочие необходимые для жителей услуги всегда рядом.",70.5 м²,1024290276.0,ЖК «Оникс»,1024290276.0,ЖК «Оникс»,652.0,1/23,70.5 м²,70.5,1,17,2895077516,Sale,/2-komnatnaya-kvartira-na-prodazhu-novosibirsk-2895077516,268.0,6 590 000 ₽,93 475 ₽ за м²,93475,6590000,Apartment,2020-09-28T18:24:48.495963Z,78,Listing,2,2.0,2021-01-03T07:33:05.212504+03:00,1991502966,2020-09-28T21:15:35.536034+03:00,2020-12-04T07:33:05.212504+03:00,0.509,268.0,#008000,Площадь Гарина-Михайловского,"2-комн. квартира, 70.5 м², 1/23 эт.",2020-12-04T04:42:08.704477Z
"Новосибирская область, Тогучинский район, рабочий посёлок Горный, Первомайская улица, 3",110118632,Евгения,Resale,3239,2020-11-06T04:14:52.916929Z,"Отличная полноценная трехкомнатная квартира 57,9 м.кв. в развивающемся поселке Горный. <br>Квартира светлая, теплая, в хорошем жилом состоянии. Установлены пластиковые окна (расположены на две стороны дома), балкон застеклен и утеплен. <br>Очень удобная ИЗОЛИРОВАННАЯ ПЛАНИРОВКА с большой кухней 7,1 м.кв. и раздельным санузлом. Отличные соседи. <br>Вся необходимая инфраструктура в шаговой доступности: остановка общественного транспорта, супермаркеты: «Магнит»,«Холди Дискаунтер»,« Мария-ра»,  Дом Культуры, Храм, парк, школа, детский сад, больница, спортивный комплекс, горнолыжный комплекс. Можно так же с квартирой купить дачу в с/о Новинка  с летним домом.<br>Заключен договор с АН Жилфонд",57.9 м²,,,,,,4/5,57.9 м²,57.9,4,9,2985222911,Sale,/3-komnatnaya-kvartira-na-prodazhu-gornyy-2985222911,,1 700 000 ₽,29 361 ₽ за м²,29361,1700000,Apartment,2020-11-06T04:14:52.916929Z,78,Listing,3,3.0,2021-01-05T08:25:28.839334+03:00,2022556383,2020-11-06T07:05:29.125863+03:00,2020-12-06T08:25:28.839334+03:00,,,,,"3-комн. квартира, 57.9 м², 4/5 эт.",2020-12-06T05:34:33.566102Z
"ул. Декабристов, д. 115",107238416,"Отдел продаж Застройщика ""Инвест-плюс""",New,3285,2020-12-03T09:21:15.042643Z,"Полноценная однокомнатная квартира-студия.<br>Подходит под ипотеку с ГОС. ПОДДЕРЖКОЙ.<br>ВЫСОКАЯ СТАДИЯ ГОТОВНОСТИ. В декабре сдача.<br>Надёжный объект с проектным финансированием ПАО СБЕРБАНК.<br>БЕЗ КОМИССИИ за юридическое сопровождение сделки.<br>Безопасные расчёты через счёт ЭСКРОУ.<br>— Хорошее расположение. В пешей доступности станция метро Речной Вокзал.<br>— Красивый высокий дом. Отличный панорамный вид на реку, Бугринский и Коммунальный мост.<br>— Фасад С ПОДСВЕТКОЙ.<br>— Остеклённые лоджии.<br>Современный высококомфортабельный комплекс с благоустроенной придомовой территорией. Дизайнерское исполнение подъездов современном стиле. УЛУЧШЕННАЯ ЧИСТОВАЯ ОТДЕЛКА. Кофе бар с камином и мягкими диванами. Три скоростных лифта. Двор без машин. Огороженная территория. Наличие беседки барбекю. Мини стадион. Уличные тренажеры и беговая дорожка. Современная детская игровая площадка на высшем уровне.<br>Так же в продаже есть парковочные места 600 000 и 650 000 рублей.<br>ПОМОЩЬ В ПОЛУЧЕНИИ ИПОТЕКИ.",35.2 м²,91288.0,ЖК «Октябрьский квартал»,91288.0,ЖК «Октябрьский квартал»,650.0,2/24,35.2 м²,35.2,2,27,3049536726,Sale,/kvartira-na-prodazhu-novosibirsk-3049536726,265.0,3 000 000 ₽,85 227 ₽ за м²,85227,3000000,Apartment,2020-12-03T09:21:15.042643Z,78,Listing,Студия,,2021-01-02T12:12:10.471634+03:00,2062271855,2020-12-03T12:11:43.900183+03:00,2020-12-04T07:31:44.865892+03:00,1.463,265.0,#FF0000,Речной вокзал,"Квартира-студия, 35.2 м², 2/24 эт.",2020-12-04T04:41:09.278886Z
