address,agencyId,agencyName,apartmentSaleType,cityId,createdAt,description,details,developmentId,developmentName,developmentParentId,developmentParentName,districtId,floor,floorArea,floorAreaCalculated,floorInt,galleryImagesCount,id,itemType,itemUrl,metroId,price,pricePerArea,pricePerAreaValue,priceValue,propertyType,publishDate,regionId,resultType,rooms,roomsOrdinal,sourceFinishTime,sourceId,sourceStartTime,sourceUpdateTime,station_distance,station_id,station_lineColors,station_name,title,updatedAt
"ул. Королева, д. 1А",7239253,Новостройки 0% без Комиссий! Ипотека Обмен Трэйд-ин!,New,3285,2020-11-04T05:48:26.482157Z,"Продается квартира-студия 27.3 м2 в кирпичном доме с современными планировками квартир!<br>До Метро 10-15 минут пешком. Автобусная остановка рядом с комплексом!<br>Новый дом, сдача запланирована на декабрь 2022 года!<br>Такие квартиры есть на разных этажах!<br>Успейте купить по выгодной цене! Обмен старого жилья на Новостройки!<br>Комиссия за покупку 0% + бесплатная помощь в получение ипотеки + полное юридическое сопровождение сделки с Гарантией безопасности!<br>— 4,5% (семейная ипотека) ежемесячный платеж - 10 052 р.<br>— 6% ежемесячный платеж по данной квартире - 11 895 р.<br>— Материнский капитал как первоначальный взнос!<br>— Подберу квартиры в любых Новостройках Новосибирска.<br>— Работаем только с надежными застройщиками.<br>— Гарантированная безопасность сделки!<br>— Обмен старого жилья на Новое!<br>Бесплатная экскурсия производится на автомобиле компании!<br>ЖК «На Королева» — это:<br>- 15 мин прогулочным шагом до двух станций метро;<br>- закрытая и безопасная территория;<br>- теплый паркинг;<br>- стильный двор с местами для игр, спорта и отдыха;<br>- кирпичные дом с современными планировками квартир.<br>О ПРОЕКТЕ:<br>Жилой комплекс “На Королева” строят в 15 минутах ходьбы от станций метро “Березовая роща” и “Золотая Нива”. Рядом с комплексом две остановки общественного транспорта - “Королева” и “Красина”. Отсюда отходит 7 автобусов, 3 троллейбуса и 4 маршрутных такси, и вы без труда доберетесь в любую точку города. Неподалеку от новых домов две широкие автомагистрали, это позволяет быстро доехать до центра Новосибирска или любого другого района без пробок.<br>Застройщик жилого комплекса “На Королева”, компания ООО ""ЗАО СМС”, ответственно подошел к реализации проекта. Здесь действительно продумано все: от удачной локации у двух станций метро до благоустройства придомовой территории, и от материалов строительства до функциональных планировок.<br>Каждый житель здесь будет ощущать себя комфортно и безопасно. Территория охраняется и закрыта от проезда машин, во дворе - масштабное озеленение и современные площадки для игр и спорта, для автовладельцев - теплый подземный паркинг.<br>Кирпичные дома с изящным фасадом<br>Фасады домов жилого комплекса “На Королева” облицованы кирпичом, который обладает высокой прочностью и морозоустойчивостью - в квартирах будет комфортный микроклимат в любое время года. Отличительная черта комплекса - увеличенные размеры окон и витражное остекление лоджий, а также качественная отделка подъездов.<br>Подъезды с консьержем и колясочными<br>Просторные и светлые подъезды есть в каждой новостройке. В ЖК “На Королева” так будет всегда - за порядком и чистотой в доме следит приветливый консьерж. Одна из главных особенностей холлов комплекса - колясочные. Это решение застройщика сэкономит место в квартире и порадует семейных жителей.<br>Для любого автомобилиста важно наличие собственного парковочного места. Вам больше не придется искать, куда поставить машину - в жилом комплексе “На Королева” будет теплый подземный паркинг, есть и наземные парковки по периметру.<br>Безопасность в каждой детали<br>Одна из главных потребностей каждого человека - безопасность. Застройщик позаботился о том, чтобы вас никогда не покидало это чувство. Территория комплекса охраняется и закрыта от посторонних, установлено круглосуточное видеонаблюдение. Двор повышенной безопасности защищен от проезда машин - вы будете спокойно отпускать детей играть на площадках.<br>Детский городок и зеленые зоны во дворе<br>Ощущение, что вы дома, начинается с порога жилого комплекса. На уютной территории оборудуют яркий детский городок, подростки и родители оценят современные спортивные площадки. Проведите время с любимой книгой или устройте пикник с друзьями - здесь легко отдохнуть и расслабиться.<br>Если есть какие либо вопросы смело звоните и спрашивайте, с удовольствием отвечу!",27.3 м²,,,,,651.0,17/20,27.3 м²,27.3,17,15,2980590046,Sale,/kvartira-na-prodazhu-novosibirsk-2980590046,272.0,2 480 000 ₽,90 842 ₽ за м²,90842,2480000,Apartment,2020-11-04T05:48:26.482157Z,78,Listing,Студия,,2021-01-06T15:00:07.4822+03:00,2035122893,2020-11-04T08:39:00.615809+03:00,2020-12-07T15:00:07.4822+03:00,1.099,272.0,#008000,Золотая Нива,"Квартира-студия, 27.3 м², 17/20 эт.",2020-12-07T12:09:12.823651Z
"Новосибирск, улица Есенина, 10/2",152810530,Центральное агентство недвижимости,Resale,3285,2020-12-07T12:10:39.308929Z,"В продаже 2-х комнатная квартира в кирпичном доме с хорошим ремонтом. Расположение комнат на две стороны. Есть лождия. Окна пластиковые , потолки новые, батареи поменяны. Санузел совмещен , унитаз с ванной новые. На кухне есть место под окном для хранения зимой продуктов. Останется встроенный шкаф, кухонный гарнитур. Приглашаю на просмотр.<br>При звонке, пожалуйста, назовите номер объявления - 116 568<br>Консультируем подробно по телефону.",51 м²,,,,,651.0,1/10,51 м²,51.0,1,9,3058759492,Sale,/2-komnatnaya-kvartira-na-prodazhu-novosibirsk-3058759492,272.0,3 270 000 ₽,64 118 ₽ за м²,64118,3270000,Apartment,2020-12-07T12:10:39.308929Z,78,Listing,2,2.0,2021-01-06T15:01:38.419882+03:00,2048290028,2020-12-07T15:01:13.845192+03:00,2020-12-08T15:35:33.052222+03:00,1.63,272.0,#008000,Золотая Нива,"2-комн. квартира, 51 м², 1/10 эт.",2020-12-08T12:49:09.775575Z
"Новосибирск, Стартовая улица, 1",152810530,Центральное агентство недвижимости,Resale,3285,2020-12-07T12:10:40.386738Z,"В продаже уютная квартира в отличном состоянии. На полу плитка ПВХ, пол на лоджии с подгревом, оборудован как кабинет. Санузел современный, просторный 6.5 кв.м. Кухонный гарнитур с техникой, встроенный шкаф в прихожей остается новому хозяину. Один собственник, без обременения и прочих особенностей. Документы готовы к слелке.  Подходит под все виды расчёта. Приглашаём на просмотр<br>При звонке, пожалуйста, назовите номер объявления - 115 869<br>Консультируем подробно по телефону.",46 м²,,,,,654.0,14/18,46 м²,46.0,14,5,3058759515,Sale,/1-komnatnaya-kvartira-na-prodazhu-novosibirsk-3058759515,266.0,4 750 000 ₽,103 261 ₽ за м²,103261,4750000,Apartment,2020-12-07T12:10:40.386738Z,78,Listing,1,1.0,2021-01-06T15:01:38.501136+03:00,2047917431,2020-12-07T15:01:13.158174+03:00,2020-12-08T05:24:40.646434+03:00,1.063,266.0,#FF0000,Студенческая,"1-комн. квартира, 46 м², 14/18 эт.",2020-12-08T02:34:08.712762Z
"Новосибирск, Рельсовая улица, 3",152810530,Центральное агентство недвижимости,Resale,3285,2020-12-07T12:21:20.058559Z,"В продаже 3-х ком.квартира светлая, уютная  с  хорошим качественным  ремонтом, окна пластиковые, большая лоджия с французскими окнами , вся сантехника и трубы новые. Квартира с положительной энергетикой очень подходит для большой и дружной семьи. Реально высокий 1-ый этаж. Вся инфраструктура рядом: Лицей №13, школа № 74 ,садики.поликлиника. В шаговой доступности м. Гагаринская. Приходите на просмотр.<br>При звонке, пожалуйста, назовите номер объявления - 116 286<br>Консультируем подробно по телефону.",60 м²,,,,,653.0,1/9,60 м²,60.0,1,5,3058778550,Sale,/3-komnatnaya-kvartira-na-prodazhu-novosibirsk-3058778550,261.0,4 700 000 ₽,78 333 ₽ за м²,78333,4700000,Apartment,2020-12-07T12:21:20.058559Z,78,Listing,3,3.0,2021-01-06T15:12:19.569805+03:00,2048279717,2020-12-07T15:11:55.002742+03:00,2020-12-07T15:12:19.569805+03:00,0.594,261.0,#FF0000,Гагаринская,"3-комн. квартира, 60 м², 1/9 эт.",2020-12-07T12:21:22.701141Z
"Новосибирск, Дивногорская улица, 150/3",152810530,Центральное агентство недвижимости,Resale,3285,2020-12-07T12:21:23.684694Z,"В продаже студия, в быстроразвивающемся районе, в теплом, кипричном доме. Качественный ремонт, мебель вся остается. Развитая инфраструктура, хорошая транспортная развязка. <br>При звонке, пожалуйста, назовите номер объявления - 116 654<br>Консультируем подробно по телефону.",24.2 м²,,,,,654.0,5/6,24.2 м²,24.2,5,7,3058778651,Sale,/kvartira-na-prodazhu-novosibirsk-3058778651,,1 800 000 ₽,74 380 ₽ за м²,74380,1800000,Apartment,2020-12-07T12:21:23.684694Z,78,Listing,Студия,,2021-01-06T15:12:20.092648+03:00,2048499836,2020-12-07T15:11:54.687206+03:00,2020-12-07T15:12:20.092648+03:00,,,,,"Квартира-студия, 24.2 м², 5/6 эт.",2020-12-07T12:21:24.271332Z
"Новосибирск, улица Николая Грицюка, 3",152810530,Центральное агентство недвижимости,Resale,3285,2020-12-07T12:21:22.209332Z,"Продам студию в ЖК  Художник .<br>Дом сдан. Высота потолков 310 см.<br> 2 квартиры на пощадке.<br>Панорамные окна.<br> Центральное отопление.Свежий воздух.<br>В квартире частично сделан  ремонт.<br>При звонке, пожалуйста, назовите номер объявления - 116 694<br>Консультируем подробно по телефону.",20 м²,,,,,655.0,1/3,20 м²,20.0,1,9,3058778614,Sale,/1-komnatnaya-kvartira-na-prodazhu-novosibirsk-3058778614,,1 600 000 ₽,80 000 ₽ за м²,80000,1600000,Apartment,2020-12-07T12:21:22.209332Z,78,Listing,1,1.0,2021-01-06T15:12:21.359509+03:00,2048737231,2020-12-07T15:11:55.728493+03:00,2020-12-07T15:12:21.359509+03:00,,,,,"1-комн. квартира, 20 м², 1/3 эт.",2020-12-07T12:21:24.755644Z
"Новосибирская область, Новосибирский район, рабочий посёлок Краснообск, 6-й микрорайон, 30",152810530,Центральное агентство недвижимости,Resale,3287,2020-12-07T12:21:27.354256Z,"При звонке, пожалуйста, назовите номер объявления - 66 447<br>Консультируем подробно по телефону.",116 м²,,,,,,1/3,116 м²,116.0,1,11,3058778766,Sale,/3-komnatnaya-kvartira-na-prodazhu-krasnoobsk-3058778766,,10 150 000 ₽,87 500 ₽ за м²,87500,10150000,Apartment,2020-12-07T12:21:27.354256Z,78,Listing,3,3.0,2021-01-06T15:12:25.249934+03:00,2048794113,2020-12-07T15:11:56.104293+03:00,2020-12-08T15:35:33.655108+03:00,,,,,"3-комн. квартира, 116 м², 1/3 эт.",2020-12-08T12:45:24.772198Z
"Новосибирск, улица Немировича-Данченко, 22",96013137,Алиса,Resale,3285,2020-12-07T10:22:43.414469Z,"Обратите внимание на вариант!<br>Квартира с хорошим ремонтом и удобной планировкой (планировку позже выложу). <br>Новым хозяевам остается кухонный гарнитур со всей встроенной техникой ( варочная панель, холодильник, духовой шкаф).<br>В шаговой доступности три школы и три детских сада, футбольное поле, две автобусных остановки, а так же магазины, аптеки и салоны красоты. Во дворе современная детская площадка. <br>Подходит под любые формы расчёта! Звоните и записывайтесь на просмотр!<br>Поможем в получении ипотечного решения, юридическое сопровождение сделки.",43 м²,,,,,654.0,4/5,43 м²,43.0,4,9,3058434058,Sale,/2-komnatnaya-kvartira-na-prodazhu-novosibirsk-3058434058,267.0,2 870 000 ₽,66 744 ₽ за м²,66744,2870000,Apartment,2020-12-07T10:22:43.414469Z,78,Listing,2,2.0,2021-01-07T07:07:14.458572+03:00,2031845304,2020-12-07T13:07:33.438297+03:00,2020-12-08T12:45:35.536399+03:00,2.092,267.0,#FF0000,Площадь Маркса,"2-комн. квартира, 43 м², 4/5 эт.",2020-12-08T09:55:07.578124Z
