address,agencyId,agencyName,apartmentSaleType,cityId,createdAt,description,details,developmentId,developmentName,developmentParentId,developmentParentName,districtId,floor,floorArea,floorAreaCalculated,floorInt,galleryImagesCount,id,itemType,itemUrl,metroId,price,pricePerArea,pricePerAreaValue,priceValue,propertyType,publishDate,regionId,resultType,rooms,roomsOrdinal,sourceFinishTime,sourceId,sourceStartTime,sourceUpdateTime,station_distance,station_id,station_lineColors,station_name,title,updatedAt
,188663210,"Квартал «Авиатор», застройщик Брусника",New,3285,2020-09-11T11:26:21.801469Z,"Квартира с объединенной кухней-гостиной и одной спальней в квартале «Авиатор». <br>                  ОБЪЯВЛЕНИЕ ОТ ЗАСТРОЙЩИКА. Покупка квартиры защищена банком.<br>Квартиру можно купить онлайн.<br>Однокомнатная квартира в ЖК «Авиатор» — это квартира с объединенной кухней-гостиной, отдельной спальней и просторной ванной комнатой. Предусмотрены дополнительные ниши под хранение вещей, гардеробные или постирочные комнаты. Есть варианты планировок с французским балконом, протяжённым открытым балконом, глубокой террасой. Купить однокомнатную квартиру выгодно напрямую от застройщика Брусника. <br>На сдаче в 1-комнатных квартирах ЖК «Авиатор» выполнена отделка под чистовую. Стены выровнены и оштукатурены, на полу ー цементно-песчаная стяжка. В квартирах установлены розетки, выключатели, приборы учёта. Сделаны выводы под сантехнику и разводка электрики. Радиаторы установлены в каждой комнате и оборудованы терморегулятором. Нет стояков и вертикальных коммуникаций. В межкомнатных стенах и полу проложена шумоизоляция. В квартирах установлены пластиковые окна и надёжная сейф-дверь с замком. Отделка под чистовую экономит время и затраты на ремонт. Она включена в стоимость квартиры и не требует замены. <br>ЖК «Авиатор» расположен на пересечении улицы Аэропорт и Мочищенского шоссе, рядом с остановками «Байкальская», «Жуковского» и «Городской аэропорт», в 7 минутах ходьбы от сквера им. Чаплыгина и 10 минутах от крупной транспортной магистрали – Красного проспекта. До станции метро «Заельцовская» и площади «Калинина» – около 10 минут на автомобиле. Сформированная инфраструктура локации – школы, детские сады, магазины, спортивный стадион – делают жизнь в квартале комфортной. Первые новостройки в районе Аэропорта Северного сдаются в 3 квартале 2023 года. <br>«Авиатор» в Новосибирске строит компания Брусника. ЖК состоит из 11 домов. В центре квартала расположены 6-8-этажные урбан-виллы и 9-этажные парные дома с общим холлом. По периметру они отделены от городских улиц двумя секционными домами от 6 до 18 этажей со стилобатом и паркингом. Расположенная рядом школа будет интегрирована в проект при помощи элементов благоустройства и общественных пространств. Первая очередь строительства ЖК «Авиатор» включает возведение двух одноподъездных урбан-вилл и двух подъездов секционного дома, расположенного по улице Аэропорт. <br>Купить однокомнатную квартиру в новостройках вблизи Красного проспекта Новосибирске выгодно с использованием программ покупки и сервисов от застройщика Брусника: <br>— ипотека 5,85% по госпрограмме от ПАО Промсвязьбанк;<br>— ипотека с отсрочкой платежей на год от ПАО Сбербанк;<br>— беспроцентная рассрочка на квартиру;<br>— обмен своей квартиры на новую.<br>Получить одобрение ипотеки или рассрочку, а также осуществить обмен квартиры можно онлайн. Запишитесь на онлайн презентацию по телефону или на сайте.<br>            № квартиры в нашей базе: НСК17419.",50.1 м²,1027376811.0,Квартал «Авиатор»,1027376811.0,Квартал «Авиатор»,653.0,5/8,50.1 м²,50.1,5,9,2855345043,Sale,/1-komnatnaya-kvartira-na-prodazhu-novosibirsk-2855345043,260.0,4 700 000 ₽,93 812 ₽ за м²,93812,4700000,Apartment,2020-09-11T11:26:21.801469Z,78,Listing,1,1.0,2020-12-18T20:34:42.563993+03:00,1992309891,2020-09-11T14:16:19.383974+03:00,2020-11-25T09:56:56.989547+03:00,2.449,260.0,#FF0000,Заельцовская,"1-комн. квартира, 50.1 м², 5/8 эт.",2020-11-25T07:29:45.521991Z
,188663210,"Квартал «Авиатор», застройщик Брусника",New,3285,2020-09-11T08:33:01.919367Z,"Квартира с объединенной кухней-гостиной и одной спальней в квартале «Авиатор». <br>                  ОБЪЯВЛЕНИЕ ОТ ЗАСТРОЙЩИКА. Покупка квартиры защищена банком.<br>Квартиру можно купить онлайн.<br>Однокомнатная квартира в ЖК «Авиатор» — это квартира с объединенной кухней-гостиной, отдельной спальней и просторной ванной комнатой. Предусмотрены дополнительные ниши под хранение вещей, гардеробные или постирочные комнаты. Есть варианты планировок с французским балконом, протяжённым открытым балконом, глубокой террасой. Купить однокомнатную квартиру выгодно напрямую от застройщика Брусника. <br>На сдаче в 1-комнатных квартирах ЖК «Авиатор» выполнена отделка под чистовую. Стены выровнены и оштукатурены, на полу ー цементно-песчаная стяжка. В квартирах установлены розетки, выключатели, приборы учёта. Сделаны выводы под сантехнику и разводка электрики. Радиаторы установлены в каждой комнате и оборудованы терморегулятором. Нет стояков и вертикальных коммуникаций. В межкомнатных стенах и полу проложена шумоизоляция. В квартирах установлены пластиковые окна и надёжная сейф-дверь с замком. Отделка под чистовую экономит время и затраты на ремонт. Она включена в стоимость квартиры и не требует замены. <br>ЖК «Авиатор» расположен на пересечении улицы Аэропорт и Мочищенского шоссе, рядом с остановками «Байкальская», «Жуковского» и «Городской аэропорт», в 7 минутах ходьбы от сквера им. Чаплыгина и 10 минутах от крупной транспортной магистрали – Красного проспекта. До станции метро «Заельцовская» и площади «Калинина» – около 10 минут на автомобиле. Сформированная инфраструктура локации – школы, детские сады, магазины, спортивный стадион – делают жизнь в квартале комфортной. Первые новостройки в районе Аэропорта Северного сдаются в 3 квартале 2023 года. <br>«Авиатор» в Новосибирске строит компания Брусника. ЖК состоит из 11 домов. В центре квартала расположены 6-8-этажные урбан-виллы и 9-этажные парные дома с общим холлом. По периметру они отделены от городских улиц двумя секционными домами от 6 до 18 этажей со стилобатом и паркингом. Расположенная рядом школа будет интегрирована в проект при помощи элементов благоустройства и общественных пространств. Первая очередь строительства ЖК «Авиатор» включает возведение двух одноподъездных урбан-вилл и двух подъездов секционного дома, расположенного по улице Аэропорт. <br>Купить однокомнатную квартиру в новостройках вблизи Красного проспекта Новосибирске выгодно с использованием программ покупки и сервисов от застройщика Брусника: <br>— ипотека 5,85% по госпрограмме от ПАО Промсвязьбанк;<br>— ипотека с отсрочкой платежей на год от ПАО Сбербанк;<br>— беспроцентная рассрочка на квартиру;<br>— обмен своей квартиры на новую.<br>Получить одобрение ипотеки или рассрочку, а также осуществить обмен квартиры можно онлайн. Запишитесь на онлайн презентацию по телефону или на сайте.<br>            № квартиры в нашей базе: НСК17353.",50.1 м²,1027376811.0,Квартал «Авиатор»,1027376811.0,Квартал «Авиатор»,653.0,3/8,50.1 м²,50.1,3,9,2854717361,Sale,/1-komnatnaya-kvartira-na-prodazhu-novosibirsk-2854717361,260.0,4 500 000 ₽,89 820 ₽ за м²,89820,4500000,Apartment,2020-09-11T08:33:01.919367Z,78,Listing,1,1.0,2020-12-18T20:34:43.406961+03:00,1992073207,2020-09-11T11:23:20.60201+03:00,2020-11-25T09:56:57.830463+03:00,2.449,260.0,#FF0000,Заельцовская,"1-комн. квартира, 50.1 м², 3/8 эт.",2020-11-25T07:30:03.610138Z
"Новосибирск, Владимировская улица, 21",166050215,Квартирный Портал,Resale,3285,2020-11-11T03:26:57.870553Z,"Эта квартира для Вас!<br>Предлагается к продаже большая, светлая трехкомнатная квартира на четвёртом этаже в одном из лучших домов Железнодорожного района!<br>Общая площадь БЕЗ 2-х лоджий 97,2 кв.м, жилая 54,6 кв.м.<br>Комфортный этаж в кирпичном, ухоженном доме. Огороженная территория, камеры видеонаблюдения и достаточное количество парковочных мест.<br>Очень развитая инфраструктура: ВСЕ РЯДОМ: больницы для взрослых и детей, магазины и супермаркеты, остановка ""Ж/д больница"", детские сады и школы.<br>В квартире с тремя просторными спальнями и двумя гардеробными выполнен качественный ремонт, не требующий вложений. Потолки 2,7 метра. Две застекленные лоджии не оставят вас равнодушными. В подарок покупателям остается вместительный встроенный шкаф-купе и кухня с техникой.<br>Ждём на просмотры! Не упустите мечту, воплощенную в реальность! )<br>Покупка квартиры подходит под все виды расчета, обременения и долей нет, более 3 лет в собственности, быстрый выход на сделку, ключи будут переданы в день полного расчета.<br>Помощь в получении Ипотечного решения.<br>stroyfond-562455",97.2 м²,,,,,652.0,4/10,97.2 м²,97.2,4,28,2996774089,Sale,/3-komnatnaya-kvartira-na-prodazhu-novosibirsk-2996774089,268.0,6 400 000 ₽,65 844 ₽ за м²,65844,6400000,Apartment,2020-11-11T03:26:57.870553Z,78,Listing,3,3.0,2020-12-11T06:17:55.360937+03:00,2021544252,2020-11-11T06:17:30.859763+03:00,2020-12-01T10:48:47.913091+03:00,0.71,268.0,#008000,Площадь Гарина-Михайловского,"3-комн. квартира, 97.2 м², 4/10 эт.",2020-12-01T08:00:14.195665Z
"ул. Адриена Лежена, 1 этап",35388588,"Федерация Недвижимости. Квартира, новостройка",New,3285,2020-11-12T09:21:15.752644Z,"Предлагаем к продаже 1-к студии в новом ЖК ""Акация""<br>СТАРТ ПРОДАЖ! Выгодное предложение по линии метро<br>ЖК «Акация на Лежена» расположен в тихом квартале Октябрьского района, по адресу ул. Адриена Лежена, 33 стр., в пешей доступности от метро «Золотая Нива».<br>Состоит из трёх 17-этажных крупнопанельных домов с яркими цветными фасадами, благоустроенной территорией, детскими и спортивными площадками.<br>Современные безопасные и энергосберегающие системы отопления.<br>Автоматическое погодозависимое регулирование отопления, термостатические клапаны на радиаторах, рециркуляция горячей воды.<br>Вертикальная разводка труб.<br>Возможна покупка квартир с использованием Материнского капитала, подходит под Военную ипотеку, действует госпрограмма 2020 г по сниженным процентным ставкам от ВТБ и Сбербанка.<br>Комиссия агента 0%<br>Записывайтесь на экскурсию, подробно консультируем по телефону.",26.2 м²,1029441554.0,ЖК «Акация на Лежена»,1029441554.0,ЖК «Акация на Лежена»,650.0,15/17,26.2 м²,26.2,15,5,3000242556,Sale,/kvartira-na-prodazhu-novosibirsk-3000242556,272.0,2 500 000 ₽,95 420 ₽ за м²,95420,2500000,Apartment,2020-11-12T09:21:15.752644Z,78,Listing,Студия,,2020-12-12T12:12:13.405289+03:00,2026714420,2020-11-12T12:11:48.839978+03:00,2020-11-18T10:59:44.780123+03:00,0.868,272.0,#008000,Золотая Нива,"Квартира-студия, 26.2 м², 15/17 эт.",2020-11-18T08:08:49.655119Z
"мкр. «Радужный», ул. Луговая, д. 17/4",159311405,Илья,New,3268,2019-06-18T08:11:13.85955Z,"Продам студию в доме 17/4 по переуступке ДДУ, срочно! Сдача 3 квартал 2021 года под чистовую отделку. В100м от дома детский сад, До школы 700м, в шаговои доступности 4 магазина, во дворах современные детские площадки. 9км до Обского моря по новой трассе! 15 мин до площади Маркса, до остановки 2 мин, маршрутки курсируют каждые пол часа.ОЧЕНЬ ДЕШЕГО!!!к сдаче цена будет расти,успейте купить по привлекательной цене!",25 м²,40613.0,ЖК «Радужный город»,40613.0,ЖК «Радужный город»,,4/4,25 м²,25.0,4,6,1528123548,Sale,/kvartira-na-prodazhu-verh_tula-1528123548,,950 000 ₽,38 000 ₽ за м²,38000,950000,Apartment,2019-06-18T08:11:13.85955Z,78,Listing,Студия,,2020-12-13T20:03:17.294528+03:00,1719223829,2019-06-18T05:54:20.251764+03:00,2020-11-23T11:33:22.437963+03:00,,,,,"Квартира-студия, 25 м², 4/4 эт.",2020-11-23T08:42:49.808205Z
"ул. 1-я Чулымская, д. 8, блок-секция 1, 2, 3, 4",149819459,Ирина Лакшинская,New,3285,2020-11-14T10:00:51.281755Z,"Однокомнатная квартира в ЖК Венеция, 8 этаж. Вид из окон на реку Обь и правый берег. Жилой комплекс находится в 10 минутах от площади Ленина, рядом расположены гипермаркеты Лента, Гигант, аквапарк, детский сад, школа. Ключи в декабре 2020г.",39.9 м²,92438.0,ЖК «Венеция-2»,92438.0,ЖК «Венеция-2»,654.0,8/17,39.9 м²,39.9,8,2,3005441120,Sale,/1-komnatnaya-kvartira-na-prodazhu-novosibirsk-3005441120,268.0,3 300 000 ₽,82 707 ₽ за м²,82707,3300000,Apartment,2020-11-14T10:00:51.281755Z,78,Listing,1,1.0,2020-12-14T12:51:49.903197+03:00,2017253283,2020-11-14T12:51:23.638571+03:00,2020-11-24T14:03:31.153107+03:00,2.01,268.0,#008000,Площадь Гарина-Михайловского,"1-комн. квартира, 39.9 м², 8/17 эт.",2020-11-24T11:12:53.877607Z
"ул. Петухова, стр. 1",160537375,Татьяна,New,3285,2020-11-17T11:22:53.598025Z,"квартира с отделкой под ключ, ключи в этом году",34.6 м²,39193.0,ЖК «Матрешкин двор»,39193.0,ЖК «Матрешкин двор»,655.0,14/23,34.6 м²,34.6,14,0,3012663542,Sale,/1-komnatnaya-kvartira-na-prodazhu-novosibirsk-3012663542,,2 250 000 ₽,65 029 ₽ за м²,65029,2250000,Apartment,2020-11-17T11:22:53.598025Z,78,Listing,1,1.0,2020-12-17T14:13:43.027646+03:00,2045612496,2020-11-17T14:13:23.385878+03:00,2020-11-17T14:13:43.027646+03:00,,,,,"1-комн. квартира, 34.6 м², 14/23 эт.",2020-11-17T11:23:08.305729Z
