address,agencyId,agencyName,apartmentSaleType,cityId,createdAt,description,details,developmentId,developmentName,developmentParentId,developmentParentName,districtId,floor,floorArea,floorAreaCalculated,floorInt,galleryImagesCount,id,itemType,itemUrl,metroId,price,pricePerArea,pricePerAreaValue,priceValue,propertyType,publishDate,regionId,resultType,rooms,roomsOrdinal,sourceFinishTime,sourceId,sourceStartTime,sourceUpdateTime,station_distance,station_id,station_lineColors,station_name,title,updatedAt
"Новосибирск, Красный проспект, 323/15",174587903,Жилфонд,Resale,3285,2020-08-03T08:52:24.187671Z,"Продается трехкомнатная квартира-студия в сданном кирпичном доме в ЖК ""Онега"". Онега - жилой комплекс, созданный по канонам настоящего искусства.<br>Продуманное планировочное решения квартиры: Просторная прихожая, гардеробные, большая кухня-гостиная, спальни, которые находятся в стороне от зоны прихожей и гостиной, и где можно спокойно отдохнуть в тишине. <br>А так же несомненым преимуществом данного комплекса являются:<br>- Наземный и подземный паркинг!<br>- Закрытая территория, охрана, система контроля доступа и распознавания лиц!<br>- Современный двор без машин, прекрасные детские площадки!<br>- Отличная архитектура!<br>- Развитая инфраструктура: рядом много магазинов, гипермаркеты Лента и Леруа мерлен, садики, школы ( в частности 211 самая лучшая школа в городе в 5 минутах ходьбы), секции, больницы, остановка в двух минутах ходьбы.<br>Здесь есть всё для того, чтобы творить, растить детей, строить бизнес и строить свою счастливую жизнь!<br>КВАРТИРА В ЧИСТОЙ ПРОДАЖЕ ! БЫСТРЫЙ ВЫХОД НА СДЕЛКУ !<br>Звоните прямо сейчас! Отвечу на все Ваши вопросы. Запланируем и проведем показ.",64.7 м²,,,,,648.0,8/10,64.7 м²,64.7,8,17,2761045887,Sale,/3-komnatnaya-kvartira-na-prodazhu-novosibirsk-2761045887,,4 880 000 ₽,75 425 ₽ за м²,75425,4880000,Apartment,2020-08-03T08:52:24.187671Z,78,Listing,3,3.0,2020-12-11T12:50:01.578574+03:00,1981597823,2020-08-03T11:42:51.661424+03:00,2020-11-11T12:50:01.578574+03:00,,,,,"3-комн. квартира, 64.7 м², 8/10 эт.",2020-11-11T09:59:07.318181Z
"Новосибирск, Красный проспект, 323/14",174587903,Жилфонд,Resale,3285,2020-08-03T08:48:06.933275Z,"Продается двухкомнатная квартира-студия  в сданном кирпичном доме в ЖК ""Онега"". Онега - жилой комплекс, созданный по канонам настоящего искусства.<br>Продуманное планировочное решения квартиры: большая кухня-гостиная и  спальня, находятся в стороне от зоны прихожей, и можно спокойно отдохнуть в тишине.  <br>А так же несомненым преимуществом данного комплекса являются:<br>- Наземный и подземный паркинг!<br>- Закрытая территория, охрана, система контроля доступа и распознавания лиц!<br>- Современный двор без машин, прекрасные детские площадки!<br>- Отличная архитектура!<br>- Развитая инфраструктура: рядом много магазинов, гипермаркеты Лента и Леруа мерлен, садики, школы ( в частности 211 самая лучшая школа в городе в 5 минутах ходьбы), секции, больницы, остановка в двух минутах ходьбы.<br>Здесь есть всё для того, чтобы творить, растить детей, строить бизнес и строить свою счастливую жизнь!<br>КВАРТИРА В ЧИСТОЙ ПРОДАЖЕ ! БЫСТРЫЙ ВЫХОД НА СДЕЛКУ !<br>Звоните прямо сейчас! Отвечу на все Ваши вопросы. Запланируем и проведем показ.",39.6 м²,,,,,648.0,5/10,39.6 м²,39.6,5,12,2761036158,Sale,/2-komnatnaya-kvartira-na-prodazhu-novosibirsk-2761036158,,3 380 000 ₽,85 354 ₽ за м²,85354,3380000,Apartment,2020-08-03T08:48:06.933275Z,78,Listing,2,2.0,2020-12-11T12:50:03.4795+03:00,1981074772,2020-08-03T11:38:35.131592+03:00,2020-11-11T12:50:03.4795+03:00,,,,,"2-комн. квартира, 39.6 м², 5/10 эт.",2020-11-11T09:59:13.654831Z
"Новосибирск, улица Немировича-Данченко, 144/1",174587903,Жилфонд,Resale,3285,2020-07-20T07:20:47.377455Z,"В продаже эксклюзивная двухкомнатная квартира улучшенной планировки в доме повышенной комфортности!!! В квартире сделан высококачественный ремонт, что дает возможность сразу заехать и жить, без дополнительных расходов и вложений . Бонусом для покупателя остается мебель и встроенная бытовая техника!<br>Приятное впечатление для Вас оставит не только квартира, но и окружающее пространство придомовой территории! В доме предусмотрено: закрытая придомовая территория, подземный паркинг с выходом в подъезд, в каждой секции 2 лифта, видеонаблюдение, консьерж, современная детская площадка, спортивная площадка с тренажерами.<br>В пешеходной доступности Торгово-развлекательные комплексы, кафе, ВУЗы (СибУПК, НГТУ), Областная больница, до метро «Студенческая» 800 метров!<br>Отличная транспортная доступность и высокоразвитая инфраструктура района сделает ваше проживание в данной квартире спокойным и комфортным, и позволяет жителям получать все необходимое для проживания не выезжая за пределы.<br>Хотите узнать больше? Звоните прямо сейчас",56.9 м²,,,,,655.0,17/23,56.9 м²,56.9,17,16,2727941709,Sale,/2-komnatnaya-kvartira-na-prodazhu-novosibirsk-2727941709,266.0,6 990 000 ₽,122 847 ₽ за м²,122847,6990000,Apartment,2020-07-20T07:20:47.377455Z,78,Listing,2,2.0,2020-12-11T12:50:34.334871+03:00,1981849723,2020-07-20T10:04:27.815858+03:00,2020-11-11T12:50:34.334871+03:00,0.677,266.0,#FF0000,Студенческая,"2-комн. квартира, 56.9 м², 17/23 эт.",2020-11-11T09:59:38.645535Z
"Новосибирск, Курганская улица, 24",152810530,Центральное агентство недвижимости,Resale,3285,2020-11-11T02:43:47.297505Z,"В продаже 2-х комнатная уютная, теплая квартира в тихом спокойном районе со всем необходимым для комфортного проживания. Возле дома имеется достаточное количество парковочных мест. Хорошая транспортная развязка. Все необходимые объекты инфраструктуры в шаговой доступности: аптеки, магазины, торгово-развлекательный центр Континент. В радиусе 700м расположены 4 детских сада и 4 общеобразовательные школы.  Двор очень тихий и уютный.Квартира подходит под все виды расчетов. Приглашаем на просмотр.<br>При звонке, пожалуйста, назовите номер объявления - 114 170<br>Консультируем подробно по телефону.",43.4 м²,,,,,654.0,4/5,43.4 м²,43.4,4,8,2996745583,Sale,/2-komnatnaya-kvartira-na-prodazhu-novosibirsk-2996745583,267.0,2 800 000 ₽,64 516 ₽ за м²,64516,2800000,Apartment,2020-11-11T02:43:47.297505Z,78,Listing,2,2.0,2020-12-11T05:34:44.549055+03:00,2015959650,2020-11-11T05:34:19.258167+03:00,2020-12-08T15:35:28.618581+03:00,3.334,267.0,#FF0000,Площадь Маркса,"2-комн. квартира, 43.4 м², 4/5 эт.",2020-12-08T12:45:11.501707Z
"Новосибирск, Спортивная улица, 15",152810530,Центральное агентство недвижимости,Resale,3285,2020-11-11T02:43:53.211213Z,"Продается однокомнатная квартира с очень функциональной планировкой,  на две стороны(распашонка). Квартира в хорошем состоянии, теплая и светлая. В квартире остается вся мебель. Просторный двор с современными детскими площадками, большое количество мест для парковки автомобилей. Отличное расположение дома, в шаговой доступности множество магазинов, детские сады, школа, спортивный комплекс и т.п. Квартира продается в связи с переездом в другой регион.<br>При звонке, пожалуйста, назовите номер объявления - 113 817<br>Консультируем подробно по телефону.",37.4 м²,,,,,654.0,2/10,37.4 м²,37.4,2,5,2996745625,Sale,/1-komnatnaya-kvartira-na-prodazhu-novosibirsk-2996745625,,2 800 000 ₽,74 866 ₽ за м²,74866,2800000,Apartment,2020-11-11T02:43:53.211213Z,78,Listing,1,1.0,2020-12-11T05:34:51.080176+03:00,2016247786,2020-11-11T05:34:27.254086+03:00,2020-12-06T15:40:54.529268+03:00,,,,,"1-комн. квартира, 37.4 м², 2/10 эт.",2020-12-06T12:53:40.93379Z
"Новосибирск, Комсомольский проспект, 13",113320813,Елена,Resale,3285,2020-07-11T13:41:30.978298Z,"Менее года назад в квартире сделан капитальный ремонт с заменой всех коммуникаций с использованием качественных и дорогостоящих материалов. Произведена и узаконена перепланировка, в результате которой комнаты стали изолированными и появилось место под гардеробную.<br>Современный и функциональный кухонный гарнитур с варочной панелью, а также вместительный шкаф в коридоре остаются в качестве бонуса покупателю. Сан.узел совмещенный, балкон.<br>Квартира без обременений.<br>Дом находится в самом сердце Железнодорожного района, на Комсомольском проспекте, который располагается между Вокзальной магистралью и улицей Ленина. Очень удобная транспортная развязка. В 5 минутах ходьбы: ЖД вокзал, станция метро «Пл. Гарина-Михайловского», остановка «ЦУМ» и «Красный факел». Рядом находится три супермаркета: «Лента», «Магнит», «Ярче». Детский сад. Вдоль проспекта располагается уютная аллея для прогулок. Тихий двор, спокойные соседи. Множество салонов красоты и необходимых магазинов (от обувных до косметических), ресторанов и кафе разного уровня. Все рядом, в шаговой доступности для комфортной городской жизни. <br>Услуги агенств не интересуют.",59 м²,,,,,652.0,3/5,59 м²,59.0,3,13,2711338742,Sale,/3-komnatnaya-kvartira-na-prodazhu-novosibirsk-2711338742,268.0,5 990 000 ₽,101 525 ₽ за м²,101525,5990000,Apartment,2020-07-11T13:41:30.978298Z,78,Listing,3,3.0,2020-12-09T18:11:42.050613+03:00,1963751642,2020-07-11T16:30:29.321842+03:00,2020-11-09T18:11:42.050613+03:00,0.563,268.0,#008000,Площадь Гарина-Михайловского,"3-комн. квартира, 59 м², 3/5 эт.",2020-11-09T15:20:44.964781Z
"Новосибирск, Народная улица, 77",167623683,Stas,Resale,3285,2020-11-13T09:19:42.724487Z,"Продается квартира от собственника с хорошим ремонтом, в отличном состоянии. Окна пластиковые, батареи биметаллические, на полу ламинат, в квартире есть гардероб и балкон.<br>Живописный вид из окна с высоты 9-го этажа.<br>Развитый район города: остановки, магазины, школы, все в шаговой доступности, так же рядом расположен сосновый бор - приятное место для прогулок и насыщения кислородом)<br>О просмотре можно договориться по указанному телефону.",38 м²,,,,,648.0,9/9,38 м²,38.0,9,7,3002886036,Sale,/kvartira-na-prodazhu-novosibirsk-3002886036,,3 450 000 ₽,90 789 ₽ за м²,90789,3450000,Apartment,2020-11-13T09:19:42.724487Z,78,Listing,Студия,,2020-12-13T12:10:40.139755+03:00,2017599609,2020-11-13T12:10:13.076271+03:00,2020-11-19T16:07:30.567091+03:00,4.354,260.0,#FF0000,Заельцовская,"Квартира-студия, 38 м², 9/9 эт.",2020-11-19T13:16:57.788674Z
"Новосибирская область, Новосибирский район, село Барышево, Инская улица, 2",14544714,КВАДРОТЕКА (Сибакадемстрой Недвижимость),Resale,3261,2020-08-10T14:16:06.766048Z,"Более подробное описание объекта — на сайте агентства. Номер варианта: ПРВ17000152.  <br>	село Барышево. Замечательное предложение - однокомнатная квартира для использование материнского капитала по низкой, бюджетной цене, с хорошими квадратными метрами. Отопление печное-водяное, вода центральная. Вход в квартиру отдельный. Ремонт обычный, но чистый. Остановка общественного транспорта в шаговой доступности. Недалеко находится школа, детский садик, магазины, остановочная платформа электричек.",35.3 м²,,,,,,1/1,35.3 м²,35.3,1,5,2778260669,Sale,/1-komnatnaya-kvartira-na-prodazhu-baryshevo-2778260669,,710 000 ₽,20 113 ₽ за м²,20113,710000,Apartment,2020-08-10T14:16:06.766048Z,78,Listing,1,1.0,2020-12-12T12:10:09.743367+03:00,1960373113,2020-08-10T17:06:42.529737+03:00,2020-11-17T12:13:46.438926+03:00,,,,,"1-комн. квартира, 35.3 м², 1/1 эт.",2020-11-17T09:23:45.695979Z
"Новосибирск, улица Петухова, 103/2",69429783,Частное лицо,Resale,3285,2020-10-07T07:17:23.892473Z," <br>ОТЛИЧНЫЙ ВАРИАНТ ОЧЕНЬ РЕДКАЯ ПЛАНИРОВКА ТЕПЛАЯ ПЕРВЫЙ ЭТАЖ ВЫСОКИЙ ЧИСТАЯ ПРОДАЖА СПЕШИТЕ СКОРО УЙДЕТ!!! РЕАЛЬНЫМ ПОКУПАТЕЛЯМ МНОГО ЧТО ОСТАВИМ ИЗ МЕБЕЛИ.<br>Продам двухкомнатную квартиру в жилом комплексе Матрешкин двор, отличное расположение: школа ,детские сады, магазины, остановки, поликлиника в шаговой доступности, квартира теплая, лоджия утеплена и застеклена качественными стеклопакетами, обшита вагонкой .Удобное расположение комнат на две стороны, окна выходят во двор и на школу ,разделенный санузел, установлен водонагреватель, заменена входная дверь, шумоизоляция отличная. Во дворе большая парковка. По документам юридически чистая, не в ипотеке- куплена за наличку. Остаётся кухонный гарнитур, кухонный уголок, встроенный шкаф.<br>Уже сотрудничаем с агентством недвижимости.",57 м²,,,,,655.0,1/10,57 м²,57.0,1,9,2913139606,Sale,/2-komnatnaya-kvartira-na-prodazhu-novosibirsk-2913139606,,3 380 000 ₽,59 298 ₽ за м²,59298,3380000,Apartment,2020-10-07T07:17:23.892473Z,78,Listing,2,2.0,2020-12-12T04:35:12.010724+03:00,2005093034,2020-10-07T10:05:30.500807+03:00,2020-11-18T09:40:27.442103+03:00,,,,,"2-комн. квартира, 57 м², 1/10 эт.",2020-11-18T06:49:30.020663Z
"Новосибирская область, Каргат",143351089,Сергей,Resale,3244,2019-02-05T20:44:26.359381Z,"Дом из вечных материалов, стены, плиты перекрытий - всё из железобетона. Ничего не сгниёт. <br>Окна пластиковые!<br>Нет никаких деформаций, осадок и прочих.<br>Новый хозяин будет очень доволен!<br>Продам большую благоустроенную четырёхкомнатную квартиру в двухквартирном панельном доме на земле. Участок 20 соток.<br>Установлен бойлер, поэтому всегда есть горячая вода.<br>Туалет, ванная/душевая - раздельные.<br>Баня с раздельными мойкой и парилкой, подача воды от водопровода, вёдрами носить не нужно. В мойке проведена горячая вода от бойлера к смесителю душевой лейки.<br>Гараж, сараи, палисадник, огород.<br>Также имеется уличная летняя душевая, вода нагревается от солнца, подача воды в ёмкость от водопровода.<br>г.Каргат, Нефтебазы, д.4, кв. 1",95 м²,,,,,,1/1,95 м²,95.0,1,21,256802131,Sale,/4-komnatnaya-kvartira-na-prodazhu-kargat-256802131,,900 000 ₽,9 474 ₽ за м²,9474,900000,Apartment,2019-02-05T20:44:26.359381Z,78,Listing,4,4.0,2020-12-11T13:27:46.134018+03:00,1297821828,2018-08-15T19:02:17.098641+03:00,2020-11-11T13:27:46.134018+03:00,,,,,"4-комн. квартира, 95 м², 1/1 эт.",2020-11-11T10:39:10.078768Z
"Новосибирская область, Бердск, Вокзальная улица, 50А",169644752,Наталья Светличная,Resale,3279,2020-07-16T04:18:25.531801Z,"продам 3 комнатную квартиру с лоджией 80 кв м в кирпичном доме.Дом расположен в очень удобном месте ,рядом вся транспортная развязка,включая поезда.Во дворе дома спорткомплекс,хоккейная площадка,детская площадка,детский сад,школа №6.магазин Мария ра .аптека сберкасса и еще магазины,стоматология .Все это во дворе ,даже дорогу переходить не надо Квартира очень теплая,все комнаты изолированны,огромный коридор из натурального дерева.В квартире имеется отдельная кладовая как маленькая комната перепланировок не было лоджия застеклена.Вокруг дома две парковки на 80 машин.оснащена видеокамерой.Прекрасный вид с окна на бердский залив В доме 2 лифта,один из них грузовой .Чистая продажа,один собственник.",80 м²,,,,,,11/12,80 м²,80.0,11,18,2718727441,Sale,/3-komnatnaya-kvartira-na-prodazhu-berdsk-2718727441,,3 800 000 ₽,47 500 ₽ за м²,47500,3800000,Apartment,2020-07-16T04:18:25.531801Z,78,Listing,3,3.0,2020-12-10T15:42:33.622016+03:00,1966553231,2020-07-16T07:07:34.651125+03:00,2020-11-10T15:47:01.855092+03:00,,,,,"3-комн. квартира, 80 м², 11/12 эт.",2020-11-10T12:54:54.165834Z
"Новосибирск, улица Юности, 1",61734665,Агентство недвижимости «НИАН»,Resale,3285,2020-10-12T02:39:07.143568Z,"«Дивногорский» – уютный микрорайон состоит из кирпичных домов разного уровня. Комплекс находится в удалении от суеты, но  легко добраться до любого места левого и правого берегов. Основная ориентация – семейное проживание. На территории уже открыт и работает детский сад, для спортивного развития есть хоккейная коробка, площадки для футбола и баскетбола, дорожки для катания на велосипеде. Благоустройство постоянно продолжается..Безопасность вечерней прогулки обеспечивает уличное освещение и охрана. Большим плюсом является организация пространства для личного транспорта и большой наземный паркинг. Поблизости находятся известные гипермаркеты «Лента» и «Гигант». 2х комн студия большой площади 50 м2, лоджия 5,4, кухня-гостинная 19,5 м2. Оборудованы детская и споривная площадка. Рядом детский сад, торговый центр, остановка.",50 м²,,,,,654.0,10/12,50 м²,50.0,10,7,2923354971,Sale,/2-komnatnaya-kvartira-na-prodazhu-novosibirsk-2923354971,,2 725 000 ₽,54 500 ₽ за м²,54500,2725000,Apartment,2020-10-12T02:39:07.143568Z,78,Listing,2,2.0,2020-12-11T06:11:02.781061+03:00,1991555029,2020-10-12T05:29:42.217506+03:00,2020-11-11T06:11:02.781061+03:00,,,,,"2-комн. квартира, 50 м², 10/12 эт.",2020-11-11T03:20:11.833348Z
