address,agencyId,agencyName,apartmentSaleType,cityId,createdAt,description,details,developmentId,developmentName,developmentParentId,developmentParentName,districtId,floor,floorArea,floorAreaCalculated,floorInt,galleryImagesCount,id,itemType,itemUrl,metroId,price,pricePerArea,pricePerAreaValue,priceValue,propertyType,publishDate,regionId,resultType,rooms,roomsOrdinal,sourceFinishTime,sourceId,sourceStartTime,sourceUpdateTime,station_distance,station_id,station_lineColors,station_name,title,updatedAt
"Новосибирск, Тульская улица, 88",152810530,Центральное агентство недвижимости,Resale,3285,2020-11-11T02:34:00.065028Z,"В продаже 3-комн квартира очень светлая и уютная. Удобная планировка, для большой семьи, окна выходят на две стороны. Три лоджии. Квартира очень теплая. Есть своя кладовая на этаже. Санузел в кафеле.<br>Развитая инфраструктура, школы, лицеи, поликлинники и Торговые центры- все в шаговой доступности. До метро Маркса пешком 15 мин.<br>Просмотр по договоренности.  Чистая продажа<br>При звонке, пожалуйста, назовите номер объявления - 94 244<br>Консультируем подробно по телефону.",78 м²,,,,,655.0,7/9,78 м²,78.0,7,19,2996742550,Sale,/3-komnatnaya-kvartira-na-prodazhu-novosibirsk-2996742550,266.0,4 290 000 ₽,55 000 ₽ за м²,55000,4290000,Apartment,2020-11-11T02:34:00.065028Z,78,Listing,3,3,2020-12-11T05:24:58.611428+03:00,2016142937,2020-11-11T05:24:29.058964+03:00,2020-12-02T05:27:40.859617+03:00,1.482,266.0,#FF0000,Студенческая,"3-комн. квартира, 78 м², 7/9 эт.",2020-12-02T02:37:12.491017Z
"Новосибирск, улица Олеко Дундича, 21",152810530,Центральное агентство недвижимости,Resale,3285,2020-11-11T02:43:32.019194Z,"Продам уютную квартиру в хорошем состоянии. Пластиковые окна. Радиаторы заменены. Балкон застеклен и обшит. Кухонный гарнитур остается. В прихожей большой вместительный шкаф-купе. Бонусом к квартире тамбур на одну квартиру.<br>При звонке, пожалуйста, назовите номер объявления - 113 979<br>Консультируем подробно по телефону.",60 м²,,,,,648.0,6/9,60 м²,60.0,6,9,2996745484,Sale,/3-komnatnaya-kvartira-na-prodazhu-novosibirsk-2996745484,271.0,3 800 000 ₽,63 333 ₽ за м²,63333,3800000,Apartment,2020-11-11T02:43:32.019194Z,78,Listing,3,3,2020-12-11T05:34:29.121525+03:00,2016634762,2020-11-11T05:34:04.073578+03:00,2020-12-07T05:24:19.459072+03:00,3.694,271.0,#008000,Берёзовая роща,"3-комн. квартира, 60 м², 6/9 эт.",2020-12-07T02:34:24.1528Z
"Новосибирск, улица Владимира Высоцкого",152810530,Центральное агентство недвижимости,Resale,3285,2020-11-11T02:43:35.065154Z,"Квартира с ремонтом.Отличные качественные материалы. В квартире никто не жил. Возможна продажа с мебелью. Лифт работает.Переуступка ДДУ. <br>С проектной декларацией можно ознакомиться на сайте застройщика.<br>При звонке, пожалуйста, назовите номер объявления - 113 810<br>Консультируем подробно по телефону.",48.5 м²,,,,,650.0,9/10,48.5 м²,48.5,9,14,2996745506,Sale,/1-komnatnaya-kvartira-na-prodazhu-novosibirsk-2996745506,272.0,2 500 000 ₽,51 546 ₽ за м²,51546,2500000,Apartment,2020-11-11T02:43:35.065154Z,78,Listing,1,1,2020-12-11T05:34:32.097117+03:00,2016405191,2020-11-11T05:34:07.102748+03:00,2020-12-07T05:24:19.516886+03:00,2.655,272.0,#008000,Золотая Нива,"1-комн. квартира, 48.5 м², 9/10 эт.",2020-12-07T02:34:07.670109Z
"Новосибирск, улица Твардовского, 22",152810530,Центральное агентство недвижимости,Resale,3285,2020-11-11T02:43:44.209026Z,"В продаже 3к кв студия. с хорошим ремонтом. <br>При звонке, пожалуйста, назовите номер объявления - 113 162<br>Консультируем подробно по телефону.",48.2 м²,,,,,657.0,13/17,48.2 м²,48.2,13,16,2996745552,Sale,/3-komnatnaya-kvartira-na-prodazhu-novosibirsk-2996745552,,2 950 000 ₽,61 203 ₽ за м²,61203,2950000,Apartment,2020-11-11T02:43:44.209026Z,78,Listing,3,3,2020-12-11T05:34:41.58602+03:00,2016801704,2020-11-11T05:34:16.150786+03:00,2020-12-07T05:24:18.834431+03:00,,,,,"3-комн. квартира, 48.2 м², 13/17 эт.",2020-12-07T02:34:35.193259Z
"Новосибирск, улица Доватора, 37/1",152810530,Центральное агентство недвижимости,Resale,3285,2020-11-11T02:43:50.343887Z,"Интересный вариант. Удобное расположение, транспортная доступность, развитая инфраструктура. Различные варианты покупки, обмена.Школа и д/сад за домом.квартира на обе стороны.<br>При звонке, пожалуйста, назовите номер объявления - 114 125<br>Консультируем подробно по телефону.",43 м²,,,,,651.0,3/5,43 м²,43.0,3,6,2996745612,Sale,/2-komnatnaya-kvartira-na-prodazhu-novosibirsk-2996745612,272.0,3 050 000 ₽,70 930 ₽ за м²,70930,3050000,Apartment,2020-11-11T02:43:50.343887Z,78,Listing,2,2,2020-12-11T05:34:47.875862+03:00,2016887383,2020-11-11T05:34:22.222429+03:00,2020-12-07T05:24:19.808991+03:00,1.742,272.0,#008000,Золотая Нива,"2-комн. квартира, 43 м², 3/5 эт.",2020-12-07T02:34:22.816555Z
"Новосибирская область, Чулым, улица Островского, 2",70717417,Алёхина Ж.Г.,Resale,3249,2020-10-12T02:48:13.195619Z,"Теплая, светлая, сухая 2-х комнатная квартира. Поменяны системы отопления и канализации; ждет своего хозяина. Собственник один, документы готовы.",40 м²,,,,,,1/2,40 м²,40.0,1,18,2923358044,Sale,/2-komnatnaya-kvartira-na-prodazhu-chulym-2923358044,,459 000 ₽,11 475 ₽ за м²,11475,459000,Apartment,2020-10-12T02:48:13.195619Z,78,Listing,2,2,2020-12-11T05:40:26.601061+03:00,1991468187,2020-10-12T05:38:45.040315+03:00,2020-11-11T05:40:26.601061+03:00,,,,,"2-комн. квартира, 40 м², 1/2 эт.",2020-11-11T02:49:30.39033Z
"Новосибирск, улица Дунаевского, 14/3",152810530,Центральное агентство недвижимости,Resale,3285,2020-11-11T02:51:14.36522Z,"Продам полноценную 2х комнатную квартиру. Квартира находится в новом современном ЖК Дунаевский от застройщика  Сибакадемстрой .<br>Видеонаблюдение, пропускная система заезда и выезда. Отличная детская площадка.<br>В квартире сделан качественный ремонт от строительной компании  Сойка  гарантия.<br>Квартира новая практически никто не проживал. Остаётся кухня, спальня.<br>При звонке, пожалуйста, назовите номер объявления - 114 172<br>Консультируем подробно по телефону.",48 м²,,,,,648.0,5/9,48 м²,48.0,5,4,2996747678,Sale,/2-komnatnaya-kvartira-na-prodazhu-novosibirsk-2996747678,,4 350 000 ₽,90 625 ₽ за м²,90625,4350000,Apartment,2020-11-11T02:51:14.36522Z,78,Listing,2,2,2020-12-11T05:42:11.409007+03:00,2016393181,2020-11-11T05:34:09.1009+03:00,2020-12-07T05:24:19.456706+03:00,,,,,"2-комн. квартира, 48 м², 5/9 эт.",2020-12-07T02:34:22.990483Z
"Новосибирск, Ельцовская улица, 4",71368327,Открытый Город,Resale,3285,2019-10-21T08:48:09.125071Z,"Продается уютная, теплая, светлая квартира на 2 этаже кирпичного дома общей площадью 118 кв м. В квартире сделан стильный ремонт с использованием качественных материалов - пластиковые окна, две застекленные лоджии с раздвижными решетками, на окнах кованные решетки, в комнатах на полу ламинат (Германия), в столовой и коридоре - керамогранит. Установлена беспроводная сигнализация. На площадке 2 квартиры. В квартире остаются встроенные прихожая и кухонный гарнитур. Прекрасная, благоустроенная придомовая территория с детской площадкой. Дом находится в районе с развитой транспортной развязкой и инфраструктурой - школы, детские сады, Заельцовский парк и метро в шаговой доступности.<br>Возможен обмен (с доплатой) на двухкомнатную квартиру в Заельцовском, Железнодорожном, Центральном, Калининкском (по Б.Хмельницкого) районам.<br>Приглашаем на просмотр!",118.4 м²,,,,,653.0,2/5,118.4 м²,118.4,2,20,1932639922,Sale,/4-komnatnaya-kvartira-na-prodazhu-novosibirsk-1932639922,268.0,7 500 000 ₽,63 345 ₽ за м²,63345,7500000,Apartment,2019-10-21T08:48:09.125071Z,78,Listing,4,4,2020-12-09T08:57:42.248668+03:00,1797487670,2019-10-21T11:32:30.603352+03:00,2020-11-23T06:51:33.233347+03:00,1.399,268.0,#008000,Площадь Гарина-Михайловского,"4-комн. квартира, 118.4 м², 2/5 эт.",2020-11-23T04:00:34.558057Z
"Новосибирская область, Новосибирский район, село Толмачёво, улица Титова, 30",152810530,Центральное агентство недвижимости,Resale,3270,2020-11-11T02:53:26.245572Z,"Рядом есть всё необходимое Магазин, Детская площадка и детский сад в двух минутах ходьбы, школа в десяти минутах.<br>Консультируем подробно по телефону.<br>При звонке, пожалуйста, назовите номер объявления - 112 251<br>Консультируем подробно по телефону.",40.1 м²,,,,,,1/2,40.1 м²,40.1,1,5,2996748459,Sale,/2-komnatnaya-kvartira-na-prodazhu-tolmachevo-2996748459,,1 800 000 ₽,44 888 ₽ за м²,44888,1800000,Apartment,2020-11-11T02:53:26.245572Z,78,Listing,2,2,2020-12-11T05:44:25.805134+03:00,2016097313,2020-11-11T05:44:01.090802+03:00,2020-12-07T05:24:19.901005+03:00,,,,,"2-комн. квартира, 40.1 м², 1/2 эт.",2020-12-07T02:34:26.898851Z
"Новосибирск, улица Забалуева, 88",152810530,Центральное агентство недвижимости,Resale,3285,2020-11-11T02:53:29.248395Z,"В продаже светая, уютная квартира с отличным видом на озеро. Приглашаем на просмотр.<br>При звонке, пожалуйста, назовите номер объявления - 109 923<br>Консультируем подробно по телефону.",40 м²,,,,,654.0,11/17,40 м²,40.0,11,12,2996748483,Sale,/1-komnatnaya-kvartira-na-prodazhu-novosibirsk-2996748483,,2 900 000 ₽,72 500 ₽ за м²,72500,2900000,Apartment,2020-11-11T02:53:29.248395Z,78,Listing,1,1,2020-12-11T05:44:27.55153+03:00,2016080475,2020-11-11T05:44:02.970045+03:00,2020-12-07T05:24:19.883136+03:00,,,,,"1-комн. квартира, 40 м², 11/17 эт.",2020-12-07T02:34:23.052051Z
"Новосибирская область, Бердск, Звёздная улица, 6/1",8616888,СОБСТВЕННИК,Resale,3279,2020-11-09T13:36:46.700473Z,"Квартира продаётся с кухней и встроенной техникой, а так же с шкафами в коридоре.<br>Один из лучших домов на Микрорайоне, огромная территория, парковка, детские площадки, баскетбольное, футбольное поле и это всё на территории дома.<br>Квартиру переделана в 3ку-студию или по другому дву-трёшку - это кухня-гостинная 19м2 и две спальни 11м2 и 10м2.<br>В квартире хороший свежий ремонт.<br>Торг.",52 м²,,,,,,3/9,52 м²,52.0,3,23,2993281338,Sale,/2-komnatnaya-kvartira-na-prodazhu-berdsk-2993281338,,3 600 000 ₽,69 231 ₽ за м²,69231,3600000,Apartment,2020-11-09T13:36:46.700473Z,78,Listing,2,2,2020-12-09T16:28:10.419501+03:00,2038303974,2020-11-09T16:27:17.788278+03:00,2020-11-09T16:28:10.419501+03:00,,,,,"2-комн. квартира, 52 м², 3/9 эт.",2020-11-09T13:37:17.746969Z
"Новосибирск, Большевистская улица, 122",36141544,Агентство недвижимости КАМЕЛОТ,Resale,3285,2020-11-10T04:22:51.55099Z,"Предлагается к продаже замечательная квартира в активно развивающемся микрорайоне ""Европейский берег"". В квартире сделана перепланировка из 3-комнатной в 3шку студию, дизайнерский ремонт , итальянские обои во всей квартире, в спальне и гардеробной - паркетная доска, в гостевой спальне - ламинат. Испанский керамогранит на полу в гостиной, кухне, коридоре, прихожей. Натяжные потолки во всей квартире. Две встроенные вместительные гардеробные. На лоджии заменено остекление с алюминия на стеклопакеты. Два санузла, в ванной комнате встроенная мебель, с цельной столешницей из камня, ванна с гидромассажем. Тёплый пол в коридоре, ванной, гостиной и кухне. В гостевом санузле установлен водонагреватель, гигиенические души в обоих санузлах. В квартире была поменяна вся электропроводка, имеется видеодомофон. В зимний период в квартире очень тепло. Покупателю остается ВСЯ МЕБЕЛЬ И ТЕХНИКА, КОТОРАЯ НА ФОТО. Дом с закрытой территорией, двор без машин, имеются детские площадки. В шаговой доступности школа, детский сад, гипермаркет ""Лента"", остановка О.Т., метро речной вокзал в 7 минутах езды.<br>Чистая продажа, без обременений. Один взрослый собственник.",82 м²,,,,,650.0,5/10,82 м²,82.0,5,30,2994355270,Sale,/3-komnatnaya-kvartira-na-prodazhu-novosibirsk-2994355270,265.0,8 600 000 ₽,104 878 ₽ за м²,104878,8600000,Apartment,2020-11-10T04:22:51.55099Z,78,Listing,3,3,2020-12-10T07:14:14.73976+03:00,2022884369,2020-11-10T07:10:08.514195+03:00,2020-12-03T11:25:44.781534+03:00,3.161,265.0,#FF0000,Речной вокзал,"3-комн. квартира, 82 м², 5/10 эт.",2020-12-03T08:35:15.682618Z
"Новосибирск, Выборная улица, 137",61734665,Агентство недвижимости «НИАН»,Resale,3285,2020-09-08T03:19:39.987546Z,"В прордаже полноценная  1-комнатная квартира под самоотделку. Без обременений, 1 собственник. Дом находится в экологически чистом районе с развитой инфраструктурой: школы, детские сады, аптеки, разнопрофильные магазины, мини рынки, Педагогический Университет, колледж телекоммуникаций и информатики, горнолыжная база ""Альбатрос"", сосновый бор ... Приглашаем на просмотр!",39 м²,,,,,650.0,7/9,39 м²,39.0,7,6,2846457243,Sale,/1-komnatnaya-kvartira-na-prodazhu-novosibirsk-2846457243,272.0,2 820 000 ₽,72 308 ₽ за м²,72308,2820000,Apartment,2020-09-08T03:19:39.987546Z,78,Listing,1,1,2020-12-11T06:11:02.909279+03:00,1991211305,2020-09-08T06:10:15.950385+03:00,2020-11-19T05:17:08.235162+03:00,4.418,272.0,#008000,Золотая Нива,"1-комн. квартира, 39 м², 7/9 эт.",2020-11-19T02:26:11.210591Z
"Новосибирск, улица Лескова, 15",166050215,Квартирный Портал,Resale,3285,2020-11-11T03:26:53.956469Z,"Предлагается к продаже полноценная 1-комнатная квартира. Квартира просторная, светлая, есть 2 лоджии и место под гардероб. В квартире сделан хороший ремонт, остается мебель. Дом классической кирпичной кладки, расположен в дали от шумных магистралей, рядом школа, детский сад, торговые и развлекательные центры, парковая зона для прогулок. Двор оборудован детской площадкой. Отличная транспортная развязка позволяет максимально комфортно добраться в любой конец города, до Метро Октябрьское 800м.<br>stroyfond-1462088",40.8 м²,,,,,650.0,7/11,40.8 м²,40.8,7,14,2996774065,Sale,/1-komnatnaya-kvartira-na-prodazhu-novosibirsk-2996774065,264.0,4 350 000 ₽,106 618 ₽ за м²,106618,4350000,Apartment,2020-11-11T03:26:53.956469Z,78,Listing,1,1,2020-12-11T06:17:52.24538+03:00,2021062474,2020-11-11T06:17:31.820392+03:00,2020-11-20T06:59:33.329836+03:00,0.807,264.0,#FF0000,Октябрьская,"1-комн. квартира, 40.8 м², 7/11 эт.",2020-11-20T04:09:02.682224Z
"Новосибирск, улица Мясниковой, 8",105972645,Жилфонд,Resale,3285,2020-11-11T03:27:52.63018Z,"Калининский район, г.Новосибирск, ул. Мясниковой.  Аккуратная однокомнатная полноценная квартира на среднем этаже. <br>Пол - линоглеум, стены - ровные , двери хорошие, окна - пластик.<br>Обмен на большую с доплатой.<br>Возможен обмен на вашу недвижимость.<br>	<br>	При звонке, пожалуйста, сообщите номер варианта - <br>       JV001054103935",31.1 м²,,,,,648.0,5/9,31.1 м²,31.1,5,8,2996774453,Sale,/1-komnatnaya-kvartira-na-prodazhu-novosibirsk-2996774453,,2 400 000 ₽,77 170 ₽ за м²,77170,2400000,Apartment,2020-11-11T03:27:52.63018Z,78,Listing,1,1,2020-12-11T06:18:49.907551+03:00,2019354004,2020-11-11T06:18:27.320324+03:00,2020-11-17T06:25:12.296182+03:00,,,,,"1-комн. квартира, 31.1 м², 5/9 эт.",2020-11-17T03:34:55.78865Z
"Новосибирск, Линейная улица, 122",100876925,Юлия,Resale,3285,2019-10-06T12:45:31.384039Z,"Продам 3-х комнатную квартиру-студию в доме клубного типа.  В доме всего 80кв., в подъезде 20кв. Огороженная территория, всегда есть место для парковки авто. В двух шагах маг.Быстроном, аптеки, фруктовые павильоны. До ст. метро Гагаринская 150 м от подъезда. Высота потолков в квартире  3м, встроенные шкафы и кухня. В санузле имеется и ванна и душ, а также теплый пол. Есть хоз. комната, в которой есть бойлер, стиральная машина и приспособления для сушки белья. Отличная квартира! Заходи и живи.<br>Просьба агентствам по продаже недвижимости НЕ беспокоиться.",70 м²,,,,,653.0,5/7,70 м²,70.0,5,20,1882681324,Sale,/3-komnatnaya-kvartira-na-prodazhu-novosibirsk-1882681324,261.0,6 500 000 ₽,92 857 ₽ за м²,92857,6500000,Apartment,2019-10-06T12:45:31.384039Z,78,Listing,3,3,2020-12-10T07:41:00.768009+03:00,1819937085,2019-10-06T13:28:22.062761+03:00,2020-11-10T07:41:00.768009+03:00,0.194,261.0,#FF0000,Гагаринская,"3-комн. квартира, 70 м², 5/7 эт.",2020-11-10T04:50:03.854217Z
