address,agencyId,agencyName,apartmentSaleType,cityId,createdAt,description,details,developmentId,developmentName,developmentParentId,developmentParentName,districtId,floor,floorArea,floorAreaCalculated,floorInt,galleryImagesCount,id,itemType,itemUrl,metroId,price,pricePerArea,pricePerAreaValue,priceValue,propertyType,publishDate,regionId,resultType,rooms,roomsOrdinal,sourceFinishTime,sourceId,sourceStartTime,sourceUpdateTime,station_distance,station_id,station_lineColors,station_name,title,updatedAt
"Новосибирская область, Куйбышев, 8-й квартал, 12",12223605,Ирина,Resale,3253,2019-09-21T02:20:09.402864Z,"Срочно продам 3 комнатную квартиру. Рядом остановка, спорткомплекс, школы, детские сады, магазины, крытая автостоянка. Квартира очень теплая, светлая, утеплён балкон, вся мебель остаётся (встроенная детская мебель, кухонный гарнитур, шкафы и тд.).",56 м²,,,,,,3/4,56 м²,56.0,3,20,1833181886,Sale,/3-komnatnaya-kvartira-na-prodazhu-kuybyshev-1833181886,,2 450 000 ₽,43 750 ₽ за м²,43750,2450000,Apartment,2019-09-21T02:20:09.402864Z,78,Listing,3,3.0,2020-12-10T08:45:02.926213+03:00,1811278912,2019-09-20T16:56:34.188751+03:00,2020-11-29T11:21:43.460541+03:00,,,,,"3-комн. квартира, 56 м², 3/4 эт.",2020-11-29T08:31:07.099808Z
"Новосибирск, улица Татьяны Снежиной, 35",23367994,Компания «ЭТАЖИ»,Resale,3285,2020-10-06T03:25:33.557888Z,"Предлагается к продаже полноценная однокомнатная квартира. Удачное расположение дома. В шаговой доступности школа, детский сад, магазины, парикмахерские, аптеки, до остановки две минуты ходьбы. Квартира тёплая, светлая, с ремонтом и отличной планировкой. Просторная кухня и комната, два больших балкона. Подходит под любой вид расчета. Помощь агентства в получении ипотеки.. Номер в базе: 3860280. Район: Октябрьский.",41 м²,,,,,650.0,7/18,41 м²,41.0,7,12,2910440218,Sale,/1-komnatnaya-kvartira-na-prodazhu-novosibirsk-2910440218,272.0,2 590 000 ₽,63 171 ₽ за м²,63171,2590000,Apartment,2020-10-06T03:25:33.557888Z,78,Listing,1,1.0,2020-12-10T09:05:14.730449+03:00,2008886577,2020-10-06T06:16:06.964336+03:00,2020-11-25T13:06:06.899804+03:00,3.406,272.0,#008000,Золотая Нива,"1-комн. квартира, 41 м², 7/18 эт.",2020-11-25T10:16:06.347345Z
"Новосибирская область, Новосибирский район, Станционный сельсовет, станция Мочище, Путейский тупик, 2",152810530,Центральное агентство недвижимости,Resale,3285,2020-10-21T02:53:36.603462Z,"При звонке, пожалуйста, назовите номер объявления - 110 137<br>Консультируем подробно по телефону.",32 м²,,,,,,1/1,32 м²,32.0,1,5,2944992196,Sale,/1-komnatnaya-kvartira-na-prodazhu-novosibirsk-2944992196,,700 000 ₽,21 875 ₽ за м²,21875,700000,Apartment,2020-10-21T02:53:36.603462Z,78,Listing,1,1.0,2020-12-15T15:33:27.934967+03:00,2016542737,2020-10-21T05:40:00.518515+03:00,2020-12-07T05:24:09.188872+03:00,,,,,"1-комн. квартира, 32 м², 1/1 эт.",2020-12-07T02:34:29.589809Z
"Новосибирск, Бронная улица, 11",147244801,Отдел Продаж Недвижимости,Resale,3285,2020-11-18T06:54:55.434746Z,Полноценная 2-х комнатная квартира с ремонтом от застройщика.,58 м²,,,,,655.0,1/10,58 м²,58.0,1,1,3014418382,Sale,/2-komnatnaya-kvartira-na-prodazhu-novosibirsk-3014418382,,2 450 000 ₽,42 241 ₽ за м²,42241,2450000,Apartment,2020-11-18T06:54:55.434746Z,78,Listing,2,2.0,2020-12-18T09:45:54.610051+03:00,2047606893,2020-11-18T09:19:34.707818+03:00,2020-11-30T12:13:47.389312+03:00,,,,,"2-комн. квартира, 58 м², 1/10 эт.",2020-11-30T09:23:14.09602Z
"Новосибирск, Бронная улица, 9/2",147244801,Отдел Продаж Недвижимости,Resale,3285,2020-11-18T07:06:06.798601Z,Большая 2-х комнатная квартира с ремонтом от застройщика.,58.8 м²,,,,,655.0,1/10,58.8 м²,58.8,1,1,3014440493,Sale,/2-komnatnaya-kvartira-na-prodazhu-novosibirsk-3014440493,,2 450 000 ₽,41 667 ₽ за м²,41667,2450000,Apartment,2020-11-18T07:06:06.798601Z,78,Listing,2,2.0,2020-12-18T09:57:03.195569+03:00,2047742463,2020-11-18T09:28:36.158798+03:00,2020-11-18T09:57:03.195569+03:00,,,,,"2-комн. квартира, 58.8 м², 1/10 эт.",2020-11-18T07:06:09.030406Z
"Новосибирская область, Барабинск, улица Кирова, 1",77301154,Виктория,Resale,3266,2019-08-11T16:14:25.639895Z,"Продам, сдам светлую, просторную квартиру в районе ЦРБ. Новый кирпичный дом. Год постройки 2012.",42 м²,,,,,,2/3,42 м²,42.0,2,4,1702019504,Sale,/2-komnatnaya-kvartira-na-prodazhu-barabinsk-1702019504,,1 900 000 ₽,45 238 ₽ за м²,45238,1900000,Apartment,2019-08-11T16:14:25.639895Z,78,Listing,2,2.0,2020-12-11T18:23:12.482567+03:00,993385084,2018-08-18T18:08:05.603212+03:00,2020-11-14T15:55:35.48462+03:00,,,,,"2-комн. квартира, 42 м², 2/3 эт.",2020-11-14T13:04:55.938401Z
"Новосибирск, улица Есенина, 43",45473436,«Город 54»  Агентство Недвижимости,Resale,3285,2020-11-12T09:20:47.544425Z,"Предлагается к продаже теплая, светлая трехкомнатная квартира.  Панорамный вид из окна, которому не мешают окна  соседских домов. Квартира расположена в подъезде, удаленном от проезжей части. Установлены пластиковые окна, качественная входная дверь. В подъезде сделан ремонт. Во дворе дома есть закрепленное  за хозяевами парковочное место. Соседи спокойные, добропорядочные. Очень хорошая транспортная развязка-множество транспорта в любое направление города. До остановки 30 метров.  Метро ""Золотая Нива"" буквально 15 мин ходьбы пешком. Разнообразные магазины,  торговые центры., кинотеатр, школы, гимназия, детские сады, все самое необходимое для комфортного проживания.",59 м²,,,,,651.0,4/5,59 м²,59.0,4,0,3000240181,Sale,/3-komnatnaya-kvartira-na-prodazhu-novosibirsk-3000240181,272.0,3 600 000 ₽,61 017 ₽ за м²,61017,3600000,Apartment,2020-11-12T09:20:47.544425Z,78,Listing,3,3.0,2020-12-12T12:11:41.670015+03:00,2042754858,2020-11-12T12:11:19.845743+03:00,2020-11-30T11:26:45.724811+03:00,0.989,272.0,#008000,Золотая Нива,"3-комн. квартира, 59 м², 4/5 эт.",2020-11-30T08:35:56.812046Z
