address,agencyId,agencyName,apartmentSaleType,cityId,createdAt,description,details,developmentId,developmentName,developmentParentId,developmentParentName,districtId,floor,floorArea,floorAreaCalculated,floorInt,galleryImagesCount,id,itemType,itemUrl,metroId,price,pricePerArea,pricePerAreaValue,priceValue,propertyType,publishDate,regionId,resultType,rooms,roomsOrdinal,sourceFinishTime,sourceId,sourceStartTime,sourceUpdateTime,station_distance,station_id,station_lineColors,station_name,title,updatedAt
"ул. Кошурникова, д. 23",190651461,Марина,New,3285,2020-11-12T08:42:51.695368Z,"В ПРОДАЖЕ ПРОСТОРНАЯ 3-КОМНАТНАЯ КВАРТИРА-СТУДИЯ под самоотделку!!! Блок-секция № 4.<br>Лоджия!!! Установлена капитальная входная дверь от Застройщика!<br>ДВА САНУЗЛА!!! Большое помещение хозяйственно-бытового назначения (кладовая, гардеробная, прачечная и пр.)<br>Большая придомовая территория без машин. Подземный двухуровневый паркинг.<br>Детская и спортивная площадки, зона отдыха.<br>Во дворе дома возводится собственный спортивно-оздоровительный комплекс с бассейном.<br>Удобная транспортная развязка, рядом школы, детские сады, медицинские центры и поликлиники, фитнес-центры, торговые и развлекательные комплексы, продуктовые магазины, парк культуры и отдыха ""Березовая Роща""<br>300 метров до станция метро ""Золотая Нива""!!!<br>СВИДЕТЕЛЬСТВО!!!<br>ДОМ СДАН!!! <br>_______________________________________<br>ПОДХОДИТ ПОД ВСЕ ВИДЫ РАСЧЕТА<br>______________________________________<br>Покажем в любое удобное для Вас время по согласованию!<br>Поможем с оформлением и подачей документов для получения ипотечного решения по самой выгодной ставке!<br>Юридическое сопровождение сделки!!!",79.5 м²,1006213351.0,ЖК «Золотая Нива»,1006213351.0,ЖК «Золотая Нива»,651.0,6/25,79.5 м²,79.5,6,6,3000142323,Sale,/3-komnatnaya-kvartira-na-prodazhu-novosibirsk-3000142323,272.0,6 800 000 ₽,85 535 ₽ за м²,85535,6800000,Apartment,2020-11-12T08:42:51.695368Z,78,Listing,3,3.0,2020-12-12T11:37:25.050794+03:00,2019257047,2020-11-12T11:33:33.695216+03:00,2020-11-13T11:23:32.181863+03:00,0.518,272.0,#008000,Золотая Нива,"3-комн. квартира, 79.5 м², 6/25 эт.",2020-11-13T08:33:05.149097Z
"Новосибирск, Большая улица, 654",84336760,Алеся Браду,Resale,3285,2020-11-11T05:29:49.648439Z,"РИЭЛТОРОВ НЕ БЕСПОКОИТЬ,продается 1к квартира,на первом этаже ,балкон с французким окном,очень теплая,имеется домофон,ремонт очень хороший, остается вся мебель,инфраструктура вся развитая,все в шаговой доступности, дом свежий 2015г,подьезд чистый,ухоженный, рядом большая парковка,чистая продажа,долгов нет ,тихие соседи,любые проверки,возможен торг,возможен обмен на меньшую с доплатой .",34 м²,,,,,654.0,1/4,34 м²,34.0,1,5,2996931827,Sale,/1-komnatnaya-kvartira-na-prodazhu-novosibirsk-2996931827,,2 500 000 ₽,73 529 ₽ за м²,73529,2500000,Apartment,2020-11-11T05:29:49.648439Z,78,Listing,1,1.0,2020-12-11T18:03:14.265996+03:00,2038795756,2020-11-11T08:16:30.504342+03:00,2020-11-12T10:44:29.776441+03:00,,,,,"1-комн. квартира, 34 м², 1/4 эт.",2020-11-12T07:53:50.049902Z
"ул. Серафимовича, д. 21",77586979,Анастасия,New,3285,2019-02-05T20:48:41.240091Z,"Продам лично студии. На 4 и 11 этаже.<br>1секция квартира на 11этаже,окна на ул.вертковская. 2секция квартира на 4 этаже,окна на ул.рим.корсакова.<br>Сдача дома 4 квартал 2021г.",24.5 м²,73435.0,ЖК «Сибирячка»,73435.0,ЖК «Сибирячка»,654.0,11/16,24.5 м²,24.5,11,5,255546267,Sale,/kvartira-na-prodazhu-novosibirsk-255546267,267.0,1 300 000 ₽,53 061 ₽ за м²,53061,1300000,Apartment,2019-02-05T20:48:41.240091Z,78,Listing,Студия,,2020-12-14T10:52:04.845253+03:00,964991090,2018-07-07T14:40:17+03:00,2020-11-14T10:52:04.845253+03:00,0.956,267.0,#FF0000,Площадь Маркса,"Квартира-студия, 24.5 м², 11/16 эт.",2020-11-14T08:01:11.415378Z
"Новосибирская область, Бердск, Микрорайон, 48А",51464857,"АН ""ЖилМассив""",Resale,3279,2020-10-09T03:48:07.688905Z,"В продаже квартира в самом динамично развивающемся микрорайоне города, вся инфраструктура в шаговой доступности: ДК ""Родина"", школы, детские сады, поликлиника, остановка городского и междугороднего транспорта. В квартире остаётся кухонный гарнитур и частично мебель. Квартира в чистой продаже!!! Ключи в день сделки! Под ипотеку подходит. Оказываем помощь в оформлении заявки, преференции (скидки) в банках-партнерах.",62 м²,,,,,,7/9,62 м²,62.0,7,8,2917398099,Sale,/2-komnatnaya-kvartira-na-prodazhu-berdsk-2917398099,,4 250 000 ₽,68 548 ₽ за м²,68548,4250000,Apartment,2020-10-09T03:48:07.688905Z,78,Listing,2,2.0,2020-12-09T16:49:56.548291+03:00,2007148482,2020-10-09T06:38:42.264322+03:00,2020-11-24T16:01:35.986493+03:00,,,,,"2-комн. квартира, 62 м², 7/9 эт.",2020-11-24T13:14:37.694486Z
"Новосибирск, улица Сибиряков-Гвардейцев, 64",152810530,Центральное агентство недвижимости,Resale,3285,2020-08-06T02:34:10.591703Z,"Просторная двухкомнатная квартира.<br>Большая застекленная лоджия.<br>Комнаты изолированные, раздельный санузел.<br>Удобное расположение дома.<br>Продуктовые магазины, поликлиника, школы, детские сады - все в шаговой доступности.<br>При звонке, пожалуйста, назовите номер объявления - 114 074<br>Консультируем подробно по телефону.",48.7 м²,,,,,655.0,1/9,48.7 м²,48.7,1,14,2767618400,Sale,/2-komnatnaya-kvartira-na-prodazhu-novosibirsk-2767618400,,2 330 000 ₽,47 844 ₽ за м²,47844,2330000,Apartment,2020-08-06T02:34:10.591703Z,78,Listing,2,2.0,2020-12-10T16:59:06.899193+03:00,1952832267,2020-08-06T05:24:43.917982+03:00,2020-11-30T15:43:09.281681+03:00,,,,,"2-комн. квартира, 48.7 м², 1/9 эт.",2020-11-30T12:55:14.955346Z
"Новосибирск, Калининский район, микрорайон Родники, улица Свечникова, 9",183262990,Агентство недвижимости ЖИЛФОНД,Resale,3285,2020-09-10T12:41:59.353848Z,"Калининский район, г.Новосибирск, ул. Свечникова.  Предлагается к продаже большая 3-х комнатная квартира улучшенной планировки в хорошем состоянии.  Окна в квартире выходят на три стороны. Придомовая территория просторная, парковочных мест всегда хватает. <br>Квартира в хорошем состоянии. Полы ровные, постелен линолеум. Потолки ровные. Санузел в кафеле. <br>Две большие остекленные лоджии (по 6 кв.м.). <br>Инфраструктура развитая. Удобное месторасположение, в шаговой доступности школа, поликлиника, детский сад, рядом с домом остановка. Во дворе бассейн для детей, магазин. Тихий и спокойный двор, доброжелательные соседи. <br>Четыре взрослых собственника. Документы готовы к сделке. Правопритязания третьих лиц отсутствуют.  <br>Подходит под любую форму расчета. Возможна покупка с использованием материнского капитала. Квалифицированная помощь в получении ипотечного решения. Полный контроль риелтором процесса сделки купли-продажи. <br>Звоните. Просмотр по договоренности.<br>Возможен обмен на вашу недвижимость.<br>	<br>	При звонке, пожалуйста, сообщите номер варианта - <br>       JV000030044366",71.3 м²,,,,,648.0,5/10,71.3 м²,71.3,5,20,2852786511,Sale,/3-komnatnaya-kvartira-na-prodazhu-novosibirsk-2852786511,,3 950 000 ₽,55 400 ₽ за м²,55400,3950000,Apartment,2020-09-10T12:41:59.353848Z,78,Listing,3,3.0,2020-12-10T16:59:24.986082+03:00,1996489150,2020-09-10T15:32:33.523733+03:00,2020-11-16T14:36:21.053103+03:00,,,,,"3-комн. квартира, 71.3 м², 5/10 эт.",2020-11-16T11:45:50.284905Z
"Новосибирск, улица Авиастроителей, 11",152810530,Центральное агентство недвижимости,Resale,3285,2020-10-12T02:24:04.386907Z,"При звонке, пожалуйста, назовите номер объявления - 83 175<br>Консультируем подробно по телефону.",78 м²,,,,,651.0,2/5,78 м²,78.0,2,5,2923334545,Sale,/3-komnatnaya-kvartira-na-prodazhu-novosibirsk-2923334545,271.0,3 000 000 ₽,38 462 ₽ за м²,38462,3000000,Apartment,2020-10-12T02:24:04.386907Z,78,Listing,3,3.0,2020-12-11T05:34:23.2721+03:00,1984759001,2020-10-12T05:14:38.321946+03:00,2020-12-03T05:29:37.027441+03:00,3.485,271.0,#008000,Берёзовая роща,"3-комн. квартира, 78 м², 2/5 эт.",2020-12-03T02:39:07.920288Z
"Обь, Новосибирская область, Степная улица, 12",154566661,Пользователь,Resale,3277,2019-02-05T20:41:42.827704Z,"Если вы хотите жить в большой и уютной квартире с удобным месторасположением, без городской суеты и шума транспорта, то это предложение для вас! Предлагается к продаже просторная квартира с современным ремонтом. Очень удобная планировка! Комнаты изолированные, большие и светлые. В этой квартире найдется место всему и всем: гостиная, спальня для взрослых, для детей, детская игровая комната, кабинет, библиотека.... Окна выходят на две стороны. Во всех комнатах  сделан ремонт, можно сразу заезжать и жить! Дому чуть больше 20 лет. В подъезде чисто, хорошие соседи. Во дворе есть место для автомобиля. Продуктовый магазин -  на первом этаже, остановка транспорта - рядом с домом,а до остановки электрички - 5 минут. Всё очень удобно! Рядом располагается вся инфраструктура: новая школа с бассейном, детские сады, магазины, рынок, ДК Крылья Сибири и т.д. Чистая продажа от собственника. Подходит под ипотеку. Торг возможен. Ждём на просмотр!",106 м²,,,,,,3/3,106 м²,106.0,3,3,261429915,Sale,/4-komnatnaya-kvartira-na-prodazhu-ob-261429915,,3 600 000 ₽,33 962 ₽ за м²,33962,3600000,Apartment,2019-02-05T20:41:42.827704Z,78,Listing,4,4.0,2020-12-10T08:53:26.094012+03:00,1162710234,2019-01-09T11:39:09.058298+03:00,2020-12-01T11:18:05.828619+03:00,,,,,"4-комн. квартира, 106 м², 3/3 эт.",2020-12-01T08:27:58.545852Z
"Новосибирск, Узорная улица, 11",183262990,Агентство недвижимости ЖИЛФОНД,Resale,3285,2020-11-10T14:17:13.615564Z,"Первомайский район, г.Новосибирск, ул. Узорная.  Однокомнатная квартира в хорошем состоянии, ремонт был выполнен в 2014 году.<br>Окна - стеклопакеты ПВХ, современная входная дверь, новые межкомнатные двери, новая сантехника, санузел отделан современной кафельной плиткой. Большая лоджия, проходящая вдоль комнаты и кухни, застеклена раздвижными стеклопакетами ПВХ.<br>Из окон открывается потрясающий вид на море. Также в квартире есть кладовка.<br>По объекту принят задаток.<br>	<br>	При звонке, пожалуйста, сообщите номер варианта - <br>       JV000010086776",30.4 м²,,,,,657.0,8/9,30.4 м²,30.4,8,11,2995662893,Sale,/1-komnatnaya-kvartira-na-prodazhu-novosibirsk-2995662893,,1 900 000 ₽,62 500 ₽ за м²,62500,1900000,Apartment,2020-11-10T14:17:13.615564Z,78,Listing,1,1.0,2020-12-10T17:08:12.523303+03:00,2028168190,2020-11-10T17:07:49.53244+03:00,2020-11-26T19:46:22.605819+03:00,,,,,"1-комн. квартира, 30.4 м², 8/9 эт.",2020-11-26T16:55:45.626199Z
"Новосибирск, Октябрьский район, микрорайон Закаменский, 20",191232667,Галина,Resale,3285,2020-11-10T14:32:00.326906Z,"Продам 4-х комнатную студию на 4 этаже в кирпичном доме в ЖК Фрунзенский. В шаговой доступности Сибирский Молл, до метро Берёзовая Роща 10 минут пешком. Территория огорожена, закрыта на вход и на въезд, охрана, видеонаблюдение. Ухоженная территория, 2 детские площадки, футбольное поле. Высажены сосны и берёзы. Много парковочных мест. В подъезд 2 входа, с парковки или со двора. Подъезды чистые, ухоженные. <br>В квартире сделан качественный дизайнерский ремонт. Три полноценные комнаты 10, 17 и 23 м. кв плюс кухня-гостиная 18 м. кв с лоджией около 4м.кв, просторный коридор, 2 с/у один с душевой кабиной, другой с ванной. Квартира по полгода стоит пустая, т.к. много времени живем за городом. Квартира для большой дружной семьи.",90.4 м²,,,,,651.0,4/9,90.4 м²,90.4,4,19,2995704642,Sale,/4-komnatnaya-kvartira-na-prodazhu-novosibirsk-2995704642,271.0,9 940 000 ₽,109 956 ₽ за м²,109956,9940000,Apartment,2020-11-10T14:32:00.326906Z,78,Listing,4,4.0,2020-12-10T17:22:58.129248+03:00,2041248891,2020-11-10T17:22:32.286709+03:00,2020-11-23T10:55:17.370997+03:00,0.543,271.0,#008000,Берёзовая роща,"4-комн. квартира, 90.4 м², 4/9 эт.",2020-11-23T08:04:48.316242Z
"Новосибирская область, Куйбышев, 15-й квартал, 2",121363565,Татьяна,Resale,3253,2020-10-10T14:32:22.428783Z,"Продам 3-х комнатную квартиру по адресу: г.Куйбышев, квартал 15, дом 2, собственник. Этаж 4, комнаты изолированные, пластиковые окна, застеклённый балкон, окна выходят на южную и северную стороны, квартира не угловая, домофон, Ростелеком: интернет, wi-fi, ТВ. Установлены счётчики на воду, в квартире требуется ремонт. Управляющая компания ""Выбор"". Рядом находятся: продуктовый магазин, детский сад ""Жемчужинка"", 6 школа, около дома есть парковка.",58.5 м²,,,,,,4/5,58.5 м²,58.5,4,7,2920858202,Sale,/3-komnatnaya-kvartira-na-prodazhu-kuybyshev-2920858202,,1 850 000 ₽,31 624 ₽ за м²,31624,1850000,Apartment,2020-10-10T14:32:22.428783Z,78,Listing,3,3.0,2020-12-09T17:24:27.280528+03:00,1995501859,2020-10-10T17:23:00.056321+03:00,2020-11-09T17:24:27.280528+03:00,,,,,"3-комн. квартира, 58.5 м², 4/5 эт.",2020-11-09T14:34:26.921447Z
"Новосибирская область, Черепаново, улица Богдана Хмельницкого, 8",74388453,Алла,Resale,3241,2019-06-18T06:56:44.394605Z,"Рядом магазин, остановка, детская площадка,тихий,уютный двор и спокойные соседи. Реальным покупателям возможен торг.",52 м²,,,,,,1/2,52 м²,52.0,1,15,1528047503,Sale,/3-komnatnaya-kvartira-na-prodazhu-cherepanovo-1528047503,,1 100 000 ₽,21 154 ₽ за м²,21154,1100000,Apartment,2019-06-18T06:56:44.394605Z,78,Listing,3,3.0,2020-12-11T19:31:22.919081+03:00,1535798487,2019-06-18T09:14:06.445419+03:00,2020-11-11T19:31:22.919081+03:00,,,,,"3-комн. квартира, 52 м², 1/2 эт.",2020-11-11T16:40:25.913341Z
"ул. Коммунистическая, ЖК «Гудимов»",71368327,Открытый Город,New,3285,2020-11-09T07:36:39.481232Z,"Предлагаем трехкомнатную студию к новом ЖК Гудимов! Дом сдан!!! Комиссия 0%!<br>ЖК Гудимов - это жилой комплекс в тихом центре Новосибирска:<br>Малое количество квартир на этаже для комфортного соседства, Лифты до подземного паркинга, Наличие детской и спортивной площадок, озеленения территории, Офисы на первых этажах секций.<br>Близость основных городских магистралей позволяет добраться в любую точку города. В комфортной пешей доступности:<br>— Образовательные учреждения<br>— Кинотеатры, рестораны и другие досуговые учреждения<br>— Крупные бизнес-центры<br>— Точки обслуживания населения<br>— Первомайский сквер.<br>Помощь в получении ипотечного решения! Звоните сейчас!",57.1 м²,1006616709.0,ЖК «Гудимов»,1006616709.0,ЖК «Гудимов»,652.0,4/12,57.1 м²,57.1,4,6,2992316851,Sale,/3-komnatnaya-kvartira-na-prodazhu-novosibirsk-2992316851,263.0,7 050 000 ₽,123 468 ₽ за м²,123468,7050000,Apartment,2020-11-09T07:36:39.481232Z,78,Listing,3,3.0,2020-12-09T10:27:20.069288+03:00,2020945760,2020-11-09T10:25:51.068846+03:00,2020-11-23T06:52:37.222906+03:00,0.945,263.0,#FF0000,Площадь Ленина,"3-комн. квартира, 57.1 м², 4/12 эт.",2020-11-23T04:01:37.377341Z
"ул. Коминтерна, д. 116, 118",167401681,"АН ""Скай Сити""",New,3285,2020-10-05T12:29:16.576993Z,"Двухкомнатная квартира-студия в новом доме комфорт-класса ЖК Red Fox от надежного застройщика.<br>Red Fox это новое поколение домов комфортного проживания, уникальный архитектурно-инженерный проект по передовым технологиям строительства для удобного и безопасного проживания.<br>Комплекс находится в благоприятном экологическом месте, в стороне от шумных дорог. Поселившись в ЖК ""Red Fox"" Вы можете чувствовать себя на природе, благодаря чистому воздуху и обилию зелени вблизи комплекса.<br>Приобретение по Договору долевого участия. Сдача дома в 3 квартале 2021г.<br>Приглашаем на экскурсию! По всем новостройкам города работаем без комиссии. Поможем с получением ипотечного решения.",43.5 м²,86477.0,ЖК «RED FOX» (РЭД ФОКС),86477.0,ЖК «RED FOX» (РЭД ФОКС),651.0,11/18,43.5 м²,43.5,11,7,2909369601,Sale,/2-komnatnaya-kvartira-na-prodazhu-novosibirsk-2909369601,272.0,3 165 400 ₽,72 768 ₽ за м²,72768,3165400,Apartment,2020-10-05T12:29:16.576993Z,78,Listing,2,2.0,2020-12-10T10:46:29.99214+03:00,1999887431,2020-10-05T15:18:27.271117+03:00,2020-11-10T10:47:51.846559+03:00,3.02,272.0,#008000,Золотая Нива,"2-комн. квартира, 43.5 м², 11/18 эт.",2020-11-10T07:57:14.779339Z
"Новосибирская область, Новосибирский район, Барышевский сельсовет, железнодорожная станция Издревая, Вокзальная улица, 14",22053818,"Агентство недвижимости""Жилищный вопрос""",Resale,3261,2020-10-12T07:56:06.293259Z,"Продам квартиру полностью благоустроенную с центральным отопление, горячей ,холодной водой, с/узел, душевая кабина.Подходит под любые формы расчета.",36 м²,,,,,,1/1,36 м²,36.0,1,7,2923873821,Sale,/1-komnatnaya-kvartira-na-prodazhu-baryshevo-2923873821,,1 400 000 ₽,38 889 ₽ за м²,38889,1400000,Apartment,2020-10-12T07:56:06.293259Z,78,Listing,1,1.0,2020-12-11T11:56:11.211728+03:00,2040574065,2020-10-12T10:46:36.737173+03:00,2020-11-11T11:56:11.211728+03:00,,,,,"1-комн. квартира, 36 м², 1/1 эт.",2020-11-11T09:05:14.922554Z
"Новосибирск, улица Мясниковой, 30",98532720,Владислав Егоров,Resale,3285,2020-10-12T09:17:40.427556Z,"Продам полноценную 1 комнатную квартиру в доме классической кирпичной кладке, продажа от собственника.",41 м²,,,,,648.0,4/12,41 м²,41.0,4,1,2924056782,Sale,/1-komnatnaya-kvartira-na-prodazhu-novosibirsk-2924056782,,2 760 000 ₽,67 317 ₽ за м²,67317,2760000,Apartment,2020-10-12T09:17:40.427556Z,78,Listing,1,1.0,2020-12-11T12:10:57.716639+03:00,1998643659,2020-10-12T12:08:17.855077+03:00,2020-11-11T12:10:57.716639+03:00,,,,,"1-комн. квартира, 41 м², 4/12 эт.",2020-11-11T09:20:31.377714Z
