address,agencyId,agencyName,apartmentSaleType,cityId,createdAt,description,details,developmentId,developmentName,developmentParentId,developmentParentName,districtId,floor,floorArea,floorAreaCalculated,floorInt,galleryImagesCount,id,itemType,itemUrl,metroId,price,pricePerArea,pricePerAreaValue,priceValue,propertyType,publishDate,regionId,resultType,rooms,roomsOrdinal,sourceFinishTime,sourceId,sourceStartTime,sourceUpdateTime,station_distance,station_id,station_lineColors,station_name,title,updatedAt
"Новосибирская область, Болотнинский район, деревня Байкал",6712491,Елена Анатольевна,Resale,3251,2020-11-09T08:51:20.989621Z,"Вы в поиске недорогого благоустроенного жилья для проживания или покупке при помощи материнского капитала?! <br>Предлагается просторная  2-комнатная квартира, на 2 этаже 2 этажного кирпичного дома в д.Байкал Болотнинского района. Площадь квартиры 47,9 кв.м. Центральное отопление, санузел-раздельный, балкон (не застеклен), окна пластик, евро-дверь. В квартире выполнен капитальный ремонт под чистовую отделку: штукатурка стен, проводка, новые пластиковые окна, межкомнатные двери. В деревне имеются магазины, средняя школа (полное образование) , д/сад, Дом культуры, мед.пункт, отделение связи, сельсовет.",47.9 м²,,,,,,2/2,47.9 м²,47.9,2,4,2992531340,Sale,/2-komnatnaya-kvartira-na-prodazhu-stantsionno_oyashinskiy-2992531340,,300 000 ₽,6 263 ₽ за м²,6263,300000,Apartment,2020-11-09T08:51:20.989621Z,78,Listing,2,2.0,2020-12-09T11:43:40.389623+03:00,2025698481,2020-11-09T11:38:16.39862+03:00,2020-11-09T11:48:09.531937+03:00,,,,,"2-комн. квартира, 47.9 м², 2/2 эт.",2020-11-09T08:57:33.487807Z
"ул. Декабристов, д. 115",34770364,"Агентство недвижимости ""ВЫСОТА""",New,3285,2020-11-11T09:35:56.685642Z,"Продается квартира от ЗАСТРОЙЩИКА! Сдача дома декабрь 2020 года!<br>Помощь в получении ипотеки под 6,1% годовых!<br>ЗВОНИТЕ!",44 м²,91288.0,ЖК «Октябрьский квартал»,91288.0,ЖК «Октябрьский квартал»,650.0,2/22,44 м²,44.0,2,3,2997613037,Sale,/1-komnatnaya-kvartira-na-prodazhu-novosibirsk-2997613037,265.0,3 550 000 ₽,80 682 ₽ за м²,80682,3550000,Apartment,2020-11-11T09:35:56.685642Z,78,Listing,1,1.0,2020-12-11T12:26:28.098953+03:00,2041924153,2020-11-11T12:26:01.07161+03:00,2020-11-28T07:31:59.126401+03:00,1.463,265.0,#FF0000,Речной вокзал,"1-комн. квартира, 44 м², 2/22 эт.",2020-11-28T04:41:30.110742Z
"Новосибирск, Степная улица, 69",183393497,АН МОСТ,Resale,3285,2020-10-13T06:39:50.709014Z,"В продаже квартира в хорошем состоянии. Комфортный третий этаж. все окна пластиковые , выходят за дом, не на дорогу. <br>Отличное место расположения, вокруг все необходимое для комфортной жизни. Школа рядом с домом, детский сад  в шаговой доступности.  Транспорт в любой конец города. До станции метро  ""Карла Маркса"" можно дойти пешком за 15-20 минут.<br>Нет никаких проблем с документами. Рассмотрим любые виды расчета. <br>Ждем вас на просмотр в  удобное время по предварительной договоренности.",43 м²,,,,,654.0,3/9,43 м²,43.0,3,20,2925980656,Sale,/2-komnatnaya-kvartira-na-prodazhu-novosibirsk-2925980656,267.0,3 200 000 ₽,74 419 ₽ за м²,74419,3200000,Apartment,2020-10-13T06:39:50.709014Z,78,Listing,2,2.0,2020-12-13T09:10:17.537585+03:00,2039815240,2020-10-13T09:30:27.644765+03:00,2020-12-02T06:51:12.837024+03:00,2.093,267.0,#FF0000,Площадь Маркса,"2-комн. квартира, 43 м², 3/9 эт.",2020-12-02T04:00:13.850397Z
"Новосибирск, Народная улица, 8",25535390,елена,Resale,3285,2020-10-12T09:50:33.003048Z,"Продается уютная  квартира на среднем этаже.Отличная транспортная развязка.Вблизи дома расположены торговые центры,детские сады,школы и многое другое для комфортного проживания.Квартира очень уютная.",62 м²,,,,,648.0,2/5,62 м²,62.0,2,10,2924151990,Sale,/3-komnatnaya-kvartira-na-prodazhu-novosibirsk-2924151990,260.0,3 500 000 ₽,56 452 ₽ за м²,56452,3500000,Apartment,2020-10-12T09:50:33.003048Z,78,Listing,3,3.0,2020-12-11T12:43:04.780052+03:00,2012420843,2020-10-12T11:56:24.913694+03:00,2020-11-11T12:43:04.780052+03:00,1.689,260.0,#FF0000,Заельцовская,"3-комн. квартира, 62 м², 2/5 эт.",2020-11-11T09:52:11.52195Z
"Черепаново, Новосибирская область, улица Урицкого, 43",54543525,Людмила,Resale,3241,2019-03-31T10:04:10.477046Z,"Продается квартира в двухквартирном доме на 2-х хозяев.Место тихое, сухое, соседи хорошие. Дом обшит металлопрофилем, теплый, с печным отоплением, отопление проведено по всему дому(батареи). В доме пластиковые окна, межкомнатные двери . Центральная вода, слив на три кольца,(туалет в доме). Небольшой земельный участок с саженцами, с теплицей из поликарбоната. Скважина для полива огорода и др нужд.Банька, хозяйственные постройки. Тротуарная плитка во дворе.Реальным покупателям торг. Рассматривается ипотека, материнский капитал. Возможен обмен на двухкомнатную квартиру.",48.2 м²,,,,,,1/1,48.2 м²,48.2,1,7,1197854463,Sale,/3-komnatnaya-kvartira-na-prodazhu-cherepanovo-1197854463,,1 100 000 ₽,22 822 ₽ за м²,22822,1100000,Apartment,2019-03-31T10:04:10.477046Z,78,Listing,3,3.0,2020-12-09T12:15:51.280335+03:00,1613936158,2019-03-31T12:52:44.678741+03:00,2020-11-09T12:15:51.280335+03:00,,,,,"3-комн. квартира, 48.2 м², 1/1 эт.",2020-11-09T09:25:29.778223Z
"ул. Михаила Немыткина, д. 1",71368327,Открытый Город,New,3285,2019-10-03T01:12:57.991157Z,"Предлагаем двухкомнатную квартиру в новом строящемся Жилом Доме Ника!!! Сдача начало 2021 года! Квартиры с отличным ремонтом от застройщика!!! Комиссия 0%! При покупке квартиры кладовая на этаже в подарок!!!<br>Жилой дом «Ника» строится в микрорайоне Родники по адресу ул. Немыткина, 9/1. Это одноподъездный 19-ти этажный дом, который рассчитан всего на 190 квартир. Проект станет настоящим украшением этой локации. Архитектурное решение дома отличается стильным дизайном, комфортными семейными планировками, а также уникальной концепцией благоустройства двора. Функциональным и полезным преимуществом станут кладовые, расположенные на каждом этаже, - их ровно столько, сколько квартир в доме – 190. Идея кладовых в том, чтобы пространство квартиры оставить свободным от детских колясок, велосипедов, самокатов. Эти функциональные помещения вне квартиры, безусловно, сказываются на общем комфорте проживания. В доме предусмотрен подземный паркинг на 59 машин, куда можно спуститься на лифте от своей квартиры - эта опция обеспечит новый уровень комфорта. Двор максимально безопасен и комфортен: закрытая территория, зона для игр и отдыха изолирована от автомобилей. Вся территория спроектирована по принципу беспорогового пространства без резких перепадов, входная группа в подъезд находится на одном уровне с придомовой территорией.<br>Помощь в получении ипотечного решения!!!",56.8 м²,1008208064.0,ЖД «Ника»,1008208064.0,ЖД «Ника»,648.0,14/19,56.8 м²,56.8,14,8,1870881293,Sale,/2-komnatnaya-kvartira-na-prodazhu-novosibirsk-1870881293,,4 316 800 ₽,76 000 ₽ за м²,76000,4316800,Apartment,2019-10-03T01:12:57.991157Z,78,Listing,2,2.0,2020-12-10T12:05:54.232716+03:00,1797599949,2019-10-02T07:28:13.996369+03:00,2020-11-23T06:51:16.782848+03:00,,,,,"2-комн. квартира, 56.8 м², 14/19 эт.",2020-11-23T04:00:17.630587Z
"Новосибирск, Ударная улица, 27/3",173701179,Макромир,Resale,3285,2020-06-30T02:11:16.999012Z,"СРОЧНО!<br>Отличная квартира по выгодной цене!<br>В продаже эксклюзивный вариант, а именно 4-комнатная квартира.<br>Все комнаты изолированны, сан узел раздельный.<br>В квартире выполнен ремонт.<br>Просторная лоджия на две комнаты.<br>Дом кирпичный, теплый.<br>Четыре изолированные комнаты правильной формы и кухня почти 12 кв.м.<br>Окна на две стороны.<br>В шаговой доступности школы, детские сады, спорт. клуб, супермаркет Лента. Рядом остановка общественного транспорта. 15 мин. езды до метро 'Площадь Маркса'.",74 м²,,,,,654.0,5/12,74 м²,74.0,5,40,2679838224,Sale,/4-komnatnaya-kvartira-na-prodazhu-novosibirsk-2679838224,267.0,3 950 000 ₽,53 378 ₽ за м²,53378,3950000,Apartment,2020-06-30T02:11:16.999012Z,78,Listing,4,4.0,2020-12-10T04:05:52.484992+03:00,1977147898,2020-06-29T20:26:08.574035+03:00,2020-11-24T18:58:47.6291+03:00,2.547,267.0,#FF0000,Площадь Маркса,"4-комн. квартира, 74 м², 5/12 эт.",2020-11-24T16:08:17.640236Z
"ул. Михаила Немыткина, д. 1",71368327,Открытый Город,New,3285,2019-10-03T00:55:32.906468Z,"Предлагаем двухкомнатную студию в новом строящемся Жилом Доме Ника!!! Сдача начало 2021 года! Квартиры с отличным ремонтом от застройщика!!! Комиссия 0%! При покупке квартиры кладовая на этаже в подарок!!!<br>Жилой дом «Ника» строится в микрорайоне Родники по адресу ул. Немыткина, 9/1. Это одноподъездный 19-ти этажный дом, который рассчитан всего на 190 квартир. Проект станет настоящим украшением этой локации. Архитектурное решение дома отличается стильным дизайном, комфортными семейными планировками, а также уникальной концепцией благоустройства двора. Функциональным и полезным преимуществом станут кладовые, расположенные на каждом этаже, - их ровно столько, сколько квартир в доме – 190. Идея кладовых в том, чтобы пространство квартиры оставить свободным от детских колясок, велосипедов, самокатов. Эти функциональные помещения вне квартиры, безусловно, сказываются на общем комфорте проживания. В доме предусмотрен подземный паркинг на 59 машин, куда можно спуститься на лифте от своей квартиры - эта опция обеспечит новый уровень комфорта. Двор максимально безопасен и комфортен: закрытая территория, зона для игр и отдыха изолирована от автомобилей. Вся территория спроектирована по принципу беспорогового пространства без резких перепадов, входная группа в подъезд находится на одном уровне с придомовой территорией.<br>Помощь в получении ипотечного решения!!!",44 м²,1008208064.0,ЖД «Ника»,1008208064.0,ЖД «Ника»,648.0,11/19,44 м²,44.0,11,8,1870608694,Sale,/2-komnatnaya-kvartira-na-prodazhu-novosibirsk-1870608694,,3 718 000 ₽,84 500 ₽ за м²,84500,3718000,Apartment,2019-10-03T00:55:32.906468Z,78,Listing,2,2.0,2020-12-10T12:07:03.48298+03:00,1797088887,2019-10-02T07:24:33.130011+03:00,2020-11-23T06:51:16.77625+03:00,,,,,"2-комн. квартира, 44 м², 11/19 эт.",2020-11-23T04:00:17.756498Z
"ул. Декабристов, д. 115",34770364,"Агентство недвижимости ""ВЫСОТА""",New,3285,2020-11-11T10:14:23.21394Z,"Продажа от ЗАСТРОЙЩИКА!!!! Сдача дома декабрь 2020 год!!! <br>Помощь в получении ипотечного решения под 6,1% годовых!!!<br>ЗВОНИТЕ!",85 м²,91288.0,ЖК «Октябрьский квартал»,91288.0,ЖК «Октябрьский квартал»,650.0,3/22,85 м²,85.0,3,3,2997724352,Sale,/3-komnatnaya-kvartira-na-prodazhu-novosibirsk-2997724352,265.0,6 200 000 ₽,72 941 ₽ за м²,72941,6200000,Apartment,2020-11-11T10:14:23.21394Z,78,Listing,3,3.0,2020-12-11T13:05:22.305956+03:00,2042789537,2020-11-11T13:05:01.323445+03:00,2020-11-28T07:31:00.762323+03:00,1.463,265.0,#FF0000,Речной вокзал,"3-комн. квартира, 85 м², 3/22 эт.",2020-11-28T04:40:24.472481Z
"Новосибирская область, Бердск, Комсомольская улица, 24",152810530,Центральное агентство недвижимости,Resale,3279,2020-11-11T02:51:04.810575Z,"Отличная квартира в центре города.Окна выходят во двор.Балкон застеклен.Подходит под все виды расчета.<br>При звонке, пожалуйста, назовите номер объявления - 110 068<br>Консультируем подробно по телефону.",54 м²,,,,,,5/9,54 м²,54.0,5,3,2996747633,Sale,/2-komnatnaya-kvartira-na-prodazhu-berdsk-2996747633,,2 850 000 ₽,52 778 ₽ за м²,52778,2850000,Apartment,2020-11-11T02:51:04.810575Z,78,Listing,2,2.0,2020-12-12T15:40:44.090627+03:00,2016908937,2020-11-11T05:34:09.051352+03:00,2020-11-12T15:44:54.356544+03:00,,,,,"2-комн. квартира, 54 м², 5/9 эт.",2020-11-12T12:53:58.593261Z
"Новосибирск, улица Твардовского, 22",152810530,Центральное агентство недвижимости,Resale,3285,2020-11-12T12:50:19.717387Z,"В продаже студия с ремонтом. Балкон Остеклен.<br>Удобный этаж. Тихие соседи.<br>Отличная транспортная развязка. Рядом все необходимое. Магазины, дет сады, школы, поликлиники.<br>Большая детская площадка.<br>Парковка под окном.<br>Покажем в удобное для Вас время. Торг возможен.<br>При звонке, пожалуйста, назовите номер объявления - 114 368<br>Консультируем подробно по телефону.",18.2 м²,,,,,657.0,2/17,18.2 м²,18.2,2,2,3000839728,Sale,/kvartira-na-prodazhu-novosibirsk-3000839728,,1 300 000 ₽,71 429 ₽ за м²,71429,1300000,Apartment,2020-11-12T12:50:19.717387Z,78,Listing,Студия,,2020-12-12T15:41:18.070936+03:00,2016907393,2020-11-12T15:40:54.178258+03:00,2020-11-22T15:36:07.127775+03:00,,,,,"Квартира-студия, 18.2 м², 2/17 эт.",2020-11-22T12:46:08.579117Z
