address,agencyId,agencyName,apartmentSaleType,cityId,createdAt,description,details,developmentId,developmentName,developmentParentId,developmentParentName,districtId,floor,floorArea,floorAreaCalculated,floorInt,galleryImagesCount,id,itemType,itemUrl,metroId,price,pricePerArea,pricePerAreaValue,priceValue,propertyType,publishDate,regionId,resultType,rooms,roomsOrdinal,sourceFinishTime,sourceId,sourceStartTime,sourceUpdateTime,station_distance,station_id,station_lineColors,station_name,title,updatedAt
"ул. Дуси Ковальчук, д. 238",30305367,"ООО ""Недвижимость Новосибирска-НН""",New,3285,2020-06-10T00:47:50.041292Z,Под С/О квартира! Полное сопровождение сделки.,31 м²,36703.0,ЖК «Дом на Плановой»,36703.0,ЖК «Дом на Плановой»,653.0,7/19,31 м²,31.0,7,4,2625791653,Sale,/1-komnatnaya-kvartira-na-prodazhu-novosibirsk-2625791653,260.0,1 725 000 ₽,55 645 ₽ за м²,55645,1725000,Apartment,2020-06-10T00:47:50.041292Z,78,Listing,1,1.0,2020-12-12T10:05:34.071715+03:00,1941646633,2020-06-09T10:23:27.651421+03:00,2020-12-02T07:05:49.627389+03:00,0.967,261.0,#FF0000,Гагаринская,"1-комн. квартира, 31 м², 7/19 эт.",2020-12-02T04:14:51.189869Z
"ул. Дуси Ковальчук, д. 238",30305367,"ООО ""Недвижимость Новосибирска-НН""",New,3285,2020-06-10T01:45:02.391666Z,Квартира под С/О. Полное сопровождение сделки!,38 м²,36703.0,ЖК «Дом на Плановой»,36703.0,ЖК «Дом на Плановой»,653.0,4/19,38 м²,38.0,4,4,2626727495,Sale,/1-komnatnaya-kvartira-na-prodazhu-novosibirsk-2626727495,260.0,1 980 000 ₽,52 105 ₽ за м²,52105,1980000,Apartment,2020-06-10T01:45:02.391666Z,78,Listing,1,1.0,2020-12-12T10:06:41.260217+03:00,1941888955,2020-06-09T10:16:18.567077+03:00,2020-12-02T07:05:50.692491+03:00,0.967,261.0,#FF0000,Гагаринская,"1-комн. квартира, 38 м², 4/19 эт.",2020-12-02T04:14:51.717056Z
"Новосибирск, Плановая улица, 52",30305367,"ООО ""Недвижимость Новосибирска-НН""",Resale,3285,2020-06-09T01:48:03.25938Z,В Продаже студия под С/О. Отличный вид из окна! Ключи на руках дом сдан.,33 м²,,,,,653.0,19/19,33 м²,33.0,19,2,2624135716,Sale,/kvartira-na-prodazhu-novosibirsk-2624135716,260.0,2 980 000 ₽,90 303 ₽ за м²,90303,2980000,Apartment,2020-06-09T01:48:03.25938Z,78,Listing,Студия,,2020-12-12T10:09:32.099599+03:00,1940958633,2020-06-08T07:47:28.388733+03:00,2020-12-02T07:05:47.241085+03:00,1.257,260.0,#FF0000,Заельцовская,"Квартира-студия, 33 м², 19/19 эт.",2020-12-02T04:14:47.281384Z
"ул. Охотская, д. 86/2",17367072,"Агентство недвижимости ""Аванта""",New,3285,2020-10-02T06:59:19.4476Z,"Изумрудные вековые сосны, хрустальное озеро родниковой воды, <br> аромат свежего воздуха и естественный ландшафт с перепадом высот – это жилой комплекс Эволюция. <br>Который бережно и гармонично встроили в это пространство, не потеряв ни одного<br> живого дерева, ведь те, что нужно было сохранить, аккуратно перенесли, подарив<br> парку и детскому саду.<br> Это новый тренд, геном эволюции современного жилья.<br> Родниковое озеро в центре комплекса стало прообразом ядра живой<br> клетки, как ядра притяжения и общения жителей комплекса.<br>Развитая и уже сложившаяся инфраструктура микрорайона представлена тремя детскими садами, школой, молодежным и детским центрами, медицинскими учреждениями, отделениями банков, различными магазинами и кафе.<br> Гордостью детской инфраструктуры микрорайона является спортивный клуб ""Стрижи"", участники которого регулярно завоевывают золотые медали на мировых первенствах по ушу, тренера-мастера спорта занимаются с детишками также кёкусинкай-каратэ, смешанными единоборствами, есть лыжные секции, а также хоккейный клуб ""Стрижи"".<br> Детским творчеством и развитием занимаются более 500 детишек в развивающим центре ""Стрижата""<br> Построен автовокзал ""Стрижи"" - теплый вокзал с аптекой, столовой и залом ожидания - для комфорта людей, пользующихся общественным транспортом. Первый в городе фермерский рынок ""Крестьянская слобода"" также построен на ул.Кубовая - фермерские продукты ждут вас каждый день в новом формате торговли, где вы знаете поставщиков товаров.<br> Расширяются и строятся дороги, в том числе внутриквартальные.<br> В настоящий момент проектируются новая поликлиника и пристройка к школе, существенно ее увеличивающую.<br>Территория жилого комплекса «Эволюция»огорожена и находится под круглосуточным видеонаблюдением.<br> Особую безопасность детям дарит двор, в который машины попасть физически не могут.<br> Оборудованы КПП для въезда на территорию ЖК, организована круглосуточная охрана силами управляющей компании.<br>При отделке подъездов используются качественные материалы, дизайнеры создают уникальный стиль для каждого жилого дома. В подъездах наших домов чисто, светло и уютно. Малое количество квартир на этажах дает дополнительный комфорт проживания, улучшает добрососедские отношения. Для жильцов нормальная практика - цветы на окнах в общих зонах, за которыми ухаживают. Лифты изготовляются компанией OTIS.<br>Квартиры сдаются с улучшенной самоотделкой. Стяжка пола подготовлена к укладке чистовых отделочных материалов (керамо- гранит, ПВХ-плитка, ламинат, паркет и т.д.), на кирпичные стены нанесена гипсовая штукатурка, швы между пазогребневыми пли- тами заштукатурены. Стены сан. узлов изнутри оштукатурены марочным цементно-песчаным раствором. Во всех квартирах установлены приборы учета воды, электроэнергии и качественные металлические утепленные вход- ные двери с двумя замками и внутренним МДФ-щитком.<br>Окна и двери балконов выполнены из пятикамерного ПВХ-профиля белого цвета с заполнением стеклопакетом, на откосы балкон- ных и оконных блоков изнутри нанесена штукатурка, снаружи - в полном объеме ПВХ-профиль. Ограждения «французских» окон находятся на высоте 1,2 м и установлены по всей ширине проема.<br>Подходит любая форма форма расчета. Помощь в получении ипотечного решения – бесплатно. Цена застройщика. Комиссия 0%.",106 м²,83694.0,ЖК «Эволюция»,83694.0,ЖК «Эволюция»,653.0,10/12,106 м²,106.0,10,9,2902760882,Sale,/3-komnatnaya-kvartira-na-prodazhu-novosibirsk-2902760882,,7 780 000 ₽,73 396 ₽ за м²,73396,7780000,Apartment,2020-10-02T06:59:19.4476Z,78,Listing,3,3.0,2020-12-09T08:52:14.269774+03:00,1982713714,2020-10-02T09:49:54.525911+03:00,2020-11-09T08:52:24.462489+03:00,,,,,"3-комн. квартира, 106 м², 10/12 эт.",2020-11-09T06:01:49.596363Z
"ул. Краузе, стр. 5",192523641,Андрей С,New,3285,2020-11-10T08:16:38.580618Z,"Продаётся 2-х комнатная квартира в ЖК ""Онега"". Дом построен из кирпича, что даёт гарантию тепло-шумоизоляции. Входная дверь как в танке, стальная и непробиваемая. Окна: пятикамерный ПВХ, то есть мимо пролетающую ракету вы не услышите. В самой квартире чистовая самоотделка, наружные, межквартирные и стены сан. узла из кирпича. Межкомнатные стены из пазогребневых плит (если говорить проще, то прессованный гипс), что даёт Вам возможность перепланировки квартиры. Горизонтальная разводка отопления даёт Вам бонусом тёплый пол. Инфраструктура: школа буквально через дорогу, детский сад в 5-10 минутах ходьбы, спортзалы, супермаркеты, салоны красоты, строительный магазин ""Леруа Мерлен"", кинотеатр. То есть есть всё, что может пригодится для комфортной жизни. Сам жилой комплекс построен по принципу северной деревни, то есть это скошенные крыши, хаотичное расположение домов, деревянные детские площадки, тропа здоровья, а также огорождаться ЖК будет живой изгородью. На территории будет присутствовать круглосуточная охрана и камеры видеонаблюдения с функцией распознавания лиц. Имеется подземный паркинг. Сроки сдачи жилого комплекса: III квартал 2021 года.<br>Звонить можно с 9-21, а лучше пишите в ватсап.",54.9 м²,1003935880.0,ЖК «Онега»,1003935880.0,ЖК «Онега»,648.0,8/12,54.9 м²,54.9,8,7,2994791376,Sale,/2-komnatnaya-kvartira-na-prodazhu-novosibirsk-2994791376,,4 050 000 ₽,73 770 ₽ за м²,73770,4050000,Apartment,2020-11-10T08:16:38.580618Z,78,Listing,2,2.0,2020-12-10T11:07:36.113761+03:00,2039794013,2020-11-10T11:03:11.571892+03:00,2020-11-10T11:08:04.499859+03:00,,,,,"2-комн. квартира, 54.9 м², 8/12 эт.",2020-11-10T08:16:49.179353Z
"ул. Аэропорт, стр. 1, блок-секция 4-7",182504330,Милый Дом,New,3285,2020-11-10T08:17:20.280265Z,"Отличный вариант 2х комнатной квартиры<br>В продаже квартира 50 кв.м под чистовую отделку , сдача дома в 3 кв. 2023, комиссии при оформлении - ОТСУТСТВУЮТ<br>Квартал «Авиатор» расположен на пересечении улицы Аэропорт и Мочищенского шоссе рядом с бывшим городским аэропортом «Новосибирск-Северный». <br>Квартал состоит из 11 домов. В центре квартала расположены 6-8-этажные урбан-виллы и 9-этажные парные дома с общим холлом. <br>По периметру они отделены от городских улиц двумя секционными домами от 6 до 18 этажей со стилобатом и паркингом.",50 м²,1027376811.0,Квартал «Авиатор»,1027376811.0,Квартал «Авиатор»,653.0,3/8,50 м²,50.0,3,4,2994794047,Sale,/2-komnatnaya-kvartira-na-prodazhu-novosibirsk-2994794047,260.0,4 500 000 ₽,90 000 ₽ за м²,90000,4500000,Apartment,2020-11-10T08:17:20.280265Z,78,Listing,2,2.0,2020-12-10T11:08:14.445211+03:00,2024064028,2020-11-10T11:07:21.305665+03:00,2020-11-14T11:56:39.253726+03:00,2.471,260.0,#FF0000,Заельцовская,"2-комн. квартира, 50 м², 3/8 эт.",2020-11-14T09:06:01.690107Z
"ул. Хилокская, д. 1б",68531542,Агентство недвижимости «Афина Паллада»,New,3285,2020-11-11T02:38:50.165614Z,"Арт. 43610505 Продаётся по переуступке.Продаётся 3 комнатная квартира. Общая площадь 77.5 кв.м площадь комнат 43 кв.м. Большая застекленная лоджия. Квартира под чистовую отделку, большие комнаты, все изолированные. остановка транспорта рядом с домом. Огороженная территория, детская площадка. Квартира очень теплая. Возможна ипотека.",77.5 м²,67123.0,ЖК «Хороший»,67123.0,ЖК «Хороший»,654.0,7/10,77.5 м²,77.5,7,2,2996744175,Sale,/3-komnatnaya-kvartira-na-prodazhu-novosibirsk-2996744175,267.0,2 750 000 ₽,35 484 ₽ за м²,35484,2750000,Apartment,2020-11-11T02:38:50.165614Z,78,Listing,3,3.0,2020-12-11T05:29:48.507706+03:00,2036471734,2020-11-11T05:29:26.828143+03:00,2020-11-11T05:29:48.507706+03:00,4.584,267.0,#FF0000,Площадь Маркса,"3-комн. квартира, 77.5 м², 7/10 эт.",2020-11-11T02:38:51.171076Z
"Новосибирск, улица Виктора Шевелёва, 34",178825960,"2ПН, покупка-продажа недвижимости",Resale,3285,2020-11-09T14:56:05.358218Z,"Продается 3 - х комнатная квартира - студия с балконом, с частичным ремонтом от собственника. Окна на две стороны.<br>Рядом с домом находится парк, детский сад, магазины, в шаговой доступности школа.<br>Документы получены. Просмотр по договоренности.",59 м²,,,,,655.0,9/10,59 м²,59.0,9,14,2993430952,Sale,/3-komnatnaya-kvartira-na-prodazhu-novosibirsk-2993430952,,2 800 000 ₽,47 458 ₽ за м²,47458,2800000,Apartment,2020-11-09T14:56:05.358218Z,78,Listing,3,3.0,2020-12-09T17:47:03.50753+03:00,2022389431,2020-11-09T17:46:37.376239+03:00,2020-12-02T12:19:03.93906+03:00,,,,,"3-комн. квартира, 59 м², 9/10 эт.",2020-12-02T09:34:41.946615Z
