address,agencyId,agencyName,apartmentSaleType,cityId,createdAt,description,details,developmentId,developmentName,developmentParentId,developmentParentName,districtId,floor,floorArea,floorAreaCalculated,floorInt,galleryImagesCount,id,itemType,itemUrl,metroId,price,pricePerArea,pricePerAreaValue,priceValue,propertyType,publishDate,regionId,resultType,rooms,roomsOrdinal,sourceFinishTime,sourceId,sourceStartTime,sourceUpdateTime,station_distance,station_id,station_lineColors,station_name,title,updatedAt
"Россия, Новосибирск, улица Фрунзе, 2Б, подъезд 1",37727341,Ольга,Resale,3285,2020-09-10T09:49:50.295707Z,"Продам 1-ком квартиру в центре,без посредников",34.4 м²,,,,,649.0,2/9,34.4 м²,34.4,2,0,2852366064,Sale,/1-komnatnaya-kvartira-na-prodazhu-novosibirsk-2852366064,262.0,3 000 000 ₽,87 209 ₽ за м²,87209,3000000,Apartment,2020-09-10T09:49:50.295707Z,78,Listing,1,1.0,2020-12-10T18:36:03.22091+03:00,1995509606,2020-09-08T06:37:37.226263+03:00,2020-11-30T14:04:50.000339+03:00,0.577,262.0,#FF0000,Красный проспект,"1-комн. квартира, 34.4 м², 2/9 эт.",2020-11-30T11:14:12.552737Z
"Новосибирская область, Барабинск, улица Ленина, 192",62109801,Наталья,Resale,3266,2019-04-07T16:25:00.578168Z,"Продается 3-х комнатная квартира в кирпичном доме на 5-ом этаже, 51 м², теплая, солнечная сторона.  Комнаты изолированные; ванна и туалет раздельно с новой  сантехникой; шумоизоляция во всех комнатах, балкон застеклен, стеклопакет. За домом расположен детский сад. В 7 минутах ходьбы от дома школа, в 10 минутах ходьбы привокзальная площадь, вокзал, рынок. Возможен обмен на квартиру г. Омск! Торг реальному покупателю!",51 м²,,,,,,5/5,51 м²,51.0,5,8,1223866948,Sale,/3-komnatnaya-kvartira-na-prodazhu-barabinsk-1223866948,,1 500 000 ₽,29 412 ₽ за м²,29412,1500000,Apartment,2019-04-07T16:25:00.578168Z,78,Listing,3,3.0,2020-12-09T06:55:18.568867+03:00,429894506,2014-10-09T20:33:47+04:00,2020-11-09T06:55:18.568867+03:00,,,,,"3-комн. квартира, 51 м², 5/5 эт.",2020-11-09T04:04:23.317071Z
"Новосибирск, Кировский район, Затулинский жилмассив, улица Громова, 5",176123877,"ООО ""Новосибирскстрой-Недвижимость+""",Resale,3285,2020-10-09T04:33:29.672752Z,Продам 2х комнатную квартиру. Комнаты смежно-изолированы. Окна пластик. ,44 м²,,,,,655.0,2/5,44 м²,44.0,2,10,2917437727,Sale,/2-komnatnaya-kvartira-na-prodazhu-novosibirsk-2917437727,,2 400 000 ₽,54 545 ₽ за м²,54545,2400000,Apartment,2020-10-09T04:33:29.672752Z,78,Listing,2,2.0,2020-12-09T06:56:33.432422+03:00,1987201833,2020-10-09T07:23:59.934203+03:00,2020-11-09T06:56:33.432422+03:00,,,,,"2-комн. квартира, 44 м², 2/5 эт.",2020-11-09T04:05:37.230602Z
"ул. 1-я Чулымская, д. 9",61734665,Агентство недвижимости «НИАН»,New,3285,2020-08-11T02:19:39.721524Z,"«Венеция» представляет собой современный жилой комплекс, построенный с помощью новейших передовых технологий в строительстве. Новостройки находятся в живописном месте Ленинского района, на берегу реки Обь. В шаговой доступности  детский сад, школа, а также такие торговые  комплексы, как «Лента», «Леруа Мерлен» и «Гигант». Недалеко от жилого комплекса аквапарк. До остановоки 5 минут. Квртира 2х-ком полноценная, кухня 8.4м2, большая лоджия 7,4м2. В наших квартирах: Возведены межкомнатные перегородки Произведена разводка электричества по квартире Установлены розетки и выключатели Установлены окна с откосами и подоконной доской Выполнено остекление лоджии Сделана стяжка пола В квартиру заведены трубы горячей и холодной воды, канализация, установлены заглушки.",61.5 м²,1009192613.0,ЖК «Венеция-3»,1009192613.0,ЖК «Венеция-3»,654.0,11/17,61.5 м²,61.5,11,0,2779242536,Sale,/2-komnatnaya-kvartira-na-prodazhu-novosibirsk-2779242536,263.0,3 943 000 ₽,64 114 ₽ за м²,64114,3943000,Apartment,2020-08-11T02:19:39.721524Z,78,Listing,2,2.0,2020-12-09T07:06:06.574785+03:00,1959342391,2020-08-11T05:10:12.546124+03:00,2020-11-09T07:06:06.574785+03:00,1.987,268.0,#008000,Площадь Гарина-Михайловского,"2-комн. квартира, 61.5 м², 11/17 эт.",2020-11-09T04:15:10.23258Z
"Новосибирск, Октябрьский район, микрорайон Закаменский, 16",36392421,Оксана,New,3285,2020-10-14T03:57:28.073398Z,Отличное вложение капитала,24 м²,,,,,650.0,3/17,24 м²,24.0,3,2,2928014797,Sale,/kvartira-na-prodazhu-novosibirsk-2928014797,271.0,1 750 000 ₽,72 917 ₽ за м²,72917,1750000,Apartment,2020-10-14T03:57:28.073398Z,78,Listing,Студия,,2020-12-13T06:49:26.402533+03:00,2019584956,2020-10-14T06:48:05.99585+03:00,2020-11-25T12:52:14.695281+03:00,0.712,271.0,#008000,Берёзовая роща,"Квартира-студия, 24 м², 3/17 эт.",2020-11-25T10:02:07.765696Z
"Новосибирская область, Искитим, улица Белинского, 47А",187442408,Нина Васильевна,Resale,3252,2020-08-13T07:23:15.174189Z,"Продам 2х комнатную квартиру в 4х квартирном доме. <br>Вся инфраструктура в шаговой доступности: школы, дет.сады, магазины, остановка ""ДК Россия"" и ""Экспедиция"", до ОП ""Монолитная"" 7-10 минут ходьбы.<br>Квартира очень теплая, светлая, центральное отопление, водоснабжение, канализация. В кухне и ванной выложен кафель. Установлены пластиковые окна, а также две входных двери хорошего качества.<br>Высота потолков 2,8 м. <br>Большая веранда - дополнительная комната на летний период.<br>Огород 1,5 сот. Есть хозблок.<br>Участок со всех сторон огорожен забором.<br>Рассмотрим варианты обмена.<br>Просмотр квартиры только по предварительному звонку.",50 м²,,,,,,1/1,50 м²,50.0,1,6,2784860828,Sale,/2-komnatnaya-kvartira-na-prodazhu-iskitim-2784860828,,1 750 000 ₽,35 000 ₽ за м²,35000,1750000,Apartment,2020-08-13T07:23:15.174189Z,78,Listing,2,2.0,2020-12-12T11:04:18.269757+03:00,1958172177,2020-08-13T10:13:41.807708+03:00,2020-11-26T14:05:13.671463+03:00,,,,,"2-комн. квартира, 50 м², 1/1 эт.",2020-11-26T11:14:17.178886Z
