address,agencyId,agencyName,apartmentSaleType,cityId,createdAt,description,details,developmentId,developmentName,developmentParentId,developmentParentName,districtId,floor,floorArea,floorAreaCalculated,floorInt,galleryImagesCount,id,itemType,itemUrl,metroId,price,pricePerArea,pricePerAreaValue,priceValue,propertyType,publishDate,regionId,resultType,rooms,roomsOrdinal,sourceFinishTime,sourceId,sourceStartTime,sourceUpdateTime,station_distance,station_id,station_lineColors,station_name,title,updatedAt
,188663210,"Квартал «Авиатор», застройщик Брусника",New,3285,2020-09-10T14:42:03.144951Z,"Трехкомнатная квартира в квартале «Авиатор». <br>                  ОБЪЯВЛЕНИЕ ОТ ЗАСТРОЙЩИКА. Покупка квартиры защищена банком.<br>Квартиру можно купить онлайн.<br>Трёхкомнатная квартира в ЖК «Авиатор» — это квартира с объединенной кухней-гостиной, тремя спальнями, просторной ванной комнатой и гостевым санузлом. Предусмотрены дополнительные ниши под хранение вещей, гардеробные или постирочные комнаты. Есть варианты планировок с французским балконом, протяжённым открытым балконом, глубокой или прогулочной террасой. Во всех квартирах сделаны большие окна, благодаря которым все помещения наполнены светом. Купить трёхкомнатную квартиру выгодно напрямую от застройщика Брусника. <br>На сдаче в 3-комнатных квартирах ЖК «Авиатор» выполнена отделка под чистовую. Стены выровнены и оштукатурены, на полу ー цементно-песчаная стяжка. В квартирах установлены розетки, выключатели, приборы учёта. Сделаны выводы под сантехнику и разводка электрики. Радиаторы установлены в каждой комнате и оборудованы терморегулятором. Нет стояков и вертикальных коммуникаций. В межкомнатных стенах и полу проложена шумоизоляция. В квартирах установлены пластиковые окна и надёжная сейф-дверь с замком. Отделка под чистовую экономит время и затраты на ремонт. Она включена в стоимость квартиры и не требует замены. <br>ЖК «Авиатор» расположен на пересечении улицы Аэропорт и Мочищенского шоссе, рядом с остановками «Байкальская», «Жуковского» и «Городской аэропорт», в 7 минутах ходьбы от сквера им. Чаплыгина и 10 минутах от крупной транспортной магистрали – Красного проспекта. До станции метро «Заельцовская» и площади «Калинина» – около 10 минут на автомобиле. Сформированная инфраструктура локации – школы, детские сады, магазины, спортивный стадион – делают жизнь в квартале комфортной. Первые новостройки в районе Аэропорта Северного сдаются в 3 квартале 2023 года. <br>«Авиатор» в Новосибирске строит компания Брусника. ЖК состоит из 11 домов. В центре квартала расположены 6-8-этажные урбан-виллы и 9-этажные парные дома с общим холлом. По периметру они отделены от городских улиц двумя секционными домами от 6 до 18 этажей со стилобатом и паркингом. Расположенная рядом школа будет интегрирована в проект при помощи элементов благоустройства и общественных пространств. Первая очередь строительства ЖК «Авиатор» включает возведение двух одноподъездных урбан-вилл и двух подъездов секционного дома, расположенного по улице Аэропорт. <br>Купить 3-комнатную квартиру в Новосибирске выгодно с использованием программ покупки и сервисов от застройщика Брусника: <br>— ипотека 5,85% по госпрограмме от ПАО Промсвязьбанк;<br>— ипотека с отсрочкой платежей на год от ПАО Сбербанк;<br>— беспроцентная рассрочка на квартиру;<br>— обмен своей квартиры на новую.<br>Получить одобрение ипотеки или рассрочку, а также осуществить обмен квартиры можно онлайн. Запишитесь на онлайн презентацию по телефону или на сайте.<br>            № квартиры в нашей базе: НСК17520.",94 м²,1027376811.0,Квартал «Авиатор»,1027376811.0,Квартал «Авиатор»,653.0,10/16,94 м²,94.0,10,9,2853095409,Sale,/3-komnatnaya-kvartira-na-prodazhu-novosibirsk-2853095409,260.0,7 250 000 ₽,77 128 ₽ за м²,77128,7250000,Apartment,2020-09-10T14:42:03.144951Z,78,Listing,3,3.0,2020-12-10T20:16:28.476503+03:00,1992152424,2020-09-10T17:32:22.855162+03:00,2020-11-25T09:56:46.616158+03:00,2.459,260.0,#FF0000,Заельцовская,"3-комн. квартира, 94 м², 10/16 эт.",2020-11-25T07:29:50.973591Z
,188663210,"Квартал «Авиатор», застройщик Брусника",New,3285,2020-09-10T17:29:16.281066Z,"Двухкомнатная квартира в квартале «Авиатор». <br>                  ОБЪЯВЛЕНИЕ ОТ ЗАСТРОЙЩИКА. Покупка квартиры защищена банком.<br>Квартиру можно купить онлайн.<br>Двухкомнатная квартира в ЖК «Авиатор» — это квартира с объединенной кухней-гостиной, двумя отдельными спальнями, просторной ванной комнатой и гостевым санузлом. Предусмотрены дополнительные ниши под хранение вещей, гардеробные или постирочные комнаты. Есть варианты планировок с французским балконом, протяжённым открытым балконом, глубокой или прогулочной террасой. Купить двухкомнатную квартиру выгодно напрямую от застройщика Брусника. <br>На сдаче в 2-комнатных квартирах ЖК «Авиатор» выполнена отделка под чистовую. Стены выровнены и оштукатурены, на полу ー цементно-песчаная стяжка. В квартирах установлены розетки, выключатели, приборы учёта. Сделаны выводы под сантехнику и разводка электрики. Радиаторы установлены в каждой комнате и оборудованы терморегулятором. Нет стояков и вертикальных коммуникаций. В межкомнатных стенах и полу проложена шумоизоляция. В квартирах установлены пластиковые окна и надёжная сейф-дверь с замком. Отделка под чистовую экономит время и затраты на ремонт. Она включена в стоимость квартиры и не требует замены. <br>ЖК «Авиатор» расположен на пересечении улицы Аэропорт и Мочищенского шоссе, рядом с остановками «Байкальская», «Жуковского» и «Городской аэропорт», в 7 минутах ходьбы от сквера им. Чаплыгина и 10 минутах от крупной транспортной магистрали – Красного проспекта. До станции метро «Заельцовская» и площади «Калинина» – около 10 минут на автомобиле. Сформированная инфраструктура локации – школы, детские сады, магазины, спортивный стадион – делают жизнь в квартале комфортной. Первые новостройки в районе Аэропорта Северного сдаются в 3 квартале 2023 года. <br>«Авиатор» в Новосибирске строит компания Брусника. ЖК состоит из 11 домов. В центре квартала расположены 6-8-этажные урбан-виллы и 9-этажные парные дома с общим холлом. По периметру они отделены от городских улиц двумя секционными домами от 6 до 18 этажей со стилобатом и паркингом. Расположенная рядом школа будет интегрирована в проект при помощи элементов благоустройства и общественных пространств. Первая очередь строительства ЖК «Авиатор» включает возведение двух одноподъездных урбан-вилл и двух подъездов секционного дома, расположенного по улице Аэропорт. <br>Купить 2-комнатную в новостройках вблизи Красного проспекта Новосибирске выгодно с использованием программ покупки и сервисов от застройщика Брусника: <br>— ипотека 5,85% по госпрограмме от ПАО Промсвязьбанк;<br>— ипотека с отсрочкой платежей на год от ПАО Сбербанк;<br>— беспроцентная рассрочка на квартиру;<br>— обмен своей квартиры на новую.<br>Получить одобрение ипотеки или рассрочку, а также осуществить обмен квартиры можно онлайн. Запишитесь на онлайн презентацию по телефону или на сайте.<br>            № квартиры в нашей базе: НСК17552.",79.3 м²,1027376811.0,Квартал «Авиатор»,1027376811.0,Квартал «Авиатор»,653.0,12/18,79.3 м²,79.3,12,9,2853462985,Sale,/2-komnatnaya-kvartira-na-prodazhu-novosibirsk-2853462985,260.0,6 600 000 ₽,83 228 ₽ за м²,83228,6600000,Apartment,2020-09-10T17:29:16.281066Z,78,Listing,2,2.0,2020-12-10T20:16:28.814064+03:00,1992005003,2020-09-10T20:19:22.427674+03:00,2020-11-25T09:56:49.362431+03:00,2.459,260.0,#FF0000,Заельцовская,"2-комн. квартира, 79.3 м², 12/18 эт.",2020-11-25T07:29:44.931708Z
,188663210,"Квартал «Авиатор», застройщик Брусника",New,3285,2020-09-10T17:28:48.415049Z,"Однокомнатная квартира в квартале «Авиатор». <br>                  ОБЪЯВЛЕНИЕ ОТ ЗАСТРОЙЩИКА. Покупка квартиры защищена банком.<br>Квартиру можно купить онлайн.<br>Однокомнатная квартира в ЖК «Авиатор» — это квартира с объединенной кухней-гостиной, отдельной спальней и просторной ванной комнатой. Предусмотрены дополнительные ниши под хранение вещей, гардеробные или постирочные комнаты. Есть варианты планировок с французским балконом, протяжённым открытым балконом, глубокой террасой. Купить однокомнатную квартиру выгодно напрямую от застройщика Брусника. <br>На сдаче в 1-комнатных квартирах ЖК «Авиатор» выполнена отделка под чистовую. Стены выровнены и оштукатурены, на полу ー цементно-песчаная стяжка. В квартирах установлены розетки, выключатели, приборы учёта. Сделаны выводы под сантехнику и разводка электрики. Радиаторы установлены в каждой комнате и оборудованы терморегулятором. Нет стояков и вертикальных коммуникаций. В межкомнатных стенах и полу проложена шумоизоляция. В квартирах установлены пластиковые окна и надёжная сейф-дверь с замком. Отделка под чистовую экономит время и затраты на ремонт. Она включена в стоимость квартиры и не требует замены. <br>ЖК «Авиатор» расположен на пересечении улицы Аэропорт и Мочищенского шоссе, рядом с остановками «Байкальская», «Жуковского» и «Городской аэропорт», в 7 минутах ходьбы от сквера им. Чаплыгина и 10 минутах от крупной транспортной магистрали – Красного проспекта. До станции метро «Заельцовская» и площади «Калинина» – около 10 минут на автомобиле. Сформированная инфраструктура локации – школы, детские сады, магазины, спортивный стадион – делают жизнь в квартале комфортной. Первые новостройки в районе Аэропорта Северного сдаются в 3 квартале 2023 года. <br>«Авиатор» в Новосибирске строит компания Брусника. ЖК состоит из 11 домов. В центре квартала расположены 6-8-этажные урбан-виллы и 9-этажные парные дома с общим холлом. По периметру они отделены от городских улиц двумя секционными домами от 6 до 18 этажей со стилобатом и паркингом. Расположенная рядом школа будет интегрирована в проект при помощи элементов благоустройства и общественных пространств. Первая очередь строительства ЖК «Авиатор» включает возведение двух одноподъездных урбан-вилл и двух подъездов секционного дома, расположенного по улице Аэропорт. <br>Купить однокомнатную квартиру в новостройках вблизи Красного проспекта Новосибирске выгодно с использованием программ покупки и сервисов от застройщика Брусника: <br>— ипотека 5,85% по госпрограмме от ПАО Промсвязьбанк;<br>— ипотека с отсрочкой платежей на год от ПАО Сбербанк;<br>— беспроцентная рассрочка на квартиру;<br>— обмен своей квартиры на новую.<br>Получить одобрение ипотеки или рассрочку, а также осуществить обмен квартиры можно онлайн. Запишитесь на онлайн презентацию по телефону или на сайте.<br>            № квартиры в нашей базе: НСК17551.",60.8 м²,1027376811.0,Квартал «Авиатор»,1027376811.0,Квартал «Авиатор»,653.0,12/16,60.8 м²,60.8,12,9,2853462428,Sale,/1-komnatnaya-kvartira-na-prodazhu-novosibirsk-2853462428,260.0,5 000 000 ₽,82 237 ₽ за м²,82237,5000000,Apartment,2020-09-10T17:28:48.415049Z,78,Listing,1,1.0,2020-12-10T20:16:29.333937+03:00,1992067027,2020-09-10T20:19:22.340271+03:00,2020-11-25T09:56:49.157332+03:00,2.459,260.0,#FF0000,Заельцовская,"1-комн. квартира, 60.8 м², 12/16 эт.",2020-11-25T07:29:43.431766Z
,188663210,"Квартал «Авиатор», застройщик Брусника",New,3285,2020-09-10T17:29:16.250685Z,"Студия в квартале «Авиатор». <br>                  ОБЪЯВЛЕНИЕ ОТ ЗАСТРОЙЩИКА. Покупка квартиры защищена банком.<br>Квартиру можно купить онлайн.<br>Студия в ЖК «Авиатор» в микрорайоне Аэропорт — это квартира с объединенной кухонной зоной и местом для отдыха и сна, а также отдельной ванной комнатой. Предусмотрены дополнительные ниши под хранение вещей. Есть варианты планировок с французским балконом, на который можно выйти подышать воздухом и полюбоваться видами. Купить квартиру-студию без посредников выгодно напрямую от застройщика Брусника. <br>На сдаче в однокомнатных студиях ЖК «Авиатор» выполнена отделка под чистовую. Стены выровнены и оштукатурены, на полу ー цементно-песчаная стяжка. В квартирах установлены розетки, выключатели, приборы учёта. Сделаны выводы под сантехнику и разводка электрики. Радиаторы установлены в каждой комнате и оборудованы терморегулятором. Нет стояков и вертикальных коммуникаций. В межкомнатных стенах и полу проложена шумоизоляция. В квартирах установлены пластиковые окна и надёжная сейф-дверь с замком. Отделка под чистовую экономит время и затраты на ремонт. Она включена в стоимость квартиры и не требует замены. <br>ЖК «Авиатор» расположен на пересечении улицы Аэропорт и Мочищенского шоссе, рядом с остановками «Байкальская», «Жуковского» и «Городской аэропорт», в 7 минутах ходьбы от сквера им. Чаплыгина и 10 минутах от крупной транспортной магистрали – Красного проспекта. До станции метро «Заельцовская» и площади «Калинина» – около 10 минут на автомобиле. Сформированная инфраструктура локации – школы, детские сады, магазины, спортивный стадион – делают жизнь в квартале комфортной. Первые новостройки в районе Аэропорта Северного сдаются в 3 квартале 2023 года. <br>«Авиатор» в Новосибирске строит компания Брусника. ЖК состоит из 11 домов. В центре квартала расположены 6-8-этажные урбан-виллы и 9-этажные парные дома с общим холлом. По периметру они отделены от городских улиц двумя секционными домами от 6 до 18 этажей со стилобатом и паркингом. Расположенная рядом школа будет интегрирована в проект при помощи элементов благоустройства и общественных пространств. Первая очередь строительства ЖК «Авиатор» включает возведение двух одноподъездных урбан-вилл и двух подъездов секционного дома, расположенного по улице Аэропорт. <br>Купить студию в новостройках вблизи Красного проспекта Новосибирске выгодно с использованием программ покупки и сервисов от застройщика Брусника: <br>— ипотека 5,85% по госпрограмме от ПАО Промсвязьбанк;<br>— ипотека с отсрочкой платежей на год от ПАО Сбербанк;<br>— беспроцентная рассрочка на квартиру;<br>— обмен своей квартиры на новую.<br>Получить одобрение ипотеки или рассрочку, а также осуществить обмен квартиры можно онлайн. Запишитесь на онлайн презентацию по телефону или на сайте.<br>            № квартиры в нашей базе: НСК17548.",33.1 м²,1027376811.0,Квартал «Авиатор»,1027376811.0,Квартал «Авиатор»,653.0,12/18,33.1 м²,33.1,12,9,2853462984,Sale,/kvartira-na-prodazhu-novosibirsk-2853462984,260.0,3 300 000 ₽,99 698 ₽ за м²,99698,3300000,Apartment,2020-09-10T17:29:16.250685Z,78,Listing,Студия,,2020-12-10T20:16:29.868722+03:00,1992710446,2020-09-10T20:19:22.505834+03:00,2020-11-25T09:56:49.312909+03:00,2.459,260.0,#FF0000,Заельцовская,"Квартира-студия, 33.1 м², 12/18 эт.",2020-11-25T07:29:44.742523Z
"Новосибирская область, Новосибирский район, село Криводановка, Садовая улица, 27",192523274,Ирина,Resale,3258,2020-11-10T07:10:13.117798Z,"Продам  двухкомнатную   квартиру . В хорошем состоянии .В квартире сделан отличный ремонт.Лоджия застекленна.Сан узел раздельный. Отличные , добрые соседи.Прекрастный вид из окна.Школа,садик в шаговой доступности.Остановка рядом.Вокруг лес ,свежий воздух.",43.3 м²,,,,,,5/5,43.3 м²,43.3,5,5,2994629971,Sale,/2-komnatnaya-kvartira-na-prodazhu-krivodanovka-2994629971,,2 000 000 ₽,46 189 ₽ за м²,46189,2000000,Apartment,2020-11-10T07:10:13.117798Z,78,Listing,2,2.0,2020-12-10T10:01:11.393038+03:00,2024396751,2020-11-10T10:00:48.018928+03:00,2020-11-10T10:01:11.393038+03:00,,,,,"2-комн. квартира, 43.3 м², 5/5 эт.",2020-11-10T07:10:14.218425Z
