address,agencyId,agencyName,apartmentSaleType,cityId,createdAt,description,details,developmentId,developmentName,developmentParentId,developmentParentName,districtId,floor,floorArea,floorAreaCalculated,floorInt,galleryImagesCount,id,itemType,itemUrl,metroId,price,pricePerArea,pricePerAreaValue,priceValue,propertyType,publishDate,regionId,resultType,rooms,roomsOrdinal,sourceFinishTime,sourceId,sourceStartTime,sourceUpdateTime,station_distance,station_id,station_lineColors,station_name,title,updatedAt
"Новосибирская область, Бердск, улица Дзержинского",23367994,Компания «ЭТАЖИ»,Resale,3279,2020-12-05T02:16:17.514081Z,"Продается 3х комнатная квартира в кирпичном доме. Выполнена функциональная перепланировка. 2 комнаты изолированы, кухня соединена с гостиной. В подарок покупателю остается вся мебель, вытяжка, варочная плита, 2 кондиционера.Тихий уютный двор, на въездах шлагбаум. Удобная транспортная развязка. До станции метро Березовая роща 15 мин пешком.<br>Торг.<br>Приглашаем на просмотр!. Номер в базе: 5035229. Район: Дзержинский.",55.5 м²,,,,,,2/5,55.5 м²,55.5,2,12,3053347856,Sale,/3-komnatnaya-kvartira-na-prodazhu-berdsk-3053347856,,3 900 000 ₽,70 270 ₽ за м²,70270,3900000,Apartment,2020-12-05T02:16:17.514081Z,78,Listing,3,3.0,2021-01-04T05:07:16.587449+03:00,2072605458,2020-12-05T05:06:49.962085+03:00,2020-12-05T05:07:16.587449+03:00,,,,,"3-комн. квартира, 55.5 м², 2/5 эт.",2020-12-05T02:16:19.803888Z
"ул. Тополёвая, стр. 1",122634585,Академия Недвижимости,New,3285,2020-12-04T11:22:14.443951Z,"ОБРАТИТЕ ВНИМАНИЕ !!!!!<br>ОДНО ИЗ ПОСЛЕДНИХ ПРЕДЛОЖЕНИЙ ЗАСТРОЙЩИКА В ЭТОМ ДОМЕ !!!!!!!!!<br>УСПЕЙТЕ !!!!!!!!<br>СДАЧА ЧЕРЕЗ НЕДЕЛЮ  !!!!!!<br>КОМИССИЯ 0%<br>ЛОКАЦИЯ ОГОНЬ !!!!<br>В продаже прекрасная ПОЛНОЦЕННАЯ трехкомнатная квартира в жилом комплексе ""На Тополевой"", в пяти минутах от ТРЦ ""АУРА"" !!!<br>Чистовая отделка. ТОЛЬКО НА ЭТОМ ЭТАЖЕ ПОТОЛКИ 3 МЕТРА !!!!!!!!!! Стройка идет с опережением сроков сдачи !!!<br>Район с исторической архитектурой Военного городка.<br>Невысокая этажность, кирпичные стены.<br>Бесшумные скоростные лифты увеличенного размера.<br>Круглосуточная охрана и видеонаблюдение.<br>Комфортное удаление от транспортной магистрали.<br>Быстрый выезд на Ипподромскую магистраль, 200 м до школы, 500м до ТРЦ ""Аура"", 500м до Регионального волейбольного центра.<br>Развитая инфраструктура, всё необходимое современному человеку находится рядом: в пешей доступности три школы, два детских сада, поликлиника, аптеки, Площадь Ленина, Оперный театр (в 10 минутах ходьбы),ТРЦ ""АУРА"",Exetrime Fitness"", множество других магазинов, несколько автомоечных комплексов, станция метро ""Октябрьская"", остановки общественного транспорта.<br>КОМИССИЯ 0%<br>Если вы хотите жить в престижном районе, тихом месте, звоните, спокойная и комфортная жизнь вам гарантирована !<br>Помогу вам оформить ипотеку на выгодных условиях: с лояльными правилами погашения, низкой процентной ставкой, высоким шансом одобрения заявки !!!!!<br>Звоните, с удовольствием отвечу на Ваши вопросы !<br>Будет здорово, если именно Вы успеете купить эту квартиру !!!!!!!!!!!!!!",67.6 м²,1030178252.0,ЖК «На Тополевой»,1030178252.0,ЖК «На Тополевой»,650.0,10/10,67.6 м²,67.6,10,7,3052363331,Sale,/3-komnatnaya-kvartira-na-prodazhu-novosibirsk-3052363331,264.0,5 950 000 ₽,88 018 ₽ за м²,88018,5950000,Apartment,2020-12-04T11:22:14.443951Z,78,Listing,3,3.0,2021-01-03T14:13:11.621623+03:00,2071813957,2020-12-04T14:12:45.825039+03:00,2020-12-04T14:26:14.658936+03:00,1.386,264.0,#FF0000,Октябрьская,"3-комн. квартира, 67.6 м², 10/10 эт.",2020-12-04T11:35:45.479214Z
"Новосибирск, улица Владимира Высоцкого, 42",170121642,VDOME недвижимость,Resale,3285,2020-12-08T12:41:57.229926Z,"продам квартиру в быстроразвивающемся районе МЖК, остановка в шаговой доступности ( 2 минуты )<br>продается в связи с переездом в другой город, мебель оставляем полностью, забираем только личные вещи<br>телевизор по договоренности, соседи все спокойные, квартира изолирована тамбуром, стоит железная дверь.<br>Этаж первый но высокий, подъезд внутри двора, желательно наличный расчет, подойдет как для жилья или сдачи <br>цена аренды от 17 тысяч. Ждем на просмотр в любое время!!!!",42.9 м²,,,,,650.0,1/10,42.9 м²,42.9,1,0,3061368496,Sale,/2-komnatnaya-kvartira-na-prodazhu-novosibirsk-3061368496,272.0,2 600 000 ₽,60 606 ₽ за м²,60606,2600000,Apartment,2020-12-08T12:41:57.229926Z,78,Listing,2,2.0,2021-01-07T15:32:54.016215+03:00,2056489736,2020-12-08T15:32:26.350102+03:00,2020-12-08T15:32:54.016215+03:00,3.183,272.0,#008000,Золотая Нива,"2-комн. квартира, 42.9 м², 1/10 эт.",2020-12-08T12:42:00.122576Z
"Новосибирск, Бронная улица, 44, подъезд 2",4668180,Андрей,New,3285,2020-12-07T10:32:50.625716Z,Продажа по переуступке.,58 м²,,,,,655.0,3/10,58 м²,58.0,3,19,3058472325,Sale,/2-komnatnaya-kvartira-na-prodazhu-novosibirsk-3058472325,,2 900 000 ₽,50 000 ₽ за м²,50000,2900000,Apartment,2020-12-07T10:32:50.625716Z,78,Listing,2,2.0,2021-01-06T13:23:48.805766+03:00,2066860103,2020-12-07T13:23:26.898991+03:00,2020-12-07T13:23:48.805766+03:00,,,,,"2-комн. квартира, 58 м², 3/10 эт.",2020-12-07T10:32:51.893434Z
"Новосибирск, Кавалерийская улица, 3/1",28582264,РК  «Риэлт–Мастер»,Resale,3285,2020-12-07T19:09:26.806491Z,"Продам видовую 1-комнатную квартиру студию   с панорамным остеклением в Жилом комплексе  Комфорт Класса  LEO . Дом на сдаче! Этажность: 25 Материал дома: Кирпич-монолит . Договор долевого участия, продажа по переуступке. Остекленение лоджии полностью оплачено.. Скоро сдача дома, после оформления в собственность  стоимость квартиры будет уже больше.",37 м²,,,,,653.0,23/25,37 м²,37.0,23,6,3059727622,Sale,/1-komnatnaya-kvartira-na-prodazhu-novosibirsk-3059727622,260.0,3 150 000 ₽,85 135 ₽ за м²,85135,3150000,Apartment,2020-12-07T19:09:26.806491Z,78,Listing,1,1.0,2021-01-06T22:00:24.562079+03:00,2070207667,2020-12-07T22:00:03.442766+03:00,2020-12-07T22:00:24.562079+03:00,0.399,260.0,#FF0000,Заельцовская,"1-комн. квартира, 37 м², 23/25 эт.",2020-12-07T19:09:27.410862Z
"Новосибирская область, Бердск, улица Ленина, 30",51464857,"АН ""ЖилМассив""",Resale,3279,2020-12-07T10:36:41.783627Z,В продаже двухкомнатная квартира в кирпичном доме в центре Бердска. Под с/отделку. Квартира в залоге Сбербанк.,40 м²,,,,,,5/5,40 м²,40.0,5,5,3058480309,Sale,/2-komnatnaya-kvartira-na-prodazhu-berdsk-3058480309,,2 100 000 ₽,52 500 ₽ за м²,52500,2100000,Apartment,2020-12-07T10:36:41.783627Z,78,Listing,2,2.0,2021-01-06T13:27:38.959741+03:00,2071000748,2020-12-07T13:27:14.62088+03:00,2020-12-07T13:27:38.959741+03:00,,,,,"2-комн. квартира, 40 м², 5/5 эт.",2020-12-07T10:36:42.023654Z
"Новосибирск, Ереванская улица, 5",35388588,"Федерация Недвижимости. Квартира, новостройка",Resale,3285,2020-12-04T11:33:18.057431Z,"Продается светлая, теплая, уютная трехкомнатная квартира в кирпичном доме.<br>В квартире сделан оемонт. Пластиковые окна, натяжные потолки, на полу линолиум.<br>В ванной установлена новая сантехника. Произведена замена труб разводки водоснабжения на кухне и в санузле.<br>На балконе - стекление из ПВХ.<br>Удобная транспортная развязка. До метро Заельцовская 4 остановки.<br>Вся инфраструктура в шаговой доступности: во дворе детский сад №272, школы №77 и Сибирский кадетский корпус.<br>Один взрослый собственник.<br>Приглашаем на просмотр.",73.4 м²,,,,,653.0,2/2,73.4 м²,73.4,2,10,3052385621,Sale,/3-komnatnaya-kvartira-na-prodazhu-novosibirsk-3052385621,260.0,3 400 000 ₽,46 322 ₽ за м²,46322,3400000,Apartment,2020-12-04T11:33:18.057431Z,78,Listing,3,3.0,2021-01-03T14:24:10.921801+03:00,2058308199,2020-12-04T14:21:57.000264+03:00,2020-12-04T14:39:31.285056+03:00,1.834,260.0,#FF0000,Заельцовская,"3-комн. квартира, 73.4 м², 2/2 эт.",2020-12-04T11:48:59.658375Z
"Новосибирск, улица Виктора Уса, 4",23367994,Компания «ЭТАЖИ»,Resale,3285,2020-12-07T19:16:31.131005Z,"В продаже большая студия на Виктора Уса.Рядом два детских садика, до ближайшего 190м. Развитая инфраструктура, магазины,аптеки.До метро Маркса 15мин.<br>Огороженная территория,просторный двор, детская площадка. В подъезде и лифтах установлены камеры видео наблюдения.Квартира с ремонтом и мебелью, заходи и живи.<br>Идеальный вариант для начала приобретения первого жилья либо для сдачи в аренду.<br>Любые формы расчётов. Помощь в получении ипотеки.<br>Звоните!. Номер в базе: 4859675. Район: Кировский.",33 м²,,,,,655.0,8/17,33 м²,33.0,8,8,3059734448,Sale,/kvartira-na-prodazhu-novosibirsk-3059734448,267.0,2 200 000 ₽,66 667 ₽ за м²,66667,2200000,Apartment,2020-12-07T19:16:31.131005Z,78,Listing,Студия,,2021-01-06T22:07:30.174199+03:00,2072794049,2020-12-07T22:07:05.643531+03:00,2020-12-07T22:07:30.174199+03:00,4.709,267.0,#FF0000,Площадь Маркса,"Квартира-студия, 33 м², 8/17 эт.",2020-12-07T19:16:33.577916Z
"Новосибирск, Большая улица, 628",23367994,Компания «ЭТАЖИ»,Resale,3285,2020-11-06T12:16:42.694517Z,"В продаже 3-х комнатная квартира в ЖК «Новомарусино», расположенном в зеленой зоне Новосибирска. До Димитриевского моста 5км. До остановки 5мин (много транспорта). На территории есть свой детский садик.2 больших Торговый центра (аптека, одежда, бытовые услуги).В 2022г поблизости по проекту строительство школы. <br>Огороженная территория со своей парковой зоной,мощённые дорожки, лавочки, озеленение. Рядом с домом парковка. <br>На этаже по две квартиры,широкие лестницы,своя газовая котельная (экономия на коммунальных платежах), счётчики на этаже.<br>Комнаты изолированные, на разные стороны дома. Высота потолков 3м.Средний этаж.<br>Цена ниже рынка.<br>Любые формы расчётов.Ипотека (помощь в получении).<br>Звоните!. Номер в базе: 4892081. Район: Ленинский.",64 м²,,,,,654.0,2/3,64 м²,64.0,2,7,2986403526,Sale,/3-komnatnaya-kvartira-na-prodazhu-novosibirsk-2986403526,,2 900 000 ₽,45 313 ₽ за м²,45313,2900000,Apartment,2020-11-06T12:16:42.694517Z,78,Listing,3,3.0,2021-01-06T05:07:16.545787+03:00,2040497480,2020-11-06T15:07:08.565212+03:00,2020-12-07T16:21:54.537298+03:00,,,,,"3-комн. квартира, 64 м², 2/3 эт.",2020-12-07T13:31:55.381656Z
"Новосибирская область, Бердск, микрорайон Северный, 21",84601290,Бизнес недвижимость,Resale,3279,2019-12-02T05:38:21.215727Z,Продам отличную квартиру в кирпичном доме. Вся ифраструктура в шаговой доступности. Транспортная развязка до Новосибирска и Академгородка. Возможен обмен на 2х комнатную в этом же районе. Рассмотрим все варианты. Предлагайте . Показ по предварительному звонку.,77 м²,,,,,,2/9,77 м²,77.0,2,12,2071792287,Sale,/3-komnatnaya-kvartira-na-prodazhu-berdsk-2071792287,,3 750 000 ₽,48 701 ₽ за м²,48701,3750000,Apartment,2019-12-02T05:38:21.215727Z,78,Listing,3,3.0,2021-01-03T07:13:07.892334+03:00,1832214694,2019-12-02T08:27:26.243969+03:00,2020-12-04T07:13:07.892334+03:00,,,,,"3-комн. квартира, 77 м², 2/9 эт.",2020-12-04T04:22:12.688151Z
"ул. Грибоедова, стр. 4",158578188,"Квартал «Никитина», застройщик Брусника",New,3285,2020-05-14T00:58:48.129232Z,"Квартира с объединенной кухней-гостиной и тремя спальнями в квартале с урбан-виллами на «Никитина». <br>                  ОБЪЯВЛЕНИЕ ОТ ЗАСТРОЙЩИКА<br>Квартиру можно купить онлайн.<br>Купить трёхкомнатную квартиру в Октябрьском районе Новосибирска можно в урбан-виллах на «Никитина» от застройщика «Брусника. Сибакадемстрой». Это квартиры с объединённой кухней-гостиной, тремя спальнями, ванной комнатой и гостевым санузлом. Трёхкомнатная может быть укомплектована тёплой лоджий, где удобно разместить рабочее место или кресла для отдыха. Есть варианты квартир с открытым французским балконом и террасами. В квартирах также спроектированы дополнительные помещения — гардеробные или ниши под хранение, постирочные, второй санузел. Есть варианты квартир с отдельным входом с улицы. <br>На сдаче в 3-комнатных квартирах в новостройках на «Никитина» выполнена отделка под чистовую. В каждой квартире — приборы учёта, радиаторы, розетки и выключатели, выполнена разводка электрики и отопления. Стены оштукатурены. Пол готов к финишному покрытию — ламинату, линолеуму, плитке.<br>Квартал «Никитина» расположен на пересечении улиц Никитина и Декабристов, 15 минут на автомобиле до центра города и 20 минут пешком до станции метро «Речной вокзал». Рядом находятся продуктовые магазины, аптеки, несколько детских садов, школа и гимназия, остановки общественного транспорта. <br>Проект ЖК «Никитина» включает восемь урбан-вилл высотой 7–9 этажей и одну визуальную доминанту — 17-этажную башню, которые окружены парковым пространством двора. Под кварталом расположен подземный паркинг для жителей. Проектом предусмотрено четыре очереди строительства. В первой очереди квартала на пересечении улиц Декабристов и Грибоедова будет 3 урбан-виллы, 145 квартир и 89 паркингов. Ввод квартир в новостройках на Никитина в эксплуатацию запланирован на 4 квартал 2021 года.<br>Купить 3-комнатную квартиру в ЖК «Никитина» в Октябрьском районе Новосибирска можно напрямую от застройщика «Брусника. Сибакадемстрой»:<br>— ипотека с отсрочкой платежей на год от ПАО Сбербанк;<br>— беспроцентная рассрочка на трёхкомнатные в новостройках на «Никитина»;<br>— обмен своей квартиры на 3-комнатную в квартале «Никитина»;<br>— возможность заказать отделку и оформить её вместе с трёхкомнатной квартирой в ипотеку;<br>— бесплатный юридический сервис по оформлению квартиры.<br>Получить одобрение ипотеки или рассрочку, а также осуществить обмен квартиры можно онлайн. Запишитесь на онлайн презентацию по телефону или на сайте.<br>            № квартиры в нашей базе: НСК15973.",95.6 м²,1004982330.0,Урбан-виллы на «Никитина»,1004982330.0,Урбан-виллы на «Никитина»,650.0,3/10,95.6 м²,95.6,3,20,2557272688,Sale,/3-komnatnaya-kvartira-na-prodazhu-novosibirsk-2557272688,265.0,8 900 000 ₽,93 096 ₽ за м²,93096,8900000,Apartment,2020-05-14T00:58:48.129232Z,78,Listing,3,3.0,2020-12-12T16:26:09.626231+03:00,1930242007,2020-05-13T07:14:58.820777+03:00,2020-12-03T10:01:03.108062+03:00,1.122,265.0,#FF0000,Речной вокзал,"3-комн. квартира, 95.6 м², 3/10 эт.",2020-12-03T07:10:08.557951Z
"ул. Даргомыжского, стр. 1",28582264,РК  «Риэлт–Мастер»,New,3285,2020-12-07T19:20:46.746846Z,"Мощный Жилой комплекс Чкалов состоит из трех жилых домов и многоэтажной автостоянки. Два односекционных дома высотой 25 этажей и один дом состоящий из 4-х секций переменной этажности (23, 25 этажа) расположены вдоль ул. Светлановская в Заельцовском районе. Территория условно разделена на 2 части- зону жилых домов с благоустроенными дворами и существующим лесным массивом, и зону, где размещены автостоянки для личного автотранспорта. Услугти агенства 0%.",24 м²,1006254738.0,ЖК «Чкалов»,1006254738.0,ЖК «Чкалов»,653.0,3/25,24 м²,24.0,3,4,3059738818,Sale,/1-komnatnaya-kvartira-na-prodazhu-novosibirsk-3059738818,260.0,2 350 000 ₽,97 917 ₽ за м²,97917,2350000,Apartment,2020-12-07T19:20:46.746846Z,78,Listing,1,1.0,2021-01-06T22:11:44.861368+03:00,2070408352,2020-12-07T22:11:24.927562+03:00,2020-12-07T22:11:44.861368+03:00,2.231,260.0,#FF0000,Заельцовская,"1-комн. квартира, 24 м², 3/25 эт.",2020-12-07T19:20:48.807909Z
"ул. Герцена, стр. 1/2",28582264,РК  «Риэлт–Мастер»,New,3285,2020-12-07T19:20:48.984959Z,"Продам шикарную однокомнатную-студию, которую можно переделать в 2х студию! ЖК Прибрежный расположен в 200 метрах от реки Обь, на левом берегу. Прекрасный вид на Бугринский мост. Преимущество местности очевидны: пляж, парк культуры и отдыха Бугринская роща , спортивный комплекс с плавательным бассейном. Магазины и супермаркеты Горожанка , Пятерочка,, Мария-Ра , крупный торговый центр стц Мега, Икея , Леруа Мерлен . Отличная транспортная развязка.",40 м²,1009144113.0,ЖК «Прибрежный»,1009144113.0,ЖК «Прибрежный»,655.0,15/18,40 м²,40.0,15,5,3059738870,Sale,/1-komnatnaya-kvartira-na-prodazhu-novosibirsk-3059738870,,2 475 000 ₽,61 875 ₽ за м²,61875,2475000,Apartment,2020-12-07T19:20:48.984959Z,78,Listing,1,1.0,2021-01-06T22:11:45.327624+03:00,2070516472,2020-12-07T22:11:25.879188+03:00,2020-12-07T22:11:45.327624+03:00,,,,,"1-комн. квартира, 40 м², 15/18 эт.",2020-12-07T19:20:51.298603Z
