address,agencyId,agencyName,apartmentSaleType,cityId,createdAt,description,details,developmentId,developmentName,developmentParentId,developmentParentName,districtId,floor,floorArea,floorAreaCalculated,floorInt,galleryImagesCount,id,itemType,itemUrl,metroId,price,pricePerArea,pricePerAreaValue,priceValue,propertyType,publishDate,regionId,resultType,rooms,roomsOrdinal,sourceFinishTime,sourceId,sourceStartTime,sourceUpdateTime,station_distance,station_id,station_lineColors,station_name,title,updatedAt
"Новосибирск, Северная улица, 13",23367994,Компания «ЭТАЖИ»,Resale,3285,2020-12-07T19:16:30.544664Z,"Предлагается квартира, сделан качественный дорогой ремонт год назад. На стенах декоративная штукатурка, плитка в ванне и на полу Италия. В комнате ламинат. Двери в гардеробную сделаны на заказ, кухня сделана на заказ.<br>дом на гарантии до конца 2021 года. Капитальный ремонт не платится. шикарный вид из окна на красный проспект. хорошая шумоизоляция в квартире, соседей не слышно.<br>До метро 10 минут пешком.<br>Хорошее местоположение дома, рядом все инстанции, школы, детские сады, также рядом бот. Сад и зоопарк для прогулок, в 10 минутах пляж и заельцовский парк.<br>Магазины метро в соседнем здании, рядом гигант и много мелких универсамов.<br>Квартира продаётся со всей мебелью и техникой.. Номер в базе: 5071740. Район: Заельцовский.",40 м²,,,,,653.0,9/25,40 м²,40.0,9,0,3059734439,Sale,/1-komnatnaya-kvartira-na-prodazhu-novosibirsk-3059734439,260.0,5 400 000 ₽,135 000 ₽ за м²,135000,5400000,Apartment,2020-12-07T19:16:30.544664Z,78,Listing,1,1.0,2021-01-06T22:07:29.129208+03:00,2072313266,2020-12-07T22:07:04.209379+03:00,2020-12-07T22:07:29.129208+03:00,1.316,260.0,#FF0000,Заельцовская,"1-комн. квартира, 40 м², 9/25 эт.",2020-12-07T19:16:31.54826Z
"Новосибирск, улица Бориса Богаткова, 194/5",23367994,Компания «ЭТАЖИ»,Resale,3285,2020-12-04T10:20:17.860013Z,"В квартире выполнен современный ремонт, всё делалось для себя любимого. Своё парковочное место, которое находится под круглосуточным видеонаблюдением. Хорошо развита инфраструктура в непосредственной близости - гимназия №11, , торговые центры, мини-рынок ""Молодежный"", спортивно-оздоровительный центр, поликлиника №15, развлекательные центры, аптеки, супермаркеты, банки. В 5 минутах ходьбы все виды общественного транспорта, станция метро ""Золотая нива"" в шаговой доступности. Отличный вид из квартиры на две стороны.Один взрослый собственник.Звоните и записывайтесь на просмотр. Помощь в оформлении ипотека под низкий %<br>Приобретая эту квартиру, вы бесплатно получаете Гарантийный сертификат* в соответствии с Положением ""О гарантийных обязательствах"". Подробности вы можете узнать по телефону.. Номер в базе: 5063234. Район: Октябрьский.",37 м²,,,,,650.0,3/9,37 м²,37.0,3,16,3052233320,Sale,/1-komnatnaya-kvartira-na-prodazhu-novosibirsk-3052233320,272.0,3 650 000 ₽,98 649 ₽ за м²,98649,3650000,Apartment,2020-12-04T10:20:17.860013Z,78,Listing,1,1.0,2021-01-03T13:11:11.466524+03:00,2072306181,2020-12-04T13:10:35.007273+03:00,2020-12-07T10:06:50.832783+03:00,0.89,272.0,#008000,Золотая Нива,"1-комн. квартира, 37 м², 3/9 эт.",2020-12-07T07:16:23.448888Z
"Новосибирск, улица Семьи Шамшиных, 18",23367994,Компания «ЭТАЖИ»,Resale,3285,2020-12-04T10:20:17.823053Z,"В пpoдaжe светлaя уютная квартирa в доме классической кирпичной кладки. Территория огорожена. Есть детская площадка.<br>Планировка свободная, можно сделать двухкомнатную студию. Два санузла, один из которых также можно задействовать для других целей.<br>Дом pасполoжeн в цeнтре Hoвoсибирcка, за тц ""Аура"".<br>В шаговой доступности расположены: метро, продуктовые магазины, поликлиника, школа, детский сад.<br>Удобная транспортная развязка как для пешеходов, так и для водителей.. Номер в базе: 5007829. Район: Центральный.",48.6 м²,,,,,649.0,5/9,48.6 м²,48.6,5,10,3052233317,Sale,/1-komnatnaya-kvartira-na-prodazhu-novosibirsk-3052233317,263.0,5 680 000 ₽,116 872 ₽ за м²,116872,5680000,Apartment,2020-12-04T10:20:17.823053Z,78,Listing,1,1.0,2021-01-03T13:11:11.612057+03:00,2072480710,2020-12-04T13:10:42.144212+03:00,2020-12-04T13:11:11.612057+03:00,0.842,263.0,#FF0000,Площадь Ленина,"1-комн. квартира, 48.6 м², 5/9 эт.",2020-12-04T10:20:23.291173Z
"ул. Герцена, стр. 1/2",28582264,РК  «Риэлт–Мастер»,New,3285,2020-12-07T19:20:49.462421Z,"Продается студия в новом строящемся кирпичном доме.Рядом  с рекой Обь и рядом с Бугринской рощей.Район с развитой инфраструктурой.Идеальный вариант как для инвестиций так и для личного проживания.<br>ЖК Прибрежный расположен в 200 метрах от реки Обь, на левом берегу. Прекрасный вид на Бугринский мост. Преимущество местности очевидны: пляж, парк культуры и отдыха Бугринская роща , спортивный комплекс с плавательным бассейном. Магазины и супермаркеты Горожанка , Пятерочка,, Мария-Ра , крупный торговый центр стц Мега, Икея , Леруа Мерлен . Отличная транспортная развязка.",48 м²,1009144113.0,ЖК «Прибрежный»,1009144113.0,ЖК «Прибрежный»,655.0,1/17,48 м²,48.0,1,4,3059738888,Sale,/1-komnatnaya-kvartira-na-prodazhu-novosibirsk-3059738888,,2 550 000 ₽,53 125 ₽ за м²,53125,2550000,Apartment,2020-12-07T19:20:49.462421Z,78,Listing,1,1.0,2021-01-06T22:11:48.512033+03:00,2070035290,2020-12-07T22:11:25.906793+03:00,2020-12-07T22:11:48.512033+03:00,,,,,"1-комн. квартира, 48 м², 1/17 эт.",2020-12-07T19:20:51.01979Z
"Новосибирск, Первомайский район, микрорайон Весенний, Заречная улица, 4",128581768,АН СФЕРА,Resale,3285,2020-12-04T10:24:22.646174Z,"Вашему вниманию представлена трехкомнатная квартира со свежим ремонтом, мебелью и техникой. Современный дизайн квартиры рассчитан на комфортное проживание всем членам семьи. <br>Объединенная с коридором гостинная визуально делает квартиру просторной и гостеприимной. Она не загромождена лишней мебелью, но оснащена всем необходимым. Треск электрокамина придает дополнительный уют интерьеру. <br>В детская комната обставлена с учетом того, что в ней будет удобно нескольким детям. Детская кровать в собранном виде занимает мало места, с удобными матрацами для детских игр, в тоже время она легко раздвигается и превращается в просторную двуспальную кровать с ортопедическим основанием. ""Царство"" хозяйки дома продумано до мелочней, внешне минимизировано, но содержит всю необходимую технику: встроенный духовой шкаф, варочную пловерхность, посудомоечную машину, на раковине смонтирован качественный смеситель с гибким основанием, а много потаенных шкафов гарнитура, дает возможность идеально разместить все кухонные мелочи.<br>Распашной вместительный матовый белый шкаф с удобными системами хранения для взрослых и детей полностью ликвидирует необходимость в дополнительных шкафах и комодах в жилых зонах, тем самым освобождая это пространство для комфортного проживания. Все наполнение квартиры новое, техника, мебель, сантехника на гарантии производителя. Уникальность данного предложения в том, что квартира находится в современном развитом микрорайоне Первомайского района. Окна квартиры с одной стороны выходят на большую огороженную детскую площадку, с другой стороны на только что открывшийся супермаркет ""Пятерочка"" и на остановку общественного транспорта. Вокруг дома полно надземных парковок, а лифт подъезда спускается в подземный теплый паркинг. <br>Квартира очень теплая, а толщина стен не позволяет слышать даже крики соседних детей и шум с улицы.<br>Для покупателей этой квартиры станет приятным бонусом ее красивый номер.<br>Квартира в собственности менее 3 лет, показываем в любое удобное время. Можем также рассмотреть предложенные Вами обменные варианты. Не упустите свой шанс приобрести уникальную квартиру по привлекательной цене.",74 м²,,,,,657.0,9/10,74 м²,74.0,9,15,3052248414,Sale,/3-komnatnaya-kvartira-na-prodazhu-novosibirsk-3052248414,,5 800 000 ₽,78 378 ₽ за м²,78378,5800000,Apartment,2020-12-04T10:24:22.646174Z,78,Listing,3,3.0,2021-01-03T13:14:58.20956+03:00,2022791617,2020-12-04T13:14:29.434095+03:00,2020-12-05T13:20:16.489774+03:00,,,,,"3-комн. квартира, 74 м², 9/10 эт.",2020-12-05T10:29:44.42029Z
"Новосибирск, улица Палласа, 17",5817230,Дмитрий,Resale,3285,2020-12-04T11:19:41.945953Z,"Отличная двухкомнатная квартира!<br>Комнаты изолированные, Сан.узел раздельный. (кафель)<br>Окна пластиковые, входная дверь металлическая, балкон застеклен.<br>Потолки чистые не текут, крыша в порядке.Стоит отсечка на весь пятый этаж.<br>Чистые подъезды и придомовая территория.<br>В шаговой доступности, остановка, магазины, школа и т.д.<br>Возможен ОБМЕН на студию в Дивногорском.<br>Два взрослых собственника, без обременений и ограничений.",44 м²,,,,,655.0,5/5,44 м²,44.0,5,6,3052356737,Sale,/2-komnatnaya-kvartira-na-prodazhu-novosibirsk-3052356737,267.0,2 390 000 ₽,54 318 ₽ за м²,54318,2390000,Apartment,2020-12-04T11:19:41.945953Z,78,Listing,2,2.0,2021-01-04T12:10:57.525524+03:00,2028779760,2020-12-04T14:08:12.448605+03:00,2020-12-05T12:10:57.525524+03:00,4.14,267.0,#FF0000,Площадь Маркса,"2-комн. квартира, 44 м², 5/5 эт.",2020-12-05T09:29:12.538606Z
"Новосибирск, улица Бориса Богаткова, 219",45473436,«Город 54»  Агентство Недвижимости,Resale,3285,2020-12-07T19:26:13.756712Z,"Предлагается к продаже уютная, светлая, теплая двухкомнатная квартира в отличном состоянии. Высокий 1-й этаж, комнаты раздельные, стены выровнены, поменена эл. проводка, установлены счетчики воды, санузел раздельный, ванна выложена кафелем, хорошая входная дверь.Тамбур отделён на 2 квартиры, соседи замечательные. Квартира без перепланировок и обременений. Остается встроенная мебель и кухонный гарнитур. У дома отличное местоположение, метро Золотая Нива 1 мин. пешком. Развитая инфраструктура рядом школа, дет. садик, магазины, апткуи, банк, остановка общественного транспорта. Отличная транспортная развязка.",43 м²,,,,,650.0,1/9,43 м²,43.0,1,0,3059750934,Sale,/2-komnatnaya-kvartira-na-prodazhu-novosibirsk-3059750934,272.0,3 680 000 ₽,85 581 ₽ за м²,85581,3680000,Apartment,2020-12-07T19:26:13.756712Z,78,Listing,2,2.0,2021-01-06T22:17:09.17575+03:00,2074246672,2020-12-07T22:16:47.266274+03:00,2020-12-07T22:17:09.17575+03:00,0.075,272.0,#008000,Золотая Нива,"2-комн. квартира, 43 м², 1/9 эт.",2020-12-07T19:26:22.909159Z
"Новосибирск, улица Гаранина, 21",45473436,«Город 54»  Агентство Недвижимости,Resale,3285,2020-12-07T19:26:15.395165Z,"Предлагается к продаже уютная, светлая, теплая двухкомнатная квартира в кирпичном доме Квартира улучшенной планировки-большая кухня (7,6),высокие потолки, широкие подоконники Интернет, камера наблюдения над подъездом,своя тв.антенна. Поменяны эл.проводка, трубы,ванна,батарея отопления в гостиной биметалл. Кафель (Италия) на лоджии. Все межкомнатные двери- натуральный массив сосны. Встроенный шкаф. Две входные двери металлические. Развитая инфраструктура рядом два дет. садика, школа, магазины, аптеки, остановка общественного транспорта,  в пешей доступности станция метро Золотая нива. Отличная транспортная развязка.",47 м²,,,,,650.0,2/9,47 м²,47.0,2,0,3059751041,Sale,/2-komnatnaya-kvartira-na-prodazhu-novosibirsk-3059751041,272.0,3 550 000 ₽,75 532 ₽ за м²,75532,3550000,Apartment,2020-12-07T19:26:15.395165Z,78,Listing,2,2.0,2021-01-06T22:17:09.157622+03:00,2073934433,2020-12-07T22:16:48.500987+03:00,2020-12-07T22:17:09.157622+03:00,1.198,272.0,#008000,Золотая Нива,"2-комн. квартира, 47 м², 2/9 эт.",2020-12-07T19:26:24.244962Z
"Новосибирск, улица Ползунова, 33",152810530,Центральное агентство недвижимости,Resale,3285,2020-10-06T02:23:11.090788Z,"При звонке, пожалуйста, назовите номер объявления - 110 776<br>Консультируем подробно по телефону.",42 м²,,,,,651.0,4/4,42 м²,42.0,4,7,2910399098,Sale,/3-komnatnaya-kvartira-na-prodazhu-novosibirsk-2910399098,272.0,2 500 000 ₽,59 524 ₽ за м²,59524,2500000,Apartment,2020-10-06T02:23:11.090788Z,78,Listing,3,3.0,2021-01-06T05:01:25.814645+03:00,1984107788,2020-10-06T05:13:44.703228+03:00,2020-12-08T05:24:37.746866+03:00,3.233,272.0,#008000,Золотая Нива,"3-комн. квартира, 42 м², 4/4 эт.",2020-12-08T02:34:07.795517Z
"Новосибирск, Путевая улица, 8",152810530,Центральное агентство недвижимости,Resale,3285,2020-10-06T03:00:58.716196Z,"При звонке, пожалуйста, назовите номер объявления - 112 667<br>Консультируем подробно по телефону.",55.1 м²,,,,,654.0,5/5,55.1 м²,55.1,5,15,2910423376,Sale,/3-komnatnaya-kvartira-na-prodazhu-novosibirsk-2910423376,266.0,2 950 000 ₽,53 539 ₽ за м²,53539,2950000,Apartment,2020-10-06T03:00:58.716196Z,78,Listing,3,3.0,2021-01-06T05:11:44.345006+03:00,1984015952,2020-10-06T05:51:32.640288+03:00,2020-12-07T05:11:44.345006+03:00,1.417,266.0,#FF0000,Студенческая,"3-комн. квартира, 55.1 м², 5/5 эт.",2020-12-07T02:20:49.70408Z
"Новосибирск, Ленинградская улица, 145",152810530,Центральное агентство недвижимости,Resale,3285,2020-10-06T03:01:00.382397Z,"Дом  в центре Никитинского жилого массива, вторая линия от магистрали - тишина и спокойствие для проживания.<br>Рядом с домом есть все для активной жихни, детские и спортивные площадки, хорошая школа и детский сад, развивающие студии, множество магазинов, поликлиника, недалеко Октябрьский рынок, несколько институтов( строительный, связи). Прекрасное предложение  для аренды.<br>При звонке, пожалуйста, назовите номер объявления - 112 485<br>Консультируем подробно по телефону.",30 м²,,,,,650.0,1/5,30 м²,30.0,1,6,2910423397,Sale,/1-komnatnaya-kvartira-na-prodazhu-novosibirsk-2910423397,265.0,2 040 000 ₽,68 000 ₽ за м²,68000,2040000,Apartment,2020-10-06T03:01:00.382397Z,78,Listing,1,1.0,2021-01-06T05:11:44.342092+03:00,1984197433,2020-10-06T05:51:32.164864+03:00,2020-12-07T05:23:59.213592+03:00,1.741,265.0,#FF0000,Речной вокзал,"1-комн. квартира, 30 м², 1/5 эт.",2020-12-07T02:34:09.396079Z
"Новосибирск, улица Крылова, 41",152810530,Центральное агентство недвижимости,Resale,3285,2020-10-06T03:01:00.259508Z,"При звонке, пожалуйста, назовите номер объявления - 112 344<br>Консультируем подробно по телефону.",61 м²,,,,,649.0,3/9,61 м²,61.0,3,9,2910423395,Sale,/3-komnatnaya-kvartira-na-prodazhu-novosibirsk-2910423395,270.0,5 500 000 ₽,90 164 ₽ за м²,90164,5500000,Apartment,2020-10-06T03:01:00.259508Z,78,Listing,3,3.0,2021-01-06T05:11:44.551445+03:00,1984039380,2020-10-06T05:51:32.098805+03:00,2020-12-08T15:35:26.619506+03:00,0.355,270.0,#008000,Маршала Покрышкина,"3-комн. квартира, 61 м², 3/9 эт.",2020-12-08T12:45:01.70975Z
"Новосибирск, Бронная улица, 36",152810530,Центральное агентство недвижимости,Resale,3285,2020-10-06T03:14:10.39134Z,"При звонке, пожалуйста, назовите номер объявления - 195 450<br>Консультируем подробно по телефону.",73.2 м²,,,,,655.0,6/18,73.2 м²,73.2,6,16,2910428432,Sale,/kvartira-na-prodazhu-novosibirsk-2910428432,,3 130 000 ₽,42 760 ₽ за м²,42760,3130000,Apartment,2020-10-06T03:14:10.39134Z,78,Listing,Студия,,2021-01-06T05:11:44.527091+03:00,1984268067,2020-10-06T06:04:43.293622+03:00,2020-12-07T05:11:44.527091+03:00,,,,,"Квартира-студия, 73.2 м², 6/18 эт.",2020-12-07T02:20:49.853422Z
"Новосибирск, улица Дениса Давыдова, 5",152810530,Центральное агентство недвижимости,Resale,3285,2020-10-06T12:33:33.393795Z,"При звонке, пожалуйста, назовите номер объявления - 113 585<br>Консультируем подробно по телефону.",59 м²,,,,,651.0,6/9,59 м²,59.0,6,3,2911580647,Sale,/3-komnatnaya-kvartira-na-prodazhu-novosibirsk-2911580647,271.0,4 600 000 ₽,77 966 ₽ за м²,77966,4600000,Apartment,2020-10-06T12:33:33.393795Z,78,Listing,3,3.0,2021-01-06T05:11:47.800396+03:00,1984508588,2020-10-06T15:24:01.962403+03:00,2020-12-07T05:24:01.025368+03:00,3.498,271.0,#008000,Берёзовая роща,"3-комн. квартира, 59 м², 6/9 эт.",2020-12-07T02:34:12.217061Z
"Новосибирск, улица Татьяны Снежиной, 25",152810530,Центральное агентство недвижимости,Resale,3285,2020-10-06T12:33:45.364174Z,"При звонке, пожалуйста, назовите номер объявления - 113 514<br>Консультируем подробно по телефону.",33 м²,,,,,650.0,3/10,33 м²,33.0,3,9,2911581616,Sale,/1-komnatnaya-kvartira-na-prodazhu-novosibirsk-2911581616,272.0,2 250 000 ₽,68 182 ₽ за м²,68182,2250000,Apartment,2020-10-06T12:33:45.364174Z,78,Listing,1,1.0,2021-01-06T05:11:48.349219+03:00,1984821362,2020-10-06T15:24:05.771492+03:00,2020-12-07T05:24:01.396376+03:00,3.05,272.0,#008000,Золотая Нива,"1-комн. квартира, 33 м², 3/10 эт.",2020-12-07T02:34:21.00664Z
