address,agencyId,agencyName,apartmentSaleType,cityId,createdAt,description,details,developmentId,developmentName,developmentParentId,developmentParentName,districtId,floor,floorArea,floorAreaCalculated,floorInt,galleryImagesCount,id,itemType,itemUrl,metroId,price,pricePerArea,pricePerAreaValue,priceValue,propertyType,publishDate,regionId,resultType,rooms,roomsOrdinal,sourceFinishTime,sourceId,sourceStartTime,sourceUpdateTime,station_distance,station_id,station_lineColors,station_name,title,updatedAt
"Новосибирск, улица Куприна, 14, подъезд 1",131547246,Квартира Мечты,Resale,3285,2020-12-02T14:34:23.120854Z,"Двухкомнатная квартира без вложений .<br>О квартире:<br>Выполнен качественный капитальный ремонт с полной заменой всех коммуникаций и электропроводки, так что можете забыть о глобальных тратах.<br>Установлены хорошие межкомнатные двери и надежная входная.<br>В квартире зимой тепло, а летом не жарко. <br>О доме:<br>Дом расположен во дворе. Нет шума дорог и пыли. Летом при открытых окнах тишина, в утренние часы которую нарушает пение птичек. Придомовая территория озеленена и ухожена. Даже если вы работаете до позднего времени, всегда найдется место для парковки автомобиля.<br>Про инфраструктуру:<br>Несколько детских садов и общеобразовательных школ на выбор.Школа №177 с хорошими отзывами в 2 Гис. Школа №7 с кадетскими классами. <br>Городская поликлиника 17, отделение Почты России и управляющая компания-все в шаговой доступности.<br>Продуктовые рынки, популярные супермаркеты рядом, что очень удобно. <br>В 10 минутах от дома прогулочным шагом находится станция метро Золотая Нива. Через двор расположены остановки общественного транспорта ""Калейдоскоп"" и "" Есенина"".Отсюда вы уедете в любое время в нужное место.<br>Квартира отлично подойдет для семьи, ценящей спокойствие и тишину.<br>Объект подходит под любую форму расчёта. <br>Рассматриваем ипотеку без первоначального взноса. <br>Бесплатное оформление ипотеки при покупки этой квартиры.<br>Покупая квартиру у нас, вы не платите комиссию!",47 м²,,,,,651.0,1/5,47 м²,47.0,1,17,3047880167,Sale,/2-komnatnaya-kvartira-na-prodazhu-novosibirsk-3047880167,272.0,3 199 000 ₽,68 064 ₽ за м²,68064,3199000,Apartment,2020-12-02T14:34:23.120854Z,78,Listing,2,2,2021-01-01T17:25:44.606124+03:00,2027988028,2020-12-02T17:23:10.173022+03:00,2020-12-02T17:37:28.82404+03:00,1.065,272.0,#008000,Золотая Нива,"2-комн. квартира, 47 м², 1/5 эт.",2020-12-02T14:46:29.769986Z
"Новосибирск, Советский район, микрорайон Нижняя Ельцовка, Лесосечная улица, 2",23367994,Компания «ЭТАЖИ»,Resale,3285,2020-12-07T18:42:42.267476Z,"Расширяетесь? И хотите жить в экологичном районе? Тогда читайте до конца или звоните прямо сейчас!<br>В продаже просторная, светлая 5-тикомнатная квартира по цене трехкомнатной! В тихом районе Нижняя Ельцовка. Отличный вариант для большой и дружной семьи. Одно из самых больших преимуществ микрорайона - близость реки и нескольких озер. Сосновый бор делает воздух чище и свежее, представляет собой целую экологическую систему и просто является прекрасным местом для отдыха.<br>В подъезде дома выполнен косметический ремонт, работает новый лифт. Во дворе две детские площадки, большое количество парковочных мест, сразу за окном сосновый бор, в пешей доступности прогулочная зона.<br>Окна выходят на две стороны. В 10 минутах ходьбы станция электрички. Также рядом с домом остановка транспорта. В микрорайоне есть детский сад и школа, магазины, спортивный клуб, секции для детей, поликлиника, аптеки. Всё что нужно для жизни.<br>Квартира требует ремонта в некоторых комнатах и отлично подойдёт для реализации ваших собственных идей. <br>Подходит под любые виды расчета. Бесплатно и быстро поможем в получении ипотечного решения по низким ставкам. Звоните!. Номер в базе: 4985753. Район: Советский.",91.3 м²,,,,,656.0,8/10,91.3 м²,91.3,8,7,3059689778,Sale,/5-komnatnaya-kvartira-na-prodazhu-novosibirsk-3059689778,,4 050 000 ₽,44 359 ₽ за м²,44359,4050000,Apartment,2020-12-07T18:42:42.267476Z,78,Listing,5,5,2021-01-06T21:33:40.933572+03:00,2072446608,2020-12-07T21:33:09.133686+03:00,2020-12-07T21:33:40.933572+03:00,,,,,"5-комн. квартира, 91.3 м², 8/10 эт.",2020-12-07T18:42:44.788527Z
"ул. Герцена, стр. 1/2",28582264,РК  «Риэлт–Мастер»,New,3285,2020-12-07T18:47:16.430821Z,"Продам просторную однокомнатную квартиру-студию шикарной планировки. Есть возможность поставить стену, так как есть окно и лоджия.<br>ЖК Прибрежный расположен в 200 метрах от реки Обь, на левом берегу. Прекрасный вид на Бугринский мост. Преимущество местности очевидны: пляж, парк культуры и отдыха Бугринская роща , спортивный комплекс с плавательным бассейном. Магазины и супермаркеты Горожанка , Пятерочка,, Мария-Ра , крупный торговый центр стц Мега, Икея , Леруа Мерлен . Отличная транспортная развязка.",47 м²,1009144113.0,ЖК «Прибрежный»,1009144113.0,ЖК «Прибрежный»,655.0,1/17,47 м²,47.0,1,4,3059696308,Sale,/1-komnatnaya-kvartira-na-prodazhu-novosibirsk-3059696308,,2 550 000 ₽,54 255 ₽ за м²,54255,2550000,Apartment,2020-12-07T18:47:16.430821Z,78,Listing,1,1,2021-01-06T21:38:14.97448+03:00,2070033177,2020-12-07T21:37:55.747988+03:00,2020-12-07T21:38:14.97448+03:00,,,,,"1-комн. квартира, 47 м², 1/17 эт.",2020-12-07T18:47:19.081788Z
"Новосибирск, улица Маяковского, 1/1",14544714,КВАДРОТЕКА (Сибакадемстрой Недвижимость),Resale,3285,2020-08-19T09:20:30.425713Z,"Более подробное описание объекта — на сайте агентства. Номер варианта: ПРВ20000326.  <br>	Предлагается к продаже однокомнатная квартира в новом доме классической кирпичной кладки 2012 года постройки. Благоустроенная придомовая территория огорожена,находится под круглосуточным видеонаблюдением, въезд во двор через шлагбаум.  Окна выходят во двор. Прекрасное место для проживания, тихое местечко вокруг хвойные деревья. Своя ТСЖ, в чистоте содержится придомовая территория и подъезды. Не смотря, что квартира находится на первом этаже, цокольный этаж высокий. Квартира очень теплая и светлая. В шаговой доступности школа, детский садик, поликлиника детская и взрослая, роддом №7, остановка общественного транспорта, парк культуры и отдыха, Дом культуры (ДКЖ), множество супермаркетов.Без обременений.",30 м²,,,,,657.0,1/5,30 м²,30.0,1,7,2799584730,Sale,/1-komnatnaya-kvartira-na-prodazhu-novosibirsk-2799584730,,3 000 000 ₽,100 000 ₽ за м²,100000,3000000,Apartment,2020-08-19T09:20:30.425713Z,78,Listing,1,1,2021-01-03T05:15:30.101061+03:00,1959992917,2020-08-19T12:11:06.006641+03:00,2020-12-04T05:15:30.101061+03:00,,,,,"1-комн. квартира, 30 м², 1/5 эт.",2020-12-04T02:24:32.535206Z
"Новосибирская область, Тогучинский район, село Льниха",14544714,КВАДРОТЕКА (Сибакадемстрой Недвижимость),Resale,3239,2020-09-10T01:20:29.154448Z,"Более подробное описание объекта — на сайте агентства. Номер варианта: ПРВ19000534.  <br>	село Льниха. Отличный вариант! Продается двухкомнатная квартира в четырех-квартирном доме. Классное место, как для проживания, так и для дачи. Рядом ж/д станция, магазин, есть мед. кабинет. В пяти минутах ходьбы река Иня. Школьников возит школьный автобус в п. Жеребцово. В квартире проведен водопровод, есть слив. Отопление печное-водяное, комнаты изолированы. Крыша покрыта металло-профилем. В подарок остается газовая плита, холодильник, кухня, мебель по договоренности. В доме проживают очень доброжелательные соседи. Есть участок земли под посадки. При покупке есть возможность использовать материнский капитал.",42.2 м²,,,,,,1/1,42.2 м²,42.2,1,5,2851421396,Sale,/2-komnatnaya-kvartira-na-prodazhu-gornyy-2851421396,,650 000 ₽,15 403 ₽ за м²,15403,650000,Apartment,2020-09-10T01:20:29.154448Z,78,Listing,2,2,2021-01-03T05:15:35.593717+03:00,1992828301,2020-09-10T04:04:26.466414+03:00,2020-12-04T05:15:35.593717+03:00,,,,,"2-комн. квартира, 42.2 м², 1/1 эт.",2020-12-04T02:24:39.338953Z
"Новосибирск, улица Чапаева, 5",14544714,КВАДРОТЕКА (Сибакадемстрой Недвижимость),Resale,3285,2020-04-07T02:52:31.63428Z,"Более подробное описание объекта — на сайте агентства. Номер варианта: ОИП19001074.  <br>	Продается теплая, солнечная квартира для большой семьи,  комнаты смежно-изолированные, сан.узел раздельный, на кухне пол выложен кафельной  плиткой, пол с подогревом в ванной доставит приятные ощущения. Первый этаж тоже имеет свои преимущества. В квартире две лоджии, одна  утепленная (узаконена), на другой лоджии есть погреб для хранения зимних заготовок.  Окна выходят на  две стороны (юг, восток). Развитая инфраструктура, рядом школа, детский сад, магазины, рынок, остановки общественного и  железнодорожного транспорта,  до поликлиники на автобусе или маршрутном такси  3 остановки. Документы готовы к продаже. Любая форма расчета, подходит под ипотеку с использованием мат. капитала. Реальным покупателям хороший торг.",76 м²,,,,,657.0,1/9,76 м²,76.0,1,30,2468456586,Sale,/4-komnatnaya-kvartira-na-prodazhu-novosibirsk-2468456586,,3 750 000 ₽,49 342 ₽ за м²,49342,3750000,Apartment,2020-04-07T02:52:31.63428Z,78,Listing,4,4,2021-01-03T05:15:35.737407+03:00,1896297992,2020-04-06T12:25:15.97599+03:00,2020-12-04T05:15:35.737407+03:00,,,,,"4-комн. квартира, 76 м², 1/9 эт.",2020-12-04T02:24:39.295388Z
