address,agencyId,agencyName,apartmentSaleType,cityId,createdAt,description,details,developmentId,developmentName,developmentParentId,developmentParentName,districtId,floor,floorArea,floorAreaCalculated,floorInt,galleryImagesCount,id,itemType,itemUrl,metroId,price,pricePerArea,pricePerAreaValue,priceValue,propertyType,publishDate,regionId,resultType,rooms,roomsOrdinal,sourceFinishTime,sourceId,sourceStartTime,sourceUpdateTime,station_distance,station_id,station_lineColors,station_name,title,updatedAt
"ул. Коминтерна, стр. 1",182504330,Милый Дом,New,3285,2020-10-05T10:55:15.190431Z,"Последние 2-комн. квартиры площадью 40,5 м2 в новом смарт-квартале «Red Fox»‼️<br>Новое поколение домов комфортного проживания, уникальный архитектурно-инженерный проект по передовым технологиям строительства удобного и безопасного жилья!<br>Экологически благоприятное место, чистый воздух и обилие зелени создают ощущение загородной жизни!<br>☑️Удобные функциональные планировки<br>☑️Рядом школы и детские сады<br>☑️Огороженная территория<br>☑️Круглосуточные консьержи<br>☑️Видеонаблюдение<br>💳Варианты покупки:<br>➖наличный расчёт<br>➖ипотека без первоначального взноса<br>➖ипотека ВТБ под 6,1%<br>➖субсидированная ипотека от 0,1%<br>➖военная ипотека<br>➖материнский капитал<br>➖рассрочка<br>➖trade in<br>🔆Записаться на экскурсию, узнать подробности о ЖК ""Red Fox"" и забронировать квартиру можно, позвонив по телефону<br>☑️Покупая квартиру в ипотеку, каждому нашему клиенту предоставляется комплексное юридическое сопровождение на любом из этапов сделки - мы даем абсолютную гарантию безопасности сделки по покупке квартиры!<br>👍Услуги по покупке квартир в новостройках АБСОЛЮТНО БЕСПЛАТНЫ‼️<br>☎️Звоните/пишите и мы подберем для Вас идеальную квартиру по самой выгодной цене!",40.5 м²,86477.0,ЖК «RED FOX» (РЭД ФОКС),86477.0,ЖК «RED FOX» (РЭД ФОКС),651.0,12/18,40.5 м²,40.5,12,10,2909148010,Sale,/2-komnatnaya-kvartira-na-prodazhu-novosibirsk-2909148010,272.0,2 755 200 ₽,68 030 ₽ за м²,68030,2755200,Apartment,2020-10-05T10:55:15.190431Z,78,Listing,2,2,2021-01-05T10:42:23.384243+03:00,1992134746,2020-10-05T13:46:08.432622+03:00,2020-12-06T10:42:23.384243+03:00,3.067,272.0,#008000,Золотая Нива,"2-комн. квартира, 40.5 м², 12/18 эт.",2020-12-06T07:51:25.436578Z
"Красный пр-т, д. 323/15",182504330,Милый Дом,New,3285,2020-06-30T00:16:13.105158Z,"Просторная квартира с огромной лоджией и выходом со всех комнат!<br>✅ ЖК ""Онега"". Дом СДАН!<br>✅ Уникальный, живой, не имеющий аналогов жилой комплекс с русской душой<br>✅ Просторная территория, тропа здоровья 1 км протяженность<br>✅ Индивидуальность! На 947 квартир - более 400 вариантов планировок на любой вкус!<br>✅ Развитая инфраструктура, прописка Красный проспект, привязка к 211 школе!<br>✅ Безопасность: закрытая территория, видеонаблюдение, охрана.<br>ЖК ""Онега"" - уникальный проект с эксклюзивными планировочными решениями. Таких проектов в Новосибирске еще не было!<br>ЖК расположен в одном из лучших мест Новосибирска - микрорайоне Родники, который является частью Калининского района, где есть всё необходимое для комфортной жизни<br>Более восьми детских садов, несколько общеобразовательных школ, в число которых входит школа № 211 - лучшая за Уралом, оснащенная всем, что необходимо школьнику в наше время<br>Новая поликлиника №29 с детским и взрослым отделениями. Напротив ЖК ""Онега"" уже открыт спортивный фехтовальный центр с бассейном на первом этаже, а в 15 минутах ходьбы пешком расположена ледовая арена ""Родник"", где можно записать своих детей в спортивные секции - девочек на фигурное катание, мальчиков - на хоккей<br>Способы покупки: наличные, ипотека<br>Покупая квартиру в ипотеку, каждому нашему клиенту предоставляется комплексное юридическое сопровождение на любом из этапов сделки - мы даем абсолютную гарантию безопасности сделки по покупке квартиры! Услуги по покупке квартир в новостройках АБСОЛЮТНО БЕСПЛАТНЫ! Звоните!",53.7 м²,1003935880.0,ЖК «Онега»,1003935880.0,ЖК «Онега»,648.0,6/9,53.7 м²,53.7,6,32,2677974632,Sale,/2-komnatnaya-kvartira-na-prodazhu-novosibirsk-2677974632,,4 650 000 ₽,86 592 ₽ за м²,86592,4650000,Apartment,2020-06-30T00:16:13.105158Z,78,Listing,2,2,2021-01-05T10:42:32.136003+03:00,1960320773,2020-06-29T11:55:25.614926+03:00,2020-12-06T10:42:32.136003+03:00,,,,,"2-комн. квартира, 53.7 м², 6/9 эт.",2020-12-06T07:51:35.594159Z
"Красный пр-т, д. 323/15",182504330,Милый Дом,New,3285,2020-07-06T14:50:17.875699Z,"‼️Последние квартиры в первой очереди ЖК ""Онега"" - уникальном проекте с эксклюзивными планировочными решениями.<br>⏳Сроки сдачи: II квартал 2020 - дом сдан!<br>ЖК ""Онега"" располагается в одном из лучших мест Новосибирска - микрорайоне Родники, который является частью Калининского района, где есть всё необходимое для комфортной жизни<br>Более восьми детских садов, несколько общеобразовательных школ, в число которых входит школа № 211 - лучшая за Уралом, оснащенная всем, что необходимо школьнику в наше время<br>Новая поликлиника №29 с детским и взрослым отделениями. Напротив ЖК ""Онега"" уже открыт спортивный фехтовальный центр с бассейном на первом этаже, а в 15 минутах ходьбы пешком расположена ледовая арена ""Родник"", где можно записать своих детей в спортивные секции - девочек на фигурное катание, мальчиков - на хоккей<br>Первая очередь - четыре кирпичных дома, два из которых - с мансардными скошенными крышами<br>🔐Способы покупки: наличные, ипотека, trade in<br>☑️Покупая квартиру в ипотеку, каждому нашему клиенту предоставляется комплексное юридическое сопровождение на любом из этапов сделки - мы даем абсолютную гарантию безопасности сделки по покупке квартиры! Услуги по покупке квартир в новостройках АБСОЛЮТНО БЕСПЛАТНЫ‼️<br>Звоните!",104.6 м²,1003935880.0,ЖК «Онега»,1003935880.0,ЖК «Онега»,648.0,9/10,104.6 м²,104.6,9,28,2697895641,Sale,/3-komnatnaya-kvartira-na-prodazhu-novosibirsk-2697895641,,8 310 000 ₽,79 446 ₽ за м²,79446,8310000,Apartment,2020-07-06T14:50:17.875699Z,78,Listing,3,3,2021-01-05T10:42:42.756943+03:00,1960593042,2020-07-06T17:41:14.306358+03:00,2020-12-06T10:42:42.756943+03:00,,,,,"3-комн. квартира, 104.6 м², 9/10 эт.",2020-12-06T07:51:47.392192Z
"Красный пр-т, д. 323/11",182504330,Милый Дом,New,3285,2020-07-06T14:46:43.604179Z,"‼️Две последние 1-комнатные квартиры в первой очереди ЖК ""Онега"" - уникальном проекте с эксклюзивными планировочными решениями.<br>⏳Сроки сдачи: II квартал 2020 - дом сдан!<br>ЖК ""Онега"" располагается в одном из лучших мест Новосибирска - микрорайоне Родники, который является частью Калининского района, где есть всё необходимое для комфортной жизни<br>Более восьми детских садов, несколько общеобразовательных школ, в число которых входит школа № 211 - лучшая за Уралом, оснащенная всем, что необходимо школьнику в наше время<br>Новая поликлиника №29 с детским и взрослым отделениями. Напротив ЖК ""Онега"" уже открыт спортивный фехтовальный центр с бассейном на первом этаже, а в 15 минутах ходьбы пешком расположена ледовая арена ""Родник"", где можно записать своих детей в спортивные секции - девочек на фигурное катание, мальчиков - на хоккей<br>Первая очередь - четыре кирпичных дома, два из которых - с мансардными скошенными крышами<br>🔐Способы покупки: наличные, ипотека, trade in<br>☑️Покупая квартиру в ипотеку, каждому нашему клиенту предоставляется комплексное юридическое сопровождение на любом из этапов сделки - мы даем абсолютную гарантию безопасности сделки по покупке квартиры! Услуги по покупке квартир в новостройках АБСОЛЮТНО БЕСПЛАТНЫ‼️<br>Звоните!",37.2 м²,1003935880.0,ЖК «Онега»,1003935880.0,ЖК «Онега»,648.0,3/9,37.2 м²,37.2,3,33,2697893969,Sale,/1-komnatnaya-kvartira-na-prodazhu-novosibirsk-2697893969,,3 200 000 ₽,86 022 ₽ за м²,86022,3200000,Apartment,2020-07-06T14:46:43.604179Z,78,Listing,1,1,2021-01-05T10:42:59.795093+03:00,1960795609,2020-07-06T17:37:40.134578+03:00,2020-12-06T10:42:59.795093+03:00,,,,,"1-комн. квартира, 37.2 м², 3/9 эт.",2020-12-06T07:52:05.211903Z
"Новосибирск, улица Жуковского, 115/4",190295922,Лариса,Resale,3285,2020-10-03T09:29:29.669476Z,"ЧИСТАЯ ПРОДАЖА!  БЫСТРЫЙ ВЫХОД НА СДЕЛКУ! Предлагается к продаже двухкомнатная квартира, расположенная на пятом этаже пятиэтажного дома, над головой никто не топает. Состояние квартиры обычное, жилое. Удачное расположение дома, всё необходимое для повседневной жизни находится в шаговой доступности, что немаловажно и экономит время при современном ритме жизни: магазины Пятёрочка,Магнит,Мария ра, 2 школы, 2 детских сада, поликлинника ,жэу ,рядом остановки общественного  транспорта, троллейбуса и автобуса, Зоопарк, Дендропарк, Тимирязевский сквер,аптеки,сбербанк,почта,до метро площадь Калинина 10 минут пешком.  Дом находится в центре жилого массива, вдали от дорог,шума и пыли, окна выходят на зелёную зону, а не на соседнюю пятиэтажку. Квартира сухая,тёплая.Чистый подъезд,порядочные и спокойные соседи. ПРОДАЁМ ЛИЧНО,НЕ АГЕНСТВО! С АГЕНСТВАМИ ГОТОВЫ СОТРУДНИЧАТЬ ТОЛЬКО ПРИ НАЛИЧИИ РЕАЛЬНОГО ПОКУПАТЕЛЯ!",46.8 м²,,,,,653.0,5/5,46.8 м²,46.8,5,13,2905200892,Sale,/2-komnatnaya-kvartira-na-prodazhu-novosibirsk-2905200892,260.0,3 280 000 ₽,70 085 ₽ за м²,70085,3280000,Apartment,2020-10-03T09:29:29.669476Z,78,Listing,2,2,2021-01-05T10:43:21.092161+03:00,2000193241,2020-10-03T12:10:14.512976+03:00,2020-12-06T10:43:21.092161+03:00,1.137,260.0,#FF0000,Заельцовская,"2-комн. квартира, 46.8 м², 5/5 эт.",2020-12-06T07:52:24.323481Z
"Новосибирск, улица Есенина, 49",141598932,Ирина Зайкова,Resale,3285,2020-12-05T07:54:02.266316Z,"Цена снижена!!! Хорошая, теплая и уютная квартира для большой семьи!!! Отличный вариант! До метро 2 остановки! Всё в шаговой доступности!<br>Чистая продажа. 1 взрослый собственник, без обременений. Документы готовы к быстрому выходу на сделку!",58.3 м²,,,,,651.0,1/5,58.3 м²,58.3,1,9,3053849070,Sale,/3-komnatnaya-kvartira-na-prodazhu-novosibirsk-3053849070,272.0,3 280 000 ₽,56 261 ₽ за м²,56261,3280000,Apartment,2020-12-05T07:54:02.266316Z,78,Listing,3,3,2021-01-04T10:45:23.370256+03:00,2066750265,2020-12-05T10:44:15.631526+03:00,2020-12-05T16:42:13.224924+03:00,0.988,272.0,#008000,Золотая Нива,"3-комн. квартира, 58.3 м², 1/5 эт.",2020-12-05T13:51:35.456903Z
"Новосибирск, улица Петухова, 150",158827343,Олег,Resale,3285,2020-08-09T17:02:55.953429Z,Просторная квартира в новом доме. Квартира под самоотделку. Свое ТСЖ. Территория дома огорожена и охраняется.,70 м²,,,,,655.0,10/10,70 м²,70.0,10,6,2776276312,Sale,/2-komnatnaya-kvartira-na-prodazhu-novosibirsk-2776276312,,4 100 000 ₽,58 571 ₽ за м²,58571,4100000,Apartment,2020-08-09T17:02:55.953429Z,78,Listing,2,2,2021-01-07T05:50:21.329954+03:00,1964942904,2020-08-09T19:53:35.398776+03:00,2020-12-08T05:50:21.329954+03:00,,,,,"2-комн. квартира, 70 м², 10/10 эт.",2020-12-08T02:59:24.884886Z
"Новосибирск, улица Пархоменко, 112",23367994,Компания «ЭТАЖИ»,Resale,3285,2020-11-03T09:19:27.844178Z,"Предлагается к покупке трехкомнатная квартира, с изолированными комнатами и просторной кухней (можно увеличить до 11м2 за счет кладовки ). Квартира в хорошем состоянии, светлая, удобной планировки. Хороший вид из окон(пластик) на две стороны. Застекленная , утепленная лоджия. Санузел раздельный, полностью кафель. Видео домофон и охрана квартиры. Чистый подъезд и лифт. Ухоженная придомовая территория , рядом детская площадка. Инфраструктура максимально развита, всё необходимое для жизни : магазины, аптеки, детские сады, школы. поликлиника, ледовый дворец спорта, рынок, в шаговой доступности. Хорошая транспортная развязка, остановки общественного транспорта в двух минутах ходьбы. Подходит под любые формы расчета. По документам чисто все. Поможем в получении ипотечного решения по выгодным ставкам. Номер в базе: 4894067. Район: Ленинский.",63.3 м²,,,,,654.0,6/9,63.3 м²,63.3,6,20,2978766168,Sale,/3-komnatnaya-kvartira-na-prodazhu-novosibirsk-2978766168,267.0,4 210 000 ₽,66 509 ₽ за м²,66509,4210000,Apartment,2020-11-03T09:19:27.844178Z,78,Listing,3,3,2021-01-02T14:13:17.932122+03:00,2040111839,2020-11-03T12:09:47.915791+03:00,2020-12-07T10:06:51.264551+03:00,3.353,267.0,#FF0000,Площадь Маркса,"3-комн. квартира, 63.3 м², 6/9 эт.",2020-12-07T07:16:26.082641Z
"Новосибирская область, Бердск, Бердский санаторий, 41",38815338,Наталья,Resale,3279,2020-12-04T08:48:38.740374Z,"Продается квартира расположенная в экологически чистом месте города Бердска.   Рядом лес,  пляж, ТЦ Ясная поляна с рестораном,  отель Крона и санаторий Борвиха с хорошей инфраструктурой (летние бассейны с подогревом, тренажерные залы, теннисные корты и баскетбольные площадки, круглогодичные аквацентры).  <br>В квартире сделан хороший ремонт. Санузел совмещен, установлена душевая кабина. Пол в квартире  кафель (теплый пол) и ламинат.  Остается кухонный гарнитур без бытовой техники.  Лоджия утеплена и выходит  на  огороженный  земельный участок.",81 м²,,,,,,1/3,81 м²,81.0,1,29,3051990302,Sale,/2-komnatnaya-kvartira-na-prodazhu-berdsk-3051990302,,4 500 000 ₽,55 556 ₽ за м²,55556,4500000,Apartment,2020-12-04T08:48:38.740374Z,78,Listing,2,2,2021-01-03T12:10:14.379256+03:00,2056581769,2020-12-04T11:35:17.834076+03:00,2020-12-04T12:10:14.379256+03:00,,,,,"2-комн. квартира, 81 м², 1/3 эт.",2020-12-04T09:19:21.399076Z
"Новосибирск, Советский район, микрорайон Академгородок, Академическая улица, 2",116154364,Александр,Resale,3285,2020-12-01T05:28:09.170993Z,"Предлагается отличная 1-комнатная квартира на одной из самых «зеленых» улиц Академгородка – Академической. Прописка относится к Лицею 130. Практически за домом начинается Ботанический сад и район коттеджей - шикарное место для прогулок в любое время года. Окна выходят на лес и на южную сторону. Самый удобный 3-й этаж.<br>В шаговой доступности НГУ, магазины и остановки общественного транспорта. Около дома всегда найдется свободное парковочное место. Отличный район, добропорядочные соседи, благоустроенный двор. <br>Эта квартира имеет большую площадь (33,6 м2), чем обычные хрущевки. Кроме этого, гораздо более удачная планировка коридора (видно на плане БТИ).<br>В квартире высококачественный ремонт из современных материалов. Электропроводка медная новая, заменена прямо от подъездного щитка. Водопровод медный. Радиаторы отопления биметаллические итальянские Global.  Огромный плюс – в 2017 году во всем доме были заменены стояки холодной и горячей воды и канализации, то есть главная проблема квартир на ВЗ решена на ближайшие 30 лет. Квартира полностью укомплектована мебелью и бытовой техникой – заходи и живи. Все фирменное и высокого качества (холодильник Toshiba, духовой шкаф Electrolux, варочная поверхность Bosch, стиральная машина Bosch, водонагреватель Ariston). Все остается будущим хозяевам. Идеальное вложение средств для родителей студента НГУ или будущего первоклассника. После окончания НГУ данную квартиру можно будет легко продать. Или сдавать в аренду. Стоимость данной квартиры (в вышеуказанной комплектации) в аренду не менее 25000 рублей в месяц.<br>Приглашаем на просмотр!",33.6 м²,,,,,656.0,3/4,33.6 м²,33.6,3,20,3044017517,Sale,/1-komnatnaya-kvartira-na-prodazhu-novosibirsk-3044017517,,4 600 000 ₽,136 905 ₽ за м²,136905,4600000,Apartment,2020-12-01T05:28:09.170993Z,78,Listing,1,1,2020-12-31T08:23:23.893528+03:00,2042541675,2020-12-01T08:18:51.079422+03:00,2020-12-03T17:59:11.415989+03:00,,,,,"1-комн. квартира, 33.6 м², 3/4 эт.",2020-12-03T15:08:38.646776Z
