address,agencyId,agencyName,apartmentSaleType,cityId,createdAt,description,details,developmentId,developmentName,developmentParentId,developmentParentName,districtId,floor,floorArea,floorAreaCalculated,floorInt,galleryImagesCount,id,itemType,itemUrl,metroId,price,pricePerArea,pricePerAreaValue,priceValue,propertyType,publishDate,regionId,resultType,rooms,roomsOrdinal,sourceFinishTime,sourceId,sourceStartTime,sourceUpdateTime,station_distance,station_id,station_lineColors,station_name,title,updatedAt
"ул. Декабристов, д. 115",107238416,"Отдел продаж Застройщика ""Инвест-плюс""",New,3285,2020-11-30T11:09:35.44481Z,"Отличный вариант полноценной двухкомнатной квартиры.<br>ВЫСОКАЯ СТАДИЯ ГОТОВНОСТИ. В декабре сдача.<br>Надёжный объект с проектным финансированием ПАО СБЕРБАНК.<br>Квартира от застройщика. БЕЗ КОМИССИИ. Подходит под Гос. поддержку.<br>Безопасные расчёты через счёт ЭСКРОУ.<br>— Хорошее расположение. В пешей доступности станция метро Речной Вокзал.<br>— Красивый высокий дом. Отличный панорамный вид на реку, Бугринский и Коммунальный мост.<br>— Фасад С ПОДСВЕТКОЙ.<br>— Остеклённые лоджии.<br>Современный высококомфортабельный комплекс с благоустроенной придомовой территорией. Дизайнерское исполнение подъездов современном стиле. УЛУЧШЕННАЯ ЧИСТОВАЯ ОТДЕЛКА. Кофе бар с камином и мягкими диванами. Три скоростных лифта. Двор без машин. Огороженная территория. Наличие беседки барбекю. Мини стадион. Уличные тренажеры и беговая дорожка. Современная детская игровая площадка на высшем уровне.<br>Так же в продаже есть парковочные места 600 000 и 650 000 рублей.<br>ПОМОЩЬ В ПОЛУЧЕНИИ ИПОТЕКИ.",65.8 м²,91288.0,ЖК «Октябрьский квартал»,91288.0,ЖК «Октябрьский квартал»,650.0,19/22,65.8 м²,65.8,19,38,3042406541,Sale,/2-komnatnaya-kvartira-na-prodazhu-novosibirsk-3042406541,265.0,5 400 000 ₽,82 067 ₽ за м²,82067,5400000,Apartment,2020-11-30T11:09:35.44481Z,78,Listing,2,2.0,2020-12-30T14:00:33.959405+03:00,2030656577,2020-11-30T14:00:06.538102+03:00,2020-12-03T10:59:46.924043+03:00,1.463,265.0,#FF0000,Речной вокзал,"2-комн. квартира, 65.8 м², 19/22 эт.",2020-12-03T08:09:11.611534Z
"Новосибирск, улица Одоевского, 1/8",105972645,Жилфонд,Resale,3285,2020-11-06T07:22:06.367005Z,"В продаже отличная студия с хорошим ремонтом и мебелью!!! В ванной кафель, балкон остеклен. <br>Дом находится в экологически чистом районе, рядом остановка общественного транспорта, можно уехать в любую сторону города!!! <br>Развитая инфраструктура: в шаговой доступности новые детские сады, школы!!! <br>Подходит под все виды расчета. Приглашаем на просмотр!!! <br>Номер в базе агентства: 100813157",18.1 м²,,,,,657.0,11/17,18.1 м²,18.1,11,4,2985600155,Sale,/kvartira-na-prodazhu-novosibirsk-2985600155,,1 300 000 ₽,71 823 ₽ за м²,71823,1300000,Apartment,2020-11-06T07:22:06.367005Z,78,Listing,Студия,,2021-01-05T18:02:31.886601+03:00,2019281429,2020-11-06T10:12:26.572642+03:00,2020-12-06T18:02:31.886601+03:00,,,,,"Квартира-студия, 18.1 м², 11/17 эт.",2020-12-06T15:11:36.082901Z
"Новосибирск, улица Твардовского, 22/3",18526757,"Агентство недвижимости ""ЖИЛФОНД""",Resale,3285,2020-11-03T06:13:20.590601Z,"Продается отличная студия по улице Твардовского,на среднем этаже. В квартире сделан хороший ремонт, в санузле кафель от пола до потолка, застекленная лоджия и самое главное добропорядочные соседи. Квартира без обременений, один взрослый собственник. Рядом расположены 3 школы, несколько детских садов и конечно в шаговой доступности большие магазины, аптеки и остановка общественного транспорта. Квартира подойдет как для проживания, так и для сдачи в аренду. <br>Подходит под все виды расчёта.<br>Приходите на просмотр в любое время по договоренности.<br>Поможем получить ипотечное решение по данному варианту.",19.2 м²,,,,,657.0,7/17,19.2 м²,19.2,7,7,2978278959,Sale,/kvartira-na-prodazhu-novosibirsk-2978278959,,1 400 000 ₽,72 917 ₽ за м²,72917,1400000,Apartment,2020-11-03T06:13:20.590601Z,78,Listing,Студия,,2021-01-02T10:27:53.287513+03:00,2019893274,2020-11-03T08:59:41.386613+03:00,2020-12-03T10:28:03.300033+03:00,,,,,"Квартира-студия, 19.2 м², 7/17 эт.",2020-12-03T07:37:37.770111Z
"Новосибирск, Республиканская улица, 11А",157321240,Агент 54,Resale,3285,2020-12-04T14:13:43.49236Z,"1 собственник, без обременений, чистая продажа.<br>Средний этаж. Высокие потолки. Пластиковые окна. Встроенный шкаф.<br>Хорошие соседи.",45 м²,,,,,651.0,3/5,45 м²,45.0,3,10,3052651709,Sale,/2-komnatnaya-kvartira-na-prodazhu-novosibirsk-3052651709,271.0,2 678 000 ₽,59 511 ₽ за м²,59511,2678000,Apartment,2020-12-04T14:13:43.49236Z,78,Listing,2,2.0,2021-01-03T17:04:41.786525+03:00,2070051840,2020-12-04T17:04:19.199702+03:00,2020-12-08T15:34:00.382467+03:00,2.641,271.0,#008000,Берёзовая роща,"2-комн. квартира, 45 м², 3/5 эт.",2020-12-08T12:43:24.972745Z
"Новосибирск, Выборная улица, 99/2",105972645,Жилфонд,Resale,3285,2020-11-06T05:36:48.263404Z,"Октябрьский район, г.Новосибирск, ул. Выборная.  Квартира двухкомнатная, комфортный этаж, рядом школы и садики, хорошая транспортная развязка, у дома закрытая территория. В санузлах кафельная плитка, оставляем кухонный гарнитур с посудомойкой, вытяжкой и варочной поверхностью. Лоджия застеклена и утеплена.<br>В квартире никто не живёт.<br>Возможен обмен на вашу недвижимость.<br>	<br>	При звонке, пожалуйста, сообщите номер варианта - <br>       JV000020071566",58 м²,,,,,650.0,7/9,58 м²,58.0,7,2,2985354246,Sale,/2-komnatnaya-kvartira-na-prodazhu-novosibirsk-2985354246,272.0,4 150 000 ₽,71 552 ₽ за м²,71552,4150000,Apartment,2020-11-06T05:36:48.263404Z,78,Listing,2,2.0,2021-01-05T09:36:36.410928+03:00,2019820177,2020-11-06T08:27:23.731827+03:00,2020-12-06T09:36:36.410928+03:00,4.338,272.0,#008000,Золотая Нива,"2-комн. квартира, 58 м², 7/9 эт.",2020-12-06T06:45:39.950005Z
